"序號","統一編號","公司名稱","公司所在地","代表人","資本額","核准設立日期"
"821","52449938","工誠不動產仲介經紀有限公司","臺北市中山區松江路65號6樓","陳延瑀","350000","1051123"
"822","52450081","晶鑽全球有限公司","臺北市大安區泰順街44巷6號","謝明潭","500000","1051123"
"823","52450110","小林國際股份有限公司","臺北市松山區敦化南路1段3號9樓之5","謝長佑","1000000","1051123"
"824","52450131","交泰建材有限公司","臺北市中正區林森北路5巷12號5樓","周至軒","2000000","1051123"
"825","52450147","漢燿投資股份有限公司","臺北市內湖區瑞光路618號5樓","林壯恭","10000000","1051124"
"826","52450152","台灣森培國際教育科技有限公司","臺北市中正區仁愛路2段27號4樓之1","陳奕如","1000000","1051123"
"827","52450174","定詠股份有限公司","臺北市中山區南京東路2段137號14樓","康芸華","1000000","1051123"
"828","52450189","尚靖股份有限公司","臺北市中山區南京東路2段137號14樓","王尚偉","1000000","1051123"
"829","52450218","錡鋒企業有限公司","臺北市南港區重陽路491號","胡延長","500000","1051123"
"830","52450245","台灣愛音斯坦文化傳媒有限公司","臺北市中山區松江路122號11樓","馮盛養(PANG THENG YANG)","100000","1051123"
"831","52450250","京元蔬食有限公司","臺北市大安區文昌街130號","王敏昌","1000000","1051123"
"832","52450414","彩虹光科技有限公司","臺北市內湖區瑞光路258巷51號5樓","陳武廷","6000000","1051123"
"833","52450603","崧洋國際貿易有限公司","臺北市信義區基隆路1段37巷24號2樓","張韻文","1000000","1051123"
"834","52450815","智賢車業有限公司","臺北市士林區延平北路6段425巷臨3之1號","張閔智","900000","1051123"
"835","52450884","易昆印刷實業有限公司","臺北市中正區忠孝東路1段76號12樓之1","呂中文","200000","1051123"
"836","52451011","幸福林友善農業股份有限公司","臺北市大安區復興南路1段209號11樓","林李玉霞","5000000","1051125"
"837","52451103","偉陞鋁業有限公司","臺北市中山區南京東路2段137號14樓","陳詮木","1000000","1051123"
"838","52451130","詩篇國際時尚傳媒有限公司","臺北市大安區信義路4段279號8樓","林宏儒","100000","1051123"
"839","52451167","巧奪天工國際有限公司","臺北市大安區忠孝東路4段290號10樓","林峰生","1500000","1051123"
"840","52451201","日和士林股份有限公司","臺北市士林區福德路31號","陳美如","100000000","1051124"
"841","52451217","提昇股份有限公司","臺北市大安區忠孝東路3段305號6樓之1","張蕓筠","1000000","1051123"
"842","52451265","承新有限公司","臺北市信義區基隆路1段159號7樓之2","林承煒","1000000","1051125"
"843","52451321","青雲開發股份有限公司","臺北市中山區敬業一路182號6樓","劉書伸","4500000","1051124"
"844","52451390","全督有限公司","臺北市南港區忠孝東路6段6號3樓之2","鄭安全","180000","1051124"
"845","52451618","海貫國際有限公司","臺北市南港區忠孝東路6段6號3樓之2","鄭安全","680000","1051124"
"846","52451639","巨迦室內裝修有限公司","臺北市大安區信義路4段187號8樓","林正賢","1100000","1051124"
"847","52451687","寶貝幫有限公司","臺北市南港區經貿二路255巷39號","曾雨薇","1200000","1051124"
"848","52451808","銄成實業有限公司","臺北市內湖區新明路460巷18弄9號(1樓)","江衍義","1000000","1051124"
"849","52451814","贊誠視覺文化有限公司","臺北市信義區松山路541巷16號3樓之1","張凱俊","28000000","1051124"
"850","52451820","承心清潔有限公司","臺北市北投區石牌路2段89之1號4樓","陳燕如","500000","1051124"
"851","52451856","德昱投資有限公司","臺北市內湖區成功路5段77號5樓","陳文英","5000000","1051124"
"852","52451899","河流娛樂股份有限公司","臺北市信義區基隆路1段420號12樓之1","林效偉","500000","1051124"
"853","52451960","聖展金香有限公司","臺北市中山區南京東路2段172號5樓","李雅瑩","1000000","1051124"
"854","52452068","禹科國際實業有限公司","臺北市文山區景文街41號1樓","程凱","100000","1051124"
"855","52452139","權羽國際有限公司","臺北市萬華區西昌街163號4樓之1","王庭茹","200000","1051124"
"856","52452314","大方廣設計工程有限公司","臺北市松山區八德路3段210號11樓","王絹閔","150000","1051124"
"857","52452525","捷麗服飾有限公司","臺北市南港區中坡北路50巷19號1樓","洪貫霖","1000000","1051124"
"858","52452530","昇駿不動產有限公司","臺北市中山區長安東路2段67號6樓之3","張立政","500000","1051124"
"859","52452617","永鑄投資股份有限公司","臺北市信義區忠孝東路5段1之7號9樓","何佩玲","1000000","1051124"
"860","52452638","容誠駟有限公司","臺北市士林區大北路54號","吳幸容","500000","1051124"
"861","52452721","七步影業有限公司","臺北市中山區吉林路24號6樓之2","鍾享葳","1000000","1051124"
"862","52452763","智柏源科技有限公司","臺北市北投區中央南路2段12之27號19樓","任素云","1000000","1051124"
"863","52452813","沛程股份有限公司","臺北市大安區忠孝東路4段221號10樓","范美瑛","6000000","1051124"
"864","52452834","台灣韓比衣有限公司","臺北市中山區林森北路132號8樓","黃湘敏","1000000","1051124"
"865","52452911","台廉建材有限公司","臺北市信義區永吉路226號1樓","詹志鵬","2000000","1051124"
"866","52453051","上雅有限公司","臺北市大安區和平東路1段234號1樓、2樓","廖振修","3000000","1051124"
"867","52453138","枋克斐概念設計有限公司","臺北市大安區忠孝東路4段166號10樓","李哲","100000","1051124"
"868","52453171","華廣科技股份有限公司","臺北市內湖區民權東路6段180巷6號9樓之26","王明科","6600000","1051125"
"869","52453257","品茂有限公司","臺北市南港區忠孝東路6段278巷5弄18號5樓","蔡孟奇","100000","1051124"
"870","52453307","旭海能源有限公司","臺北市信義區信義路5段8號14樓","潘信方","2000000","1051124"
"871","52453334","諾薇雅行銷企劃有限公司","臺北市大安區敦化南路1段169巷8號","楊渝憓","500000","1051124"
"872","52453587","彼岸有限公司","臺北市信義區基隆路1段400號6樓","梁弘卓","6000000","1051124"
"873","52453622","季沃室內裝修有限公司","臺北市中山區松江路206號6樓之5","翁蕾雯","300000","1051124"
"874","52453670","適禾有限公司","臺北市大安區光復南路102號10樓","李欣怡","300000","1051124"
"875","52453708","上珵科技有限公司","臺北市中山區新生北路3段87巷55號3樓","高仕恩","200000","1051124"
"876","52453778","台日橋有限公司","臺北市大安區忠孝東路4段147巷1號5樓","尾本勝征","100000","1051124"
"877","52453806","福爾摩薩影業有限公司","臺北市中山區南京東路1段132巷18號9樓之3","謝璧蓮","500000","1051124"
"878","52453812","吉得堡餐飲管理顧問有限公司","臺北市松山區八德路2段439號10樓","莊喬惟","500000","1051125"
"879","52453833","友善農創股份有限公司","臺北市南港區忠孝東路6段394號","韓雅涵","5000000","1051124"
"880","52453849","買新鮮實業股份有限公司","臺北市大同區承德路3段214巷31號地下1樓","楊守仁","500000","1051124"
"881","52453910","見微生醫股份有限公司","臺北市中山區南京東路3段201號3樓","柳慶徽","1000000","1051125"
"882","52453931","捷夏企業有限公司","臺北市信義區信義路5段109號地下1樓","陳漢胤","200000","1051130"
"883","52454002","台北國際旅遊導覽雜誌有限公司","臺北市中山區松江路65號6樓","李翔羿","100000","1051121"
"884","52454018","錸利國際股份有限公司","臺北市中正區羅斯福路1段24號11樓","唐邦郁","10000000","1051125"
"885","52454066","億發生物科技股份有限公司","臺北市中山區撫順街8號7樓","梁怡倩","12000000","1051125"
"886","52454158","紅創設計整合行銷有限公司","臺北市大安區安和路2段7號11樓","林怡伶","2500000","1051125"
"887","52454468","台灣國際汎肯有限公司","臺北市松山區民生東路4段80巷1弄1號","劉宇軒","1000000","1051125"
"888","52454501","鈺祺實業有限公司","臺北市中正區金門街44巷7號","李宜榛","1000000","1051125"
"889","52454538","易冠開發有限公司","臺北市中山區南京西路1之1號6樓","王宸泰","1000000","1051125"
"890","52454586","加陽貿易有限公司","臺北市士林區士商路135號1樓","鄭梓恒","2000000","1051125"
"891","52454592","寶基投資有限公司","臺北市大安區光復南路102號8樓","游素秋","1000000","1051125"
"892","52454621","名閱投資有限公司","臺北市內湖區金湖路326巷51號2樓之3","詹麗美","20000000","1051125"
"893","52454663","禾貿紡織實業有限公司","臺北市內湖區康寧路3段189巷21弄12號1樓","吳岳展","10000000","1051125"
"894","52454713","台灣吉兵衛股份有限公司","臺北市信義區松壽路28號","吳念忠","6000000","1051125"
"895","52454798","絲田企業有限公司","臺北市內湖區堤頂大道2段297號8樓","陳玲玲","5000000","1051128"
"896","52454827","鉅邦生活智慧有限公司","臺北市信義區光復南路565號1樓","巫怡瑱","200000","1051125"
"897","52454832","東廷建設開發有限公司","臺北市士林區中山北路5段527號4樓","李志宏","1000000","1051125"
"898","52454869","崧博整合行銷有限公司","臺北市大安區忠孝東路4段333號6樓之1","虞竣傑","6000000","1051125"
"899","52454967","意克希國際有限公司","臺北市中山區明水路650號4樓之7","徐立","5000000","1051125"
"900","52454988","羿閎實業有限公司","臺北市中正區忠孝東路1段76號12樓之1","曾奕明","1000000","1051125"
"901","52454994","劭爺音樂股份有限公司","臺北市信義區東興路69號9樓","王文劭","50000","1051125"
"902","52455001","柏詩格有限公司","臺北市松山區民權東路3段144號7樓之3","夏爾雅","500000","1051125"
"903","52455017","華煜工程有限公司","臺北市大同區南京西路163號2樓之46","鄭思良","1000000","1051125"
"904","52455023","吉柏實業有限公司","臺北市士林區福國路95號3樓之13","陳柏宏","2000000","1051125"
"905","52455109","普世投資有限公司","臺北市中山區南京東路3段101號4樓","宋守智","10000","1051128"
"906","52455142","多田國際有限公司","臺北市內湖區內湖路3段59巷8號3樓","方美月","200000","1051125"
"907","52455179","寶富麗生技食品有限公司","臺北市士林區克強路10巷21弄20號2樓","龔麗琴","500000","1051125"
"908","52455184","國賦貿易有限公司","臺北市松山區民生東路5段198號12樓之12","黃啓峰","300000","1051125"
"909","52455261","環盛有限公司","臺北市中山區樂群二路187號6樓之3","蕭述仁","500000","1051125"
"910","52455375","天基投資有限公司","臺北市信義區信義路4段458號11樓","盧達一","10000","1051125"
"911","52455467","詠樂建材有限公司","臺北市文山區秀明路1段51號","陳俊萌","1000000","1051125"
"912","52455516","桔客國際文教有限公司","臺北市大安區和平東路1段16號3樓之1","陳侑敏","600000","1051125"
"913","52455591","宥永藍田有限公司","臺北市松山區敦化北路207號11樓之3","藍永明","1680000","1051125"
"914","52455662","宏築有限公司","臺北市中山區華陰街15號5樓","林縫環","1000000","1051125"
"915","52455733","台灣福代代有限公司","臺北市松山區南京東路3段287號9樓","崔馨方","4900000","1051125"
"916","52455776","日旺實業有限公司","臺北市大同區重慶北路3段243巷5號","方維霆","28000000","1051129"
"917","52456141","豪恩國際生物科技有限公司","臺北市內湖區民權東路6段123巷24號3樓","陳嬡儷","15000000","1051125"
"918","52456183","亞茲數位行銷有限公司","臺北市中正區忠孝西路1段7號6樓之1","林士安","1000000","1051125"
"919","52456212","南卓科技有限公司","臺北市內湖區行善路48巷18號6樓之3","羅輝龍","1000000","1051128"
"920","52456310","鰻谷實業有限公司","臺北市中正區汀州路3段151號1樓","王志龍","6000000","1051125"
"921","52456331","磐鉐實業有限公司","臺北市文山區政大一街279號2樓","許峯嘉","1000000","1051128"
"922","52456389","駿泰資產有限公司","臺北市信義區松德路65號8樓","林文章","1000000","1051125"
"923","52456395","台灣意德勤有限公司","臺北市信義區信義路5段8號14樓","麥曉東","50000","1051125"
"924","52456450","頂利管理顧問有限公司","臺北市大安區忠孝東路4段221號12樓","陳信翰","1000000","1051125"
"925","52456515","微藝娛樂有限公司","臺北市中山區林森北路557巷3號8樓之7","莊啓祥","2000000","1051125"
"926","52456521","鈞稘有限公司","臺北市萬華區成都路22號","陳芸鈞","300000","1051125"
"927","52456769","虛擬農場有限公司","臺北市南港區忠孝東路6段481號3樓","林家齊","6000000","1051125"
"928","52456796","沃禾室內裝修設計有限公司","臺北市松山區民生東路5段137巷4弄20號","林正侃","1000000","1051125"
"929","52456851","國宏投資有限公司","臺北市士林區承德路4段246號5樓","蘇美燕","29800000","1051128"
"930","52456901","銘洪有限公司","臺北市大安區敦化南路2段2號4樓之1","張浩銘","5000000","1051128"
"931","52456923","咬一口投資有限公司","臺北市信義區福德街268巷5弄17號","田旭弘","1000000","1051128"
"932","52457079","誠評網路資訊有限公司","臺北市大安區忠孝東路4段290號10樓","石聖安","340000","1051128"
"933","52457107","飛凰國際實業有限公司","臺北市信義區忠孝東路5段508號17號之3","廖仲偉","500000","1051128"
"934","52457161","壹際科技有限公司","臺北市松山區南京東路5段70號5樓之2","黃佩恩","225000","1051128"
"935","52457205","迷你糖有限公司","臺北市大安區信義路3段134巷12號","鄭姿鋨","2500000","1051128"
"936","52457211","締榮有限公司","臺北市中山區南京東路2段150號10樓","鄭勝澤","200000","1051128"
"937","52457269","明翎企業股份有限公司","臺北市松山區敦化北路201之4號12樓","李明彥","2000000","1051128"
"938","52457388","乘龍資訊有限公司","臺北市中山區南京東路2段36號7樓","康光耀","10000","1051128"
"939","52457394","三杰國際股份有限公司","臺北市信義區信義路6段15巷12弄3號1樓","郭彬","10000000","1051128"
"940","52457438","平久科技有限公司","臺北市北投區中央北路4段406號","時嘉寧","600000","1051128"
"941","52457471","錸旺食品有限公司","臺北市南港區合順街8巷3弄13號1樓","劉有常","500000","1051128"
"942","52457628","和亞國際有限公司","臺北市松山區民族東路689號","巫景裕","1000000","1051128"
"943","52457660","黑筆筆國際有限公司","臺北市大安區忠孝東路4段290號10樓","林昱汝","500000","1051128"
"944","52457704","昊鼎水產有限公司","臺北市南港區向陽路162巷109號9樓","吳裕福","10000000","1051128"
"945","52457824","義莎顧問有限公司","臺北市松山區南京東路4段1號11樓","帕茉莉PABA MARIA GIUSEPPINA","515000","1051128"
"946","52457866","五豪國際貿易有限公司","臺北市大同區南京西路434巷7之1號4樓","賴俊成","1000000","1051128"
"947","52457872","中晟投資有限公司","臺北市中正區許昌街42之1號11樓","李憶華","10000000","1051128"
"948","52457887","柒柒娛樂股份有限公司","臺北市中山區中山北路2段45巷11號3樓","郭全榮","500000","1051128"
"949","52458020","臺渥國際有限公司","臺北市大同區民生西路323號9樓之2","邱震承","5000000","1051128"
"950","52458035","台灣雷門國際科技有限公司","臺北市松山區南京東路5段158號7樓之1","黃泓琳","100000","1051128"
"951","52458106","白尊宇顧問股份有限公司","臺北市信義區基隆路2段91號5樓","戴功哲","500000","1051128"
"952","52458160","艾普達健康管理顧問有限公司","臺北市中山區松江路65號6樓","陳政勳","400000","1051128"
"953","52458324","翠碧雅柏顧問有限公司","臺北市內湖區東湖路43巷38號","林韋銘","540000","1051128"
"954","52458400","因心有限公司","臺北市信義區信義路4段415號12樓","洪郁雯","4500000","1051128"
"955","52458422","瑞得喜有限公司","臺北市信義區信義路4段415號12樓","李昱潔","6000000","1051128"
"956","52458437","嘉誼企業管理顧問有限公司","臺北市大同區市民大道1段211號10樓之16","傅珍珍","200000","1051128"
"957","52458464","濤濤國際博學有限公司","臺北市松山區復興北路57號16樓","陳宥如","5000000","1051128"
"958","52458485","大富環球創意傢俬有限公司","臺北市松山區八德路3段210號11樓","許暥哲","150000","1051128"
"959","52458513","旭陞資訊有限公司","臺北市中正區青島東路5號4樓之3","吳尚雨","5000000","1051128"
"960","52458534","鐳菲斯工程有限公司","臺北市中正區漢口街1段110號8樓之1","楊棓銘","5000000","1051128"
"961","52458611","聚欣工程有限公司","臺北市士林區美德街66號","吳沛聰","200000","1051128"
"962","52458653","創奕地板工程有限公司","臺北市南港區舊莊街1段229號2樓","廖浩鈞","1000000","1051130"
"963","52458703","良豆股份有限公司","臺北市大安區安和路1段72號","魏淑鳳","3050000","1051128"
"964","52458788","眾躍國際有限公司","臺北市大安區復興南路1段380號12樓之1","柳承志","3588888","1051128"
"965","52458990","鈿園開發建設有限公司","臺北市中山區長安東路1段101號8樓之2","陳瑞雲","5000000","1051128"
"966","52459077","銀禧國際管理顧問有限公司","臺北市信義區基隆路2段149之49號11樓之9","許傑凱","700000","1051128"
"967","52459132","黑龍影片股份有限公司","臺北市中山區南京東路1段132巷18號9樓之3","魏滔(WELLES, GIDEON DAVID)","2660000","1051128"
"968","52459230","維珍旅行社有限公司","臺北市中正區忠孝東路2段118號10樓","劉維禮","8000000","1051129"
"969","52459344","暖暖蜜蜂生活創意有限公司","臺北市中山區南京東路1段25號10樓之3","翁瑩純","1600000","1051128"
"970","52459386","亮超旅行社有限公司","臺北市中山區林森北路575號9樓之3","詹承翰","6000000","1051128"
"971","52459415","樂服健康管理顧問有限公司","臺北市萬華區艋舺大道416號","孫瑞蓮","100000","1051128"
"972","52459421","琦俐國際有限公司","臺北市大安區敦化南路2段138號","李燕華","500000","1051128"
"973","52459506","二十五資訊有限公司","臺北市信義區信義路4段415號12樓","陳威良","1000000","1051128"
"974","52459597","具能企業有限公司","臺北市內湖區瑞光路210號12樓","沈頤光","6000000","1051129"
"975","52459604","承穩實業有限公司","臺北市大同區承德路3段244號13樓","朱東輝","199800000","1051129"
"976","52459695","全民鑑寶媒體頻道股份有限公司","臺北市大安區忠孝東路4段176之1號7樓","黃傑齊","1000000","1051128"
"977","52459739","宇柏投資股份有限公司","臺北市士林區中山北路7段14巷5弄17號3樓","王桂珠","6000000","1051129"
"978","52460010","王涵國際光束設計有限公司","臺北市信義區忠孝東路5段508之5號1樓","王涵","500000","1051129"
"979","52460068","德捷投資股份有限公司","臺北市信義區信義路5段150巷2號9樓之6","葉佳紋","30000000","1051129"
"980","52460216","艾爾立有限公司","臺北市內湖區洲子街48號6樓","陳宏凱","300000","1051129"
"981","52460237","承彥企業有限公司","臺北市大同區重慶北路2段153號6樓之3","林建國","5000000","1051129"
"982","52460314","信石國際資本有限公司","臺北市大安區信義路4段263號12樓之4","吳柏霖","500000","1051129"
"983","52460412","利嘉行國際股份有限公司","臺北市內湖區堤頂大道1段33號2樓","趙一葵","1000000","1051129"
"984","52460433","琦勝工程股份有限公司","臺北市松山區民生東路3段110巷10號3樓","樊國屏","6000000","1051129"
"985","52460481","貫致有限公司","臺北市信義區基隆路1段155號7樓","李俊寬","100000","1051129"
"986","52460519","濬承國際有限公司","臺北市信義區信義路4段415號12樓","林濬暘","600000","1051129"
"987","52460588","文碩股份有限公司","臺北市大安區羅斯福路2段95號19樓","林宇安","1000000","1051129"
"988","52460601","星寶電子科技有限公司","臺北市大安區光復南路306號11樓","陳啟民","300000000","1051129"
"989","52460617","瑞宜潛水有限公司","臺北市松山區復興北路181號5樓之1","吳啓瑞","500000","1051129"
"990","52460623","禾沃科技股份有限公司","臺北市中山區天津街51號3樓","黃勝暉","2000000","1051129"
"991","52460686","映色有限公司","臺北市大安區延吉街129巷6號3樓","楊儉業","1000000","1051129"
"992","52460709","筆谷股份有限公司","臺北市中山區民生東路2段3號6樓之3","陳謙","300000","1051129"
"993","52460715","依莀有限公司","臺北市大安區忠孝東路4段206號8樓","雷依莀","100000","1051129"
"994","52460807","耕果有限公司","臺北市北投區北投路1段77號8樓","陳炫宇","1000000","1051129"
"995","52460855","桂嘉興業有限公司","臺北市大安區忠孝東路4段320號2樓","楊立達","2000000","1051129"
"996","52460975","卡普股份有限公司","臺北市信義區基隆路2段135號6樓","劉文正","1000000","1051129"
"997","52461046","全方位投資有限公司","臺北市士林區至善路2段180號15樓","林王淑蓉","1000000","1051129"
"998","52461088","合基投資有限公司","臺北市北投區中山北路7段219巷3弄199號","林柏源","1000000","1051129"
"999","52461094","仁鼎投資有限公司","臺北市中正區忠孝西路1段66號28樓","簡錫欣","1000000","1051129"
"1000","52461186","裕瀚投資有限公司","臺北市大安區敦化南路1段376號8樓之3","蔡裕隆","1000000","1051129"
"1001","52461192","中意有限公司","臺北市中山區林森北路452號8樓","鍾穗","6000000","1051129"
"1002","52461290","筑園餐飲有限公司","臺北市南港區忠孝東路5段803、805號","洪筱喻","100000","1051129"
"1003","52461340","宥構美室內裝修設計有限公司","臺北市士林區承德路4段198號3樓","陳美姿","1000000","1051129"
"1004","52461496","仁通投資有限公司","臺北市信義區信義路4段391號12樓之7","陳婉萍","1000000","1051129"
"1005","52461539","觀健康有限公司","臺北市內湖區瑞湖街39號2樓","陳凝觀","3500000","1051129"
"1006","52461616","膳百味有限公司","臺北市文山區景中街1號1樓","郭君聿","300000","1051129"
"1007","52461637","艾婕生健康事業有限公司","臺北市士林區士東路200巷58弄1號4樓","張愛卿","1000000","1051129"
"1008","52461664","海富長和國際有限公司","臺北市中山區松江路301號6樓之2","張竹煌","15000000","1051129"
"1009","52461670","魚樂娛樂有限公司","臺北市大安區信義路4段1號12樓之5","倪子鈞","1000000","1051129"
"1010","52461685","寶饈食品有限公司","臺北市大安區復興南路2段148巷35號2樓","藍文青","1000000","1051129"
"1011","52461720","臺灣研凱數位股份有限公司","臺北市大安區忠孝東路4段221號12樓","林君翰","500000","1051129"
"1012","52461828","太陞地板工程有限公司","臺北市松山區南京東路4段130號2樓之1","余麗卿","2000000","1051129"
"1013","52461860","慕宇生物科技股份有限公司","臺北市中山區敬業一路162號2樓","鍾燿年","1000000","1051129"
"1014","52461881","正裕綠能科技股份有限公司","臺北市信義區基隆路2段33號12樓之2","柯光隆","2500000","1051129"
"1015","52462039","唯一創意行銷有限公司","臺北市中山區復興北路420號7樓","陳建宇","1000000","1051129"
"1016","52462191","義美生醫技術股份有限公司","臺北市大安區信義路2段88號9樓","高志尚","32000000","1051129"
"1017","52462214","樂渥有機物股份有限公司","臺北市信義區基隆路1段115號1樓","陳美冬","10000000","1051129"
"1018","52462278","永丞資產管理有限公司","臺北市中正區忠孝西路1段33號7樓","孟永貴","1000000","1051129"
"1019","52462283","蒸烹派有限公司","臺北市信義區忠孝東路5段783號","鄭宗奇","1000000","1051129"
"1020","52462306","圓智國際投資有限公司","臺北市松山區南京東路4段21號8樓之2","呂淑容","1000000","1051129"
"1021","52462474","大苑娛樂製作有限公司","臺北市松山區八德路2段346巷5之1號1樓","楊韻儒","500000","1051129"
"1022","52462517","榕德國際投資有限公司","臺北市松山區南京東路4段25號7樓之1","施玫君","1000000","1051129"
"1023","52462559","言森有限公司","臺北市松山區南京東路4段106號8樓","林晉賢","200000","1051129"
"1024","52462586","台灣大車隊投資控股股份有限公司","臺北市中山區長安東路2段162號2樓","林村田","100000","1051129"
"1025","52462615","弄寓樂股份有限公司","臺北市內湖區瑞光路513巷39號5樓","謝翼陽","2000000","1051129"
"1026","52462621","善仁國際投資有限公司","臺北市中正區重慶南路1段83號6樓","林許美玲","1000000","1051129"
