"序號","統一編號","公司名稱","公司所在地","代表人","資本額","核准設立日期"
"1841","59147965","華杰瑞國際有限公司","高雄市前鎮區瑞和街213之10號1樓","陳秉楓","500000","1051110"
"1842","59147971","鼎懷實業有限公司","高雄市三民區順昌街93號2樓之1","王士槐","5000000","1051110"
"1843","59147992","芩盟企業有限公司","高雄市大社區大社路365之1號1樓","謝士廷","1000000","1051110"
"1844","59148009","福瑞斯特文教事業股份有限公司","高雄市鳥松區文前路3巷10之4號","竇瑜芬","10000000","1051110"
"1845","59148021","大大洋行有限公司","高雄市三民區遼寧二街222號1樓","陳國寶","300000","1051110"
"1846","59148036","郡群有限公司","高雄市三民區自由一路228號2樓","黃金城","200000","1051110"
"1847","59148042","巧揚事業有限公司","高雄市橋頭區新東一街277號13樓","王育光","500000","1051111"
"1848","59148107","統瀛國際實業有限公司","高雄市鳳山區高鳳一路50號4樓","黃煜清","50000","1051111"
"1849","59148113","宇文愛車時尚有限公司","高雄市三民區澄清路311號","陳勇仁","1000000","1051111"
"1850","59148129","蜜思赫本美粧有限公司","高雄市旗山區復新北街21號1樓","方靖淳","30000","1051111"
"1851","59148155","迷蝶香手工皂有限公司","高雄市小港區高坪二十五路5號1樓","林永得","200000","1051111"
"1852","59148161","旭力工程有限公司","高雄市苓雅區建國一路123巷1弄8號1樓","曾佩珊","1000000","1051114"
"1853","59148182","承鴻食品有限公司","高雄市三民區河北一路287號1樓","陳緯哲","2000000","1051111"
"1854","59148248","御福參道有限公司","高雄市前金區五福三路69號1樓","彭錦繡","3000000","1051111"
"1855","59148303","瑞興起重工程有限公司","高雄市仁武區文學路2段601號1樓","陳健興","5000000","1051111"
"1856","59148351","百奕開發工程有限公司","高雄市楠梓區三山街99巷2弄18號1樓","許玉常","1000000","1051111"
"1857","59148367","台灣顏玉瑩投資興業有限公司","高雄市三民區大連街366號9樓之9","顏福成","3000000","1051111"
"1858","59148373","非凡國際藝術有限公司","高雄市新興區南台路129號9樓之2","陳金娥","300000","1051111"
"1859","59148388","六一六輕旅有限公司","高雄市前金區五福三路61號6樓之2","蔡瓊姝","1688888","1051111"
"1860","59148417","九鎰電機有限公司","高雄市仁武區京中三街11號","蔡錦文","2000000","1051111"
"1861","59148438","博陽通信有限公司","高雄市岡山區壽天路67號1樓","凌柄樺","1000000","1051114"
"1862","59148444","台灣網一有限公司","高雄市左營區翠華路601巷96號4樓","梁玉英","1000000","1051114"
"1863","59148459","廣晉能源開發有限公司","高雄市旗山區大同街39號","陳安婕","20000000","1051114"
"1864","59148465","察理王子國際興業有限公司","高雄市大寮區大寮路686巷28弄9號","吳隆健","10000000","1051114"
"1865","59148471","巨群貿易有限公司","高雄市新興區文橫一路13號1樓","劉淑琳","1000000","1051114"
"1866","59148508","京達資產管理有限公司","高雄市三民區鼎泰街122號1樓","黃燕玉","500000","1051114"
"1867","59148520","彤茂國際有限公司","高雄市三民區壽昌路271號","王宗垤","2000000","1051114"
"1868","59148578","朝旭光電有限公司","高雄市苓雅區建國一路140巷17弄5號1樓","柯秀旻","500000","1051114"
"1869","59148606","宗迎有限公司","高雄市苓雅區和平一路292號1樓","盧宗華","10000000","1051114"
"1870","59148612","旭日發科技有限公司","高雄市鳳山區龍成路220號5樓","蔡岱霖","500000","1051114"
"1871","59148654","朝昱光電有限公司","高雄市苓雅區建國一路140巷17弄5號1樓","柯秀旻","500000","1051114"
"1872","59148676","三揚生技實業有限公司","高雄市新興區五福二路136號5樓之1","張惟勝","1000000","1051114"
"1873","59148697","三喜幸福門股份有限公司","高雄市左營區文川路74巷1號","陳金麗","1000000","1051114"
"1874","59148726","古錐運動行銷有限公司","高雄市左營區辛亥路117號10樓之2","葉純芳","100000","1051114"
"1875","59148768","九鼎國際食品有限公司","高雄市苓雅區光華一路321號7樓之8","黃靖婷","200000","1051114"
"1876","59148789","參號倉有限公司","高雄市楠梓區大學東路203號","許淑麗","6800000","1051114"
"1877","59148795","鼎楠實業有限公司","高雄市三民區義永路43巷7弄17號1樓","林育翔","5000000","1051115"
"1878","59148824","菁饌初日有限公司","高雄市鼓山區明誠三路479號1樓","楊建文","1000000","1051115"
"1879","59148850","東鴻企業有限公司","高雄市苓雅區興中二路54巷8號5樓","滕中文","1000000","1051115"
"1880","59148866","忻晟有限公司","高雄市小港區復華路7巷8號","賴淮忻","100000","1051115"
"1881","59148937","欣佳建設有限公司","高雄市仁武區中華路379號1樓","王隆裕","2000000","1051115"
"1882","59148943","永翔建設股份有限公司","高雄市前鎮區復興新巷55號5樓","張博鈞","200000","1051115"
"1883","59148958","倢創生物科技有限公司","高雄市苓雅區武嶺街33巷14號5樓","許融響","1200000","1051115"
"1884","59148964","辰威不銹鋼金屬門窗有限公司","高雄市梓官區展寶路永生巷55號1樓","趙振欽","100000","1051115"
"1885","59148991","百耀石材有限公司","高雄市鳳山區保泰路494號","鄭雋立","1000000","1051115"
"1886","59149056","高順不動產經紀有限公司","高雄市苓雅區建國一路109號4樓之3","李承修","1000000","1051115"
"1887","59149083","寶可夢科技有限公司","高雄市大寮區內厝路361號7樓","蘇建州","1000000","1051115"
"1888","59149099","玄濬工程有限公司","高雄市鳳山區建國路3段85號4樓","王景怡","100000","1051115"
"1889","59149106","世芸有限公司","高雄市苓雅區四維三路57巷18號1樓","林佩芸","30000","1051115"
"1890","59149149","天譯文化科技有限公司","高雄市苓雅區中山二路368號","何明智","50000","1051115"
"1891","59149226","昭利有限公司","高雄市三民區遼寧一街381號1樓","陳炳宏","50000","1051115"
"1892","59149231","巧益聯合有限公司","高雄市前鎮區瑞隆路132號1樓","羅永昌","200000","1051115"
"1893","59149268","永群企業有限公司","高雄市橋頭區成功北路170號","黃淑錦","500000","1051115"
"1894","59149302","峰達生物科技有限公司","高雄市岡山區岡榮路2巷6號","余威槿","30000","1051115"
"1895","59149318","鄔斯特有限公司","高雄市左營區新庄仔路788巷23號1樓","張素惠","2000000","1051115"
"1896","59149422","龍林生技有限公司","高雄市苓雅區大順三路189號1樓","伍宥蓁","800000","1051115"
"1897","59149443","安順建材事業有限公司","高雄市苓雅區建國一路64巷21之2號","黃盟喜","2000000","1051115"
"1898","59149534","仕倍得國際有限公司","高雄市左營區榮德街3號21樓之2","林思佩","500000","1051115"
"1899","59149555","銘鋒機電有限公司","高雄市橋頭區里林西路文化巷42號1樓","蒲家茜","50000","1051116"
"1900","59149561","禾嵐婚紗有限公司","高雄市三民區中華二路297號1樓","譚莉樺","5000000","1051107"
"1901","59149598","文藻外語諮詢顧問有限公司","高雄市三民區延慶街61號","陳世珍","1000000","1051116"
"1902","59149611","泰勇工程有限公司","高雄市大寮區琉球路75之38號1樓","毛昭傑","50000","1051116"
"1903","59149627","佳營工程有限公司","高雄市鼓山區青雲街73號1樓","李金祥","200000","1051116"
"1904","59149669","慈航投資股份有限公司","高雄市鼓山區青海路305號10樓","陳金枝","1000000","1051116"
"1905","59149675","瑞宣實業有限公司","高雄市鳳山區五甲二路378號1樓","周建良","500000","1051116"
"1906","59149719","禾芽科技有限公司","高雄市左營區文育路1號11樓之2","林宏憲","100000","1051116"
"1907","59149794","樂予國際實業有限公司","高雄市鼓山區美術北三路200號6樓","陳曉妮","300000","1051116"
"1908","59149871","旺鼎生技食品有限公司","高雄市左營區重信路421號","謝盛宇","1000000","1051116"
"1909","59149957","宇群金屬有限公司","高雄市大寮區鳳屏二路157之52號","周敬敦","50000","1051116"
"1910","59149990","新座複合材料有限公司","高雄市左營區立大路50巷17弄3號6樓之3","陳采蓮","500000","1051116"
"1911","59150004","齊力盈企業有限公司","高雄市楠梓區朝明路7號","蔡雅雯","1200000","1051116"
"1912","59150026","菁朧有限公司","高雄市岡山區竹圍西街302號","林婷婷","400000","1051116"
"1913","59150031","艾司鐵馬克國際有限公司","高雄市前金區河南二路109號1樓","黃世任","1000000","1051116"
"1914","59150124","魯胖胖有限公司","高雄市左營區城峰路52號14樓","鄭哲明","85000","1051116"
"1915","59150216","騰飛達企業有限公司","高雄市前鎮區台鋁十一巷17號3樓","林東樺","1000000","1051117"
"1916","59150243","頡邑空間設計有限公司","高雄市三民區皓東路76巷19弄6號3樓","黃意惠","1000000","1051117"
"1917","59150308","綠源風電設備有限公司","高雄市彌陀區民生街258號1樓","周春木","1000000","1051117"
"1918","59150341","樂米旅店有限公司","高雄市鹽埕區府北路39號","魏榮杉","4000000","1051117"
"1919","59150406","璇光科技有限公司","高雄市鳳山區輜汽路154號1樓","陳皇志","1200000","1051117"
"1920","59150433","申達工程有限公司","高雄市左營區文自路885號4樓","王耀生","100000","1051117"
"1921","59150476","閔斌企業股份有限公司","高雄市鼓山區龍德路293號30樓","林欣怡","5000000","1051117"
"1922","59150525","天火同人有限公司","高雄市鼓山區神農路161號15樓","孟三中","10000000","1051117"
"1923","59150757","揚佰企業有限公司","高雄市三民區水源路33號4樓","楊穎昌","1000000","1051117"
"1924","59150807","豪策科技貿易有限公司","高雄市前鎮區漁港路30號1樓","涂育豪","2000000","1051117"
"1925","59150840","高進環保科技有限公司","高雄市仁武區義大二路851之1號","李啟宏","15000000","1051117"
"1926","59150877","三誠工程有限公司","高雄市鹽埕區光榮街85號15樓之2","莊茗傑","450000","1051117"
"1927","59150996","東方星媒體有限公司","高雄市岡山區中山北路26號10樓","呂聯長","1000000","1051117"
"1928","59151046","富盛租賃開發有限公司","高雄市鼓山區富農路118號","許曜璿","3000000","1051117"
"1929","59151192","豐華投資有限公司","高雄市三民區永吉街104號1樓","林碧鑾","10000000","1051118"
"1930","59151215","名揮有限公司","高雄市前鎮區光華二路70號3樓","張志明","50000","1051118"
"1931","59151242","貸貸鑫科技有限公司","高雄市左營區左營大路514號2樓","方勝新","100000","1051118"
"1932","59151355","文利貿易有限公司","高雄市左營區曾子路210巷5號4樓","趙淑華","6600000","1051118"
"1933","59151432","喬揚有限公司","高雄市鳳山區青年路2段255號","呂璥全","10000000","1051118"
"1934","59151496","迦賀企業有限公司","高雄市三民區昭良街7號3樓","林美伶","1000000","1051118"
"1935","59151502","鑫嘉工程有限公司","高雄市岡山區嘉新東路159號1樓","林才淵","100000","1051118"
"1936","59151876","久砌貿易有限公司","高雄市前鎮區新光路7號33樓之5","謝易霖","500000","1051121"
"1937","59151968","鑫茗芳事業有限公司","高雄市仁武區八德中路582號1樓","王茗芳","100000","1051118"
"1938","59151989","甲四方國際實業有限公司","高雄市仁武區鳳仁路278號1樓","江國維","1200000","1051118"
"1939","59152050","鍏藍科技有限公司","高雄市鳳山區頂庄路148號6樓","胡育慧","500000","1051121"
"1940","59152072","宏鷹生技有限公司","高雄市鼓山區建榮路168號2樓","吳君宏","1000000","1051121"
"1941","59152100","皇鑫通訊工程有限公司","高雄市三民區水源路109巷1號","陳俊吉","300000","1051121"
"1942","59152191","榮成國際企業有限公司","高雄市前金區中正四路151號12樓之2","楊孟儒","100000","1051121"
"1943","59152376","臣照實業有限公司","高雄市仁武區名湖街399號1樓","石文承","100000","1051121"
"1944","59152397","浚展工程有限公司","高雄市小港區青山街125號","莊晉德","1000000","1051121"
"1945","59152431","巴黎國際香水有限公司","高雄市鳳山區中山路121號","楊麗萍","500000","1051121"
"1946","59152447","贔佳貿易有限公司","高雄市小港區鳳林路40號1樓","涂瑜珈","100000","1051121"
"1947","59152474","富祺有限公司","高雄市苓雅區自強三路3號31樓之11","曹霞","6000000","1051121"
"1948","59152495","創造傳播有限公司","高雄市苓雅區中山二路331號1樓","黃淑美","1000000","1051121"
"1949","59152544","橫河貿易有限公司","高雄市三民區熱河一街421號","謝季芳","100000","1051121"
"1950","59152777","惟至佳科技有限公司","高雄市鼓山區中華一路203號11樓","林承螢","1000000","1051121"
"1951","59152875","慶鴻國際實業有限公司","高雄市旗山區復新東街82號","鍾文榮","2000000","1051121"
"1952","59152951","恆潤企業有限公司","高雄市三民區義華路171號5樓","蕭書臻","1000000","1051121"
"1953","59153001","儀展機械有限公司","高雄市仁武區赤貴街95巷11號1樓","朱維振","2000000","1051121"
"1954","59153017","沛鈺實業有限公司","高雄市鹽埕區五福四路346號","曾永豪","250000","1051121"
"1955","59153023","億泰工業有限公司","高雄市三民區銀杉街22號1樓","黃雲堅","5000000","1051121"
"1956","59153038","奧尼克娛樂股份有限公司","高雄市鳥松區本興路6號","王樑華","250000","1051121"
"1957","59153121","吉恩貿易洋行有限公司","高雄市苓雅區苓雅一路354號1樓","馬郁智","3000000","1051121"
"1958","59153190","小奇食品有限公司","高雄市甲仙區中正路2號","劉士賢","3000000","1051121"
"1959","59153240","華誠餐飲有限公司","高雄市前金區五福三路57號8樓","張銘池","7500000","1051121"
"1960","59153261","愛丰盛國際顧問有限公司","高雄市左營區立文路77號11樓201室","梁育均","100000","1051121"
"1961","59153282","豐毓食品有限公司","高雄市左營區文自路609號1樓","張益誌","2000000","1051121"
"1962","59153298","致盛數位印刷有限公司","高雄市三民區通化街120號","蔡瑞得","1500000","1051121"
"1963","59153305","惠翔國際有限公司","高雄市鼓山區鼓山三路41號","張家豪","100000","1051121"
"1964","59153311","畇里有限公司","高雄市苓雅區凱旋三路837號1樓","許語芯","1000000","1051121"
"1965","59153353","愛力有限公司","高雄市苓雅區建國一路175之6號1樓","黃士豪","1100000","1051121"
"1966","59153430","方福國際管理顧問有限公司","高雄市鼓山區青海路320號2樓","楊崧右","1000000","1051121"
"1967","59153451","桐毅設計有限公司","高雄市仁武區永昌三街71巷9號1樓","黃石鏡","500000","1051122"
"1968","59153494","潔敏國際生醫有限公司","高雄市鼓山區美明路70號5樓","蔡燕章","1000000","1051122"
"1969","59153810","晁億興業有限公司","高雄市大社區大吉路16巷66號1樓","陳貴寶","1000000","1051122"
"1970","59153874","承柏工程有限公司","高雄市前金區七賢二路282號8樓","龔桓陞","100000","1051122"
"1971","59153987","南方之心天使創業投資股份有限公司","高雄市苓雅區光華一路210號4樓之1","林志隆","2550000","1051122"
"1972","59154135","民生發展有限公司","高雄市左營區安吉街436號1檈","蔡寶寶","40000","1051123"
"1973","59154141","翔鈴設計有限公司","高雄市左營區曾子路398號4樓","呂溫婕薰","200000","1051122"
"1974","59154162","維格美容企業有限公司","高雄市前鎮區瑞隆路533號9樓","簡于珊","100000","1051122"
"1975","59154212","谷福生技有限公司","高雄市新興區中正二路182號12樓之1","劉馥綺","1000000","1051122"
"1976","59154228","喬德御貿易有限公司","高雄市三民區九如二路495號12樓","王樹德","1000000","1051122"
"1977","59154249","次回有限公司","高雄市楠梓區德豐街1號4樓","李嘉雯","6800000","1051122"
"1978","59154254","富長鑫企業有限公司","高雄市鳳山區武慶二路36號7樓","廖秋娥","500000","1051122"
"1979","59154439","蜜達絲化粧品有限公司","高雄市前金區自強一路22號11樓之1","陳冠博","1000000","1051122"
"1980","59154493","家圓包材有限公司","高雄市前鎮區瑞恩街1號4樓","尤曾寶瑤","120000","1051122"
"1981","59154590","幸福書房有限公司","高雄市苓雅區英明路200號1樓","林美惠","200000","1051122"
"1982","59154613","協泰豐國際有限公司","高雄市楠梓區右昌街542巷1號1樓","詹建德","1000000","1051123"
"1983","59154634","信品科技有限公司","高雄市燕巢區中北路34號2樓","李東融","100000","1051123"
"1984","59154655","源成茶莊有限公司","高雄市小港區山田路135巷12號3樓","王冠程","200000","1051123"
"1985","59154661","堃鑫企業有限公司","高雄市仁武區澄合街120巷12號1樓","賴國永","1000000","1051123"
"1986","59154677","假期汽車租賃有限公司","高雄市三民區建國二路305號","林町潔","6000000","1051123"
"1987","59154705","鈊創空間室內設計有限公司","高雄市林園區忠孝西路125巷18號2樓","廖薰依","500000","1051123"
"1988","59154732","新穎益有限公司","高雄市鼓山區河邊街11巷15弄25號","戴崇傑","160000","1051123"
"1989","59154901","天壹金屬企業有限公司","高雄市大社區中華路258巷19號10樓","施文鵬","300000","1051123"
"1990","59154959","藝碩資訊有限公司","高雄市三民區延吉街121巷21號2樓","周育民","100000","1051123"
"1991","59155021","春億綠能科技股份有限公司","高雄市仁武區永新五街91號1樓","李宗和","15000000","1051123"
"1992","59155090","祐瑞開發有限公司","高雄市三民區文濱路29號2樓","張祐綸","1000000","1051123"
"1993","59155269","晶弘寶國際有限公司","高雄市苓雅區四維四路172之7號3樓之4","杜泓瑩","100000","1051123"
"1994","59155296","展易金屬工程有限公司","高雄市湖內區正義一路216巷57號1樓","王立元","1000000","1051123"
"1995","59155325","俊亞實業有限公司","高雄市三民區灣中街286巷7號1樓","黃俊毅","1000000","1051123"
"1996","59155417","宇金企業有限公司","高雄市彌陀區鹽埕大路1號1樓","林冠儒","1000000","1051123"
"1997","59155459","凱軒國際有限公司","高雄市大寮區鳳林三路315之7號8樓","李采璇","90000","1051123"
"1998","59155535","榮達誠有限公司","高雄市仁武區五和路410號","陳仁賢","200000","1051123"
"1999","59155612","澄知室內裝修工程設計有限公司","高雄市苓雅區自強三路3號23樓之1","魏志昌","1000000","1051123"
"2000","59155681","飛翔國際貿易有限公司","高雄市鳳山區鳳誠路11號2樓","何青峰","900000","1051123"
"2001","59155710","好客滿餐飲有限公司","高雄市三民區九如二路341號1樓","唐哲平","1000000","1051123"
"2002","59155802","鎮陽模具有限公司","高雄市路竹區國昌路71巷6弄14號1樓","鄧國志","200000","1051123"
"2003","59155887","米棋多媒體整合行銷有限公司","高雄市鼓山區龍勝路28號12樓","黃秉棋","1000000","1051124"
"2004","59155916","至新企業有限公司","高雄市鳳山區鳳仁路100之92號1樓","林黃玉霞","300000","1051124"
"2005","59155937","捌捌捌行銷企業有限公司","高雄市大寮區力行路88之1號","邱俊智","500000","1051124"
"2006","59155958","歐映企業有限公司","高雄市前鎮區漁港北一路17號1樓","蔡明勛","1000000","1051124"
"2007","59155970","和瑞工程有限公司","高雄市鳳山區文學街31巷6之4號","高秋蓮","100000","1051123"
"2008","59156035","上順租賃有限公司","高雄市苓雅區中正一路149號","林守益","60000","1051124"
"2009","59156056","豪礎建設有限公司","高雄市岡山區大全街11巷23號","蕭正道","3000000","1051124"
"2010","59156083","金御閣餐飲事業有限公司","高雄市楠梓區德民路938之2號","曾啓明","100000","1051124"
"2011","59156181","宥樂企業有限公司","高雄市大樹區瓦厝街76巷2之12號","鄭雅瓊","3000000","1051124"
"2012","59156197","傳馨生物科技有限公司","高雄市前鎮區英德街59號1樓","莊景翔","500000","1051124"
"2013","59156252","祥詠生活有限公司","高雄市仁武區京中四街72巷26號3樓","吳詠薇","50000","1051124"
"2014","59156350","督瑪那努工程有限公司","高雄市左營區崇德路117號6樓","胡子軒","1000000","1051124"
"2015","59156387","納威有限公司","高雄市前鎮區民權二路8號16樓之1","趙耀華","1000000","1051125"
"2016","59156470","芃帛企業有限公司","高雄市苓雅區四維四路22號10樓之2","陳姝伶","300000","1051125"
"2017","59156577","互聯國際股份有限公司","高雄市楠梓區土庫路256號","潘健義","500000","1051125"
"2018","59156627","東詳國際行銷有限公司","高雄市鳳山區八德路2段212巷46號1樓","鄭振家","1000000","1051125"
"2019","59156788","豪大事業有限公司","高雄市岡山區民族路2號1樓","楊玉晴","1000000","1051125"
"2020","59156844","義恆有限公司","高雄市鼓山區青海路110號","林偉","3125000","1051125"
"2021","59156859","高新能科技有限公司","高雄市苓雅區永康街218號1樓","陳鋐澤","1000000","1051125"
"2022","59156886","捷榮物流有限公司","高雄市岡山區民族南一街8號1樓","許志榮","500000","1051125"
"2023","59156921","泡泡紅國際有限公司","高雄市左營區太華街213號6樓","林聖庭","500000","1051125"
"2024","59156942","福田屋國際有限公司","高雄市三民區鼎中路162號2樓","林淑麗","3000000","1051125"
"2025","59156963","欣佰利企業有限公司","高雄市鳳山區瑞順街131號1樓","劉玉琛","500000","1051125"
"2026","59156984","鈺崴油漆工程有限公司","高雄市杉林區司馬路384巷42之3號","吳再生","500000","1051128"
"2027","59157040","光駿貿科技有限公司","高雄市小港區桂華街9號1樓","劉士榮","100000","1051128"
"2028","59157055","恩錸健康有限公司","高雄市新興區大同一路61號1樓","王子嘉","1000000","1051128"
"2029","59157077","長明承工程有限公司","高雄市仁武區八德西路1755號1樓","陳俊豪","3000000","1051128"
"2030","59157132","蒂浦電子股份有限公司","高雄市新興區民生一路52號2樓","鄧博仁","4000000","1051128"
"2031","59157148","濾淨有限公司","高雄市岡山區前峰路111巷43號1樓","黃文富","1200000","1051128"
"2032","59157251","金型企業有限公司","高雄市左營區政德路637號1樓","謝淑芬","15000000","1051128"
"2033","59157323","無尾香蕉有限公司","高雄市前金區光復一街23號","","10000000","1051128"
"2034","59157359","泰山資源有限公司","高雄市三民區灣中街259號1樓","張偉峯","1000000","1051128"
"2035","59157409","真味食油有限公司","高雄市林園區海墘路46巷12弄7號","蘇淑貞","1688989","1051129"
"2036","59157415","宗邑豪有限公司","高雄市永安區永工三路5號","李建鋒","29500000","1051128"
"2037","59157442","高裕科技有限公司","高雄市苓雅區大順三路8號1樓","詹適榮","5000000","1051129"
"2038","59157533","萬瑞誠企業有限公司","高雄市彌陀區中正西路249號1樓","李春嬿","1000000","1051128"
"2039","59157576","義品進口服飾有限公司","高雄市鼓山區美術東六街227號1樓","江文如","500000","1051128"
"2040","59157652","昇進五金有限公司","高雄市前鎮區瑞政街91號","蔡坤佑","1450000","1051128"
"2041","59157674","金建商務飯店有限公司","高雄市小港區飛機路459號","林金妮","5000000","1051128"
"2042","59157689","一起吧星點股份有限公司","高雄市苓雅區自強三路3號26樓之3","姜建良","178000","1051129"
"2043","59157772","澄韻有限公司","高雄市左營區左營大路2之39號2樓","黃稚閑","500000","1051129"
"2044","59157793","慢走有限公司","高雄市前鎮區二聖一路196巷10號5樓","王恩加","30000","1051129"
"2045","59157822","棋美工程有限公司","高雄市小港區營口路21巷7號1樓","呂俊杰","1000000","1051129"
"2046","59157870","輛晶晶有限公司","高雄市楠梓區建楠橫路42之15號3樓","李威伸","1000000","1051129"
"2047","59157914","嘉盛工程有限公司","高雄市林園區中芸路83巷1號1樓","何盛嘉","850000","1051129"
"2048","59158012","正大明漁業股份有限公司","高雄市前鎮區天后街67號","許明周","10000000","1051129"
"2049","59158168","長誼金屬有限公司","高雄市岡山區壽華路131巷3號1樓","陳永發","1000000","1051129"
"2050","59158343","永璨國際有限公司","高雄市左營區富民路452號","蔡富麟","1001000","1051129"
"2051","59158370","嘿森設計有限公司","高雄市苓雅區永康街111之1號1樓","鍾亦迦","200000","1051129"
"2052","59158420","華印機電設備有限公司","高雄市鳥松區圓山路2之8號2樓","王建華","1000000","1051129"
"2053","59158483","鈺晟興業有限公司","高雄市仁武區旭成街10號1樓","黃于蘋","500000","1051129"
"2054","59158630","鴻莉貿易有限公司","高雄市鳳山區八德路2段272號1樓","楊光晴","200000","1051130"
