"序號","統一編號","公司名稱","公司所在地","代表人","資本額","核准設立日期"
"2850","66263377","飽米食品有限公司","新北市板橋區板新路20號7樓","蔡承諭","150000","1051101"
"2851","66263411","雅鴿文創股份有限公司","新北市泰山區新生路15巷6號3樓","呂昌熙","5000000","1051101"
"2852","66263432","君霖興業有限公司","新北市三重區成功路104巷19號","蔡耀陞","50000","1051101"
"2853","66263448","凱捷節能科技有限公司","新北市鶯歌區尖山路212巷3號","林雪華","1000000","1051102"
"2854","66263469","菲比科技有限公司","新北市中和區中興街204號2樓","林冠廷","800000","1051101"
"2855","66263502","謙福投資有限公司","新北市板橋區雙十路2段50號3樓","郭枝群","15680000","1051101"
"2856","66263524","原博多媒體設計有限公司","新北市三芝區智成街23號","張家宜","100000","1051101"
"2857","66263600","嘉益鋼鐵有限公司","新北市鶯歌區德昌二街70巷32弄36號","魏瑞毅","500000","1051101"
"2858","66263643","漢生東投資顧問股份有限公司","新北市板橋區漢生東路171號6樓之1","高世杰","15000000","1051102"
"2859","66263720","台灣電研端子股份有限公司","臺北市中正區福祥路146號","岡崎美樹孝","8000000","1051101"
"2860","66263778","光惠國際企業有限公司","新北市板橋區民族路188號3樓","張惠娜","5000000","1051101"
"2861","66263799","圻濬工程有限公司","新北市汐止區康寧街61巷41號","許志誠","2000000","1051101"
"2862","66263806","湘山國際投資股份有限公司","新北市板橋區四川路1段57號","李照玲","18325000","1051101"
"2863","66263812","詡欣生技有限公司","新北市新莊區新北大道2段292號4樓","葉倉銓","500000","1051101"
"2864","66263849","馨奇股份有限公司","新北市三重區大智街139號8樓","李啟賓","900000","1051102"
"2865","66263881","昂德洛休閒事業股份有限公司","新北市三重區重陽路3段7號2樓之2","林欣逸","800000","1051102"
"2866","66263926","東金巴黎食品股份有限公司","新北市汐止區樟樹一路5號","陳鳳嬌","3500000","1051102"
"2867","66263947","大鯨魚網路平台有限公司","新北市鶯歌區尖山路156巷45號7樓","鍾游陳茶","1000000","1051102"
"2868","66264002","崇暘有限公司","新北市新莊區福營路227巷1號","李永翔","1000000","1051102"
"2869","66264018","中孚創聯科技有限公司","臺北市南港區三重路19之13號3樓","伍自強","1000000","1051102"
"2870","66264024","全鏡科技有限公司","新北市新莊區民本街27巷20之3號","王月櫻","1000000","1051102"
"2871","66264045","三鑫工程有限公司","新北市五股區西雲路116之15號9樓","張峻華","500000","1051102"
"2872","66264100","德馨醫院管理顧問有限公司","新北市新店區環河路10號","陳林彩薇","1000000","1051102"
"2873","66264158","鐵騎士餐飲有限公司","新北市淡水區新市一路3段119號","范皓程","2000000","1051102"
"2874","66264170","旺鴻不動產開發有限公司","新北市新莊區建福路40號","李金德","500000","1051102"
"2875","66264278","弘淼健康加生活事業有限公司","新北市永和區國光路116巷5號(1樓)","陳弘淼","2000000","1051102"
"2876","66264312","龍贏自動化工程有限公司","新北市三重區光復路2段80號8樓","陳怡伶","6000000","1051102"
"2877","66264431","美義科技有限公司","新北市新店區民權路161號3樓","王璽寧","4000000","1051102"
"2878","66264447","雙時有限公司","新北市永和區永貞路417巷31號2樓","陳文良","1000000","1051102"
"2879","66264565","慶祥生命禮儀有限公司","新北市汐止區福德一路152號7樓","林儒謙","200000","1051102"
"2880","66264642","昊喆電信工程有限公司","新北市三重區溪尾街27巷12號6樓","劉中豪","500000","1051102"
"2881","66264734","豐禾農林開發有限公司","新北市新店區寶橋路78巷68號27樓","楊芷菻","10000000","1051102"
"2882","66264782","昆娜有限公司","新北市永和區中山路1段126號4樓之2","林佳伶","200000","1051103"
"2883","66264832","俊埕有限公司","新北市中和區保健路48巷4之2號","黃金俊","1000000","1051102"
"2884","66264880","仕凱實業有限公司","新北市蘆洲區長安街131巷29號","何玉蘭","1000000","1051102"
"2885","66264930","峰偉毅企業有限公司","新北市新店區民權路42巷59弄10號3樓","吳偉","1000000","1051102"
"2886","66264973","兆峰光電科技有限公司","新北市樹林區啓智街137巷6號(1樓)","林瑞鴻","500000","1051102"
"2887","66264988","首品投資有限公司","新北市板橋區信義路26巷18號8樓","黃檉","25300000","1051102"
"2888","66265121","賓利不銹鋼有限公司","新北市板橋區民族路247巷5弄38號","王欣寬","888888","1051102"
"2889","66265163","尼羅河國際有限公司","新北市汐止區新台五路1段77號15樓之5","張振豪","5000000","1051102"
"2890","66265234","台灣天家生物科技股份有限公司","新北市板橋區漢生東路337號3樓","黃家榮","5000000","1051102"
"2891","66265332","豐田健康安全工程有限公司","新北市板橋區英士路58巷14號(1樓)","曾翔駿","50000","1051102"
"2892","66265396","同德國際企業有限公司","新北市中和區福祥路57號2樓之1","李家穎","1000000","1051102"
"2893","66265500","動力追蹤科技有限公司","新北市三峽區復興路357號4樓","江文周","100000","1051103"
"2894","66265516","即物設計有限公司","新北市淡水區淡金路1段539號10樓","廖浤雲","250000","1051102"
"2895","66265585","鴻鉅精密有限公司","新北市樹林區三俊街199巷10之11號","陳貫嘉","1000000","1051102"
"2896","66265760","兆燈工程有限公司","新北市中和區員山路327巷53號","陳志詮","3000000","1051102"
"2897","66265924","歆儒懿有限公司","新北市深坑區北深路3段307號2樓","林建宏","600000","1051102"
"2898","66265966","文霖科技有限公司","新北市中和區景平路703巷2弄11之3號","王宏文","500000","1051102"
"2899","66266058","月半生技有限公司","新北市土城區中華路1段56巷19號","吳亞璟","1000000","1051102"
"2900","66266064","靚點國際有限公司","新北市板橋區金門街87號11樓","林璧欗","500000","1051102"
"2901","66266085","富揚全球科技有限公司","新北市永和區得和路55號","何志凌","1000000","1051103"
"2902","66266120","永旭環境科技股份有限公司","新北市樹林區龍興街32巷38號2樓","李進貴","8800000","1051103"
"2903","66266141","無解有限公司","新北市淡水區北新路192之3號2樓","許義昕","500000","1051103"
"2904","66266178","鑫捷輝科技有限公司","新北市新莊區新樹路257巷6號","鄭裕仁","2000000","1051103"
"2905","66266233","瑞仁生醫股份有限公司","新北市樹林區博愛街242號10樓","官志凱","92000000","1051103"
"2906","66266276","媽媽咪月嫂國際股份有限公司","新北市中和區泰和街2號4樓","陳建輝","1000000","1051103"
"2907","66266304","韓軒傳統小吃有限公司","新北市新莊區成功街6巷2號(1樓)","鄧錫咪","200000","1051103"
"2908","66266331","宇堂印刷設計有限公司","新北市泰山區明志路2段185號2樓","黃教哲","200000","1051103"
"2909","66266347","里山時代廣告有限公司","新北市林口區忠孝路376巷6號3樓","鄭清輝","1000000","1051103"
"2910","66266374","沛若資訊工程有限公司","新北市土城區中央路2段50巷16弄36號","李杰紘","200000","1051103"
"2911","66266395","宏龍生技股份有限公司","新北市林口區文化三路2段211巷80號","王至見","10000000","1051103"
"2912","66266402","順福兆國際有限公司","新北市汐止區東勢街216巷5弄8號(1樓)","林安妮","1000000","1051103"
"2913","66266450","惟群國際有限公司","新北市板橋區文化路2段182巷3弄52號5樓","陳建成","200000","1051103"
"2914","66266515","祥麟開發有限公司","新北市土城區學享街83巷5號(1樓)","溫宗鈺","1000000","1051103"
"2915","66266613","陳樺國際遊留學有限公司","新北市樹林區大成路331號","謝承業","1180000","1051103"
"2916","66266634","日天國際有限公司","新北市泰山區楓江路26巷9號10樓","陶鳳儀","500000","1051103"
"2917","66266705","長生堂企業有限公司","新北市樹林區俊興街211巷7弄37號","王怡文","10000","1051103"
"2918","66266727","百佳烘焙有限公司","新北市中和區連城路222巷2弄3號5樓","鐘美芳","1000000","1051104"
"2919","66266732","適才文教有限公司","新北市永和區永元路50號","李柳吟","10000000","1051103"
"2920","66266775","松高貿易有限公司","新北市板橋區萬板路80號2樓","林倫仰","1000000","1051103"
"2921","66266796","天星股份有限公司","新北市三重區永春街27號2樓","莊意萍","1000000","1051103"
"2922","66266803","宗圓有限公司","新北市新店區中正路76巷11弄16號3樓","阮家宏","500000","1051103"
"2923","66266851","阿法貝塔投資有限公司","新北市板橋區新民街7巷6號(1樓)","李龍秋梅","8700000","1051104"
"2924","66266901","東森建設實業股份有限公司","新北市新莊區新北大道3段5號15樓之6、之7","王應傑","60000000","1051103"
"2925","66266992","統聿有限公司","新北市中和區中正路677號14樓之2","相鴻宇","5000000","1051103"
"2926","66267009","鴻羿企業管理顧問有限公司","新北市板橋區松柏街1巷4之3號","黃俊超","200000","1051104"
"2927","66267036","傑生興業有限公司","新北市永和區仁愛路352巷92弄18號2樓","陳宏文","1000000","1051103"
"2928","66267057","艾德森投資有限公司","新北市板橋區新民街7巷6號(1樓)","林志取","8700000","1051104"
"2929","66267280","金喜喜事業有限公司","新北市汐止區汐萬路2段257號5樓","蘇建翰","200000","1051104"
"2930","66267330","倍士資訊有限公司","新北市永和區永寧街65號3樓","黃玲子","2000000","1051104"
"2931","66267367","凱妮時尚國際貿易有限公司","新北市新店區寶橋路235巷127號4樓","羅英傑","500000","1051104"
"2932","66267401","樊花錦有限公司","新北市永和區保生路2號21樓之2","陳宇恬","3300000","1051104"
"2933","66267465","庠燊股份有限公司","新北市土城區中央路1段72之1號","黃佳卉","20000000","1051104"
"2934","66267492","雅比斯時尚有限公司","新北市新莊區青山路1段50之2號8樓","李尚嫺","3000000","1051104"
"2935","66267508","向羿電通有限公司","新北市樹林區中山路1段62號","周嘉宏","1000000","1051104"
"2936","66267535","青商工程有限公司","新北市板橋區金門街372巷13號11樓","王秀香","1000000","1051104"
"2937","66267541","仁和工程有限公司","新北市新莊區瓊林路40巷16之2號","張友霞","500000","1051104"
"2938","66267556","睿廣國際有限公司","新北市汐止區新台五路1段188號10樓","吳雄生","300000","1051104"
"2939","66267562","弦燁工程有限公司","新北市中和區景平路528之4號","楊庭豐","1000000","1051104"
"2940","66267789","媽祖生活有限公司","新北市樹林區佳園路3段512號(8樓)","千愛芬","300000","1051104"
"2941","66267802","燄光股份有限公司","新北市汐止區福德一路342巷1弄5號(2樓)","陳麗娜","500000","1051107"
"2942","66267818","霧農實業有限公司","新北市中和區莒光路64號","翁宗緯","1000000","1051104"
"2943","66267893","新盛室內裝潢工程有限公司","新北市鶯歌區國際二路18巷1號(1樓)","劉文雄","100000","1051104"
"2944","66267900","喜堡國際有限公司","新北市新莊區福德三街1號","李健平","600000","1051107"
"2945","66267916","佳龍精密工業有限公司","新北市樹林區三龍街99號","李謀佳","1000000","1051104"
"2946","66267964","享世紀國際股份有限公司","新北市中和區南山路236巷23弄2號","程俊","1000000","1051107"
"2947","66268231","穎欣貿易有限公司","新北市中和區中山路3段136巷15號14樓","陳家弘","500000","1051104"
"2948","66268751","北台國際開發有限公司","新北市汐止區新台五路1段79號16樓之11","王長福","10000000","1051104"
"2949","66268801","多莉創新有限公司","新北市中和區民享街116巷2號","莊宜諺","300000","1051104"
"2950","66268817","艾妘有限公司","新北市林口區文化三路1段553號8樓","洪漢龍","1000000","1051104"
"2951","66268823","順利冷氣空調有限公司","新北市三重區仁興街28巷32號(1樓)","蔡明軒","1000000","1051104"
"2952","66268865","貝爾國際文教顧問有限公司","新北市永和區中和路385號4樓","張學海","500000","1051104"
"2953","66268936","泰瑞特科技股份有限公司","新北市五股區五工二路127號6樓","張揚孟","23000000","1051104"
"2954","66268942","秉燁國際有限公司","新北市板橋區中山路2段403之7號4樓","陳貞蓉","5000000","1051107"
"2955","66269077","聖豐室內裝修有限公司","新北市新莊區建國一路31巷7號","許聖明","2000000","1051107"
"2956","66269111","新蕊科技有限公司","新北市新店區青山路88巷20弄6號","孫建文","300000","1051107"
"2957","66269127","有儷國際有限公司","新北市汐止區樟樹二路259號5樓","劉有芳","500000","1051107"
"2958","66269251","康緹有限公司","新北市永和區永貞路136號6樓","凌玉芳","500000","1051107"
"2959","66269442","締歐國際實業有限公司","新北市蘆洲區中正路150之1號8樓","陳志彥","300000","1051107"
"2960","66269506","鈳藝星球娛樂有限公司","新北市五股區工商路152號3樓","黃奕達","1000000","1051107"
"2961","66269554","致和股份有限公司","新北市五股區五權六路22號(1樓)","白耀邦","13570000","1051109"
"2962","66269576","一佳一國際生活有限公司","新北市汐止區湖前街57號11樓","高正吉","1000000","1051107"
"2963","66269626","采舒園有限公司","新北市中和區中山路2段2巷47號","顏郁展","5000000","1051107"
"2964","66269631","晟洲文化教育顧問有限公司","新北市三重區光明路32巷22號3樓","黃芃菻","500000","1051107"
"2965","66269787","福源行銷有限公司","新北市新莊區新北大道7段356號11樓","羅文政","100000","1051107"
"2966","66269816","光城有限公司","新北市八里區龍米路2段226巷13號4樓","陳俊宏","1000000","1051107"
"2967","66269822","路創光傑智能工程股份有限公司","新北市八里區中山路2段102號之5","許富傑","5000000","1051107"
"2968","66269858","丞倢有限公司","新北市板橋區中山路2段403之7號4樓","陳貞蓉","5000000","1051107"
"2969","66269870","菘和企業有限公司","新北市中和區中山路3段110之3號(1樓)","吳棕翰","500000","1051107"
"2970","66269891","玩美世界有限公司","新北市新店區中央路165之3號(1樓)","謝瑋恬","500000","1051107"
"2971","66269908","萬安氣體有限公司","新北市新莊區萬安街61之2號(3樓)","馬淑玲","300000","1051107"
"2972","66269956","雙子運動管理顧問有限公司","新北市樹林區保安街2段181之2號9樓","陳昱儒","400000","1051107"
"2973","66269983","朵利安創意有限公司","新北市汐止區大同路2段184巷1號3樓之4","鄭美燕","50000","1051107"
"2974","66269999","麒麟實業有限公司","新北市五股區新五路2段367號","黃麟驊","5000000","1051107"
"2975","66270150","大東亞國際徵信企業有限公司","新北市新莊區建安街26巷16號(1樓)","朱約翰","1010000","1051107"
"2976","66270166","中原管理顧問有限公司","新北市中和區莒光路53之1號","黃伯超","100000","1051107"
"2977","66270308","聚星國際企業股份有限公司","新北市板橋區四川路1段87巷85之2號4樓","許伯霆","10000000","1051107"
"2978","66270399","富樺工程有限公司","新北市中和區保健路10巷21弄10之2號","沈桃","1000000","1051107"
"2979","66270428","夢想生活美學有限公司","新北市中和區圓通路40之2號","賴富秋","80000","1051107"
"2980","66270454","全翰建設有限公司","新北市蘆洲區長樂路120巷2號2樓","韓濬聰","12600000","1051107"
"2981","66270638","上樸建設有限公司","新北市新莊區中華路2段298號17樓","朱志民","10000000","1051107"
"2982","66270686","百客滿企業有限公司","新北市中和區中山路2段328號(1樓)","李昱潔","200000","1051107"
"2983","66270692","高明出版有限公司","新北市蘆洲區集賢路430號","陳慧珠","1000000","1051107"
"2984","66270763","寶貴興業有限公司","新北市板橋區新海路431巷6之3號","林祐安","1000000","1051107"
"2985","66270790","富威水產有限公司","新北市中和區景平路734之1號","黃威融","3000000","1051107"
"2986","66271355","群英石墨烯有限公司","新北市樹林區中山路1段135號8樓之1","賴見忠","200000","1051108"
"2987","66271480","國際沏茶文化有限公司","新北市蘆洲區信義路158號","林暐勛","500000","1051108"
"2988","66271524","艾絲蔻拉股份有限公司","新北市蘆洲區信義路30巷10號","陳璽宇","1500000","1051108"
"2989","66271600","大楹科技有限公司","新北市中和區中正路880號2樓之5","張益華","6000000","1051108"
"2990","66271974","定承起重有限公司","新北市八里區訊埔路21號2樓","林永承","500000","1051108"
"2991","66272164","千岩營造有限公司","新北市泰山區明志路2段254巷16弄19號4樓","鄭師賢","5000000","1051108"
"2992","66272283","凱羅國際行銷股份有限公司","新北市汐止區新台五路1段173號27樓之1","王淑娟","600000","1051108"
"2993","66272523","小師傅食品有限公司","新北市板橋區四川路2段245巷42號(1樓)","王耀義","2000000","1051108"
"2994","66272707","東方維京投資事業有限公司","新北市三重區重新路5段609巷20號5樓之4","楊育達","1000000","1051108"
"2995","66272951","雙勝電子有限公司","新北市三重區興德路96號7樓之1","蕭達棋","5000000","1051108"
"2996","66273065","承昌實業有限公司","新北市瑞芳區明燈路3段265號(1樓)","游雅惠","3000000","1051108"
"2997","66273234","甫淇開發建築有限公司","新北市淡水區坪頂路143之1號2樓","李明杰","1000000","1051108"
"2998","66273380","興遠國際有限公司","新北市林口區信義路281號9樓","楊善杰","500000","1051108"
"2999","66273656","品茶樂有限公司","新北市新店區中正路151號(1樓)","李佳玲","2000000","1051108"
"3000","66273662","鑫旺展業有限公司","新北市泰山區信華一街19號6樓","張伊舜","2500000","1051108"
"3001","66273781","谷林生技有限公司","新北市三重區重新路5段609巷4號5樓之7","陳立浩","1000000","1051108"
"3002","66274120","世界珍珠有限公司","新北市新莊區思源路38號(5樓)","游秀珠","1000000","1051108"
"3003","66274199","易原工程有限公司","新北市板橋區篤行路2段141巷3之3號","廖芷菁","2000000","1051108"
"3004","66274584","合興螺絲有限公司","新北市新莊區福壽街94巷7弄2之4號","李建瑩","4500000","1051108"
"3005","66274634","泰坦電子企業有限公司","新北市新店區玫瑰路30號(1樓)","彭愛倫","1000000","1051109"
"3006","66274705","御祥園興業有限公司","新北市中和區圓通路369巷156弄15號3樓","倪宇萱","3000000","1051109"
"3007","66274888","經典印文化有限公司","新北市中和區橋和路120號11樓","葉禮瑞","1000000","1051108"
"3008","66275063","水長流有限公司","新北市三重區永福街46巷22弄5號(1樓)","黃俊清","1000000","1051108"
"3009","66275155","禾瓦室內設計有限公司","新北市板橋區四維路269巷30號(1樓)","朱得福","1000000","1051108"
"3010","66275280","瑀軒室內裝修設計有限公司","新北市新店區安康路2段341巷48號(1樓)","賴政宜","300000","1051108"
"3011","66275325","方圓娛樂科技有限公司","新北市板橋區建國街71之3號","朱大慶","500000","1051108"
"3012","66275649","木匠之家家具設計國際有限公司","新北市汐止區福德一路141巷58號4樓","陳嘉鵬","500000","1051109"
"3013","66275789","比利福國際行銷有限公司","新北市中和區連城路238號2樓之1","黃心慈","200000","1051108"
"3014","66275943","約菲爾國際有限公司","新北市板橋區重慶路245巷70之2號5樓","林恒健","3000000","1051108"
"3015","66276204","恆升威有限公司","新北市三重區三和路3段103號5樓","陳慧玲","1000000","1051108"
"3016","66276345","志眾投資股份有限公司","新北市中和區建一路139號2樓","彭李淑珠","1000000","1051109"
"3017","66276372","展拓投資股份有限公司","新北市中和區建一路139號2樓","彭李淑珠","1000000","1051109"
"3018","66276393","富慧有限公司","新北市三重區重陽路3段91號6樓","顏雅慧","1000000","1051109"
"3019","66276437","台灣皆霓施有限公司","新北市板橋區漢生西路34號","鄭芷昀","101000","1051109"
"3020","66276464","富御居有限公司","新北市中和區景新街210巷5號(1樓)","陳秀玲","580000","1051109"
"3021","66276648","新英科技股份有限公司","新北市汐止區水源路2段36巷33號2樓","吳秋桂","300000","1051109"
"3022","66277061","家明食品有限公司","新北市永和區保平路203巷5號(1樓)","鄭志揚","1800000","1051109"
"3023","66277111","上倫國際開發有限公司","新北市板橋區光武街2巷25號","許嘉芸","1000000","1051109"
"3024","66277843","赫碩室內設計有限公司","新北市中和區忠孝街2巷8之2號7樓","賴安愉","1000000","1051109"
"3025","66277962","三普羅生物技術有限公司","新北市樹林區東華街70巷7號5樓","陳俊傑","1000000","1051109"
"3026","66278126","茂宏先進綠能科技股份有限公司","新北市新店區安德街154號3樓","陳卉縈","2000000","1051109"
"3027","66278435","大泊微有限公司","新北市中和區連城路222巷8弄6號4樓","田薇","50000","1051109"
"3028","66278462","開啤有限公司","新北市板橋區信義路120之1號","王煒皓","200000","1051109"
"3029","66278505","美飛寶生技研發有限公司","新北市板橋區中山路2段409之2號9樓","范伃萱","200000","1051109"
"3030","66278786","洄溯有限公司","新北市永和區永元路138巷3號2樓","田伍峰","500000","1051110"
"3031","66278890","二八清潔有限公司","新北市新店區黎明路58巷9號","陸先岱","1000000","1051109"
"3032","66279384","春吉電子科技有限公司","新北市板橋區明德街2巷10號","徐江月姬","1000000","1051109"
"3033","66279504","大東塑膠工業有限公司","新北市泰山區辭修路10之11號2樓","黃秀美 SUMIATY WONGSO","500000","1051109"
"3034","66279531","佳福國際有限公司","新北市中和區連城路267之2號","李奇樺","500000","1051109"
"3035","66279814","盛陽綠能股份有限公司","新北市新店區中興路2段190號8樓之1","陳忠廷","12000000","1051110"
"3036","66279856","併連股份有限公司","新北市中和區莊敬路49巷20弄44號2樓","鄭信彥","3000000","1051110"
"3037","66279928","志賢工程有限公司","新北市新莊區新北大道3段7號18樓之8","林于珊","500000","1051109"
"3038","66279933","杰斯科技有限公司","新北市新莊區福樂街82號4樓","李煜堃","1000000","1051109"
"3039","66280093","安妞餐飲有限公司","新北市新店區民權路42巷17號","張莉莉","1000000","1051110"
"3040","66280208","尚鋒達工程有限公司","新北市土城區學成路107號14樓","黃尚緯","1800000","1051109"
"3041","66280312","歐帝家飾館有限公司","新北市淡水區大義街29巷8號","謝宗儒","300000","1051109"
"3042","66280729","采彤股份有限公司","新北市新莊區復興路1段173號","呂采縈","1500000","1051109"
"3043","66280896","鈞建國際有限公司","新北市板橋區雙十路2段79號2樓","郭建文","15680000","1051111"
"3044","66281213","宸獅設計有限公司","新北市板橋區裕民街117號","林毅彥","100000","1051110"
"3045","66281516","谷芳茶業有限公司","新北市三峽區白雞122之2號","洪佳玉","1000000","1051110"
"3046","66281564","美境企業有限公司","新北市中和區忠孝街19巷55號","黃忠財","100000","1051110"
"3047","66281620","嘉懋實業有限公司","新北市泰山區新生路5巷1之1號","簡錫鐘","500000","1051110"
"3048","66282016","真誠創業投資有限公司","新北市蘆洲區光華路22巷46號3樓","陳苡真","5000000","1051110"
"3049","66282395","聯亞實業有限公司","新北市五股區中興路1段142號(2樓)","邱徐賢","2800000","1051110"
"3050","66282753","台暘國際實業有限公司","新北市三重區五華街52號5樓","陳啟庭","1000000","1051110"
"3051","66282780","冠軍國際服裝有限公司","新北市板橋區中山路1段307號2樓","陳冠君","5000000","1051110"
"3052","66282846","集勝環保有限公司","新北市中和區連城路319巷4弄8之4號","陳怡靜","100000","1051114"
"3053","66282888","暉霆國際貿易有限公司","新北市永和區民權路53號6樓","李傑瑜(LEE, KIT YU ZOE)","1000000","1051110"
"3054","66283057","萬禮香有限公司","新北市板橋區忠孝路116號","廖雅惠","50000","1051110"
"3055","66283090","聚豐科技汽車影音有限公司","新北市八里區仁愛路75號2樓","張靜怡","500000","1051110"
"3056","66283129","皕饌股份有限公司","新北市蘆洲區永樂街38巷65號(1樓)","尤麒嵐","2000000","1051110"
"3057","66283606","時尚媽咪手工禮服有限公司","新北市中和區安平路36巷7號(1樓)","游秋華","800000","1051110"
"3058","66283818","廣盛行國際企業有限公司","新北市新店區寶安街4巷14號(1樓)","葉亮宏","1000000","1051110"
