"序號","統一編號","公司名稱","公司所在地","代表人","資本額","核准設立日期"
"2026","42950404","霖園碳化裝潢板材有限公司","彰化縣鹿港鎮頂厝里長安路176號1樓","吳叔霖","3600000","1070331"
"2027","42950410","美昇投資有限公司","新竹市東區東園里花園街100號11樓之1","鄭苗英","24100000","1070331"
"2028","42950426","豐田國際顧問有限公司","南投縣草屯鎮御史里御富路319巷17弄20號一樓","蕭錦賢","1000000","1070331"
"2029","42950452","亮威運動事業有限公司","新竹市東區龍山里龍山西路113號1樓","張亮威","6000000","1070331"
"2030","42950468","鑫鴻國際科技有限公司","新竹市東區豐功里公道五路二段419-2號8樓之2","蔡金坤","20000000","1070331"
"2031","42950473","香港商德綸國際投資有限公司","臺北市大安區敦化南路二段99號26樓","余峯德","8000000","1070331"
"2032","42950489","新加坡商利家有限公司","臺北市內湖區瑞光路70號4樓","孫嘉麗","100000","1070331"
"2033","42950495","宜紘企業有限公司","新竹市香山區浸水里浸水街406巷53號1樓","陳燁璉","500000","1070331"
"2034","42950501","正源建設有限公司","彰化縣埔心鄉明聖路四段258巷24號1樓","林玲惠","2500000","1070331"
"2035","42950517","宇藝實業有限公司","屏東縣竹田鄉鳳明村鳳安路58之3號二樓","陳銘傑","1000000","1070331"
"2036","42950523","生奕科技股份有限公司","新竹市東區光復路二段101號","張平","200000","1070331"
"2037","42950559","拓富有限公司","宜蘭縣宜蘭市新生里中山路五段222巷39弄32號2樓","周世祥","100000","1070331"
"2038","42950565","英屬維京群島商星宇聯網有限公司","臺北市大同區承德路一段46號3樓","林書暉","3000000","1070331"
"2039","42950570","富亦有限公司","新竹縣竹東鎮三重里中興路二段240號1樓","劉祐瑄","5000000","1070331"
"2040","42950586","欣西蘭貿易有限公司","嘉義縣竹崎鄉灣橋村灣橋340巷200號1樓","張筱葳","50000","1070331"
"2041","42950592","健銘農產有限公司","南投縣埔里鎮大城里12鄰公誠三街10號1樓","李啓銘","1000000","1070331"
"2042","42950621","風華休閒農業股份有限公司","雲林縣元長鄉內寮村內寮路96號","陳春富","60000000","1070331"
"2043","42950678","大森節能事業有限公司","彰化縣鹿港鎮東崎里25鄰祥和二街6巷3號3樓","黃依琳","200000","1070331"
"2044","42992621","捷爾斯國際有限公司","臺北市南港區中南路140之3號","王俊閔","1000000","1070305"
"2045","42992951","盛燁科技有限公司","臺北市信義區松仁路213號","黃士欽","1000000","1070227"
"2046","42993136","欣成機電工程股份有限公司","臺北市內湖區行善路385號12樓之1","劉又維","5000000","1070227"
"2047","42993184","弗來易科技股份有限公司","臺北市士林區中正路666號6樓","呂茂煥","180000000","1070227"
"2048","42993207","正光翻譯有限公司","臺北市大安區復興南路1段380號12樓之1","朴美貞PARK MEE JEONG","493985","1070227"
"2049","42993213","鑫鼎管理顧問企業有限公司","臺北市松山區復興北路201號10樓","高尚仁","1000000","1070302"
"2050","42993234","極致品牌科學有限公司","臺北市大安區忠孝東路4段222號3樓","方威迪","100000","1070301"
"2051","42993240","維強實業有限公司","臺北市信義區林口街66巷2號1樓","林立維","5000000","1070301"
"2052","42993255","德菲雅股份有限公司","臺北市中山區南京東路2段206號14樓之3","李志峰","3000000","1070301"
"2053","42993261","龍鼎有限公司","臺北市中山區松江路220號4樓之1","","6500000","1070301"
"2054","42993276","云漢實業有限公司","臺北市大安區忠孝東路3段136號11樓之5","呂志堅","300000","1070301"
"2055","42993282","不二科技有限公司","臺北市中山區復興北路164號4樓","姜燕華","1000000","1070301"
"2056","42993298","捷太有限公司","臺北市中山區錦州街49號9樓之5","胡清清","100000","1070301"
"2057","42993305","新鴻國際商務有限公司","臺北市大安區復興南路2段237號13樓","鄭錦鴻","2000000","1070301"
"2058","42993311","台灣穩鴻科技股份有限公司","臺北市南港區三重路19之11號5樓","杜和穆","5000000","1070301"
"2059","42993327","臺青創夢有限公司","臺北市內湖區洲子街58號4樓","劉揚武","500000","1070301"
"2060","42993332","粵春樓餐飲有限公司","臺北市松山區敦化南路1段7號1樓","呂應必","300000","1070301"
"2061","42993348","宇泰豐開發有限公司","臺北市大同區貴德街12號","陳昱宇","600000","1070301"
"2062","42993353","樂伊爾國際美妝有限公司","臺北市大同區民族西路251號1樓","黃冠諭","500000","1070301"
"2063","42993369","十八號商業有限公司","臺北市信義區基隆路1段186號11樓之8","李逸凡","500000","1070301"
"2064","42993374","健康二六八有限公司","臺北市松山區健康路268號1樓","陳信昌","300000","1070301"
"2065","42993380","優兔數位有限公司","臺北市信義區松高路1號4樓之3","魏梓頤","500000","1070301"
"2066","42993396","布拉格娛樂有限公司","臺北市松山區南京東路5段2號3樓","謝佩芮","400000","1070301"
"2067","42993403","大漢科技有限公司","臺北市中山區農安街126號1樓","鄭銘鎮","1000000","1070301"
"2068","42993419","鐵板至尊研發有限公司","臺北市南港區東新街64巷9號","劉長松","1500000","1070301"
"2069","42993430","靜業科技有限公司","臺北市松山區南京東路5段202號9樓之5","許博惟","100000","1070302"
"2070","42993467","智威管理顧問股份有限公司","臺北市士林區行善路111巷1號8樓之3","王乃萱","300000","1070305"
"2071","42993472","茂巨國際有限公司","臺北市中正區忠孝東路1段76號12樓之1","彭思萱","100000","1070301"
"2072","42993488","佳威不動產租賃開發股份有限公司","臺北市大安區和平東路3段38號9樓","潘怡丞","300000","1070302"
"2073","42993500","蒲公英創意有限公司","臺北市內湖區瑞光路66巷33號5樓","林冠宇","1000000","1070301"
"2074","42993516","華彩光電有限公司","臺北市內湖區新湖三路168號6樓","徐家齊","3000000","1070301"
"2075","42993522","祥圓傢俱有限公司","臺北市北投區文林北路80巷59弄15號3樓","尤志文","2000000","1070301"
"2076","42993543","道心生技有限公司","臺北市信義區基隆路1段176號13樓","張宏如","2000000","1070301"
"2077","42993558","合忠安有限公司","臺北市內湖區康樂街20巷49號","李國忠HENDRA ARIKIN ASWAN","687783","1070301"
"2078","42993564","幸福美肌諮詢顧問有限公司","臺北市北投區中央北路2段68之5號1樓","邱品齊","1000000","1070301"
"2079","42993579","號外影像製作有限公司","臺北市信義區忠孝東路5段482號5樓之7","徐浩軒","100000","1070301"
"2080","42993591","木子李饌心有限公司","臺北市松山區民生東路5段18號1樓","劉樹芬","2500000","1070301"
"2081","42993608","恩豐咖啡有限公司","臺北市松山區南京東路4段69號1樓","盧子瑜","500000","1070301"
"2082","42993614","凱立咖啡有限公司","臺北市大安區延吉街153之2號地下","王凱立","200000","1070301"
"2083","42993635","古斯企業有限公司","臺北市大安區忠孝東路3段303號3樓之3","蕭令君","21000","1070301"
"2084","42993641","邑聚藝術顧問有限公司","臺北市大安區信義路4段156號","黃亞紀","1000000","1070302"
"2085","42993656","金亮創藝有限公司","臺北市松山區南京東路4段1號11樓","邱雪亮","100000","1070302"
"2086","42993662","完備管理顧問有限公司","臺北市中山區民生東路3段36號3樓之8","蔡凱量","500000","1070302"
"2087","42993683","奎斯那有限公司","臺北市士林區華齡街52號1樓","談佩菁","60000","1070302"
"2088","42993699","楷迪企業有限公司","臺北市大同區承德路3段58號5樓之4","李麗美","200000","1070305"
"2089","42993706","海泛股份有限公司","臺北市南港區研究院路1段49號7樓","李思賢","2000000","1070302"
"2090","42993712","平塘有限公司","臺北市中山區樂群三路39號1樓","李柏毅","800000","1070302"
"2091","42993728","昂衍室內設計有限公司","臺北市松山區敦化南路1段100巷7弄5號","蔡曜牟","300000","1070302"
"2092","42993733","承續行銷顧問有限公司","臺北市中山區南京東路2段132號8樓","陳俊嘉","1000000","1070302"
"2093","42993749","新核有限公司","臺北市中山區明水路672巷27號6樓之1","鄭權","100000","1070302"
"2094","42993760","高互連有限公司","臺北市中山區南京東路2段36號7樓","林愛婷","800000","1070302"
"2095","42993775","創達整合有限公司","臺北市北投區崗山路5巷8號3樓","曾偉倫","1600000","1070302"
"2096","42993797","陽明光電科技有限公司","臺北市士林區文林路342號7樓","林宏益","500000","1070302"
"2097","42993804","特訊有限公司","臺北市信義區忠孝東路5段1之7號7樓","梁嘉尚","500000","1070302"
"2098","42993810","壹號線創意有限公司","臺北市松山區民權東路3段106巷15弄14號1樓","孫士鈞","200000","1070302"
"2099","42993831","華文美業有限公司","臺北市信義區忠孝東路5段524巷1弄10號","呂姿頻","100000","1070302"
"2100","42993847","共慧企業管理顧問股份有限公司","臺北市大安區敦化南路1段205號7樓之5","廖怡玟","500000","1070302"
"2101","42993852","海飛絲企業股份有限公司","臺北市中正區忠孝東路2段100號5樓","黃莊芳容","25500000","1070302"
"2102","42993868","兆元創意室內裝修有限公司","臺北市信義區莊敬路289巷8弄4號1樓","林俊男","200000","1070305"
"2103","42993873","影昇國際有限公司","臺北市大安區忠孝東路4段221號10樓","王柏鑑","50000","1070302"
"2104","42993889","挑豆有限公司","臺北市文山區興隆路4段109巷92弄25號6樓","張嘉芳","75000","1070302"
"2105","42993895","睿家餐飲事業有限公司","臺北市大安區光復南路290巷41號1樓","周子元","1000000","1070302"
"2106","42993902","宇興投資顧問有限公司","臺北市松山區南京東路4段130號3樓之1","杜震宇","1000000","1070302"
"2107","42993918","博報堂知達股份有限公司","臺北市松山區民權東路3段102號12樓","水野典彥","30000000","1070302"
"2108","42993924","華康數位諮詢有限公司","臺北市大安區忠孝東路4段290號10樓","李振瀛","200000","1070302"
"2109","42993939","悟匠有限公司","臺北市中山區敬業二路69巷57號6樓之9","翁正宇","100000","1070302"
"2110","42993945","小力室內裝修設計有限公司","臺北市南港區東新街77巷15弄7號1樓","温英峯","300000","1070302"
"2111","42993950","秘銀科技有限公司","臺北市信義區基隆路2段51號9樓之6","劉宥賢","1000000","1070302"
"2112","42993966","博報堂思索股份有限公司","臺北市松山區復興北路367號10樓","水野典彥","10000000","1070302"
"2113","42993971","暖時光社會企業有限公司","臺北市中正區襄陽路23號2樓","李宗勇","3000000","1070302"
"2114","42993987","愛德華戶外用品有限公司","臺北市中正區許昌街42之1號11樓","孔德偉","6000000","1070302"
"2115","42993993","以理有限公司","臺北市內湖區成功路4段91號","莊雅惠","500000","1070302"
"2116","42994000","珂妍國際貿易有限公司","臺北市南港區市民大道7段20號5樓","蔡旻真","500000","1070302"
"2117","42994016","錕泰飲食股份有限公司","臺北市士林區德行西路40號1樓","張朝龍","2500000","1070302"
"2118","42994022","宋青堂資本股份有限公司","臺北市中山區植福路308號5樓之2","張佩玲","4500000","1070302"
"2119","42994037","新辰創藝有限公司","臺北市內湖區陽光街321巷8號3樓","沈怡辰","200000","1070302"
"2120","42994043","小王子數位文創股份有限公司","臺北市信義區信義路5段8號14樓","韓世友","10000000","1070302"
"2121","42994058","台灣思達典雅股份有限公司","臺北市信義區基隆路1段143號9樓之3","北村健一","5400000","1070305"
"2122","42994064","鋍爾科技股份有限公司","臺北市中正區羅斯福路2段70號10樓之6","林季良","1800000","1070305"
"2123","42994079","成家不動產仲介經紀有限公司","臺北市松山區民生東路4段101號","林希倫","3000000","1070305"
"2124","42994085","淯習有限公司","臺北市內湖區陽光街70之3號4樓","許惠敏","500000","1070305"
"2125","42994091","杰思米有限公司","臺北市信義區基隆路1段400號10樓","連呂金美","500000","1070305"
"2126","42994108","她時尚股份有限公司","臺北市信義區忠孝東路5段510號12樓之3","張祐誠","1000000","1070305"
"2127","42994114","京成投資有限公司","臺北市中山區南京東路1段52號6樓","孫慈霙","90000000","1070305"
"2128","42994120","夏綠蒂生物科技有限公司","臺北市中正區林森南路142號3樓","胡光輝","3000000","1070305"
"2129","42994135","鈞歆軟體開發有限公司","臺北市信義區信義路4段415號12樓","王珏","500000","1070306"
"2130","42994141","萬寧有限公司","臺北市士林區天玉街35號6樓","鍾萬祥(CHUNG MAN CHONG)","36000000","1070305"
"2131","42994156","標竿創值股份有限公司","臺北市松山區民生東路5段150號5樓之2","劉慶懿","3500000","1070305"
"2132","42994162","和訓有限公司","臺北市內湖區民權東路6段90巷25弄2號","林育仲","200000","1070305"
"2133","42994177","禧鮮有限公司","臺北市萬華區德昌街272巷1號1樓","曾玟嘉","200000","1070305"
"2134","42994183","客拉弗特股份有限公司","臺北市中山區松江路520號5樓","宇井勝","7000000","1070305"
"2135","42994199","麗智雲端有限公司","臺北市大安區復興南路1段135巷17號10樓之2","吳麗卿","300000","1070305"
"2136","42994206","炘泰國際有限公司","臺北市士林區福華路158號2樓之1","蔣家禹","1000000","1070305"
"2137","42994212","健鐽企業有限公司","臺北市中正區信義路2段213號9樓","沈健福","1000000","1070305"
"2138","42994228","騰達航空股份有限公司","臺北市松山區敦化北路167號17樓","趙國帥","10000000","1070305"
"2139","42994233","王瓷有限公司","臺北市大安區仁愛路3段25號","呂芳誠","5000000","1070305"
"2140","42994249","樂昕娛樂事業有限公司","臺北市松山區民權東路3段179號8樓","馮子毓","1200000","1070305"
"2141","42994254","三熙有限公司","臺北市信義區虎林街239號","王蘭芬","6000000","1070305"
"2142","42994260","動次國際數位行銷有限公司","臺北市萬華區漢中街147巷5號5樓之11","林美蓉","100000","1070305"
"2143","42994275","良潤有限公司","臺北市中山區松江路54號6樓之2","劉翼慧","1000000","1070305"
"2144","42994281","沂源有限公司","臺北市松山區南京東路4段51號10樓","林桂達","1000000","1070305"
"2145","42994297","莉農企業有限公司","臺北市南港區經貿二路235巷60弄30號4樓","蕭楚蓁","3000000","1070305"
"2146","42994304","勁銨有限公司","臺北市信義區信義路5段109號地下一樓","郭昇銘","50000","1070305"
"2147","42994310","領展有限公司","臺北市松山區南京東路3段287號10樓","梁詠婷","5843191","1070305"
"2148","42994326","笑呵呵有限公司","臺北市松山區南京東路3段287號10樓","肖海鴻","5849100","1070305"
"2149","42994331","鑽馬國際有限公司","臺北市大安區仁愛路4段345巷2弄15號1樓","林孟璇","2000000","1070305"
"2150","42994347","幸福提案股份有限公司","臺北市大安區復興南路2段353號2樓","陳欣怡","1300000","1070305"
"2151","42994352","伊鴻有限公司","臺北市士林區福國路98號2樓之5","伊能輝","500000","1070306"
"2152","42994368","敦克爾克有限公司","臺北市松山區敦化北路170號3樓","YEE JUNG SENG","500000","1070306"
"2153","42994373","新息爾有限公司","臺北市文山區羅斯福路5段219號2樓","施凱翔","500000","1070305"
"2154","42994389","丞宇技研有限公司","臺北市松山區三民路96巷1號","賴彥丞","1000000","1070305"
"2155","42994395","樂飛空農服務股份有限公司","臺北市內湖區洲子街12號2樓","林暉悳","1000000","1070305"
"2156","42994509","正韜股份有限公司","臺北市大同區民權西路106號5樓","王正","30000","1070306"
"2157","42994515","窩三館青旅股份有限公司","臺北市中正區開封街1段2號12樓及12樓之1","朱榮貴","10000000","1070306"
"2158","42994521","奇漢有限公司","臺北市士林區華齡街17巷1號2樓","劉坤源","200000","1070306"
"2159","42994536","金雅有限公司","臺北市士林區中山北路7段150號1樓","周灝汶","270000","1070306"
"2160","42994542","香格里拉國際有限公司","臺北市內湖區環山路1段59巷10弄22號2樓","唐靜儀","500000","1070306"
"2161","42994557","紅螞蟻國際開發有限公司","臺北市中正區博愛路136號5樓","黃俊棠","500000","1070312"
"2162","42994563","國度實業有限公司","臺北市信義區忠孝東路5段510號15樓","廖弘毅","2000000","1070306"
"2163","42994578","拾米樂創意股份有限公司","臺北市中山區中山北路2段62巷3號","程儀仙","570000","1070306"
"2164","42994590","欣利賀股份有限公司","臺北市中正區北平東路30號12樓之3","林正勇","1000000","1070312"
"2165","42994607","豪柏實業有限公司","臺北市萬華區長順街30號3樓","鄧名哲","100000","1070306"
"2166","42994613","達伯豪仕國際有限公司","臺北市大安區和平東路1段199巷3號1樓","楊康","500000","1070306"
"2167","42994629","四腳國際貿易有限公司","臺北市中山區民權東路3段37號11樓","黃冠鈞","2000000","1070306"
"2168","42994634","共享文創有限公司","臺北市松山區南京東路4段186號3樓","莊文信","2000000","1070306"
"2169","42994640","教我有限公司","臺北市中正區中山北路1段2號11樓之11","何瑞明","109205","1070306"
"2170","42994655","放言科技傳媒股份有限公司","臺北市大安區信義路4段170號3樓","周玉蔻","12000000","1070306"
"2171","42994661","祖田建設開發股份有限公司","臺北市萬華區萬大路160號1樓","楊明桂","5000000","1070306"
"2172","42994676","亞特蘭蒂斯科技有限公司","臺北市信義區松德路159號11樓之2","鄧學明","100000","1070306"
"2173","42994682","艾吉帝股份有限公司","臺北市中山區南京東路2段100號8樓之1","施智璋","5000000","1070307"
"2174","42994705","同樂國際事業有限公司","臺北市中山區民權西路34之5號","吳建宏","300000","1070306"
"2175","42994711","艾柏特量子智能機器人科技股份有限公司","臺北市內湖區瑞光路358巷30弄6號6樓","陳哲宏","6000000","1070306"
"2176","42994727","德力倉儲設備有限公司","臺北市北投區裕民六路90巷1弄24號","賴明德","1000000","1070306"
"2177","42994732","皿糸金品有限公司","臺北市大安區仁愛路4段71巷8號3樓","郭盈纖","3000000","1070306"
"2178","42994748","晨翼企業管理顧問有限公司","臺北市信義區基隆路1段141號11樓之6","董立維","500000","1070306"
"2179","42994753","衣身衣飾有限公司","臺北市信義區永吉路30巷118弄5號3樓","張任一","100000","1070306"
"2180","42994769","天然精華科技有限公司","臺北市文山區羅斯福路5段88之3號","溫秀美","200000","1070306"
"2181","42994780","麥奇點文創有限公司","臺北市內湖區內湖路1段250號12樓","朱櫻鶴","5000000","1070306"
"2182","42994796","捷易資訊科技有限公司","臺北市大同區承德路3段225巷5號2樓","林明紅","2000000","1070306"
"2183","42994803","合復毅有限公司","臺北市大同區承德路3段37號3樓","孫國華","2000000","1070306"
"2184","42994819","合衆力有限公司","臺北市大同區承德路3段37號3樓","孫國華","3000000","1070306"
"2185","42994825","力永有限公司","臺北市中山區長安東路1段67號2樓","胡思漢","1000000","1070306"
"2186","42994830","快樂捌數位科技有限公司","臺北市信義區忠孝東路5段355號9樓之8","林光揚","12000000","1070308"
"2187","42994846","杏泰生物科技股份有限公司","臺北市中正區中華路1段59號10樓之1","黃鴻圖","3000000","1070306"
"2188","42994851","雅伯斯國際通商有限公司","臺北市南港區研究院路1段2號2樓之3","張瑋珊","1000000","1070306"
"2189","42994867","達程精品有限公司","臺北市中山區松江路328號7樓之6","GOH SEOK CHIN","1095081","1070307"
"2190","42994872","眾揚實業股份有限公司","臺北市內湖區瑞光路102號","陸建成","20000000","1070306"
"2191","42994888","佑基石業有限公司","臺北市中山區北安路578巷8弄17號1樓","徐嘉宏","5000000","1070307"
"2192","42994901","啟恩企業有限公司","臺北市南港區中坡北路4號4樓","黃錦榮","100000","1070306"
"2193","42994917","鎰姿漾股份有限公司","臺北市中山區南京東路1段92號1樓","鐘國誌","500000","1070306"
"2194","42994923","紹景興業有限公司","臺北市大安區樂業街159巷31號1樓","楊景翔","1000000","1070306"
"2195","42994938","雲研物聯股份有限公司","臺北市內湖區瑞光路26巷20弄1號1樓","劉克振","10000000","1070306"
"2196","42994959","雲力國際行銷有限公司","臺北市內湖區大湖山莊街176巷18號4樓之5","林漢廷","1000000","1070306"
"2197","42994965","祐昇國際股份有限公司","臺北市信義區基隆路1段188之1號1樓","林麗雅","2000000","1070306"
"2198","42994970","富順興生物科技股份有限公司","臺北市中山區復興南路1段34號12樓之1","余順旗","3000000","1070307"
"2199","42994986","立如有限公司","臺北市中山區天祥路60巷26號","吳烱滎","200000","1070307"
"2200","42994992","通觀國際有限公司","臺北市中山區松江路328號7樓之6","GOH SEOK CHIN","1095081","1070307"
"2201","42995009","輝藥農業科技股份有限公司","臺北市內湖區洲子街81號2樓","郭泰濂","6000000","1070306"
"2202","42995015","夏利恩股份有限公司","臺北市內湖區民權東路6段47巷10弄12號2樓","柯秋玲","1500000","1070307"
"2203","42995036","御見想像有限公司","臺北市大安區忠孝東路4段221號12樓","葉毓中","120000","1070307"
"2204","42995042","龍慧投資有限公司","臺北市中山區中山北路1段27號13樓","廖年豐","1000000","1070307"
"2205","42995057","創市集企業有限公司","臺北市松山區南京東路3段248號5樓之1","卓學信","5000000","1070221"
"2206","42995063","寶美生醫股份有限公司","臺北市大安區復興南路2段237號13樓","羅珮湘","500000","1070307"
"2207","42995078","鈞恆有限公司","臺北市中山區復興北路58號12樓","張閃飛","9000000","1070307"
"2208","42995084","心想文化創意有限公司","臺北市中山區中山北路2段112號8樓之2","張超傑","100000","1070307"
"2209","42995090","穎科電有限公司","臺北市大同區南京西路323之1號4樓","陳柏宇","1250000","1070307"
"2210","42995107","銓星有限公司","臺北市信義區基隆路1段400號10樓","殷仲良","100000","1070306"
"2211","42995113","億兆事業股份有限公司","臺北市大安區和平東路2段49之3號2樓","陳彥良","2500000","1070308"
"2212","42995129","琦樂投資股份有限公司","臺北市大同區環河北路1段275號2樓","潘惠民","50000","1070307"
"2213","42995134","駿騰國際實業有限公司","臺北市文山區興隆路3段333號9樓","曾元宏","500000","1070307"
"2214","42995140","禾沐投資有限公司","臺北市士林區中山北路5段505巷23號","戴士程","12000000","1070307"
"2215","42995155","國際瑪苡銀有限公司","臺北市中山區長春路40號7樓之4","後藤秀唯","500000","1070307"
"2216","42995161","富睿科技股份有限公司","臺北市大安區忠孝東路4段221號12樓","周彥廷","500000","1070307"
"2217","42995176","不羈整體形象策略有限公司","臺北市大安區忠孝東路4段177號6樓之3","鄭德音","1500000","1070307"
"2218","42995182","馬薩喬傢飾藝術有限公司","臺北市信義區基隆路1段111號8樓","簡秀芬","500000","1070307"
"2219","42995198","源枋企業有限公司","臺北市松山區八德路3段152號2樓","蘇文光","688888","1070307"
"2220","42995205","四季如蘭美學有限公司","臺北市大安區永康街75巷8號5樓之2","黃如蘭","100000","1070307"
"2221","42995211","沂維有限公司","臺北市松山區南京東路4段1號8樓","陳方美珠","300000","1070307"
"2222","42995227","淳貿有限公司","臺北市大安區信義路4段256號11樓之4","劉炳均","5000000","1070307"
"2223","42995232","富惟科技有限公司","臺北市中正區館前路8號7樓","張傳修","500000","1070307"
"2224","42995248","大喜開發有限公司","臺北市中山區敬業一路128巷51號2樓","黃奕溱","6880000","1070307"
"2225","42995253","喆祥投資有限公司","臺北市大安區忠孝東路4段26巷68號1樓","盧立華","10000000","1070307"
"2226","42995269","樺利汽車有限公司","臺北市松山區健康路325巷6弄5號1樓","楊岳樺","5000000","1070307"
"2227","42995274","樂驪有限公司","臺北市中山區長安東路2段178號5樓","藍柏鼎","1000000","1070307"
"2228","42995280","惠揚投資股份有限公司","臺北市中山區松江路139號10樓","李惠如","11000000","1070316"
"2229","42995296","立展專業音響有限公司","臺北市中正區南昌路2段103號11樓","周旭輝","1000000","1070307"
