"序號","統一編號","公司名稱","公司所在地","代表人","資本額","核准設立日期"
"1030","42894712","炫翔億科技有限公司","臺中市大肚區頂街里大明三街109號2樓","張碩麟","300000","1070328"
"1031","42894728","德森生技實業有限公司","臺中市北屯區太原路三段101巷2號1樓","葉月真","500000","1070328"
"1032","42894733","東沁有限公司","臺中市西區忠明南路118號13樓之8","趙中維","6000000","1070328"
"1033","42894749","鴻鑫福股份有限公司","臺中市沙鹿區北勢里北英路112號","謝文斌","15000000","1070328"
"1034","42894754","方格品牌有限公司","臺中市西區忠誠里臺灣大道二段580巷33號1樓","葉守益","5000000","1070328"
"1035","42894760","管管貿易有限公司","臺中市西屯區上石里青海路二段188號16樓之5","郭俞萱","200000","1070328"
"1036","42894775","昌銳建設股份有限公司","臺中市北區健行里民權路559號7樓之2","陳炫志","10000000","1070328"
"1037","42894781","古柏林有限公司","臺中市西屯區何仁里文心路三段107號1樓","黃酩惟","1000000","1070328"
"1038","42894797","員大精密工業有限公司","臺中市南屯區鎮平巷5弄6之2號1樓","劉雪梅","5000000","1070328"
"1039","42894804","式光互聯科技有限公司","臺中市東區東橋里大振街5巷10號1樓","李明潔","500000","1070328"
"1040","42894810","華飛有限公司","臺中市北區賴明里中清路一段678號","邱鉉邁","2000000","1070328"
"1041","42894826","圓創建設股份有限公司","臺中市西區吉龍里五權西五街149號1樓","曾國樑","28000000","1070328"
"1042","42894831","恩昱科技有限公司","臺中市大里區西湖里草湖路131巷9弄1號1樓","許翠倫","1000000","1070328"
"1043","42894847","嘉合投資股份有限公司","臺中市南屯區黎明里干城街280巷2弄12號1樓","胡延忠","25000000","1070328"
"1044","42894852","富翔通訊有限公司","臺中市太平區新福里中山路四段166號1樓","傅鈞毅","2000000","1070328"
"1045","42894868","花漾餐飲管理顧問有限公司","臺中市西屯區潮洋里朝富路213號15樓之8","李忠穎","1000000","1070328"
"1046","42894873","帝通瀝青有限公司","臺中市南屯區南屯路二段870巷27號1樓","吳孟佳","6000000","1070328"
"1047","42894889","福斯里德國際有限公司","臺中市北區民權路559號3樓之1","周柏誠","100000","1070328"
"1048","42894895","宗漟有限公司","臺中市西屯區何厝里何厝東二街23號4樓之3","林明宗","200000","1070328"
"1049","42894902","谷立有限公司","臺中市北屯區平田里文心路四段821號8樓之2","王忠寶","500000","1070328"
"1050","42894918","芳園有限公司","臺中市大甲區孔門里孔雀路98號2樓","徐育瑋","200000","1070328"
"1051","42894924","博斯行銷股份有限公司","臺中市西屯區何德里漢口路二段151號10樓之8","劉致廷","1000000","1070329"
"1052","42894939","岳弘大地工程技術顧問有限公司","臺中市潭子區嘉仁里福潭路750號","張景明","1000000","1070329"
"1053","42894945","很牛開發股份有限公司","臺中市北區建興里學士路238號","胡緯民","500000","1070329"
"1054","42894950","工厘室內裝修設計有限公司","臺中市南區南門里國光路437之3號4樓","江茂村","500000","1070329"
"1055","42894966","賽樂普股份有限公司","臺中市西區五權西路一段103號13樓","簡務果","29500000","1070329"
"1056","42894971","巧新食品有限公司","臺中市北屯區昌平路二段金寶巷３１號1樓","張文卿","1000000","1070329"
"1057","42894987","采丞管理顧問有限公司","臺中市太平區新福里中山路4段89號2樓","賴彥傑","200000","1070329"
"1058","42894993","第八區投資有限公司","臺中市西屯區何成里大墩十八街195號3樓之1","鄭玉嵐","3000000","1070329"
"1059","42895000","森御盒膳股份有限公司","臺中市大甲區日南里工七路10號","陳銘鴻","1600000","1070329"
"1060","42895016","亞琪侑商務有限公司","臺中市沙鹿區福興里鎮南路二段299巷19號2樓","白依芳","250000","1070329"
"1061","42895022","滾動經濟商務有限公司","臺中市西屯區永安里國安一路163號20樓之5","白佳璟","250000","1070329"
"1062","42895037","鼎昀翔有限公司","臺中市南區福田一街9號1樓","葉家妤","3000000","1070329"
"1063","42895043","旭發實業有限公司","臺中市北屯區平德里文心路四段288號12樓之25","傅儀臻","400000","1070329"
"1064","42895058","好握友有限公司","臺中市南屯區三厝里永春東七路732號1樓","洪秀芳","1000000","1070329"
"1065","42895064","賀品國際餐飲有限公司","臺中市南屯區龍富路四段583號1樓","黃怡倫","12200000","1070329"
"1066","42895079","創璿科技股份有限公司","臺中市沙鹿區公明里中清路六段161之55號2樓","黃獻毅","500000","1070330"
"1067","42895085","瑪沃拉國際貿易有限公司","臺中市豐原區東湳里三豐路二段396巷2弄1號","莊譽麟","200000","1070329"
"1068","42895091","神效教育顧問有限公司","臺中市豐原區西勢里西安街56之1號1樓","林青穎","100000","1070329"
"1069","42895108","圓夢企業管理顧問有限公司","臺中市大里區長榮里德芳南路276號十九樓之3","黃兆鴻","100000","1070329"
"1070","42895114","愛孕行銷顧問有限公司","臺中市西屯區何厝里何厝東二街23號4樓之3","林智偉","500000","1070329"
"1071","42895120","日鴻能源科技有限公司","臺中市西屯區潮洋里臺灣大道三段729巷43弄14號1樓","黃建堯","5000000","1070329"
"1072","42895135","屋極國際有限公司","臺中市大雅區中山十一路20號1樓","王俊裕","360000","1070329"
"1073","42895141","永睿碳擊科技有限公司","臺中市太平區東平里東平路820之1號","劉志成","100000","1070329"
"1074","42895156","元鈜建設股份有限公司","臺中市龍井區龍崗里沙田路四段670巷15號4樓","鄭羽涵","3000000","1070329"
"1075","42895162","昌序企業有限公司","臺中市后里區月眉里雲頭路40號1樓","昌秉義","489999","1070329"
"1076","42895177","宇南食品有限公司","臺中市北區中達里英才路238號2樓","陳雨男","200000","1070329"
"1077","42895183","金鑽工業有限公司","臺中市大甲區文武里德興路230號1樓","楊博淵","250000","1070329"
"1078","42895199","安迅有限公司","臺中市西屯區何厝里何厝東二街23號4樓之3","洪瑭琪","200000","1070329"
"1079","42895206","禾特企業有限公司","臺中市西區忠明里臺灣大道二段482巷43號三樓","謝裕元","200000","1070329"
"1080","42895212","美聯電子商務有限公司","臺中市霧峰區振興西街19號9樓","江秀苗","1000000","1070329"
"1081","42895228","斯霧司茶業有限公司","臺中市豐原區西安里成功路238號1樓","陳志賢","200000","1070329"
"1082","42895233","尚合精密有限公司","臺中市大甲區武曲里大安港路154號","梁世琮","1000000","1070330"
"1083","42895249","普犀運動事業有限公司","臺中市西區臺灣大道二段2號18樓之1","白承孝","200000","1070330"
"1084","42895260","鑠兆國際股份有限公司","臺中市西屯區西屯路二段126巷7之5號","張家誠","1000000","1070330"
"1085","42895275","以諾健康科技股份有限公司","臺中市西屯區福和里臺灣大道四段925號5樓之8","陳永祝","3500000","1070330"
"1086","42895281","黑貓餐飲有限公司","臺中市南屯區公益路二段925號、927號","陳建良","300000","1070330"
"1087","42895297","立崧科技有限公司","臺中市西屯區逢福里惠來路三段220號14樓之2","張豫琍","2000000","1070330"
"1088","42895304","弘棣工程顧問有限公司","臺中市大雅區四德里雅環路一段106巷28弄10號","朱英茂","1000000","1070330"
"1089","42895310","騰駿生技有限公司","臺中市豐原區西湳里豐原大道127號2樓","陳弘軒","2000000","1070330"
"1090","42895326","升方綠能有限公司","臺中市大里區日新里日新路363號1樓","劉國良","500000","1070330"
"1091","42895331","芮恩有限公司","臺中市南屯區永春東一路411號1樓","林桂娟","500000","1070330"
"1092","42895347","鉅益有限公司","臺中市大里區國光里大里二街88號","許文益","100000","1070330"
"1093","42895352","金佑寶工業有限公司","臺中市神岡區大豐路五段295巷6號1樓","杜淑娥","500000","1070330"
"1094","42895368","櫻籐有限公司","臺中市北屯區軍功里軍功路二段268號2樓","馮信忠","300000","1070330"
"1095","42895395","巧芳餐飲有限公司","臺中市西屯區福康路56號1樓","吳宗林","500000","1070330"
"1096","42895402","倢晟工程有限公司","臺中市西屯區寧夏西三街42號2樓","李嘉榕","3000000","1070330"
"1097","42895418","信實青海有限公司","臺中市西屯區青海路二段207之8號","王鐙毅","500000","1070330"
"1098","42895439","漪啟國際運動管理顧問股份有限公司","臺中市南區合作街62之2號8樓之1","許天鳳","500000","1070330"
"1099","42895450","杰米科技股份有限公司","臺中市北屯區軍功里軍功路二段2號4樓","王裕懋","5000000","1070330"
"1100","42895466","佛本彼岸有限公司","臺中市北區明新里中清路一段447號7樓之1","尤涵芸","2000000","1070330"
"1101","42895471","金倢有限公司","臺中市西屯區精誠路14號6樓之5","林正結","500000","1070330"
"1102","42895487","科科娛樂有限公司","臺中市大里區大里區爽文路1121號3樓","鄒兆民","100000","1070330"
"1103","42895493","樹樹文創有限公司","臺中市南區樹義二街50號1樓","賴家鑫","200000","1070330"
"1104","42895509","黑豬餐飲事業有限公司","臺中市西屯區工業區三八路150號3樓之5","張勝新","200000","1070330"
"1105","42895515","司徒加特生物科技股份有限公司","臺中市南屯區大同里向上南路一段167號14樓","盧權成","1000000","1070330"
"1106","42895536","御椰香有限公司","臺中市南區忠明南路758號10樓","江俊杰","50000","1070330"
"1107","42895542","年瑩光電有限公司","臺中市南屯區文心一路402號8樓之4","鄭金農","1000000","1070330"
"1108","42895557","瑞美開發有限公司","臺中市北屯區大連路三段113號1樓","賴淑鐘","300000","1070330"
"1109","42895563","久鈺興機械有限公司","臺中市烏日區環中路八段332巷130號","徐敬訸","3000000","1070330"
"1110","42895578","斐來旺有限公司","臺中市西區忠明里臺灣大道二段406號4樓之2","蘇大期","500000","1070330"
"1111","42895584","晟新建設有限公司","臺中市北屯區太和一街135號2樓","周永通","20000000","1070330"
"1112","42895590","冠華優化生技有限公司","臺中市神岡區社南里三社路390巷38號2樓","游文熙","5000000","1070330"
"1113","42895607","赫朵國際貿易有限公司","臺中市西屯區上德里上石路88號","薛慈婷","200000","1070330"
"1114","42895634","唯創新國際有限公司","臺中市南區大慶街二段6之16巷46號9樓之2","呂宜儒","500000","1070331"
"1115","42895640","日隆餐飲有限公司","臺中市南屯區向心路109號16樓之17","周克宇","100000","1070331"
"1116","42895655","山豪車業有限公司","臺中市南屯區新生里龍德路一段107號","賴錦鋒","1000000","1070331"
"1117","42895661","堡寬建設有限公司","臺中市后里區后里里三豐路四段348號","高銀龍","3000000","1070331"
"1118","42895676","聚富貿易有限公司","臺中市南區長榮里公理街65巷7之1號","李冠萩","1000000","1070331"
"1119","42895682","正鑫皮革有限公司","臺中市沙鹿區三鹿里保成五街86號1樓","胡秋全","100000","1070331"
"1120","42895705","勝意園有限公司","臺中市西屯區西平里福星北二街9號1樓","吳浩丞","10000","1070331"
"1121","42895711","流出名堂有限公司","臺中市西屯區何南里大墩二十街99號5樓","張德弘","300000","1070331"
"1122","42895727","劉記洋傘有限公司","臺中市豐原區南村里豐東路375號1樓","劉承恩","300000","1070331"
"1123","42895732","潮星州有限公司","臺中市西區健行路1024號","田淑君","6000000","1070331"
"1124","42895748","由展開發有限公司","臺中市大里區大明路146之1號1樓","林承緯","500000","1070331"
"1125","42895753","岱運興業有限公司","臺中市梧棲區草湳里建國北街151巷62號1樓","吳水發","500000","1070331"
"1126","42895769","進展展業有限公司","臺中市北屯區大鵬路132巷6弄8號1樓","黃俊仁","1500000","1070331"
"1127","42895774","鋒星數位行銷有限公司","臺中市西屯區上安里臺灣大道三段540號6樓之1","黃泰維","100000","1070331"
"1128","42895830","恆厚地產股份有限公司","臺中市西屯區惠來里市政北七路186號25樓","張志豪","10000000","1070331"
"1129","42895872","君聚建設開發有限公司","臺中市東區東信街78號","李俊翰","25000000","1070331"
"1130","42895888","金贊地產開發股份有限公司","臺中市西屯區惠來里市政北七路186號25樓","張志豪","10000000","1070331"
"1131","42895901","詠碩資訊科技有限公司","臺中市大里區內新里內新街70巷6之5號","賴霈蓉","300000","1070331"
"1132","42895959","福洆有限公司","臺中市西屯區大福里中清路二段189巷101號1樓","陳彥翔","3000000","1070331"
"1133","42900340","灝承自動化有限公司","臺南市安平區平通里慶平路539號17樓之16","王博灝","500000","1070307"
"1134","42900355","吉利禾股份有限公司","臺南市南區新興路283號","蔡淑蕙","600000","1070307"
"1135","42900361","逆風整合行銷有限公司","臺南市永康區中華路200-5號","應惠帆","300000","1070306"
"1136","42900376","神祕力量有限公司","臺南市永康區中興里中華路200-5號5樓","胡芳榮","100000","1070307"
"1137","42900382","冠勝發機電有限公司","臺南市北區成德里文成二路376號1樓","黃順其","3000000","1070307"
"1138","42900398","榮騰貿易有限公司","臺南市東山區東中里成功街28號","蘇耀朗","100000","1070308"
"1139","42900405","旭鼎塑膠有限公司","臺南市安南區州北里安和路五段１７１巷１７弄３２號1樓","郭貞儀","3000000","1070307"
"1140","42900411","益德股份有限公司","臺南市永康區塩行里仁愛街138巷10號1樓","陳美杏","1000000","1070307"
"1141","42900427","益盛股份有限公司","臺南市永康區塩行里仁愛街138巷10號1樓","陳美杏","1000000","1070307"
"1142","42900432","可耀股份有限公司","臺南市永康區塩行里仁愛街138巷10號1樓","陳美杏","2000000","1070307"
"1143","42900453","偉成工程有限公司","臺南市麻豆區謝安里謝厝寮3之3號1樓","李晉德","500000","1070309"
"1144","42900469","悠墨科技有限公司","臺南市中西區萬昌里青年路120號1樓","曾秀萍","700000","1070307"
"1145","42900474","海富投資有限公司","臺南市東區崇德十九街90號2樓","陳明哲","2000000","1070307"
"1146","42900480","沁旺有限公司","臺南市善化區小新里蓮潭北一街101號1樓","趙美玲","1000000","1070309"
"1147","42900496","安豐興有限公司","臺南市安南區塩田里工業二路16號1樓","黃錦彰","4000000","1070308"
"1148","42900502","廣陞豐企業有限公司","臺南市安南區塩田里工業二路16號1樓","葉寶鴻","4000000","1070307"
"1149","42900518","天廈國際股份有限公司","臺南市安平區國平里建平七街457號","梁偉丞","6000000","1070307"
"1150","42900539","立紘企業有限公司","臺南市安南區布袋里工明三路10號1樓","楊博仁","3000000","1070308"
"1151","42900545","駿昇玻璃有限公司","臺南市北區興南里11鄰西門路四段１６巷３９弄１０號1樓","廖沛筠","1000000","1070308"
"1152","42900550","大立國際投資有限公司","臺南市南區惠南街103號3樓","陳勁宇","100000","1070309"
"1153","42900566","桀昇科技工程有限公司","臺南市安定區中榮里許中營75之40號3樓","李文傑","1360000","1070309"
"1154","42900571","嘉安有限公司","臺南市安平區怡平里建平八街142號1樓","游曜聰","500000","1070309"
"1155","42900587","合藝有限公司","臺南市中西區和善街125巷13號1樓","盧冠霖","1500000","1070309"
"1156","42900593","生生電機有限公司","臺南市安南區安昌街131巷30號1樓","顏宏州","1000000","1070309"
"1157","42900600","唯盛流通企業有限公司","臺南市東區裕聖里裕信路326之1號1樓","呂昱璋","3500000","1070309"
"1158","42900616","樂享學有限公司","臺南市永康區埔園里中山路298號","廖曉雯","2000000","1070309"
"1159","42900622","皓明科技有限公司","臺南市麻豆區總榮里3鄰總爺庒23號1樓","張武雄","1000000","1070312"
"1160","42900637","友立誠有限公司","臺南市善化區坐駕里坐駕94號1樓","鄭怡真","1000000","1070312"
"1161","42900643","頂真企業有限公司","臺南市新營區王公里公正街120號1樓","黃頂典","2600000","1070312"
"1162","42900658","誠思多點有限公司","臺南市東區林森路一段56巷13號1樓","蔡惠雯","500000","1070312"
"1163","42900664","萬陽國際開發股份有限公司","臺南市新營區新北里三興街163號","吳宗憲","30000000","1070312"
"1164","42900679","睿陞健康有限公司","臺南市善化區坐駕里四維路16號","劉秀琴","1000000","1070312"
"1165","42900685","瑞翼有限公司","臺南市善化區東隆里東勢寮187號1樓","蘇惠美","250000","1070312"
"1166","42900691","康博健康事業股份有限公司","臺南市東區裕農里東寧路540號地下層","李柏融","1000000","1070312"
"1167","42900708","威北生活館有限公司","臺南市安南區溪心里安中路三段77號","林素勤","15000000","1070309"
"1168","42900714","艾芙股份有限公司","臺南市將軍區保源里7鄰苓保62之1號","楊旻靝","750000","1070313"
"1169","42900720","新煒國際有限公司","臺南市北區公園里公園南路65號12樓","蘇宇","100000","1070312"
"1170","42900735","暘佶營造有限公司","臺南市永康區塩洲里正南八街32巷9號","王冠恒","5000000","1070312"
"1171","42900741","亮銓儀器有限公司","臺南市永康區五王里23鄰成功路244巷42號1樓","邱琬雯","1000000","1070309"
"1172","42900756","富爾達貿易有限公司","臺南市北區文成二路346號1樓","黃克維","500000","1070312"
"1173","42900762","傑傑建設有限公司","臺南市北區文元里12鄰文賢路1122巷11弄18號1樓","林靖芬","12000000","1070313"
"1174","42900777","智瀚建設有限公司","臺南市北區成德里育德三街155號1樓","鄭明進","10000000","1070313"
"1175","42900783","富漢發有限公司","臺南市永康區勝利里小東路423巷10號6樓之2","曾漢州","60000","1070313"
"1176","42900799","同霖科技有限公司","臺南市南區永成路三段３５７巷４１號一樓","童可定","200000","1070313"
"1177","42900806","浩鈺物流有限公司","臺南市安平區育平里育平路７０號八樓之７","曾美麗","200000","1070313"
"1178","42900828","紅雨科技股份有限公司","臺南市北區成功路2號4樓之5","王怡佳","2000000","1070313"
"1179","42900833","晶晶國際實業有限公司","臺南市安南區海東里海東二街72號3樓","梁朝韋","1000000","1070313"
"1180","42900849","淵博國際有限公司","臺南市安南區長和路二段12巷235弄53號1樓","閔高鵬","1000000","1070313"
"1181","42900854","華府開發建設有限公司","臺南市永康區龍潭里中山北路164巷158弄16號1樓","陳清華","15000000","1070313"
"1182","42900860","芸涵投資有限公司","臺南市東區崇善路813號","楊涵如","6901350","1070313"
"1183","42900875","中星物業有限公司","臺南市安平區育平里光洲二街１４６號","楊惠羽","300000","1070313"
"1184","42900881","合冠其有限公司","臺南市仁德區保安里文賢路一段856號1樓","蔡明樺","1000000","1070313"
"1185","42900897","悅新管理顧問有限公司","臺南市安南區安中路一段５６０巷１２弄３５號四樓","李易庭","100000","1070314"
"1186","42900904","崇閔有限公司","臺南市永康區國聖街249號","徐儷萍","200000","1070313"
"1187","42900926","靚得眉工坊有限公司","臺南市仁德區文心路６６號一樓","蔡孟潔","100000","1070314"
"1188","42900931","霜潔樓創意設計有限公司","臺南市東區崇德里崇德八街48號2樓","吳佩蓉","500000","1070315"
"1189","42900947","華平科技股份有限公司","臺南市安平區怡平里華平路662號2樓","廖祥宏","2000000","1070314"
"1190","42900952","阿迪加有限公司","臺南市安南區長安里公學路二段127號1樓","莊掬雅","300000","1070314"
"1191","42900968","嘉仁建設有限公司","臺南市東區裕信三街117之3號1樓","王新朝","1000000","1070314"
"1192","42900973","聯珵國際有限公司","臺南市安南區培安路47號一樓","江惠萍","1680000","1070315"
"1193","42900989","群駿科技有限公司","臺南市永康區大灣里19鄰文賢街６８巷３６弄３０號１樓","向艾芳","200000","1070314"
"1194","42900995","新讚有限公司","臺南市仁德區仁義里義中山路215號1樓","黃李金環","1000000","1070315"
"1195","42901002","龍學建設有限公司","臺南市北區成德里育德一街２２１巷２之１號一樓","王仁宏","10000000","1070314"
"1196","42901018","欣豐樵營造工程有限公司","臺南市新市區新和里富中街93號1樓","杜子樵","10000000","1070315"
"1197","42901024","草埜國際生物科技有限公司","臺南市安平區建平里建平十一街156號1樓","許進達","1000000","1070316"
"1198","42901039","新南盟開發股份有限公司","臺南市安平區建平五街22巷36弄55號1樓","陳燦煌","30000000","1070316"
"1199","42901045","誼亮有限公司","臺南市東區大學里長榮路三段66巷6號2樓","鄭嘉鴻","1000000","1070315"
"1200","42901050","山金車有限公司","臺南市中西區永福路一段46號","陳怡良","1000000","1070315"
"1201","42901066","樟捷企業有限公司","臺南市仁德區土庫里大利路7號1樓","郭政樟","1000000","1070316"
"1202","42901071","柏子研易科技股份有限公司","臺南市中西區保安里友愛街277號2樓","林惠伶","1500000","1070316"
"1203","42901087","盛裕眼鏡企業有限公司","臺南市安南區國安里國安街236巷22號1樓","郭曜旗","100000","1070316"
"1204","42901093","有德五金有限公司","臺南市南區金華里新孝路148巷13號1樓","薛任斌","100000","1070316"
"1205","42901100","承晉科技工程有限公司","臺南市永康區永康里中山南路1054巷59號1樓","蔡宜蓁","500000","1070316"
"1206","42901116","海正投資股份有限公司","臺南市東區龍山里長榮路一段223號五樓之一","吳健序","100000","1070316"
"1207","42901122","翌順工業有限公司","臺南市東區龍山里崇善路２５巷８８號二樓","李秀琴","200000","1070320"
"1208","42901137","德貿司股份有限公司","臺南市南區明興里新都路497號二樓","歐凱翔","3000000","1070316"
"1209","42901143","海揚投資股份有限公司","臺南市東區龍山里長榮路一段223號五樓之1","吳健亨","100000","1070319"
"1210","42901158","鑫薪塑膠有限公司","臺南市新市區永就里中山路271巷14號","吳祝幸","3000000","1070319"
"1211","42901164","拓程有限公司","臺南市中西區大南里健康路一段322號4樓","劉盈伶","5000000","1070320"
"1212","42901179","睿源科技有限公司","臺南市西港區慶安里慶安路146巷3號1樓","陳明志","2000000","1070320"
"1213","42901185","允鈦金屬企業有限公司","臺南市永康區尚頂里11鄰正南一街49號","賴佑典","50000","1070320"
"1214","42901191","森井生醫國際事業有限公司","臺南市北區和順里公園南路370巷19號5樓之2","馬旭昇","300000","1070320"
"1215","42901208","凡得生醫有限公司","臺南市永康區中華路425號四樓之3","黃怡華","501000","1070320"
"1216","42901214","佳窈有限公司","臺南市中西區仙草里南寧街83巷8號","張素碧","200000","1070320"
"1217","42901220","萬騰建設有限公司","臺南市新營區埤寮里中正路397號","莊秉翰","2000000","1070320"
"1218","42901235","全日進交通企業有限公司","臺南市安南區安豐三街１９０號1樓","陳柏宏","25000000","1070319"
"1219","42901241","識草映像有限公司","臺南市安南區四草里大眾六街１５７號","陳友志","200000","1070320"
"1220","42901256","上好通風工程有限公司","臺南市新市區大營里大營130之4號1樓","陳岳華","1000000","1070320"
"1221","42901262","長勝居建設有限公司","臺南市北區勝利路467巷5弄5號1樓","翁天寶","3000000","1070320"
"1222","42901277","業樺生醫有限公司","臺南市東區裕信路291號1樓","黃景詮","500000","1070320"
"1223","42901283","岱金有限公司","臺南市永康區塩行里44鄰塩和街216號1樓","孫誌鴻","900000","1070320"
"1224","42901299","宇丞工業有限公司","臺南市麻豆區小埤里苓子林7之5號1樓","吳中信","1000000","1070321"
"1225","42901306","塑曜國際有限公司","臺南市關廟區東勢里四維街35號1樓","林士凱","300000","1070320"
"1226","42901312","昱宏紳精密有限公司","臺南市白河區白河里八德橫巷2號1樓","吳昱宏","350000","1070321"
"1227","42901328","這麼胖有限公司","臺南市東區自強里中華東路二段243巷37號4樓","黃子瑞","200000","1070320"
"1228","42901333","金協鑫科技股份有限公司","臺南市仁德區土庫里太乙路115號","候献忠","2000000","1070321"
