"序號","統一編號","公司名稱","公司所在地","代表人","資本額","核准設立日期"
"814","82957924","大宅生活美學股份有限公司","新北市三重區三和路4段16號7樓","楊旭平","12000000","1080731"
"815","82957945","滙基實業有限公司","新北市五股區成泰路3段20號(1樓)","余明洞","6000000","1080731"
"816","82957950","全益全球社企股份有限公司","新北市汐止區康寧街169巷23號6樓之3","王靜慧","100000","1080731"
"817","82957987","橙碩室內裝修設計有限公司","新北市土城區中華路1段36號9樓之1","陳佩欣","1000000","1080731"
"818","82957993","科榛有限公司","新北市新店區中華路43號6樓","蕭力元","50000","1080731"
"819","82958000","瑞恩雅有限公司","新北市汐止區中正路149號2樓","楊永旭","900000","1080731"
"820","82958016","紘德汽車材料有限公司","新北市土城區金城路3段3號12樓","李涵汝","200000","1080731"
"821","82958022","愛麗絲美妍有限公司","新北市中和區景安路33號","楊李圍","500000","1080731"
"822","82958037","承垚國際事業有限公司","新北市樹林區學勤路326號25樓","黃芷楹","3000000","1080731"
"823","82958043","宗聖科技有限公司","新北市板橋區漢生東路115之1號2樓","吳育任","5000000","1080731"
"824","82958058","毅勝投資股份有限公司","新北市新店區福園街5巷25號4樓","蘇哲毅","28000000","1080731"
"825","82958064","驊藏空間有限公司","新北市新莊區公園一路53號","柯力維","1000000","1080731"
"826","82958085","展漾有限公司","新北市蘆洲區長樂路178號11樓","黃聖崴","500000","1080731"
"827","82958091","省力影像有限公司","新北市樹林區柑園街2段328巷2弄18號","吳俐慧","1000000","1080731"
"828","82958108","育森科技有限公司","新北市鶯歌區國中街127之2號8樓","曾韋育","80000","1080731"
"829","82958114","泓展企業有限公司","新北市板橋區中山路1段206巷78之1號","胡鴻振","500000","1080731"
"830","82958120","樺山地產有限公司","新北市林口區文化北路1段281號(1樓)","吳亭山","500000","1080731"
"831","82958135","旺通水產事業有限公司","新北市三重區重陽路2段34巷16弄9號","許欣蕙","1500000","1080731"
"832","82958141","帆飛系統有限公司","新北市新店區北宜路1段39巷16弄4號3樓","李佳芸","100000","1080801"
"833","82958156","禾山國際有限公司","新北市新莊區中正路296之3號","王素月","1500000","1080801"
"834","82958162","兆盈有限公司","新北市新店區寶強路27號9樓","顏育茹","300000","1080731"
"835","82958178","宸宇精密科技有限公司","新北市板橋區大智街24巷5號","李淑君","2000000","1080731"
"836","82958183","饌億企業有限公司","新北市板橋區板新路136號、138號、140號、142號、144號，觀光街57巷15弄22號、24號","何欣典","5000000","1080801"
"837","82958199","宸芯新創工程有限公司","新北市中和區忠孝街26巷75號","李柏健","1000000","1080801"
"838","82958206","旺順企業有限公司","新北市汐止區樟樹一路129巷14號3樓","蔡奕姍","500000","1080731"
"839","82958212","好寶股份有限公司","新北市三重區溪尾街332號5樓","蔡宗融","1100000","1080801"
"840","82958228","浩展食品有限公司","新北市板橋區漢生東路279巷2號(1樓)","劉展志","100000","1080801"
"841","82958233","來恩國際食品有限公司","新北市板橋區宏國路37巷8之2號(3樓)","劉俐伶","300000","1080731"
"842","82958249","以弗得有限公司","新北市三峽區大義路205號","陳志銘","500000","1080731"
"843","82958254","彩藝通行銷股份有限公司","新北市新莊區新樹路288之19號(2樓)","吳宏仁","3000000","1080801"
"844","82958260","好牌友科技有限公司","新北市中和區景平路989巷6號17樓","郭晃成","2250000","1080801"
"845","82958276","晨恩人文有限公司","新北市淡水區大仁街19號","戴崇傑","500000","1080801"
"846","82958281","永爍有限公司","新北市林口區文化三路1段555巷66號12樓","陳筠","300000","1080801"
"847","82958297","展翊室內裝修設計工程有限公司","新北市林口區文化二路1段20巷25弄9號9樓","陳淑萍","2000000","1080801"
"848","82958304","馬云整合行銷有限公司","新北市新店區達觀路40號4樓之5","蔡昀臻","220000","1080801"
"849","82958310","尊榮國際貿易有限公司","新北市三重區力行路1段170號2樓","李嘉豪","100000","1080801"
"850","82958326","遠東馳網有限公司","新北市三重區成功路100號13樓之2","陳嘉祥","100000","1080801"
"851","82958331","妙音香業有限公司","新北市土城區中央路2段191號5樓之3","洪增楠","500000","1080801"
"852","82958347","泳盛有限公司","新北市三重區成功路110號12樓之10","楊詠琮","1000000","1080801"
"853","82958352","宏安食品有限公司","新北市樹林區三俊街85巷6號（1樓）","陳韋達","20000","1080801"
"854","82958368","和潤興精密電子組件有限公司","新北市板橋區重慶路276之6號","李國湘","1000000","1080801"
"855","82958374","朋恩有限公司","新北市新店區北宜路2段511號6樓","李朋恩","100000","1080801"
"856","82958389","拾拓整合行銷有限公司","新北市中和區民利街118巷9號2樓","李思怡","500000","1080801"
"857","82958395","保丞開發有限公司","新北市新莊區中和街186巷2弄5號4樓","蘇千堡","1000000","1080801"
"858","82958402","尚華能源科技股份有限公司","新北市中和區民生街10巷14弄12之2號(3樓)","胡正華","2000000","1080801"
"859","82958418","鼎揚國際貿易有限公司","新北市三重區光興街32號4樓","陳衍志","3100000","1080801"
"860","82958424","茗城有限公司","新北市泰山區泰林路2段599巷6號4樓","徐薇珽","250000","1080801"
"861","82958439","旅電科技有限公司","新北市永和區永和路2段301巷1號1樓","廖書緯","600000","1080801"
"862","82958445","展悅室內裝修設計工程有限公司","新北市永和區保安路288號3樓","林松樺","300000","1080801"
"863","82958450","勤承投資有限公司","新北市板橋區篤行路2段159之1號","王義強","1000000","1080801"
"864","82958466","華偉國際投資有限公司","新北市新店區寶中路92號2樓之1","賈復華","10000000","1080801"
"865","82958472","志星資訊科技股份有限公司","新北市土城區永寧路55號2樓之1","陳永芳","10000000","1080802"
"866","82958487","情淮企業有限公司","新北市板橋區漢生東路153之3號","林家安","300000","1080801"
"867","82958493","臺灣萬光祥有限公司","新北市新莊區中正路576巷28號","ONG HAN PHENG","1000000","1080801"
"868","82958509","梵天服務事業有限公司","新北市新莊區五權一路1號8樓之2","李承晉","1000000","1080801"
"869","82958515","德果紡織科技有限公司","新北市新莊區民安西路378號2樓","丁肇基","2880000","1080802"
"870","82958521","我沒空有限公司","新北市中和區捷運路8之11號7樓","張佳媛","200000","1080802"
"871","82958536","城嶽建設開發股份有限公司","新北市三重區正義北路122號(3樓)","李博仁","28000000","1080802"
"872","82958542","成長空間諮詢顧問股份有限公司","新北市八里區商港六路13號2樓","黃正宏","10000000","1080802"
"873","82958557","勝雲國際股份有限公司","新北市新莊區中港路五守新村23巷3號3樓","李維彬","100000","1080802"
"874","82958563","諾葳奇股份有限公司","新北市新店區民權路42巷59弄3號3樓","王智民","1000000","1080802"
"875","82958579","睿馳有限公司","新北市永和區中和路499號2樓","蘇玉茹","500000","1080802"
"876","82958584","馥醍巧思有限公司","新北市永和區中山路1段170號7樓","田友玲","500000","1080802"
"877","82958590","冠宏科技有限公司","新北市雙溪區中正路58巷39號2樓","盧金菊","500000","1080802"
"878","82958607","德默特爾企業有限公司","新北市新莊區五權一路11號8樓之1","黃世銘","200000","1080802"
"879","82958613","品盈國際有限公司","新北市中和區建六路70號4樓之3","陳義豪","5000000","1080802"
"880","82958629","特勤工程有限公司","新北市新莊區中平路270巷7弄6號11樓","林芳如","200000","1080802"
"881","82958634","惠新專業場管有限公司","新北市汐止區勤進路83巷3號7樓之47","郭惠新","300000","1080802"
"882","82958640","金田醫農業科技股份有限公司","新北市深坑區烏月路41巷2號","楊宜達","1000000","1080805"
"883","82958655","久留美國際實業有限公司","新北市中和區中山路2段332巷53號5樓","林舒如","700000","1080802"
"884","82958661","玉鼎福有限公司","新北市汐止區中興路226號之5","洪鈞安","3000000","1080802"
"885","82958677","創遠國際有限公司","新北市汐止區新台五路1段77號12樓之3","吳萬鴻","1000000","1080802"
"886","82958682","玉滿食品貿易有限公司","新北市汐止區福德一路117號12樓之3","梁維貞","1000000","1080802"
"887","82958698","伊思有限公司","新北市樹林區俊英街160巷2號(1樓)","黃琪鈞","300000","1080802"
"888","82958705","川達農業科技有限公司","新北市土城區中央路4段50號4樓之3","陳世欣","3000000","1080805"
"889","82958727","欣陽光電有限公司","新北市中和區中正路955號9樓","田長青","1000000","1080802"
"890","82958732","鑫萌有限公司","新北市泰山區信華六街17號19樓","賴英慈","2000000","1080802"
"891","82958748","帝寶餐飲有限公司","新北市林口區中正路121號(1樓)","黃子建","1000000","1080802"
"892","82958753","台灣受恩整合服務股份有限公司","新北市永和區永和路2段57號7樓","劉庭軒","3000000","1080805"
"893","82958769","利軒開發建設股份有限公司","新北市林口區文化一路1段258號8樓","陳銘鴻","10000000","1080805"
"894","82958775","宏展除蟲有限公司","新北市三重區三和路4段16號7樓之2","廖書展","1000000","1080802"
"895","82958780","品欣有限公司","新北市新店區立信一街37號13樓","翁昭名","200000","1080802"
"896","82958796","易新環保實業有限公司","新北市板橋區復興街91之2號(3樓)","林芯于","5000000","1080802"
"897","82958803","小河塾文創股份有限公司","新北市樹林區長壽街70巷2號5樓","詹宗賢","1000000","1080802"
"898","82958819","聯仲廣科技有限公司","新北市中和區建一路176號14樓之2","陳奕光","2150000","1080805"
"899","82958825","米多力節能有限公司","新北市土城區日新街19巷1號","葉達","2000000","1080805"
"900","82958830","茂達事業有限公司","新北市三重區集美街221號3樓之1","黃秀蘭","300000","1080805"
"901","82958846","森哲科技有限公司","新北市板橋區大智街71巷34號","沈曉琪","50000","1080805"
"902","82958851","楊安心有限公司","新北市汐止區大同路2段265號17樓","楊志詮","100000","1080805"
"903","82958867","欣悅系統整合股份有限公司","新北市三峽區大同路240巷45弄8號(1樓)","曲欣悅","1000000","1080805"
"904","82958873","贏如有限公司","新北市中和區中山路2段43號","陳姮熹","100000","1080805"
"905","82958888","易達有限公司","新北市三重區重新路2段46之8號2樓","蔡佳璋","10000000","1080805"
"906","82958894","壹空間設計有限公司","新北市淡水區民生路117巷52弄4號","李健豪","200000","1080805"
"907","82958901","勁占國際開發有限公司","新北市淡水區淡金路16巷17號4樓","鄧臣英","1000000","1080805"
"908","82958917","勝代企業有限公司","新北市三重區永福街46巷15弄22號4樓","陳彥均","100000","1080805"
"909","82958938","安勤建業有限公司","新北市三重區三和路4段390巷6號","楊定逢","50000","1080805"
"910","82958944","賽其有限公司","新北市新店區光明街224巷4號3樓","陳旻姍","3000000","1080805"
"911","82958959","吉芯有限公司","新北市中和區華新街192巷22弄6之1號","鍾星星","30000","1080805"
"912","82958965","至善美學工程有限公司","新北市中和區連城路347巷6弄26之3號","劉佳芬","400000","1080805"
"913","82958971","淦鑫有限公司","新北市新店區北宜路2段511號9樓","陳湘庭","200000","1080805"
"914","82958986","鎧聚科技有限公司","新北市新莊區新泰路369巷1號","曾婉琪","1000000","1080806"
"915","82958992","西圓設計有限公司","新北市土城區明德路1段291巷15號4樓","周筱茜","100000","1080806"
"916","82959009","晚點上班有限公司","新北市永和區安樂路481號","陳柏任","200000","1080806"
"917","82959015","雅米文化創意有限公司","新北市中和區員山路124巷2之3號","吳雅好","500000","1080806"
"918","82959021","安家不動產租賃有限公司","新北市蘆洲區復興路258巷2弄1號","黃鋅萍","15000000","1080806"
"919","82959036","成閎企業有限公司","新北市三重區重新路4段144巷6號","黃義閎","5000000","1080806"
"920","82959042","佳蓉生物科技有限公司","新北市板橋區館前西路6號10樓","吳佳蓉","500000","1080806"
"921","82959057","旭發食品有限公司","新北市鶯歌區八德路2巷18弄13號","黃清旭","1000000","1080806"
"922","82959063","承億科技環保有限公司","新北市新莊區八德街41號2樓","李純偵","2000000","1080806"
"923","82959079","佰懿實業有限公司","新北市蘆洲區民族路422巷15弄6號","李國榮","300000","1080806"
"924","82959084","寶麒銘投資股份有限公司","新北市樹林區學勤路546號17樓","邱郁涵","1000000","1080806"
"925","82959090","麒格國際有限公司","新北市中和區中正路909號10樓","王筱萍","1000000","1080806"
"926","82959107","浤盛搬家貨運有限公司","新北市樹林區保安二街59號4樓","邱奕慶","12000000","1080806"
"927","82964501","大東家國際貿易有限公司","臺中市霧峰區六股里六股路38巷40號","江政忠","100000","1080726"
"928","82964544","亞特諾股份有限公司","臺中市南區平和里美村南路17號3樓","廖曉菁","880000","1080729"
"929","82964559","闔槺企業有限公司","臺中市西屯區潮洋里市政北二路238號11樓之2","王仁仰","1000000","1080729"
"930","85008637","巨本有限公司","高雄市鳳山區中山東路60之7號7樓","唐子文","100000","1080828"
"931","85008643","恩典商業服務有限公司","高雄市前鎮區一心二路119號12樓","禤志齡","500000","1080828"
"932","85008658","富捷國際事業有限公司","高雄市三民區民族一路80號9樓之4","盧宥安","100000","1080828"
"933","85008664","藍斯燈影像有限公司","高雄市三民區九如二路150號17樓","蔡翔","500000","1080829"
"934","85008670","啟思科技有限公司","高雄市前金區五福三路63號11樓","呂易昇","2000000","1080829"
"935","85008685","豐毅實業有限公司","高雄市前鎮區天山路10巷2號1樓","陳坤作","3000000","1080829"
"936","85008708","金祥發金屬工程有限公司","高雄市小港區廈莊六街75之1號5樓","王秀麗","2000000","1080829"
"937","85008714","淞瑜珈有限公司","高雄市左營區華夏路256號3樓","劉昭銘","5000000","1080829"
"938","85008720","緯楀水管工程有限公司","高雄市岡山區岡山北路96號1樓","林兆熙","3000000","1080829"
"939","85008735","傑熙科技有限公司","高雄市三民區昌裕街2巷13號1樓","劉秀麗","500000","1080829"
"940","85008741","時機允晟股份有限公司","高雄市苓雅區光華一路232號3樓","邱志雄","1000000","1080829"
"941","85008799","亦豐印刷有限公司","高雄市鼓山區中華橫路76號1樓","陳嫚伶","1000000","1080829"
"942","85008806","名緯食品有限公司","高雄市三民區三民街70號7樓","黃明琍","2000000","1080829"
"943","85008812","綠淨環境有限公司","高雄市三民區民信路40號1樓","楊博名","2000000","1080829"
"944","85008833","金倉食品有限公司","高雄市燕巢區瓊招路12巷13號1樓","陳盈靜","1000000","1080829"
"945","85008849","宏傑營造有限公司","高雄市苓雅區武漢街98號1樓","陳滄洋","3600000","1080830"
"946","85008860","原匠室內裝修有限公司","高雄市左營區德威街79號3樓","張依婷","1680000","1080830"
"947","85008881","節點科技服務有限公司","高雄市新興區民生一路56號22樓之5","李善純","1000000","1080830"
"948","85009729","慶力油漆工程有限公司","高雄市岡山區中華路128號1樓","王湘晴","748888","1080802"
"949","85009734","旺軒有限公司","高雄市三民區九如二路597號18樓之4","張典宏","1000000","1080802"
"950","85009740","金聿股份有限公司","高雄市三民區大豐二路485號9樓","簡韶均","700000","1080802"
"951","85009755","鼎凱科技有限公司","高雄市仁武區澄合街271號2樓","張緯彬","2000000","1080802"
"952","85009761","升詠醫療器材有限公司","高雄市左營區博愛三路12號21樓","蘇振賓","1000000","1080802"
"953","85009777","好酒葉國際有限公司","高雄市前金區自強一路10號","葉威欣","900000","1080802"
"954","85009782","共時性國際行銷有限公司","高雄市鳳山區五權路33號1樓","徐里渼","1000000","1080802"
"955","85009798","榮堃投資股份有限公司","高雄市小港區廠邊三路42巷49號","柯素珍","1850000","1080802"
"956","85009811","泰竣工程有限公司","高雄市小港區鳳林路166巷7號","許清淵","1500000","1080802"
"957","85009827","六六六輔具有限公司","高雄市三民區明誠一路377號7樓","王柏凱","300000","1080802"
"958","85009832","永發商業有限公司","高雄市苓雅區光華二路440巷13號","林佩君","100000","1080802"
"959","85009848","飛帆工程有限公司","高雄市鳳山區南和街175巷21弄4號1樓","洪錦聰","100000","1080802"
"960","85009853","飛倫有限公司","高雄市鳳山區文建街187號9樓","蔡孟錡","300000","1080802"
"961","85009869","常賀股份有限公司","高雄市大寮區大同街793巷22號1樓","盧政徵","1000000","1080802"
"962","85009875","杏仁哥興業有限公司","高雄市小港區港福街20之4號","盧筱微","500000","1080802"
"963","85009880","渤昇實業有限公司","高雄市前鎮區中華五路1007巷38之1號13樓","林政憲","100000","1080802"
"964","85009896","石錦國際股份有限公司","高雄市三民區博愛一路366號8樓之1","郭石煌","25224400","1080805"
"965","85009903","台潛企業有限公司","高雄市仁武區霞海南一街33號1樓","陳琦瀛","100000","1080805"
"966","85009925","正岳國際有限公司","高雄市新興區中正三路45號2樓","鄭駿杰","10000000","1080805"
"967","85009930","大友鐵工藝有限公司","高雄市小港區宏平路445之6號6樓","丘傑仁","300000","1080805"
"968","85009946","菓平方文化事業有限公司","高雄市三民區鼎華路206號6樓之2","施少墉","5000","1080805"
"969","85009951","全鏈有限公司","高雄市阿蓮區中山路257巷12號1樓","董見林","100000","1080805"
"970","85009967","微創第一醫研教育有限公司","高雄市苓雅區四維四路216號7樓之1","楊椒喬","450000","1080805"
"971","85009973","和順科技有限公司","高雄市三民區自立一路294號","黃和順","1000000","1080805"
"972","85009988","旭鼎資產管理有限公司","高雄市苓雅區五權街30號","林芝沂","50000","1080805"
"973","85009994","承柏投資股份有限公司","高雄市新興區玉竹一街24號2樓","蔡曜任","5000000","1080805"
"974","85010009","欣安人力仲介有限公司","高雄市前鎮區瑞興街138號7樓","林秋君","5000000","1080805"
"975","85010015","美力捷有限公司","高雄市苓雅區林森二路80號11樓","李靜","10000000","1080805"
"976","85010021","富皓有限公司","高雄市三民區正氣街114號3樓","鄭岱燐","1000000","1080805"
"977","85010036","唐盛股份有限公司","高雄市前鎮區瑞和街67號7樓","陳唐城","10500000","1080806"
"978","85010042","中唐空鐵國際開發有限公司","高雄市左營區文強路235號","魏華吾","300000","1080805"
"979","85010057","柚子區塊鏈有限公司","高雄市新興區民權一路251號21樓之1","陳盈蓁","5000000","1080806"
"980","85010063","海陞水產有限公司","高雄市苓雅區四維四路7號13樓","呂柏松","4000000","1080806"
"981","85010079","杉民系統有限公司","高雄市鼓山區裕興路15號4樓","張英麗","200000","1080806"
"982","85010084","毅山國際有限公司","高雄市楠梓區清豐二路166巷62號1樓","沈志傑","500000","1080806"
"983","85010090","台灣酷雷曼科技行銷有限公司","高雄市三民區九如一路143號2樓","曾慶南","500000","1080806"
"984","85010107","日造國際設計有限公司","高雄市左營區博愛三路12號10樓","曹琳敏","1500000","1080806"
"985","85010113","三登建設事業有限公司","高雄市左營區博愛三路12號10樓","曹顧贏","3000000","1080806"
"986","85010129","金格河活動整合有限公司","高雄市仁武區八德西路1266巷3弄1號1樓","陳泱廷","100000","1080806"
"987","85010134","明寶包裝材料有限公司","高雄市苓雅區自強三路3號16樓之5","王彥彬","2000000","1080806"
"988","85010140","聯盛速配國際貿易有限公司","高雄市鳳山區八德路2段142巷3號4樓","陳志光","1000000","1080806"
"989","85010155","欣婕有限公司","高雄市三民區博愛一路162號1樓","謝宜伶","1000000","1080806"
"990","85010161","誠信醫療器材有限公司","高雄市鼓山區九如四路716巷38號1樓","鄭鴻濱","500000","1080806"
"991","85010182","可可緣有限公司","高雄市苓雅區永定街85之2號","賴錫賢","1000000","1080807"
"992","85010198","玥來餐飲有限公司","高雄市鼓山區中華一路826號11樓","王貞尤","1000000","1080807"
"993","85010211","禎姿臟器托抵裝置有限公司","高雄市三民區凱國路40號1樓","王秀鳳","270000","1080807"
"994","85010227","宸益室內裝修工程有限公司","高雄市新興區忠孝一路269巷36號1樓","蔡弼承","200000","1080807"
"995","85010232","恩萊頓實業有限公司","高雄市前金區成功一路369號4樓","湯雅涵","1000000","1080807"
"996","85010248","皚柔生技有限公司","高雄市鳳山區華興街37號2樓之1","楊采綝","1000000","1080807"
"997","85010253","旺盈企業有限公司","高雄市三民區建工路685號8樓之1","林旺成","50000","1080807"
"998","85010269","芯立綺國際有限公司","高雄市橋頭區甲昌路華昌巷8號1樓","許仲守","1000000","1080807"
"999","85010275","豐翊有限公司","高雄市三民區大豐一路322之1號","解凱仁","100000","1080807"
"1000","85010280","色鉛筆服飾有限公司","高雄市三民區天祥一路138號","唐伊辰","100000","1080807"
"1001","85010296","好好生化科技有限公司","高雄市苓雅區和平一路145巷23號3樓","莊孟凡","300000","1080807"
"1002","85010303","杉霖系統有限公司","高雄市鼓山區裕興路15號4樓","盧蕭育雄","200000","1080807"
"1003","85010319","好鑫有限公司","高雄市鼓山區中華一路352號11樓","陳語宸","300000","1080807"
"1004","85010325","富濠建設有限公司","高雄市左營區大中二路240號1樓","謝秉濠","12500000","1080807"
"1005","85010330","一米布作有限公司","高雄市三民區博愛一路391號7樓","張美英","6000000","1080808"
"1006","85010346","隆昕生技有限公司","高雄市大寮區民泰街85號1樓","許世龍","500000","1080808"
"1007","85010367","凱笙廣告有限公司","高雄市鼓山區明華路315號5樓之1","黃昱智","1000000","1080808"
"1008","85010373","華美置業有限公司","高雄市新興區中山一路14號6樓之8","鍾美財","6000000","1080808"
"1009","85010388","布拉格國際時尚事業有限公司","高雄市新興區民權一路251號21樓之1","林義超","600000","1080808"
"1010","85010394","艾峯股份有限公司","高雄市鹽埕區大勇路74號1樓","葉慶怡","1000000","1080808"
"1011","85010401","台灣邦尼事業有限公司","高雄市大寮區民族路179號1樓","李受珠","300000","1080808"
"1012","85010417","宥紀有限公司","高雄市新興區新田路89號2樓","吳俞嫺","100000","1080808"
"1013","85010423","新天成港式餐飲有限公司","高雄市三民區安東街64號2樓","羅碧云","8000000","1080808"
"1014","85010438","愷璿企業有限公司","高雄市鹽埕區堀江街15號1樓","杜育菁","1000000","1080808"
"1015","85010459","甄心整合設計有限公司","高雄市苓雅區金門街47之4號","王婷玉","1000000","1080808"
"1016","85010465","成德機械有限公司","高雄市仁武區八德南路100巷4弄23號","呂明洲","100000","1080808"
"1017","85010471","豐順益漁業有限公司","高雄市小港區崇明街176號","陳信豊","15000000","1080808"
"1018","85010486","新健合商務有限公司","高雄市苓雅區四維四路216號10樓之3","劉柏志","300000","1080808"
"1019","85010492","沅新食品有限公司","高雄市三民區正義路311巷49號1樓","蕭峻合","500000","1080808"
"1020","85010508","芳蕾股份有限公司","高雄市苓雅區英義街64號1樓","郭玲妙","3000000","1080808"
"1021","85010514","恆源機械有限公司","高雄市鳳山區中崙四路28之1號7樓","鄭進億","500000","1080809"
"1022","85010520","永基精密有限公司","高雄市岡山區祐民巷65之1號","高錦章","100000","1080809"
"1023","85010535","心創行銷有限公司","高雄市左營區崇德路91號1樓","馮國豪","200000","1080809"
"1024","85010541","地洲國際開發有限公司","高雄市鳳山區北昌三街17號2樓","陳淑櫻","200000","1080809"
