"序號","統一編號","公司名稱","公司所在地","代表人","資本額","核准設立日期"
"1643","85049335","綠點生態股份有限公司","臺中市西屯區港尾里中清路二段1420號","林映廷","5000000","1080801"
"1644","85049341","立揚顧問有限公司","臺中市西屯區市政北一路359號6樓","林美玉","10000000","1080801"
"1645","85049356","美倫美企業有限公司","臺中市西屯區逢福里河南路二段262號4樓之3","舒佩涵","500000","1080801"
"1646","85049362","福貴興資源有限公司","臺中市南區永興里高工二街72號1樓","王鳳觀","1000000","1080801"
"1647","85049378","臻酒仙有限公司","臺中市西屯區龍潭里龍富路五段368號","陳振雄","1000000","1080801"
"1648","85049383","心情方巾有限公司","臺中市太平區永成里永成北路66巷1弄35號1樓","王崑長","100000","1080801"
"1649","85049399","統盟餐飲股份有限公司","臺中市沙鹿區鹿寮里光榮街47之3號2樓","陳啟政","900000","1080801"
"1650","85049412","弘光有限公司","臺中市北區健行里民權路559號3樓之1","王秀娥","1000000","1080801"
"1651","85049428","杰棣工程有限公司","臺中市太平區振福路300巷20號1樓","賴姿文","100000","1080801"
"1652","85049433","儷昕有限公司","臺中市西區三民路一段149號12樓之1","王唯馨","500000","1080801"
"1653","85049449","合源國際貿易有限公司","臺中市南屯區同心里南屯路二段290號12樓之2","田洪秋","6000000","1080801"
"1654","85049454","硬漢重工有限公司","臺中市北區育德里健行路641號及643號","林秉漢","1700000","1080801"
"1655","85049460","掃房網有限公司","臺中市西屯區何源里成都路285號2樓","張雅媚","1000000","1080801"
"1656","85049476","涵穎實業有限公司","臺中市北屯區松茂里松竹北路172號4樓","羅涵穎","500000","1080801"
"1657","85049481","栢成國際股份有限公司","臺中市北區新北里三民路三段148之3號4樓","林文喜","1000000","1080801"
"1658","85049497","祥舜車體廠有限公司","臺中市大甲區頂店里大發路217號","蔡諺暉","200000","1080802"
"1659","85049503","艾傑斯國際有限公司","臺中市梧棲區大庄里臺灣大道八段726號2樓","郭玫甄","600000","1080802"
"1660","85049519","約書亞室內設計有限公司","臺中市北區健行里梅亭街505號1樓","潘正雄","1000000","1080802"
"1661","85049525","樂為國際有限公司","臺中市西屯區市政北二路236號21樓之1","湯麗雯","500000","1080802"
"1662","85049530","東正堂國際股份有限公司","臺中市西屯區惠來里市政路402號26樓之3","鄧安純","3000000","1080802"
"1663","85049546","鎧新節能有限公司","臺中市北屯區太安中街29號1樓","林庭伃","1000000","1080802"
"1664","85049551","神奇地產有限公司","臺中市西屯區黎明路三段519號及521號","陳淑梅","300000","1080802"
"1665","85049567","昭元鑫農業貿易有限公司","臺中市潭子區頭家東里大成街1巷8號","葉高端","500000","1080802"
"1666","85049573","慈梅實業股份有限公司","臺中市潭子區豐栗路158號1樓","賴以仁","166530000","1080802"
"1667","85049588","彬彬國際有限公司","臺中市南屯區豐樂里永春東一路707號1樓","陳呈賓","1000000","1080802"
"1668","85049594","玉賢健康事業有限公司","臺中市南屯區同心里五權西路二段260號","陳春玉","1000000","1080802"
"1669","85049601","富惟機電有限公司","臺中市西屯區惠來里臺灣大道三段76號2樓之2","王湘妮","200000","1080802"
"1670","85049617","敦富興業股份有限公司","臺中市豐原區社皮里豐原大道一段428巷22弄90號3樓","張雯玲","8000000","1080802"
"1671","85049623","國眾國際有限公司","臺中市西屯區惠來里文心路三段13之7號","李佩君","100000","1080802"
"1672","85049638","中達慶華南國際車業有限公司","臺中市烏日區三和里中山路三段239號","王陞凱","1000000","1080802"
"1673","85049659","超藝術空間有限公司","臺中市西區忠明里中興街279號3樓","洪士超","1000000","1080802"
"1674","85049665","願力企管顧問股份有限公司","臺中市北區光大里6鄰英士路28號四樓之8","楊雪蘭","500000","1080802"
"1675","85049671","昕融國際貿易有限公司","臺中市南屯區新富路238之5號1樓","李明達","200000","1080802"
"1676","85049686","禾居建設有限公司","臺中市大里區新仁路一段71巷1號6樓之6","魏秝婷","2400000","1080802"
"1677","85049692","意識型態創意有限公司","臺中市豐原區陽明里中興路7號一樓","鍾宇瀚","100000","1080802"
"1678","85049709","永濬網路行銷有限公司","臺中市潭子區頭家東里中興北路119巷6號1樓","謝秉軒","100000","1080802"
"1679","85049715","美利鑽珠寶有限公司","臺中市北屯區廍子里太順路50號1樓","高德育","50000","1080802"
"1680","85049721","橙雲國際貿易有限公司","臺中市西屯區何厝里何厝東二街23號9樓之3","吳敏盛","60000","1080802"
"1681","85049736","江泳有限公司","臺中市西屯區何仁里文心路三段155之1號7樓","楊翊辰","500000","1080802"
"1682","85049742","零訊科技有限公司","臺中市西區民龍里臺灣大道二段181號五樓之11","林熲珉","1000000","1080802"
"1683","85049757","動因子行銷有限公司","臺中市北區華美街二段82號8樓之17","魏逢俊","150000","1080805"
"1684","85049763","泰忻精工有限公司","臺中市大里區長榮里20鄰西榮路184巷3號1樓","吳俊宏","50000","1080805"
"1685","85049779","佰達工業有限公司","臺中市西區公益里中美街299巷28號3樓之1","胡芳慈","1000000","1080805"
"1686","85049784","慶福鋁業有限公司","臺中市大里區大明路410號10樓","陳玲惠","3000000","1080805"
"1687","85049790","宇觀室內裝修有限公司","臺中市北屯區大連路二段274巷4號1樓","陳威任","1000000","1080731"
"1688","85049807","晶盈彩寶有限公司","臺中市西屯區何南里大墩二十街118號5樓之1","黃珮嘉","100000","1080805"
"1689","85049813","中國中海能源有限公司","臺中市北區健行里忠明路424號5樓之1","彭志龍","100000","1080805"
"1690","85049829","晟德不動產有限公司","臺中市北區立人里北平路ㄧ段10號1樓","劉兆晟","2000000","1080805"
"1691","85049834","上恆營造有限公司","臺中市神岡區神岡里中山路1538號1樓","曾銘祺","3600000","1080805"
"1692","85049840","永豐國際開發股份有限公司","臺中市南屯區惠德街297號15樓之1","蘇素燕","10000000","1080805"
"1693","85049855","賀衆不動產仲介有限公司","臺中市潭子區潭陽里圓通南路229號1樓","陳志棕","500000","1080805"
"1694","85049861","發力土木包工業有限公司","臺中市東勢區新盛里新盛六街1巷33號","許慶龍","1000000","1080805"
"1695","85049877","中嘉高分子材料有限公司","臺中市烏日區溪南路三段503巷85弄28號1樓","曾令英","3000000","1080805"
"1696","85049882","文創瑟計有限公司","臺中市北區賴村里五常街380號11樓之13","周行道","500000","1080805"
"1697","85049898","翔宇豐原健身股份有限公司","臺中市豐原區復興路2號11樓","廖國翔","1000000","1080805"
"1698","85049905","庭朗設計有限公司","臺中市南屯區溝墘里大業路239號3樓之1","蘇建文","350000","1080805"
"1699","85049911","樂夠科技有限公司","臺中市南屯區溝墘里大業路241號3樓之1","謝凱翔","500000","1080805"
"1700","85049927","太晴空間設計有限公司","臺中市南屯區永春東七路868號1樓","潘正騰","3000000","1080805"
"1701","85049932","夏合餐飲有限公司","臺中市大雅區大雅里學府路286號1樓","許閔勝","200000","1080805"
"1702","85049948","佳豐成工業有限公司","臺中市龍井區忠和里台西南路256巷7號1樓","洪姿惠","8000000","1080805"
"1703","85049953","迪力科技有限公司","臺中市潭子區福仁里新興路一段82巷10弄3號1樓","陳立信","200000","1080805"
"1704","85049969","和昌國際有限公司","臺中市西屯區惠來里文心路三段13-7號","陳昱辰","90000","1080805"
"1705","85049975","富益裝潢工程有限公司","臺中市北屯區四平路69巷11號1樓","王芷音","100000","1080805"
"1706","85049980","華心國際有限公司","臺中市太平區新興里振福路668號","張偉舜","1000000","1080805"
"1707","85049996","富悅國際旅行社有限公司","臺中市太平區新城里樹孝路2-1號1樓","林碧真","6000000","1080805"
"1708","85050000","宥帆實業有限公司","臺中市外埔區水美里二崁路706巷39弄56號1樓","王榮宗","2000000","1080806"
"1709","85050016","堉嘉企業有限公司","臺中市北屯區后庄里后庄一街166號9樓","陳永崇","2000000","1080806"
"1710","85050022","耿芮夫科技有限公司","臺中市霧峰區本堂里樹仁路151巷5號1樓","黃亭維","1500000","1080806"
"1711","85050037","常昇太陽能有限公司","臺中市西區安龍里五權路27之1號10樓","莫保常","6000000","1080806"
"1712","85050043","數字區塊有限公司","臺中市中區民族路64號9樓之9","柯瑜鑫","100000","1080806"
"1713","85050058","詠翊設計有限公司","臺中市太平區新福里樹德一街73巷33號1樓","張世勳","100000","1080806"
"1714","85050064","勁赫製衣股份有限公司","臺中市沙鹿區鹿寮里錦華街48號1樓","蘇宥驊","5000000","1080806"
"1715","85050070","金秝豐有限公司","臺中市南屯區永春東路240號1樓","周玉惠","1000000","1080806"
"1716","85050085","冠泓科技檢驗有限公司","臺南市永康區永康里永大二路83號1樓","鄭煥文","2000000","1080821"
"1717","85050091","銓盈工業有限公司","臺南市安南區安和路一段459巷36弄23之20號1樓","許宗仁","1000000","1080822"
"1718","85050108","春春億營造有限公司","臺南市安南區海南里府安路七段84巷25號1樓","黃涵渝","3800000","1080821"
"1719","85050114","璽元投資股份有限公司","臺南市安平區安平路602-2號3樓","陳政民","3600000","1080821"
"1720","85050120","睿錡自動化有限公司","臺南市永康區中山南路６４４巷２２弄１０號1樓","黃雅惠","1000000","1080821"
"1721","85050135","金利企業有限公司","臺南市中西區西湖里和緯路五段85號12樓","郭盛雄","1000000","1080822"
"1722","85050141","三立環保養殖生技有限公司","臺南市東區仁和里仁和路139巷51弄45之17號","謝從政","1000000","1080822"
"1723","85050156","俏約翰有限公司","臺南市東區裕聖里裕孝路698之3號","蕭詩翰","5000000","1080822"
"1724","85050162","暟昱工程有限公司","臺南市安南區安富街199巷4弄13號1樓","李榮賜","1000000","1080821"
"1725","85050178","宏華投資股份有限公司","臺南市仁德區太子里太子路31巷31號","陳金章","1000000","1080822"
"1726","85050183","沁活咖啡有限公司","臺南市北區北園街99巷62號","沈朝暉","1023560","1080822"
"1727","85050199","夯強育樂文化事業有限公司","臺南市安平區育平里永華路二段1085號1樓","林貞君","3000000","1080821"
"1728","85050206","亞琢國際教育有限公司","臺南市安平區慶平路539號17樓之16","曾竑頲","500000","1080821"
"1729","85050212","神通國際管理顧問有限公司","臺南市北區立人里康樂街396號2樓","邱崇銘","2000000","1080822"
"1730","85050228","麗恆企業有限公司","臺南市北區華德里北成路422號1樓","藺應其","300000","1080823"
"1731","85050233","巨翰有限公司","臺南市中西區南美里民生路一段167號3樓","邱上豪","200000","1080822"
"1732","85050249","安思特有限公司","臺南市仁德區仁和里二空路68號1樓","林麗珠","100000","1080822"
"1733","85050254","樂恒體育國際貿易有限公司","臺南市永康區東橋里東橋七路201號14樓之2","卓俊佑","100000","1080822"
"1734","85050260","台嵐有限公司","臺南市中西區民生路一段156巷22號","冼慧儀","6000000","1080822"
"1735","85050276","旭昇綠能有限公司","臺南市安定區文科里油車62之21號","林和慶","5000000","1080822"
"1736","85050281","炫崑營造有限公司","臺南市新營區東平街30號1樓","陳永濬","3600000","1080822"
"1737","85050297","古柏有限公司","臺南市中西區民族路二段171號1樓","簡怡寧","100000","1080822"
"1738","85050304","科娜有限公司","臺南市中西區保安里海安路一段190巷10號2樓","紀永鑫","700000","1080822"
"1739","85050310","富寶鈺營造有限公司","臺南市安南區溪心理仁安一街120巷2號1樓","黃如彩","5000000","1080823"
"1740","85050326","福聯電子製造有限公司","臺南市東區龍山里26鄰崇仁街66巷10號9樓","彭崇華","500000","1080822"
"1741","85050331","展鈺刀具有限公司","臺南市永康區塩行里中正一街32巷38號","莊朝欽","1200000","1080823"
"1742","85050347","台灣來客國際有限公司","臺南市安南區公親里公學路1段262巷31號1樓","宋碧玉","1200000","1080823"
"1743","85050352","好才國際有限公司","臺南市中西區五條港里西門路2段389號8樓","黃紹軒","100000","1080823"
"1744","85050368","森德凌有限公司","臺南市仁德區仁和里保華路128號1樓","陳舒毓","500000","1080823"
"1745","85050374","六樂有限公司","臺南市中西區五條港里西門路二段389號8樓","馮美燕","100000","1080823"
"1746","85050389","吳金澤實業有限公司","臺南市永康區東橋里東橋七路359號10樓之6","吳泰鋒","1000000","1080823"
"1747","85050395","衣鋈有限公司","臺南市東區裕農里裕農路375號7樓之1","劉柏樟","100000","1080823"
"1748","85050402","拓樸實業有限公司","臺南市仁德區後壁里德洋路180巷15號1樓","蔣淑君","1000000","1080823"
"1749","85050418","歐格數位科技股份有限公司","臺南市中西區西湖里湖美二街36巷3號","葉士賢","300000","1080823"
"1750","85050424","東承陽建設有限公司","臺南市東區自由路二段51號2樓","許仁模","1000000","1080823"
"1751","85050445","廣威隆股份有限公司","臺南市仁德區上崙里中正路一段766巷50弄1號1樓","涂祐銘","5000000","1080823"
"1752","85050450","富淇策略股份有限公司","臺南市永康區烏竹里竹園一街41之15號","王文千","500000","1080823"
"1753","85050466","頂鉅科技有限公司","臺南市新市區新和里勝利街62號1樓","張瑞應","500000","1080823"
"1754","85050472","臺灣希望創新股份有限公司","臺南市歸仁區凱旋路二段211巷32號1樓","黃麗如","101000","1080823"
"1755","85050487","萬晟投資有限公司","臺南市安南區淵東里海佃路四段77號1樓","萬玫君","10000000","1080826"
"1756","85050493","樺益有限公司","臺南市新營區民族路236號","陳柏駿","300000","1080826"
"1757","85050509","台基殿有限公司","臺南市中西區兌悅里文賢路185號1樓","林文山","500000","1080826"
"1758","85050515","路加富貴有限公司","臺南市善化區民權路267號1樓","鹿紹綺","1000000","1080827"
"1759","85050521","全捷新投資有限公司","臺南市永康區新行街300號4樓","郭健利","3500000","1080827"
"1760","85050536","元鑽利刃智能股份有限公司","臺南市安南區幸福里海佃路一段107號2樓","黃傑","500000","1080827"
"1761","85050542","基甸開發工程有限公司","臺南市麻豆區麻口里麻豆口1之12號","石子奇","3000000","1080828"
"1762","85050557","正喬資訊科技有限公司","臺南市安南區溪墘里安寧街23巷31號1樓","郭子榕","1000000","1080826"
"1763","85050563","奇異公關整合行銷有限公司","臺南市善化區光文里成功路252號","黃志佳","2000000","1080827"
"1764","85050579","慕妍美容生技顧問股份有限公司","臺南市安南區安生街78巷2弄14號1樓","陳彥伶","300000","1080827"
"1765","85050584","統聯超市有限公司","臺南市後壁區頂安里197之15號1樓","魏柏修","5000000","1080827"
"1766","85050590","史柏司有限公司","臺南市北區合興里南園街127巷33號1樓","盧陳緞","1000000","1080826"
"1767","85050607","漁泰豐水產有限公司","臺南市安平區金城里城平路1號1樓","彭雪芬","200000","1080827"
"1768","85050629","世盟行銷有限公司","臺南市六甲區甲東里忠孝街245號1樓","龔慧珊","2000000","1080827"
"1769","85050640","群益人力開發有限公司","臺南市歸仁區六甲里30鄰六甲路292號1樓","林英敏","100000","1080827"
"1770","85050655","馮寅生技有限公司","臺南市新營區中山路163號1樓","李家德","100000","1080827"
"1771","85050661","富盛興建設有限公司","臺南市北區華德里文成五街190號3樓","胡誌倫","1000000","1080827"
"1772","85050677","昶陽能源股份有限公司","臺南市歸仁區武東里武東三街53巷6號3樓","張美雲","1500000","1080827"
"1773","85050698","品泓建設有限公司","臺南市東區崇德九街12號1樓","閻淑惠","5000000","1080827"
"1774","85050705","四季開發資產管理有限公司","臺南市東區忠孝里中華東路三段380巷69號3樓之3","黃于庭","200000","1080827"
"1775","85050711","日銧股份有限公司","臺南市永康區塩行里中正五街17號","胡瑞宏","300000","1080827"
"1776","85050727","鴻春五號能源股份有限公司","臺南市北區育德一街28號8樓","洪煜昌","100000","1080828"
"1777","85050732","聯豐國際實業有限公司","臺南市北區仁愛里勝利路190巷41號1樓","李欣霓","30000","1080828"
"1778","85050753","鴻玥一號能源股份有限公司","臺南市北區育德一街28號8樓","洪煜昌","100000","1080829"
"1779","85050769","久豐銀樓有限公司","臺南市中西區西門路二段230之1號","莊志鴻","1000000","1080828"
"1780","85050775","鑫鴻豐國際貿易有限公司","臺南市南區大忠里國民路270巷22弄9號1樓","陳金宇","100000","1080829"
"1781","85050780","庠宏企業有限公司","臺南市北區成德里海安路三段338巷57弄7號1樓","林莉婷","500000","1080829"
"1782","85050803","日高貿易有限公司","臺南市東區長東街131巷63號1樓","林貴彬","1000000","1080829"
"1783","85050825","天使薇薇食品有限公司","臺南市南區新興里健康路二段85號1樓","林庭薇","500000","1080829"
"1784","85050830","誠洋建設有限公司","臺南市新營區新東里開元路159號1樓","林承洋","500000","1080830"
"1785","85050846","馨嘉食品有限公司","臺南市東區崇成里崇德路600號1樓","蕭景馨","500000","1080829"
"1786","85050851","金大鋤成大有限公司","臺南市東區大學里勝利路118號","吳憶怜","3500000","1080829"
"1787","85050873","展宇企業有限公司","臺南市安南區總頭里長溪路二段５７０巷２３弄２５號2樓","林志展","3000000","1080830"
"1788","85050888","旭晶照明股份有限公司","臺南市安南區怡安路一段385巷53弄11號4樓","蘇永昌","3000000","1080830"
"1789","85050894","鴻縣五號能源股份有限公司","臺南市北區育德一街28號8樓","洪煜昌","100000","1080830"
"1790","85051789","弘昕工程有限公司","基隆市七堵區堵北里實踐路268號5樓","袁任賢","1000000","1080806"
"1791","85051795","得聖自動化控制有限公司","新竹縣竹東鎮三重里20鄰中興路一段295巷39之1號","邱得文","200000","1080806"
"1792","85051818","和電自動化設備股份有限公司","新竹縣寶山鄉雙溪村10鄰館前路27號3樓","楊集超","10000000","1080806"
"1793","85051824","寶竹土地開發有限公司","新竹縣竹北市成功六街178號4樓","張全綾","100000","1080806"
"1794","85051839","緊固焊接科技有限公司","新竹市東區東園里八德路6號","張志光","3000000","1080806"
"1795","85051845","亞洲環球國際有限公司","彰化縣彰化市崙平里中央路184號6樓之11","莊銘熹","5000000","1080806"
"1796","85051872","駿德營造股份有限公司","新竹市北區仁德里長安街43號2樓之3","陳震","22500000","1080806"
"1797","85051887","榎谷美業國際有限公司","新竹縣竹北市文化里文采街39號","侯錦彰","1000000","1080806"
"1798","85051893","藝喬室內裝修有限公司","臺東縣太麻里鄉大王村站前路5號","王秐棠","500000","1080806"
"1799","85051900","國鴻香業有限公司","彰化縣員林市萬年里明倫路39號","廖彗妙","2000000","1080806"
"1800","85051916","令和創意開發有限公司","宜蘭縣宜蘭市進士路94巷7號","鄭曉涵","200000","1080806"
"1801","85051922","鴻鼎創新國際有限公司","新竹市北區南勢里竹光路500號2樓","吳禹儂","300000","1080806"
"1802","85051937","台灣麒哥實業有限公司","基隆市中正區豐稔街125-1號","陳琮麒","1000000","1080806"
"1803","85051943","長業混凝土有限公司","屏東縣內埔鄉和興村學人路618巷45弄16號","徐志明","14000000","1080806"
"1804","85051958","玖進股份有限公司","新竹市北區育英里四維路130號四樓之3","游登評","6000000","1080806"
"1805","85051964","興冠工程有限公司","新竹市北區光華里光華街93號7樓之1","陳金元","100000","1080806"
"1806","85051970","美三科技有限公司","新竹市東區豐功里建中一路29號10樓之1","周正三","300000","1080807"
"1807","85051985","金中興營造有限公司","花蓮縣新城鄉嘉里村嘉里路19號一樓","林昱吟","4000000","1080807"
"1808","85051991","立積建設有限公司","南投縣草屯鎮明正里成功路一段377號一樓","林木傳","10000000","1080807"
"1809","85052008","英屬開曼群島商鐳芯股份有限公司","臺北市大同區南京西路61號4樓之2","EMANUEL MARK ANDREW","0","1080807"
"1810","85052014","韋呈建設有限公司","彰化縣秀水鄉莊雅村秀中街115巷52弄9號1樓","湯靜宜","5000000","1080807"
"1811","85052020","銓瀚系統股份有限公司","新竹縣竹北市北興里十興路271號4樓","戴遠謀","2000000","1080807"
"1812","85052035","振隆工程有限公司","屏東縣萬巒鄉萬德路5號1樓","潘振隆","500000","1080807"
"1813","85052041","香港商超凡有限公司","臺北市中正區許昌街42之1號10樓","潘展豪","1000000","1080807"
"1814","85052056","久健企業有限公司","彰化縣埔鹽鄉埔鹽村彰水路二段133巷1-1號一樓","陳麗璇","12000000","1080807"
"1815","85052062","藍同國際有限公司","新竹縣竹北市勝利十二街151號","唐志堅","500000","1080807"
"1816","85052078","金侑科技有限公司","彰化縣鹿港鎮草中里鹿草路五段286巷26弄59號","謝錫寅","1000000","1080807"
"1817","85052083","台灣海佳彩亮光電科技有限公司","基隆市仁愛區文昌里孝四路30之6號","游德滿","1000000","1080807"
"1818","85052099","橙樂規劃設計有限公司","宜蘭縣蘇澳鎮志成路34巷1弄3號一樓","羅仁浩","500000","1080807"
"1819","85052106","水上行有限公司","新竹市東區關新里關新路213號16樓之5","陳曉娟","50000","1080807"
"1820","85052112","日商瑞顧克斯工業股份有限公司","臺中市西屯區文心路二段201號13樓之3","江頭裕明","0","1080807"
"1821","85052128","啓源生醫有限公司","新竹縣竹北市新社里國華街1巷5號2樓","蘇啓彰","1000000","1080807"
"1822","85052133","雲端新廣播股份有限公司","屏東縣恆春鎮恆南路64巷50號","陳冠鳴","5000000","1080807"
"1823","85052149","香港商原禾國際有限公司","臺北市內湖區瑞光路513巷37號3樓","楊秀鳳","30000000","1080807"
"1824","85052154","智輪創意有限公司","彰化縣和美鎮和東里忠孝路61號一樓","楊朝淵","500000","1080808"
"1825","85052160","鑫享家不動產有限公司","屏東縣東港鎮興東里明德路109號1樓","曾郁庭","300000","1080808"
"1826","85052176","暐拓資訊有限公司","苗栗縣竹南鎮竹南里民權街43號","洪欣慈","1000000","1080808"
"1827","85052181","盛鑫水電工程有限公司","新竹市北區石坊里中山路163號2樓之3","吳志勇","100000","1080808"
"1828","85052197","和興冷凍機械有限公司","宜蘭縣蘇澳鎮建福路29巷18號一樓","邱正立","1000000","1080808"
"1829","85052204","童藝文創有限公司","苗栗縣苗栗市中苗里中山路437號","蔡雅雯","500000","1080808"
"1830","85052210","新加坡商光明諮詢有限公司台灣辦事處","臺北市大安區羅斯福路三段29號6樓","蔡光明","0","1080808"
"1831","85052226","日日是好日有限公司","嘉義市西區國華里文化路297巷3號2樓","蕭竣壬","500000","1080808"
"1832","85052231","平和房屋有限公司","宜蘭縣五結鄉四結村清水路3號六樓","許懷德","600000","1080808"
"1833","85052247","英屬開曼群島商原創基因股份有限公司","臺北市大同區西寧北路62-5號2樓","郭全榮","1000000","1080808"
"1834","85052252","香港商廈立國際控股有限公司","新北市中和區中山路二段332巷67號十三樓","林鈊雩","100000","1080808"
"1835","85052268","宥升工程有限公司","彰化縣彰化市福山里山中街97巷20弄1號","謝明隆","300000","1080808"
"1836","85052274","薩摩亞商彩佳投資有限公司","桃園市桃園區大德一街96號10樓","楊淑凰","25000000","1080808"
"1837","85052289","震玖健康生物科技有限公司","南投縣南投市平山里南崗三路20號","羅穎芝","1000000","1080808"
"1838","85052295","神龍有限公司","南投縣魚池鄉東池村秀水路61號一樓之2","林惠美","500000","1080808"
"1839","85052318","群翔消防安全設備工程有限公司","苗栗縣後龍鎮大庄里大庄60號二樓","周志豪","1000000","1080808"
"1840","85052324","桑姆蕾可企業有限公司","嘉義市興仁里興仁街10巷2號","莊雅禎","100000","1080808"
