"序號","統一編號","公司名稱","公司所在地","代表人","資本額","核准設立日期"
"813","85001796","鑫禾科技資訊有限公司","臺北市信義區忠孝東路5段1之2號11樓","曾希哲","10000","1081108"
"814","85001803","恒信資訊有限公司","臺北市中山區南京東路1段52號2樓","許哲維","1000000","1081108"
"815","85001819","旺同數位顧問有限公司","臺北市松山區南京東路4段130號2樓之1","葉天濃","10000000","1081108"
"816","85001825","旭鴻資訊有限公司","臺北市大安區忠孝東路3段303號2樓之2","李招賢","10000","1081108"
"817","85001851","山秋股份有限公司","臺北市中山區中山北路1段83巷38號","石智文","3000000","1081111"
"818","85001867","雅韻創意有限公司","臺北市中正區金山北路1號6樓之3","陳立輝","6000000","1081111"
"819","85001873","慶宏國際有限公司","臺北市信義區崇德街81巷8號","胡延慶","200000","1081111"
"820","85001888","星宸電子有限公司","臺北市內湖區內湖路1段250號12樓","林燦圳","1000000","1081111"
"821","85001894","睿虹科技有限公司","臺北市中正區開封街1段37號5樓","蔡承璋","1000000","1081111"
"822","85001901","創造館文化有限公司","臺北市松山區塔悠路195號","許淑美","6000000","1081111"
"823","85001917","山得兆股份有限公司","臺北市信義區松山路119巷7之2號1樓","李嘉俊","1250000","1081111"
"824","85001923","倍速羅得股份有限公司","臺北市信義區松仁路100號34樓","Alexander Carl Christer Helling","5000000","1081112"
"825","85001938","尚格國際開發有限公司","臺北市大同區承德路2段47號8樓","王啓吉","2000000","1081111"
"826","85001944","房地客棧有限公司","臺北市信義區通河東街2段3號地下一層","張書涵","100000","1081111"
"827","85001959","以成數位科技有限公司","臺北市北投區中央北路3段40巷34弄2號1樓","陳信宏","1000000","1081111"
"828","85001965","智享視界科技有限公司","臺北市中山區南京東路2段150號10樓","蔡旻翰","100000","1081111"
"829","85001971","城喜有限公司","臺北市士林區天母東路61巷3號3樓之2","陳威宇","500000","1081111"
"830","85001986","豐銘地產開發股份有限公司","臺北市中山區松江路54號9樓之2","許為城","5000000","1081111"
"831","85001992","秦楷企業有限公司","臺北市士林區德行西路36號3樓之13","葉柏宣","400000","1081111"
"832","85002009","卡卡歐國際有限公司","臺北市中正區延平南路157巷3號","盧美嘉","500000","1081111"
"833","85002021","鑫羿蔬果物流有限公司","臺北市中正區衡陽路10號12樓","鄭詩慧","200000","1081111"
"834","85002042","時光智慧餐飲國際股份有限公司","臺北市信義區永吉路30巷178弄2號2樓","杜文如","600000","1081111"
"835","85002057","秒拼網路資訊有限公司","臺北市中山區南京東路2段206號12樓之5","楊玉如","500000","1081111"
"836","85002063","眾興實業有限公司","臺北市萬華區成都路66號2、3樓","江宗興","1000000","1081111"
"837","85002084","小步點有限公司","臺北市大安區復興南路1段390號5樓之3","唐沁芸","300000","1081111"
"838","85002090","晨雲智匯股份有限公司","臺北市中正區新生南路1段56號5樓","廖崇男","5000000","1081111"
"839","85002107","騏揚國際企業有限公司","臺北市中正區寧波西街99之1號3樓","蕭博謙","500000","1081111"
"840","85002113","聚海國際有限公司","臺北市大安區忠孝東路4段320號2樓","楊宗霖","100000","1081111"
"841","85002129","穩盈娛樂有限公司","臺北市內湖區新湖三路237號3樓","鍾家溱","8000000","1081112"
"842","85002134","菓菓心理創意有限公司","臺北市中山區建國北路22巷13號3樓之1","林淵渟","400000","1081111"
"843","85002140","瑞達國際有限公司","臺北市大安區和平東路1段87號2樓","王濬哲","1000000","1081111"
"844","85002155","星火多媒體有限公司","臺北市信義區松德路171號5樓之7","曾俊翰","2000000","1081112"
"845","85002161","台灣萊珀妮股份有限公司","臺北市松山區民權東路3段102號8樓","Patrick Nicolas E. Rasquinet","7000000","1081111"
"846","85002177","萬寶國際古董熱釋光鑑定有限公司","臺北市大安區安和路2段213號8樓之1","巫錦麗","1000000","1081111"
"847","85002182","富美投資有限公司","臺北市內湖區金莊路88號9樓之2","翁富美","500000","1081111"
"848","85002198","雙子娛樂有限公司","臺北市大同區民族西路187巷35號3樓","張育嘉","100000","1081111"
"849","85002211","太禎國際股份有限公司","臺北市中山區南京東路2段150號5樓","曾祐詮","5200000","1081111"
"850","85002227","台灣兆麗健股份有限公司","臺北市大安區忠孝東路4段221號10樓","莊惠清","1000000","1081111"
"851","85002232","維鐸整合資產有限公司","臺北市中正區杭州南路1段45號13樓","陳振瑋","500000","1081111"
"852","85002248","耀瀚企業有限公司","臺北市中山區龍江路110號1樓","陳秀敏","68000","1081112"
"853","85002253","晶寶國際有限公司","臺北市中山區長安東路2段67號4樓","簡啓銘","10000000","1081111"
"854","85002269","跨界觸動有限公司","臺北市大同區民權西路108號2樓","林昌翰","3000000","1081111"
"855","85002275","貿翔環境有限公司","臺北市內湖區南港路3段208巷8號","石謦毓","500000","1081111"
"856","85002296","光讚資產有限公司","臺北市信義區松德路10號3樓","練怡孝","1000000","1081111"
"857","85002303","御諾資訊股份有限公司","臺北市大安區復興南路2段86號3樓之1","王昆勇","100000","1081111"
"858","85002319","法藝文創有限公司","臺北市文山區汀州路4段267號6樓","莊晏晨","500000","1081112"
"859","85002325","耀宏生技有限公司","臺北市南港區忠孝東路6段70巷24號1樓","陳奕宏","300000","1081112"
"860","85002330","中華優必交易有限公司","臺北市中山區民生東路1段43號3樓","張諾 Norman Nuo Zhang","500000","1081112"
"861","85002346","比美蒂有限公司","臺北市大安區復興南路1段133號","TANGY YOSI","500000","1081112"
"862","85002351","拾楀餐飲股份有限公司","臺北市大安區大安路1段101巷6號2樓","曾柏憲","5000000","1081112"
"863","85002367","鍾誠有限公司","臺北市大安區瑞安街208巷24弄6號5樓","鍾達誠","600000","1081112"
"864","85002373","創睿思科技有限公司","臺北市大安區和平東路3段63號8樓","蘇易漢","100000","1081112"
"865","85002388","正成室內設計有限公司","臺北市信義區基隆路1段155號12樓之6","張明","6000000","1081112"
"866","85002394","斐利巧股份有限公司","臺北市大安區延吉街131巷24號1樓","李逸倫","750000","1081112"
"867","85002401","台灣英富必有限公司","臺北市松山區南京東路4段1號2樓","TURNER SEBASTIAN CHARLES","1500000","1081112"
"868","85002417","金博特國際藝術鑑定有限公司","臺北市中正區忠孝東路2段130號4樓之6","張凱賀","1000000","1081112"
"869","85002423","大桓國際設計有限公司","臺北市中正區丹陽街16號","徐志強","1000000","1081112"
"870","85002459","沛成實業股份有限公司","臺北市大安區敦化南路2段65號12樓","張悅芬","10000000","1081112"
"871","85002465","偉恩資訊科技有限公司","臺北市文山區福興路82巷6弄1號4樓","李文熙","2000000","1081112"
"872","85002471","高禾股份有限公司","臺北市大安區敦化南路2段65號12樓","張悅娟","10000000","1081112"
"873","85002486","奇蹟創作坊有限公司","臺北市中正區廈門街127號5樓","鐘宇君","800000","1081112"
"874","85002492","全世能企業有限公司","臺北市中山區民權西路20號2樓","潘佳儀","3200000","1081112"
"875","85002508","包給你有限公司","臺北市士林區延平北路5段83巷25號1樓","陳鴻雲","500000","1081112"
"876","85002514","大師模型有限公司","臺北市士林區永平街19號1樓","黃玉婷","90000","1081112"
"877","85002520","智晟資訊服務有限公司","臺北市中山區松江路101號4樓之2","蘇寶仁","1000000","1081112"
"878","85002535","金華三好物有限公司","臺北市中山區明水路397巷19弄10號1樓","黃毓婕","1000000","1081113"
"879","85002541","星雲多媒體科技有限公司","臺北市大安區忠孝東路4段221號10樓","葛瑋剛","50000","1081112"
"880","85002556","同謙有限公司","臺北市松山區光復北路85巷3號","林迺禮","1000000","1081112"
"881","85002562","宇碩建材有限公司","臺北市中山區雙城街10巷23號7樓","曲昌國","6000000","1081112"
"882","85002578","弘碩開發建設股份有限公司","臺北市文山區興隆路2段281號7樓","林銘哲","10000000","1081112"
"883","85002583","德安科技有限公司","臺北市內湖區瑞光路168號9樓","王天霸","100000","1081112"
"884","85002599","芯霖生技有限公司","臺北市中正區南京東路1段16號9樓之2","楊品芯","100000","1081113"
"885","85002606","富橋資產管理股份有限公司","臺北市松山區慶城街28號7樓","柯吉源","62666600","1081113"
"886","85002612","麥斯特科技有限公司","臺北市大安區新生南路3段4號5樓之2","陳庭溱","1000000","1081113"
"887","85002628","尚辰創藝有限公司","臺北市中山區南京東路2段137號14樓","陳柏華","200000","1081112"
"888","85002633","戀上幸福酒窩有限公司","臺北市松山區南京東路4段55-1號1樓","吳憲枚","1000000","1081112"
"889","85002649","魏氏茶業有限公司","臺北市信義區松信路96號","林信介","2000000","1081112"
"890","85002654","銳富資產有限公司","臺北市大安區羅斯福路3段29號6樓","姜廣興","200000","1081112"
"891","85002660","庭市六九有限公司","臺北市士林區文林路69號","蔡國帝","100000","1081112"
"892","85002676","安步湖水有限公司","臺北市大安區忠孝東路3段305號4樓之3","麥志坤","6117847","1081112"
"893","85002681","龐必傑實業有限公司","臺北市松山區光復北路11巷85號","凌羽儀","168000","1081112"
"894","85002697","祥瑞雅築股份有限公司","臺北市萬華區武昌街2段124之2號9樓之22","潘鈞雄","2000000","1081112"
"895","85002704","鴻基建設開發股份有限公司","臺北市信義區忠孝東路4段557號11樓","侯秉奇","300000","1081113"
"896","85002710","魚王四口有限公司","臺北市中正區羅斯福路4段12巷9號1樓","林志清","800000","1081113"
"897","85002726","震世國際地產股份有限公司","臺北市中山區松江路158號6樓之5","楊世均","30000000","1081113"
"898","85002731","康富麗生技企業有限公司","臺北市大安區新生南路1段163號6樓","陳建言","3000000","1081113"
"899","85002747","豆沙科技股份有限公司","臺北市信義區基隆路1段149號3樓之9","周文斌","2999900","1081113"
"900","85002752","台灣極暖國際貿易有限公司","臺北市大安區信義路4段248號9樓之1","謝孟璋","1000000","1081113"
"901","85002768","駿彬有限公司","臺北市中山區吉林路24號9樓之4","邱楣瑤","1000000","1081113"
"902","85002774","芬蜜美容有限公司","臺北市松山區三民路18之1號","繆瓊慧","1000000","1081113"
"903","85002789","維禮開發有限公司","臺北市中正區忠孝東路1段76號12樓之1","李宜庭","1000000","1081113"
"904","85002795","三欽有限公司","臺北市大同區延平北路3段63號","林孟琪","500000","1081113"
"905","85002818","大臺北創新產業股份有限公司","臺北市士林區社子街93號2樓","楊竣森","500000","1081113"
"906","85002824","玉馨生物科技有限公司","臺北市文山區萬安街56巷3號2樓之3","李玉馨","200000","1081113"
"907","85002839","荏美力生技有限公司","臺北市大安區忠孝東路4段221號10樓","彭詩怡","500000","1081113"
"908","85002845","駿和環衛有限公司","臺北市中山區北安路518巷臨8號1樓","陳奕先","1000000","1081113"
"909","85002850","豐富科技有限公司","臺北市南港區東新街180巷11號地下一層之1","林文智","500000","1081113"
"910","85002866","速得利有限公司","臺北市中山區建國北路2段147號5樓之1","陳信進","10000000","1081113"
"911","85002872","明傑企業有限公司","臺北市內湖區南京東路6段200之5號5樓","廖金綢","100000","1081113"
"912","85002887","姍夆實業有限公司","臺北市中山區南京東路3段223巷18號6樓","陳壽美","100000","1081113"
"913","85002893","華銳生物科技有限公司","臺北市中山區南京西路1之1號6樓","莊詠婷","500000","1081113"
"914","85002900","溧禔國際有限公司","臺北市內湖區民權東路6段296巷121號9樓","董靜蓉","60000","1081113"
"915","85002916","吐思創意有限公司","臺北市大安區忠孝東路4段220號11樓","吳宛純","200000","1081113"
"916","85002922","卓眾工程顧問有限公司","臺北市松山區民生東路5段36巷6弄2號3樓","李翠芬","300000","1081113"
"917","85002937","富鼎富投資股份有限公司","臺北市松山區復興北路181號7摟","周志恒","60000000","1081114"
"918","85002943","金蘇有限公司","臺北市北投區大業路458號4樓","詹世倍","1000000","1081113"
"919","85002958","明鈊科技股份有限公司","臺北市大安區金山南路2段222號3樓","郭淑惠","2200000","1081113"
"920","85002964","柏莉家國際有限公司","臺北市大同區民族西路187巷35號3樓","陳柏宏","300000","1081113"
"921","85002970","起思創意有限公司","臺北市松山區南京東路5段222之1號2樓","陳郁凡","500000","1081113"
"922","85002985","鏈奇科技股份有限公司","臺北市大安區忠孝東路4段221號12樓","何建幟","90000","1081114"
"923","85002991","綠巨人清潔實業有限公司","臺北市萬華區開封街2段40號6樓之1","呂文彬","1088000","1081113"
"924","85003014","耶方國際股份有限公司","臺北市萬華區莒光路112巷9弄12號1樓","許逸珺","5000000","1081113"
"925","85003020","多霖咖啡文化有限公司","臺北市大安區復興南路2段237號13樓","蘇宗昌","1000000","1081113"
"926","85003035","毛怪樂園國際貿易有限公司","臺北市大同區歸綏街205號1樓","洪心怡","250000","1081113"
"927","85003041","成佑建設有限公司","新竹縣新豐鄉松柏村保康街10號1樓","陳佑任","10000000","1081113"
"928","85003056","歐洲國際精品有限公司","彰化縣員林市仁美里中正路652巷8號","賴俊良","500000","1081113"
"929","85003062","大腳整合行銷設計有限公司","屏東縣屏東市崇蘭里崇德路139巷6號1樓","宋明憲","100000","1081113"
"930","85003083","元吉環境科技有限公司","宜蘭縣三星鄉尚武村中興路1段196巷7號","林永崇","2000000","1081113"
"931","85003099","朕安房屋租賃有限公司","新竹市東區新莊里長春街95號1樓","陳淑貞","500000","1081113"
"932","85003106","承毅健康生物科技有限公司","彰化縣員林市三愛里浮圳路二段346號1樓","江重毅","1000000","1081113"
"933","85003112","國益技術顧問有限公司","新竹縣竹北市新國里華興一街99號一樓","吳清池","2000000","1081113"
"934","85003128","博鉅機械有限公司","苗栗縣苑裡鎮山柑里10鄰山柑121-1號","謝聯輝","50000","1081113"
"935","85003133","立業精密工業有限公司","彰化縣鹿港鎮溝墘里棋盤巷64號","許碧玉","200000","1081113"
"936","85003149","捷科資訊有限公司","新竹市東區東園里鐵道路一段28巷3號13樓","林碧君","500000","1081113"
"937","85003154","昕饗餐飲有限公司","新竹市東區龍山里埔頂路508號1樓","張文隆","2000000","1081114"
"938","85003160","日億誠商業有限公司","南投縣南投市忠孝路23號1樓","藍岳融","1000000","1081114"
"939","85003176","宏苙不動產有限公司","臺東縣臺東市永樂里民航路698巷87號","陳美卿","350000","1081114"
"940","85003181","榮璿系統股份有限公司","新竹市東區光復里15鄰新光路85號6樓","王慶橖","30000000","1081114"
"941","85003197","恆永能源股份有限公司","屏東縣屏東市前進里大溪路335之12號","廖國榮","100000","1081114"
"942","85003204","哎呀有限公司","屏東縣屏東市和興里忠孝路322號","陳盈均","300000","1081114"
"943","85003226","詠新實業股份有限公司","屏東縣鹽埔鄉鹽中村勝利路29-20號","陳福泰","6250000","1081114"
"944","85003231","恆立能源股份有限公司","屏東縣屏東市前進里大溪路335之12號","廖國榮","100000","1081114"
"945","85003247","品什麼有限公司","新竹市東區金山里27鄰光復路一段87號","林君怡","500000","1081114"
"946","85003252","永立能源股份有限公司","屏東縣屏東市前進里大溪路335之12號","廖國榮","100000","1081114"
"947","85003268","逸湘園國際有限公司","新竹市東區親仁里仁愛街85號1樓","熊慧珍","20000","1081114"
"948","85003274","香港商中盛資本管理顧問有限公司","臺北市松山區敦化北路214號8樓","李建雄","100000","1081114"
"949","85003289","鎂洋洋國際有限公司","新竹市東區金山里金山二十三街32巷6號","李厚澄","200000","1081114"
"950","85003295","特立通工程有限公司","苗栗縣竹南鎮頂埔里中華路137巷8弄19號1樓","江國榮","1000000","1081114"
"951","85003302","臻承有限公司","苗栗縣通霄鎮南華路43巷5號","黎雅慧","100000","1081114"
"952","85003324","一箱人作設計有限公司","新竹縣芎林鄉芎林村文富街28號三樓","鄭烜勛","500000","1081114"
"953","85003339","晟銘國際企業有限公司","彰化縣彰化市興北里三民路237巷29-3號","楊楷生","6000000","1081114"
"954","85003345","億兆環保股份有限公司","彰化縣花壇鄉灣東村7鄰榮興路196巷80弄18號1樓","陳有賢","10000000","1081114"
"955","85003350","良正有限公司","新竹市東區復中里民生路192號3樓之2","盧怡如","1500000","1081114"
"956","85003366","上竣股份有限公司","新竹市北區海濱里15鄰天府路二段68號4樓之6","曾淑媛","1000000","1081114"
"957","85003387","海崖谷休閒育樂有限公司","花蓮縣壽豐鄉鹽寮村大坑51-5號","周維鈞","1000000","1081114"
"958","85003393","鉅建實業有限公司","臺東縣臺東市民生里鄭州街115號1樓","吳柏頡","1500000","1081114"
"959","85003416","元健醫療器材有限公司","嘉義市西區書院里中山路651號附1一樓","林惠鈴","300000","1081114"
"960","85003443","尚艾國際股份有限公司","雲林縣古坑鄉湳仔村湳子51之5號1樓","蔡函霖","2000000","1081114"
"961","85003458","康士德國際有限公司","新竹縣竹北市縣政三街31號4樓","許豐榮","200000","1081114"
"962","85003464","昀丰能源有限公司","嘉義縣大林鎮平林里18鄰民權路9號一樓","唐榮輝","5000000","1081114"
"963","85003470","太炫國際股份有限公司","屏東縣屏東市福州街3號","黃惠琦","1200000","1081114"
"964","85003485","香港商蕾迪欣有限公司","臺北市中正區杭州南路一段27號3樓","楊穎欣","1000000","1081114"
"965","85003491","晁泰股份有限公司","彰化縣花壇鄉南口村中山路二段332巷3號1樓","宋碧桃","5000000","1081114"
"966","85003507","丞航國際貿易有限公司","彰化縣芬園鄉彰南路一段169號1樓","張麗子","200000","1081115"
"967","85003513","查克拉有限公司","宜蘭縣礁溪鄉匏崙村匏杓崙路95之6號","鄭玉梅","1800000","1081115"
"968","85003529","寶媽食品事業有限公司","基隆市中正區豐稔街102號1樓","吳宜靜","300000","1081115"
"969","85003534","御芯傢飾有限公司","新竹縣竹北市環北路五段145號一樓","林東葳","100000","1081115"
"970","85003540","池久影像有限公司","彰化縣溪湖鎮湖東里大溪路二段73巷255弄16號1樓","陳思維","500000","1081115"
"971","85003555","騰鴻工業有限公司","彰化縣彰化市延和里埔內街27巷88號1樓","曾騰慶","800000","1081115"
"972","85003561","和樂食品有限公司","臺東縣臺東市興國里正氣路215.217號","陳嘉豪","600000","1081115"
"973","85003632","強鼎生技有限公司","嘉義市西區保福里八德路126號1樓","陳彥銘","3000000","1081115"
"974","85003648","星丞貿易有限公司","基隆市七堵區泰和街70號1樓","陳芊妘","1000000","1081115"
"975","85003653","綠農循環生技有限公司","苗栗縣頭份市仁愛里12鄰17-6號1樓","曾錦田","50000","1081115"
"976","85003669","明翰顧問有限公司","花蓮縣花蓮市國興里建安街7巷17號1樓","戴招治","500000","1081115"
"977","85003675","彩昊有限公司","金門縣金湖鎮市港二路211號1樓","翁佩瑜","60000","1081115"
"978","85003680","利翌投資有限公司","新竹市育英里四維路89巷2之1號5樓之2","利信宏","3723900","1081115"
"979","85003696","晶碩綠能有限公司","新竹縣竹北市中興里嘉豐七街2號","林芸萱","100000","1081115"
"980","85003719","銓順光電股份有限公司","新竹市東區三民里民權路13號七樓","奚慧怡","300000","1081115"
"981","85003730","明宇諮詢顧問有限公司","新竹縣竹北市隘口六街157號3樓","劉淑娟","100000","1081115"
"982","85003746","元相不動產有限公司","屏東縣屏東市文明里桂林街5號2樓","楊凱文","200000","1081115"
"983","85003751","承益投資有限公司","苗栗縣竹南鎮佳興里1鄰公義路178巷5號","程鎮","500000","1081115"
"984","85003767","晶珮有限公司","新竹市北區文雅里竹光路54巷1弄12號一樓","彭靖芳","1000000","1081115"
"985","85003773","薩摩亞商創威有限公司","臺北市信義區東興路45號10樓","鄭力誌","3000000","1081115"
"986","85003794","優膳糧金山餐飲股份有限公司","新竹市東區金山八街46號2樓","張煥基","3846154","1081118"
"987","85003817","鼎婕股份有限公司","彰化縣和美鎮犁盛里東谷路126號2樓","陳蓁嫻","2500000","1081118"
"988","85003823","奧威股份有限公司","彰化縣員林市東和里南昌東路11號1樓","呂建和","5000000","1081118"
"989","85003838","益輝建設有限公司","花蓮縣吉安鄉勝安村自強路143號1樓","傅國淵","2000000","1081118"
"990","85003865","固傑特有限公司","新竹市北區康樂里東大路3段556巷6弄7號(1樓)","蘇啓明","1000000","1081118"
"991","85003871","意凡國際貿易有限公司","新竹市東區東山里食品路141巷21號1樓","謝正義","1000000","1081118"
"992","85003886","欣宸開發建設有限公司","彰化縣伸港鄉新港村中華路3號1樓","柯孟欣","4000000","1081118"
"993","85003909","邑習有限公司","彰化縣員林市三和里建國路70-1號","張藝玄","3000000","1081118"
"994","85003915","三生科技股份有限公司","彰化縣鹿港鎮海埔里鹿工北二路11號1樓","黃坤山","6000000","1081118"
"995","85003921","全能小客車租賃有限公司","花蓮縣花蓮市廣東街21之1號1樓","羅政偉","5000000","1081118"
"996","85003936","日熙股份有限公司","新竹縣竹北市縣政十一街102號1樓","鄭宇廷","1000000","1081118"
"997","85003942","和慶工程有限公司","新竹縣竹北市竹北里博愛街513號5樓之5","王紹耀","1000000","1081118"
"998","85003957","金合興科技工程有限公司","苗栗縣頭份市流東里9鄰信德路455號","饒芸佳","200000","1081118"
"999","85003963","群固科技有限公司","新竹市北區港北里延平路三段247巷42號","馮頎媜","500000","1081118"
"1000","85003984","國世貿易有限公司","嘉義市西區新榮路14號三樓","黃武珍","100000","1081118"
"1001","85003990","銘龍工程有限公司","屏東縣內埔鄉老埤村3鄰福泰路210號1樓","潘俊龍","200000","1081118"
"1002","85004007","長杙工程有限公司","新竹縣竹北市逸境新村57號","林長慶","200000","1081118"
"1003","85004029","易居建設有限公司","花蓮縣吉安鄉北昌村2鄰自樂街46巷20號1樓","林峰霆","5000000","1081118"
"1004","85004040","立而安企業有限公司","南投縣草屯鎮御史里御富路198號1樓","林桓民","500000","1081118"
"1005","85004055","晉齊科技有限公司","新竹市東區龍山里世傑路222號1樓","陳思齊","2000000","1081118"
"1006","85004061","成璽不動產仲介有限公司","基隆市中正區砂子里觀海街41號1樓","廖振宏","200000","1081118"
"1007","85004082","布農旅行社有限公司","南投縣名間鄉中山村頂廍巷4-30號2樓","谷正男","1200000","1081118"
"1008","85004105","博元國際開發有限公司","雲林縣崙背鄉崙前村崙前49之18號1樓","鄭俊謀","300000","1081118"
"1009","85004111","倉億太陽能有限公司","嘉義縣布袋鎮光復里九龍三街19號1樓","蔡崇富","3000000","1081118"
"1010","85004127","大富豪開發有限公司","基隆市中正區豐稔街54巷5-2號","滕基勝","1000000","1081118"
"1011","85004148","墨然企業有限公司","新竹縣竹北市北興里21鄰勝利十街80號","林勁宇","300000","1081118"
"1012","85004153","沃德有限公司","新竹市東區南大里食品路325號1樓","鄭竹君","200000","1081118"
"1013","85004169","臻宏興業有限公司","基隆市中山區中山一路261巷4號","王宇臻","200000","1081118"
"1014","85004196","尚麟資通有限公司","新竹市東區振興里15鄰南大路634巷6號","涂尚耘","800000","1081118"
"1015","85004203","新加坡商平鼎半導體設備股份有限公司","臺北市大安區敦化南路一段192號13樓之6","SEIFRIED TORSTEN RUDOLF","1000000","1081119"
"1016","85004219","幣吐幣有限公司","嘉義市西區車店里蘭州一街70號5樓之2","李木聰","50000","1081119"
