"序號","統一編號","公司名稱","公司所在地","代表人","資本額","核准設立日期"
"2660","85078915","正大地產有限公司","桃園市楊梅區楊明里新農街407號1樓","楊睿凡","500000","1081115"
"2661","85078921","金富宥不動產有限公司","桃園市桃園區同德里中正路1087號1樓","梁志名","2000000","1081115"
"2662","85078936","銆崴爾富有限公司","桃園市龜山區文青里文青路167號三樓之7","張桂綿","300000","1081115"
"2663","85078942","方圓景觀設計有限公司","桃園市八德區新興路342巷62弄3號","劉鎮源","1000000","1081115"
"2664","85078957","源動能國際有限公司","桃園市中壢區環中東路2段518號3樓","徐行健","100000","1081115"
"2665","85078963","元貿食品有限公司","桃園市桃園區文昌里民權路71巷22號","邱德杰","300000","1081115"
"2666","85078984","宇奕企業有限公司","桃園市大溪區仁和里仁和二街198巷15號","葉日春","500000","1081118"
"2667","85078990","鹿鈴建設有限公司","桃園市龜山區文化二路34巷14弄18號7樓之1","周家安","5000000","1081118"
"2668","85079007","雙鎰有限公司","桃園市桃園區龍山里1鄰龍壽街213巷12之17號(一樓)","黃秋月","200000","1081118"
"2669","85079013","信禾生物科技有限公司","桃園市桃園區中正路1071號18樓之8","鮑美玲","200000","1081119"
"2670","85079029","豐興製餡有限公司","桃園市新屋區頭洲里高洲路68巷106號","劉建宏","1000000","1081118"
"2671","85079034","柰斯貿易有限公司","桃園市蘆竹區大興十四街34巷6號","鍾鎮遠","500000","1081118"
"2672","85079040","瑪啡眼鏡有限公司","桃園市楊梅區新榮里新榮路161號(1樓)","左克強","660000","1081118"
"2673","85079055","佳澄清潔有限公司","桃園市楊梅區高榮里快速路五段899巷3號(1樓)","羅宣文","100000","1081118"
"2674","85079061","凱鵬實業股份有限公司","桃園市蘆竹區錦中里南崁路一段83號18號之4","陳信廷","1000000","1081118"
"2675","85079077","仟頴實業股份有限公司","桃園市中壢區月眉里環保路552巷95號(1樓)","陳詩雨","500000","1081118"
"2676","85079082","定桐有限公司","桃園市桃園區藝文一街86之6號17樓","吳承瑩","1000000","1081118"
"2677","85079098","坤厚有限公司","桃園市中壢區中建里延平路500號10樓之3","顧淑梅","1000000","1081118"
"2678","85079111","蓮溪不動產仲介有限公司","桃園市桃園區龍壽里龍城一街77號1樓","葉禎祥","1000000","1081119"
"2679","85079127","緯奕環保有限公司","桃園市八德區大湳里和平路991巷58弄70衖1號5樓","黃育恒","200000","1081119"
"2680","85079132","宏基實業有限公司","桃園市桃園區寶安里中埔一街316號(4樓)","邱國竣","3000000","1081119"
"2681","85079148","庠奕有限公司","桃園市桃園區永安北路369號（2樓）","柯崇德","500000","1081119"
"2682","85079153","福樂天事業有限公司","桃園市中壢區元化路224號12樓","邱文生","400000","1081119"
"2683","85079169","富鴻精密有限公司","桃園市龜山區萬壽路1段1302之2號","張智富","1250000","1081119"
"2684","85079175","中華商務股份有限公司","桃園市平鎮區廣達里廣西路4巷41弄13號(1樓)","徐蓓蕾","50000","1081119"
"2685","85079180","承格投資有限公司","桃園市桃園區中原路21之1號2樓","郭秉承","1000000","1081119"
"2686","85079196","益豪實業有限公司","桃園市桃園區莊敬路1段210巷15號15樓","林秀娟","2000000","1081119"
"2687","85079219","宏源精密有限公司","桃園市桃園區會稽里大有路569號13樓之2","陳郁宏","1000000","1081119"
"2688","85079225","福昱投資有限公司","桃園市桃園區莊敬路一段342之5號13樓之1","賴富敏","2000000","1081119"
"2689","85079230","我適文創股份有限公司","桃園市龍潭區烏林里中豐路533巷72號","李執鐸","2000000","1081120"
"2690","85079246","宸祺有限公司","桃園市平鎮區雙連里民族路雙連二段9號","蘇聖程","500000","1081119"
"2691","85079267","摩西農科有限公司","桃園市中壢區永福里西園路60巷10號","趙志秦","2937461","1081119"
"2692","85079273","匯旺興科技有限公司","桃園市復興區羅福里羅福151之5號","王興祥","2000000","1081119"
"2693","85079288","阿里玉有限公司","桃園市龜山區文興路9號","李燦明","6000000","1081119"
"2694","85079294","鉅宏環保科技有限公司","桃園市觀音區莊敬路226號","林泓良","5000000","1081119"
"2695","85079301","英花不動產有限公司","桃園市大溪區仁武里介壽路867號(1樓)","蕭英花","550000","1081119"
"2696","85079317","兆利投資有限公司","桃園市楊梅區四維里永美路371巷22號10樓","傅振禮","5000000","1081119"
"2697","85079323","齊豐不動產有限公司","桃園市桃園區汴洲里經國二路89號（1樓）","余建輝","1200000","1081119"
"2698","85079338","太精彩長富投資有限公司","桃園市中壢區中建里延平路500號8樓之2","蕭宇芬","500000","1081119"
"2699","85079344","陞鐽國際有限公司","桃園市大溪區文化路103巷10弄4號","宋建昇","2000000","1081119"
"2700","85079359","聚合勝國際貿易有限公司","桃園市大園區海口里海沙路13號（1樓）","楊勝杰","3000000","1081119"
"2701","85079365","永潤國際投資有限公司","桃園市桃園區中原路21之1號2樓","林麗琬","1000000","1081119"
"2702","85079371","景盛投資控股股份有限公司","桃園市中壢區青峰路1段65號13樓","簡湧杰","25000000","1081120"
"2703","85079386","龍駿機械工業有限公司","桃園市蘆竹區上興里13鄰大興一街152號12樓","鄭昱瑋","1000000","1081120"
"2704","85079392","家和國際投資股份有限公司","桃園市平鎮區環南路220號(3樓)","何奕人","2803500","1081120"
"2705","85079409","山珍食品有限公司","桃園市桃園區東埔里大華九街35-1號（1樓）","簡守謙","500000","1081120"
"2706","85079421","圓城有限公司","桃園市中壢區過嶺里松智路179號(1樓)","林建穎","1000000","1081120"
"2707","85079436","絡浧有限公司","桃園市龍潭區建林里民族路278巷89號（1樓）","歐軒慈","1000000","1081120"
"2708","85079442","枝椏設計行銷有限公司","桃園市桃園區寶慶里寶慶路80號(2樓)","江慶昇","500000","1081120"
"2709","85079457","洪通有限公司","桃園市龜山區大湖里文化三路79-1號","呂樹蘭","300000","1081120"
"2710","85079463","翔伸實業有限公司","桃園市桃園區中正路1259號","莊松標","100000","1081120"
"2711","85079479","光寅科技有限公司","桃園市中壢區中建里延平路500號10樓之3","康恒豪","2000000","1081120"
"2712","85079484","鼎欣食品有限公司","桃園市中壢區永福里中福路二段10巷10號","黃俊智","8000000","1081120"
"2713","85079490","展矅精密有限公司","桃園市平鎮區新貴里關爺北路46巷17號（1樓）","蔡定毅","2000000","1081120"
"2714","85079506","鼎玉行銷有限公司","桃園市蘆竹區大華街196巷17號（1樓）","陳湘沂","1000000","1081120"
"2715","85079512","乾聯不動產有限公司","桃園市桃園區莊敬里中正路1436號","胡偉豪","1000000","1081120"
"2716","85079528","裕盟投資有限公司","桃園市中壢區愛國路60巷15弄4號(1樓)","張展裕","2000000","1081120"
"2717","85079549","禾峻有限公司","桃園市楊梅區瑞原里民富路一段366巷36弄3號（1樓）","黃鈺婷","1000000","1081120"
"2718","85079554","川玹科技有限公司","桃園市龜山區新路里中興路301號（2樓）","沈愷芯","1000000","1081121"
"2719","85079560","壹賢交通股份有限公司","桃園市桃園區經國路9號14樓之2","魏伯諭","25000000","1081121"
"2720","85079576","旭昌海國際有限公司","桃園市中壢區內定里內定二十街15巷8號（3樓）","林于婷","1500000","1081121"
"2721","85079581","伊多儷有限公司","桃園市平鎮區大昌路55巷29號2樓","陳筱如","100000","1081121"
"2722","85079597","朝暘木箱有限公司","桃園市八德區興仁里豐德一路13號7樓","郭哲瑋","1000000","1081121"
"2723","85079604","永滐投資有限公司","桃園市平鎮區長沙街92巷12弄5號","江宏祥","1100000","1081121"
"2724","85079626","鼎欣天然氣工程有限公司","桃園市桃園區寶山里大興路205號8樓","莊泳沐","5000000","1081121"
"2725","85079631","旭懿專業營造股份有限公司","桃園市桃園區三民路三段28之1號四樓之1","蔡小君","8600000","1081121"
"2726","85079647","眾佑電化科技有限公司","桃園市龍潭區中山里北龍路262巷3號（1樓）","陳詠年","1000000","1081121"
"2727","85079652","全球貽貝粘蛋白生技有限公司","桃園市中壢區中北路二段26號3樓","彭郁菁","1000000","1081121"
"2728","85079668","橡銓科技股份有限公司","桃園市大園區橫峰里高鐵北路二段182號2樓","張豊杰","3000000","1081121"
"2729","85079674","卡斯沃企業有限公司","桃園市平鎮區湧光里南豐路133巷9號(1樓)","陳志豪","50000","1081121"
"2730","85079689","進發水電有限公司","桃園市桃園區南埔里大興西路二段235巷33號4樓","劉時評","10000","1081121"
"2731","85079695","宜霖建設股份有限公司","桃園市中壢區石頭里中正路82號7樓之1","林文馨","10000000","1081121"
"2732","85079702","楷歆有限公司","桃園市桃園區育樂街41號(1樓)","李小鳳","250000","1081122"
"2733","85079718","晶準智慧股份有限公司","桃園市桃園區經國路336巷72號12樓","駱明凌","1000000","1081121"
"2734","85079724","祥新事業股份有限公司","桃園市八德區中興街14號7樓之2","","1080000","1081121"
"2735","85079739","宏寀股份有限公司","桃園市中壢區環北路348號4樓之2","劉康仁","15000000","1081121"
"2736","85079745","能速科技股份有限公司","桃園市龜山區南上里民生北路一段2巷4弄3號(1樓)","陳威廷","5000000","1081121"
"2737","85079750","日日拖吊有限公司","桃園市桃園區汴洲里水汴一路129號","許勝凱","3000000","1081121"
"2738","85079766","墨思意象有限公司","桃園市蘆竹區忠孝西路39號3樓","蔡孟萱","120000","1081121"
"2739","85079772","久毓有限公司","桃園市桃園區中山東路76號","廖悅君","60000","1081121"
"2740","85079787","喜翻國際貿易有限公司","桃園市桃園區南平路181巷25號","楊宜潔","1000000","1081122"
"2741","85079793","陞釩科技有限公司","臺南市永康區五王里五福街162號1樓","楊世名","1010000","1081120"
"2742","85079800","優利國際投資股份有限公司","臺南市永康區東橋里中正路261號1樓","戴良政","20000000","1081120"
"2743","85079816","天鷹建材有限公司","臺南市關廟區農會路42號","張旭良","50000","1081120"
"2744","85079822","彼向室內設計有限公司","臺南市東區崇文里崇善路706號1樓","楊杰叡","300000","1081121"
"2745","85079837","台南仁德秀泰影城股份有限公司","臺南市仁德區仁愛里大同路三段759號2樓","廖偉翔","5000000","1081121"
"2746","85079843","高有國際有限公司","臺南市六甲區甲南里民生街18號1樓","顏郁芸","500000","1081121"
"2747","85079858","豐榮泰有限公司","臺南市新市區新和里永福街16巷88弄9號1樓","林義勝","50000","1081121"
"2748","85079864","嚐慢活無添加有限公司","臺南市下營區仁里里工業街2巷15號1樓","黃秋慈","88000","1081121"
"2749","85079870","敦玉科技有限公司","臺南市永康區塩州里塩行路239-10號2樓","李清瑞","1000000","1081122"
"2750","85079885","全亞國際貿易有限公司","臺南市永康區三合里中華二路80號1樓","盧米珍","1000000","1081121"
"2751","85079891","安兆投資股份有限公司","臺南市東區崇信里崇學路142巷10弄7號1樓","金淑鈴","3000000","1081122"
"2752","85079914","晨合科技有限公司","臺南市永康區塩行里中正北路78號1樓","林岑俞","1000000","1081121"
"2753","85079920","同利精密有限公司","臺南市善化區文昌里永福路90巷14號1樓","郭怡君","1000000","1081121"
"2754","85079935","瑞曦能源有限公司","臺南市北區開元路９２號二樓","陳志明","100000","1081122"
"2755","85079941","紘潤資產管理顧問有限公司","臺南市東區東門路三段31號6樓","洪瑞斌","100000","1081122"
"2756","85079956","長宇股份有限公司","臺南市新市區大營里大營126-36號1樓","陳秋燕","20000000","1081118"
"2757","85079962","名榮投資股份有限公司","臺南市東區泉南里長榮路一段89號15樓","羅婉禎","3000000","1081122"
"2758","85079978","利森國際室內裝修有限公司","臺南市北區文成五街233號1樓","廖國權","1000000","1081122"
"2759","85079999","小黑橋國際企業有限公司","臺南市南區健康路一段391巷9號1樓","郭乃華","2000000","1081122"
"2760","85080026","勤恩管理顧問股份有限公司","臺南市安平區永華路二段248號16樓之3","羅偉哲","1000000","1081122"
"2761","85080047","潤海欣業有限公司","臺南市中西區金華路三段230號3樓之1","黃子溱","1000000","1081125"
"2762","85080052","行健生醫股份有限公司","臺南市安平區永華七街17號1樓","周鼎茂","22500000","1081122"
"2763","85080068","佳祿投資股份有限公司","臺南市東區泉南里長榮路一段93號15樓","羅基豪","3000000","1081122"
"2764","85080074","宜仁投資有限公司","臺南市東區和平里文化路118號7樓","葉展宜","18000000","1081125"
"2765","85080089","成訊通訊有限公司","臺南市東區成大里北門路一段276號1樓","葉威霖","10000000","1081125"
"2766","85080095","螢希工程有限公司","臺南市北區北成路510號11樓之5","邱聖維","200000","1081122"
"2767","85080102","摩根數位科技有限公司","臺南市北區前鋒路293號9樓之2","林穎祺","100000","1081122"
"2768","85080118","立妍生技有限公司","臺南市永康區勝學路286號","鄭意樺","1000000","1081125"
"2769","85080124","廣龍機械有限公司","臺南市新市區大營里豐榮43之64號1樓","蔡龍昇","150000","1081126"
"2770","85080139","皇壁建設有限公司","臺南市新市區新和里銘傳街103巷1號1樓","陳明興","5000000","1081126"
"2771","85080145","舜英企業有限公司","臺南市東區東興路276號4樓之1","姜丁引","1000000","1081125"
"2772","85080150","鴻潤國際有限公司","臺南市東區東門路二段297號13樓","曾郁翔","100000","1081125"
"2773","85080166","來喝湯國際有限公司","臺南市南區中華南路二段400巷4弄22號3樓","吳哲彰","200000","1081125"
"2774","85080172","乾品帝室內設計有限公司","臺南市鹽水區福得里康樂路149號1樓","蔡振義","16800","1081126"
"2775","85080187","林芝有限公司","臺南市東區裕孝路３３６號1樓","王曉玲","500000","1081125"
"2776","85080193","君幸食食品有限公司","臺南市東區自強里東門路三段１３號九樓","姚忻宏","3000000","1081126"
"2777","85080200","力丞有限公司","臺南市東區富強里裕農路448-2號1樓","簡廷良","4005000","1081125"
"2778","85080216","耀設計品牌形象有限公司","臺南市南區田寮里夏林路310巷18號1樓","陳一銘","200000","1081125"
"2779","85080222","蒂寶生醫有限公司","臺南市安南區安順里開安五街16號1樓","林柏漢","1000000","1081126"
"2780","85080243","享安心有限公司","臺南市善化區光文里大成里316巷9號1樓","王偉呈","300000","1081128"
"2781","85080258","鳳栖梧有限公司","臺南市永康區東橋七路199號16樓之8","史魯萍","1500000","1081126"
"2782","85080264","長興石英科技有限公司","臺南市東區崇孝里崇明路266巷1號7樓之2","陳子恒","500000","1081127"
"2783","85080270","強鈞企業有限公司","臺南市北區公園里公園南路65號12樓","王志強","1000000","1081126"
"2784","85080285","同人文教有限公司","臺南市東區小東里東安路276號3樓","鄭雅云","700000","1081126"
"2785","85080291","凱騰投資有限公司","臺南市安南區總安街1段９０巷17弄10號1樓","陳宜龍","2000000","1081126"
"2786","85080308","凱婕投資有限公司","臺南市安南區總安街一段90巷17弄10號1樓","吳淑貞","1000000","1081128"
"2787","85080314","育勝不動產開發股份有限公司","臺南市永康區中山南路1042號8樓之2","林振祥","20000000","1081127"
"2788","85080320","光速動力有限公司","臺南市中西區淺草里中正路182號1樓","陳世昌","2000000","1081127"
"2789","85080335","沉睡的綿羊有限公司","臺南市安南區溪心里本原街二段106巷36弄20號1樓","王奕爲","250000","1081127"
"2790","85080356","利澄貿易有限公司","臺南市永康區中興里中山東路350巷12號1樓","林惠如","500000","1081128"
"2791","85080362","捷鋅實業有限公司","臺南市仁德區仁義里正義二街62號2樓","陳彥竹","2000000","1081127"
"2792","85080378","蒂蓓創意有限公司","臺南市安南區安順里開安五街18號1樓","林伊庭","200000","1081128"
"2793","85080383","台灣樂夫特家居有限公司","臺南市東區東門路三段312號1樓","高志毅","800000","1081127"
"2794","85080399","泰鑫系統工程有限公司","臺南市北區大和里文賢路799巷57弄37號1樓","胡吉順","200000","1081128"
"2795","85080412","俊辰有限公司","臺南市北區東興里小東路297-2號1樓","陳宗澤","1000000","1081128"
"2796","85080428","鼎臻開發建設有限公司","臺南市南區竹溪里體育路21巷7號","莊媛婷","5000000","1081128"
"2797","85080433","禾意開發有限公司","臺南市中西區赤嵌里公園路101號","洪少羽","3500000","1081128"
"2798","85080449","全宸建設有限公司","臺南市安南區州南里安和路四段533巷65弄60號1樓","林建勳","3500000","1081129"
"2799","85080454","弘錩工業科技股份有限公司","臺南市永康區永明里中山北路264巷11弄22號1樓","林惠珍","25000000","1081129"
"2800","85080460","國際制動來令有限公司","臺南市永康區三民里和平東路21巷7號1樓","黃俊誠","500000","1081129"
"2801","85080665","金翔榮國際有限公司","臺中市南屯區文山里向上路五段12號17樓之7","黃建順","5000000","1081031"
"2802","85080671","仕援有限公司","臺中市西屯區市政北一路359號6樓","陳姿君","100000","1081031"
"2803","85080686","侑進科技有限公司","臺中市神岡區社南里社南街200號1樓","魏進榮","1000000","1081031"
"2804","85080715","順得實業股份有限公司","臺中市太平區豐年里大源十四街17號3樓","許煙棟","2400000","1081031"
"2805","85080721","皇品軒食品有限公司","臺中市豐原區文昌街95巷15之2號1樓","羅永欣","1000000","1081031"
"2806","85080736","韻臻科技有限公司","臺中市北區忠明五街33號1樓","鍾有能","500000","1081031"
"2807","85080742","亨飛網路購物商城有限公司","臺中市西屯區市政北七路186號21樓之7","陳冠誠","100000","1081031"
"2808","85080790","永千鑫精密科技有限公司","臺中市大甲區武陵里文曲路316巷9號","李燕焙","200000","1081031"
"2809","85080834","佳和藥業生技有限公司","臺中市南區忠明南路758號1樓","白英梅","3000000","1081031"
"2810","85080840","祥陞有限公司","臺中市西屯區何厝里何厝東二街23號8樓之5","劉芸蓁","50000","1081031"
"2811","85080855","進北國際貿易有限公司","臺中市北區三民路三段217號6樓之12","屈少玲","6000000","1081031"
"2812","85080861","旭邦工程顧問有限公司","臺中市南區美村路二段392號2樓","鄭丞鈞","300000","1081031"
"2813","85080877","歐姆企業有限公司","臺中市潭子區嘉仁里福潭路601號","曾美慈","50000","1081031"
"2814","85080882","啟宇工程顧問股份有限公司","臺中市北屯區三光北二街60號2樓","黃添坤","5000000","1081031"
"2815","85080898","保羅協力資本股份有限公司","臺中市北區錦洲里進化路428號2樓","張則義","1000000","1081031"
"2816","85080911","沃格琳實業有限公司","臺中市西區民龍里臺灣大道二段285號8樓之3","廖志嘉","500000","1081031"
"2817","85080927","承宏國際企業有限公司","臺中市西屯區潮洋里市政北二路282號21樓之11","葉厚麟","50000","1081031"
"2818","85080932","永欣展有限公司","臺中市豐原區大湳里源豐路172之3號","施澤民","3000000","1081031"
"2819","85080948","同興國際企業有限公司","臺中市太平區中平里太平十二街23號1樓","林雅蘭","500000","1081031"
"2820","85080953","萬事如意租賃有限公司","臺中市南屯區永定里南屯路二段870巷63號10樓之1","李淑珠","5000000","1081031"
"2821","85080975","鈁象數位行銷顧問有限公司","臺中市南屯區文心路一段218號23樓之1","吳樺建","100000","1081101"
"2822","85080980","欣岳有限公司","臺中市大里區新里里愛心路159巷33號","曾俊偉","500000","1081101"
"2823","85080996","得利國際興業有限公司","臺中市北區淡溝里博館一街6號3樓之1","楊陳俞利","200000","1081101"
"2824","85081003","順光工程有限公司","臺中市南屯區惠中里文心路一段324號11樓之1","陳秀鳳","300000","1081101"
"2825","85081019","華威能源有限公司","臺中市大里區永隆里永隆九街63號","李莉蓉","500000","1081101"
"2826","85081030","恆東昌戶外用品有限公司","臺中市大甲區中山里甲后路五段335巷39號1樓","湯和蓉","300000","1081101"
"2827","85081046","松德租賃有限公司","臺中市大里區公園街421巷52號14樓之6","張世昕","10000000","1081101"
"2828","85081051","做茶菜有限公司","臺中市西區美村路一段149巷10號","劉立華","500000","1081101"
"2829","85081067","沐作創藝有限公司","臺中市西屯區逢甲里9鄰上石北二巷13號6樓之1","楊雅琪","200000","1081101"
"2830","85081073","凱家達有限公司","臺中市北屯區軍功里軍福十八路195巷5號1樓","廖凱萱","18000000","1081101"
"2831","85081088","芳冠國際貿易有限公司","臺中市南區永興里工學一街197巷23號1樓","林暐倫","200000","1081101"
"2832","85081094","佳晨科技有限公司","臺中市大雅區四德里中清路三段990號1樓","枋立瑋","1000000","1081101"
"2833","85081101","豐東禮儀有限公司","臺中市太平區新高里立德街31號1樓","黃淵琛","500000","1081101"
"2834","85081117","青澄顧問有限公司","臺中市潭子區福仁里新興路一段82巷12弄20號1樓","黃麗蘭","100000","1081101"
"2835","85081123","艾果生活事業有限公司","臺中市南區永興里美村南路193號3樓","余秉翰","1000000","1081101"
"2836","85081144","瑞澄企業有限公司","臺中市北屯區太原路三段137號","孫英哲","100000","1081101"
"2837","85081159","植卜力生物科技股份有限公司","臺中市太平區鵬儀路320巷3弄1號2樓","陳明進","10000000","1081023"
"2838","85081165","美森鞋業有限公司","臺中市東區東光園路286號1樓","楊俊傑","1000000","1081101"
"2839","85081171","大倉國際股份有限公司","臺中市西區臺灣大道二段285號22樓之2","林琨泰","8000000","1081101"
"2840","85081186","騰翊科技有限公司","臺中市西屯區市政北二路282號8樓之6","王志剛","1000000","1081101"
"2841","85081192","天睦先端科技有限公司","臺中市西屯區潮洋里朝貴路250號1樓","陳佳蕙","5000000","1081104"
"2842","85081209","森森院室內裝修設計有限公司","臺中市大肚區王田里興和路228巷15號","陳嘉沂","2500000","1081104"
"2843","85081215","昕裕有限公司","臺中市西屯區河南路三段131號7樓之13","黃千碩","1000000","1081104"
"2844","85081221","全鑄所室內裝修有限公司","臺中市北區梅川西路三段39巷18號2樓之9","黃彥一","2000000","1081104"
"2845","85081236","尚雲雄泰國際有限公司","臺中市南屯區大墩五街285號1樓","熊元驥","5000000","1081104"
"2846","85081242","彩藝國際設計工程有限公司","臺中市北屯區中平路1151號3樓","鍾文興","1000000","1081104"
"2847","85081257","昶泰工程有限公司","臺中市西屯區何厝里何厝東二街23號9樓之3","洪慶源","100000","1081104"
"2848","85081263","惠智建設股份有限公司","臺中市南區忠明南路758號11樓","陳建華","25000000","1081104"
"2849","85081284","振詠開發股份有限公司","臺中市豐原區圓環東路86號3樓","陳俊吉","5800000","1081104"
"2850","85081290","亦德開發有限公司","臺中市清水區菁埔里中央北路3之61號1樓","洪文川","16000000","1081104"
"2851","85081329","嘉鈺投資股份有限公司","臺中市南區忠明南路789號13樓之1","李鈺堂","3700000","1081105"
"2852","85081334","佰清工程有限公司","臺中市中區綠川里綠川西街135號12樓之1","邱茂清","500000","1081104"
"2853","85081340","尚綖堂有限公司","臺中市西屯區何仁里文心路三段155之1號7樓","陳達民","6000000","1081104"
"2854","85081355","陸遠企業股份有限公司","臺中市西屯區長安路二段71巷9弄50號6樓之2","陸祐康","1000000","1081104"
"2855","85081361","鴻達機械起重有限公司","臺中市南屯區寶山里向上路五段598之19號","游致瑋","1000000","1081104"
"2856","85081377","鈺淞實業有限公司","臺中市北屯區同榮路260巷32號1樓","楊炳郎","5000000","1081104"
"2857","85081382","麥稷實業有限公司","臺中市東區旱溪街489號1樓","黃一中","3500000","1081104"
"2858","85081405","建味實業有限公司","臺中市東區十甲里旱溪東路一段436號1樓","梁育銜","1000000","1081104"
