"序號","統一編號","公司名稱","公司所在地","代表人","資本額","核准設立日期"
"1633","85040025","億益泰有限公司","雲林縣虎尾鎮平和里大成街229號1樓","謝惠楣","10000000","1081105"
"1634","85040030","俊傑車業有限公司","雲林縣斗南鎮小東里大業路162-1號1樓","陳俊傑","500000","1081105"
"1635","85040046","華山跨境電子商務有限公司","彰化縣秀水鄉金陵村廣西巷36號","蘇品諺","1000000","1081105"
"1636","85040051","麗寶秀泰影城股份有限公司","臺東縣臺東市勝利街216號1樓","廖偉銘","5000000","1081105"
"1637","85040067","慶展清潔有限公司","彰化縣彰化市福山里彰南路1段313號","盧琪昂","10000000","1081105"
"1638","85040073","塞席爾商優力有限公司","新北市土城區大區里承天路4巷2之4號","楊舒惠","29000000","1081105"
"1639","85040088","新加坡商十訊科技股份有限公司","臺北市中山區民生東路一段51號4樓之2","NG CHOON SENG","2000000","1081105"
"1640","85040094","樂舒潔有限公司","雲林縣東勢鄉龍潭村仁愛路27巷1號1樓","黃珮瑜","500000","1081106"
"1641","85040101","饗富國際有限公司","南投縣竹山鎮山崇里山崇巷28之1號","賴昇頤","1000000","1081106"
"1642","85040117","藏富開發有限公司","南投縣南投市平山里彰南路二段739巷1號1樓","李翎毓","600000","1081106"
"1643","85040123","六易科技有限公司","嘉義市西區福民里世賢路三段363號2樓","蔡宜蓁","500100","1081106"
"1644","85040138","新善能源開發有限公司","屏東縣長治鄉中興路560之3號","潘玉美","1000000","1081106"
"1645","85040144","香港商移動摩卡有限公司","臺北市松山區八德路四段678號7樓","林澤堯","20000","1081106"
"1646","85040159","齊星科技有限公司","嘉義縣中埔鄉和美村7鄰仁義路196號(1樓)","劉文靜","5000000","1081106"
"1647","85040165","集寶車業有限公司","南投縣集集鎮八張里民生路14-2號","陳兪安","1000000","1081106"
"1648","85040171","群威精密有限公司","新竹市北區康樂里東大路三段305之21號1樓","侯可倫","500000","1081106"
"1649","85040186","晟鋐五金有限公司","彰化縣福興鄉鎮平村鎮平街21-16號1樓","梁漢鐘","1500000","1081106"
"1650","85040192","晟威建設有限公司","新竹市香山區朝山里中華路五段420巷215號1樓","張嘉珍","3000000","1081106"
"1651","85040209","威塑工業有限公司","彰化縣秀水鄉陝西村下厝巷臨71-16號","張哲瑋","300000","1081106"
"1652","85040215","晉揚健康科技有限公司","新竹縣竹北市竹北里博愛街513號5樓之5","呂沐勲","150000","1081106"
"1653","85040221","寵爺生物科技股份有限公司","宜蘭縣冬山鄉清溝村15鄰光明路48號","蔡一銘","1000000","1081106"
"1654","85040236","勤宏環保有限公司","苗栗縣後龍鎮南港里1鄰南勢山2號1樓","高誌宏","1000000","1081106"
"1655","85040242","山裕建設有限公司","臺東縣臺東市光明里中興路2段450巷28弄23號二樓","吳杉山","1100000","1081106"
"1656","85040257","龍申營造有限公司","南投縣國姓鄉石門村成功街57巷14號1樓","余進佳","5200000","1081106"
"1657","85040263","承御建設股份有限公司","嘉義縣新港鄉大潭村大潭10之16號","劉武龍","2100000","1081106"
"1658","85040279","鍚鋊製銅股份有限公司","彰化縣彰化市磚磘里線東路一段638-6號","陳建宏","10000000","1081106"
"1659","85040284","豊潤有限公司","新竹縣湖口鄉勝利村勝利路二段116號","陳雪梅","300000","1081106"
"1660","85040290","滙泉科技有限公司","新竹市東區建功里金城一路81號11樓-3","鄧台芬","100000","1081106"
"1661","85040307","佑典文化傳媒有限公司","彰化縣溪州鄉舊眉村溪斗路建177號","邢聖謙","1000000","1081106"
"1662","85040313","鴻隼環保科技有限公司","彰化縣二林鎮華崙里挖子路3-3號","邱厚任","5000000","1081106"
"1663","85040329","恆安不動產有限公司","宜蘭縣礁溪鄉吳沙村礁溪路一段321號2樓","伍冠宇","500000","1081106"
"1664","85040334","東浲有限公司","屏東縣內埔鄉東寧村自強路146巷4號","曾鋧棠","4000000","1081106"
"1665","85040340","好房東租賃住宅服務有限公司","苗栗縣造橋鄉大西村大西二街176號1樓","陳青宜","1000000","1081106"
"1666","85040355","台灣江豐電子材料股份有限公司","新竹市香山區牛埔南路374巷8號","姚力軍","15000000","1081106"
"1667","85040361","源綠科技股份有限公司","新竹市東區光明里光復路二段101號","張平","200000","1081106"
"1668","85040377","銳翰有限公司","南投縣南投市光榮東路68巷64號二樓","周宗翰","200000","1081106"
"1669","85040382","邦迪資訊顧問服務有限公司","新竹市北區經國路二段100號8樓","陳鋐菖","100000","1081106"
"1670","85040398","祥順園藝有限公司","彰化縣彰化市中庄里台化街2-4號1樓","楊憲明","1000000","1081106"
"1671","85040405","有慶建設有限公司","苗栗縣後龍鎮豐富里7鄰新東路76號1樓","涂舜吉","3000000","1081106"
"1672","85040411","仲家租賃住宅包租代管有限公司","基隆市中正區正榮街77巷48號","林俊彥","200000","1081106"
"1673","85040427","新安能源開發有限公司","屏東縣長治鄉中興路560之3號","潘玉美","1000000","1081107"
"1674","85040432","健盈實業股份有限公司","彰化縣彰化市阿夷里21鄰泰和中街77號1樓","陳健嘉","1680000","1081107"
"1675","85040448","霖曄貿易有限公司","彰化縣彰化市忠權里辭修路128巷24弄31號","劉建男","10500000","1081107"
"1676","85040453","佳佶科技有限公司","新竹市東區埔頂里慈雲路118號15樓之8","盧冠宇","1000000","1081107"
"1677","85040469","地勢坤規劃有限公司","雲林縣大埤鄉三結村中埤16-3號","林碧夏","1000000","1081107"
"1678","85040475","和歌股份有限公司","新竹縣竹北市復興三路二段168號六樓之1","佐藤弘康","5000000","1081107"
"1679","85040480","福陽國際有限公司","新竹縣新埔鎮旱坑里上樟路一段309號一樓","邱春福","200000","1081107"
"1680","85040496","大檸檬有限公司","雲林縣斗六市成功里五權街38號1樓","張碧珍","500000","1081107"
"1681","85040502","拉美國際物流股份有限公司","臺北市松山區南京東路5段48號3樓之1","鄭達臨","10000000","1081113"
"1682","85040518","天農糧倉生技股份有限公司","臺北市大安區忠孝東路4段221號12樓","王冕","100000","1081113"
"1683","85040524","富鏘汽車有限公司","臺北市中正區重慶南路1段10號8樓之15","WONG VICTORIA MING KWAN","1000000","1081113"
"1684","85040539","圓禾股份有限公司","臺北市中正區中華路2段149-1號4樓","黃馨卉","5000000","1081114"
"1685","85040545","羽上娛樂有限公司","臺北市信義區莊敬路302號","王上銘","200000","1081114"
"1686","85040566","世昇實業有限公司","臺北市松山區南京東路5段212號4樓之3","陳壽美","100000","1081114"
"1687","85040572","港博商業顧問有限公司","臺北市信義區基隆路1段163號18樓之2","Gabriel Gavin Lindsay","500000","1081114"
"1688","85040587","菁蓮有限公司","臺北市大同區錦西街38巷34號1樓","黃美菁","1000000","1081114"
"1689","85040593","奇岩體育工程有限公司","臺北市南港區忠孝東路7段512號1樓","廖政琦","500000","1081114"
"1690","85040600","金達商業有限公司","臺北市中山區長安東路2段52號樓之3","劉信昌","5000000","1081114"
"1691","85040616","柯霏時尚美學有限公司","臺北市士林區承德路4段126號6樓","吳威憲","500000","1081114"
"1692","85040637","窩邊草整體顧問有限公司","臺北市信義區忠孝東路5段1-2號11樓","陳依萱","300000","1081114"
"1693","85040658","明青健康產業鏈有限公司","臺北市南港區成福路131號","洪金灼","100000","1081114"
"1694","85040664","信毅實業有限公司","臺北市北投區立功街112號5樓之1","童宜珊","1000000","1081114"
"1695","85040670","赫泰廣告行銷有限公司","臺北市大安區忠孝東路4段221號12樓","陳宏濬","5000000","1081114"
"1696","85040685","八八手有限公司","臺北市北投區振興街11號","李玲維","600000","1081115"
"1697","85040691","築衡室內裝修有限公司","臺北市信義區松隆路78號1樓","顏鈞翰","300000","1081115"
"1698","85040708","珂鑫有限公司","臺北市中正區忠孝西路1段72號2樓之1","李曼綾","10000","1081114"
"1699","85040714","威創材料有限公司","臺北市萬華區康定路46之3號1樓","古素香","2000000","1081114"
"1700","85040720","澤雅商貿有限公司","臺北市大安區忠孝東路4段221號10樓","王姵文","200000","1081115"
"1701","85040735","華苒能源股份有限公司","臺北市士林區福港街210巷17弄2號4樓","吳厚昌","1000000","1081115"
"1702","85040756","直達科技有限公司","臺北市信義區虎林街239號","張錦秀","3000000","1081114"
"1703","85040762","壢新醫院管理顧問股份有限公司","臺北市中正區忠孝西路1段72號2樓之1","張煥禎","100000","1081114"
"1704","85040778","易瓏資產管理整合服務有限公司","臺北市大安區忠孝東路4段169號11樓之4","吳台秀","200000","1081114"
"1705","85040783","安倫科技股份有限公司","臺北市大安區忠孝東路3段303號3樓之9","張渠堂","5000000","1081114"
"1706","85040799","約瑟智慧股份有限公司","臺北市中正區羅斯福路2段7-3號5樓","郭統民","1000000","1081115"
"1707","85040806","力安能源服務股份有限公司","臺北市中山區吉林路99號3樓","郭濟安","2000000","1081114"
"1708","85040812","力達綜合能源股份有限公司","臺北市中山區吉林路99號3樓","郭濟安","2000000","1081114"
"1709","85040828","曼巴租賃有限公司","臺北市大安區敦化南路1段225號地下三層之17","陳國勇","5000000","1081114"
"1710","85040833","津園股份有限公司","臺北市文山區老泉街13號","江元皓","1000000","1081115"
"1711","85040849","楊氏發展投資有限公司","臺北市南港區忠孝東路6段285號12樓","楊立帆","20000000","1081114"
"1712","85040854","爍亮科技有限公司","臺北市松山區長春路343號地下一樓","DREYER RACHEL LOUISE","600000","1081114"
"1713","85040876","荷蒲品牌顧問有限公司","臺北市中正區林森南路2號2樓之5","胡禦之","200000","1081114"
"1714","85040881","文暘時尚國際有限公司","臺北市中山區農安街43號7樓之2","童文裕","100000","1081115"
"1715","85040897","雪可有限公司","臺北市大安區嘉興街363巷15之1號","張哲豪","500000","1081114"
"1716","85040904","信實企業有限公司","臺北市中正區八德路1段46號9樓","劉雅如","600000","1081114"
"1717","85040910","建成先進工程有限公司","臺北市大安區嘉興街363巷15之1號","周傳文","1000000","1081114"
"1718","85040926","盛紀有限公司","臺北市大同區長安西路78巷4弄9號1樓","陳言維","8000000","1081114"
"1719","85040931","達柏優有限公司","臺北市信義區忠孝東路5段372巷27弄3號1樓","吳漢倫","1000000","1081114"
"1720","85040947","唐威開發有限公司","臺北市信義區忠孝東路5段372巷27弄3號1樓","孫愛芝","1000000","1081114"
"1721","85040952","佳言國際有限公司","臺北市文山區羅斯福路6段146號7樓之2","張祐禎","200000","1081115"
"1722","85040968","璟軒有限公司","臺北市中山區復興北路48號3樓","郭淑梅","500000","1081115"
"1723","85040974","柏力電子有限公司","臺北市大安區忠孝東路四段142號3樓之3","董樂宜","5000000","1081115"
"1724","85040989","好迷客股份有限公司","臺北市中正區懷寧街84號","林志松","2000000","1081115"
"1725","85040995","沄海貿易有限公司","臺北市士林區延平北路6段511巷24號2樓","王建舜","1000000","1081115"
"1726","85041018","裕金康有限公司","臺北市中山區松江路293之511號","FUNG CHEUK CHIU","6500000","1081115"
"1727","85041024","立多多有限公司","臺北市大安區光復南路420巷1弄14號","洪晉德","1000000","1081115"
"1728","85041039","回素本美有限公司","臺北市松山區南京東路3段287號2樓","朱杰華","6000000","1081115"
"1729","85041045","千千時裝有限公司","臺北市文山區景福街138號4樓","黃嘉敏","6000000","1081115"
"1730","85041050","山田系統有限公司","臺北市中山區松江路54號11樓","陳偉文","6000000","1081115"
"1731","85041066","金豪潤有限公司","臺北市信義區基隆路1段155號13樓之5","陳佩君","1000000","1081115"
"1732","85041072","淼文國際貿易有限公司","臺北市中山區松江路101號4樓之2","徐靚如","300000","1081115"
"1733","85041087","神榮美有限公司","臺北市大安區忠孝東路4段221號10樓","陳瑞娟","500000","1081115"
"1734","85041093","易必時有限公司","臺北市大同區長安西路287號6樓之9","余潔玲","6000000","1081115"
"1735","85041100","島民創意有限公司","臺北市大同區長安西路287號6樓之9","歐陽玉娥","6000000","1081115"
"1736","85041116","豫青設計有限公司","臺北市大安區基隆路2段136號9樓","簡瑋廷","800000","1081115"
"1737","85041122","哈曼有限公司","臺北市大同區長安西路287號6樓之9","莊春玲","6000000","1081115"
"1738","85041137","羅維亞有限公司","臺北市大同區長安西路287號6樓之9","王傑華","6000000","1081115"
"1739","85041143","康藝商品包裝設計有限公司","臺北市大同區長安西路287號6樓之9","蔡惠娟","6000000","1081115"
"1740","85041158","甘明茶業有限公司","臺北市中山區朱崙街53巷10號1樓","葉育杰","1000000","1081115"
"1741","85041164","佰億科技有限公司","臺北市信義區虎林街202巷44號","曾俊維","100000","1081115"
"1742","85041170","勝安露有限公司","臺北市大同區長安西路287號6樓之9","譚美英","6000000","1081115"
"1743","85041185","禾新普惠金融科技有限公司","臺北市中山區民權東路2段9號12樓之7","陳琮銘","500000","1081115"
"1744","85041191","杜威寧有限公司","臺北市大安區復興南路1段209號4樓","黃秀鳳","5000000","1081115"
"1745","85041208","梵日精品股份有限公司","臺北市內湖區環山路3段16巷5弄1號2樓","何逸中","3050000","1081118"
"1746","85041214","盟約國際有限公司","臺北市大安區濟南路3段30號7樓","鄒筠文","200000","1081115"
"1747","85041220","沐宸室內裝修設計有限公司","臺北市大安區通化街200巷5號","蔡瑾璇","1000000","1081115"
"1748","85041235","晨恩科技有限公司","臺北市中正區新生南路1段14號2樓","林盈君","50000","1081115"
"1749","85041241","水方碩股份有限公司","臺北市大安區仁愛路4段31號10樓之2","吳豐麒","5000000","1081115"
"1750","85041256","華新國際企業有限公司","臺北市士林區承德路4段325號7樓","王新凱","500000","1081115"
"1751","85041262","樂芙茵有限公司","臺北市士林區後港街139號","谷若亞","150000","1081115"
"1752","85041278","西格瑪材料技術股份有限公司","臺北市內湖區民權東路6段123巷34弄23號3樓之6","蔡舜澤","3500000","1081115"
"1753","85041283","亭安事業股份有限公司","臺北市內湖區瑞湖街178巷21號4樓","陳亭","30000000","1081118"
"1754","85041306","泰赫國際服飾有限公司","臺北市松山區八德路4段465號7樓","葉少華","500000","1081115"
"1755","85041312","呈米國際有限公司","臺北市文山區秀明路1段103巷8弄2號","翁守呈","1000000","1081115"
"1756","85041328","泰帕斯國際有限公司","臺北市萬華區漢口街2段89號1樓","楊璽正","100000","1081115"
"1757","85041333","武土台灣股份有限公司","臺北市大安區羅斯福路3段29號6樓","王斌","1000000","1081115"
"1758","85041349","榮昇發展台灣有限公司","臺北市松山區南京東路4段1號2樓","盧偉強","500000","1081115"
"1759","85041354","鯨宇實業有限公司","臺北市信義區忠孝東路5段1-2號11樓","周京美","100000","1081115"
"1760","85041360","炙星股份有限公司","臺北市大安區辛亥路2段157號2樓","張歆浤","700000","1081118"
"1761","85041376","代官山有限公司","臺北市中正區許昌街42之1號10樓","李秋琴","5000","1081115"
"1762","85041381","呈漾有限公司","臺北市信義區基隆路1段159號13樓","葉于幼","100000","1081115"
"1763","85041397","鈜磐股份有限公司","臺北市中山區南京東路2段132號7樓之1","廖子德","5000000","1081115"
"1764","85041404","騰煬科技工程有限公司","臺北市內湖區民權東路6段423巷9弄15-2號","顏吉宏","1000000","1081115"
"1765","85041410","金庸科技有限公司","臺北市大安區光復南路630號3樓","李明鍏","3000000","1081115"
"1766","85041426","萬聯科技有限公司","臺北市信義區基隆路1段396號2樓","劉瑋","5000000","1081115"
"1767","85041431","租租我媒體事業有限公司","臺北市大安區忠孝東路4段59號10樓之2","黃正凱","200000","1081115"
"1768","85041447","友祥控股股份有限公司","臺北市中山區南京東路2段137號14樓","孫文崇","118000000","1081115"
"1769","85041452","築美廣告行銷有限公司","臺北市中正區重慶南路1段99號11樓之2","呂奇諺","510000","1081118"
"1770","85041468","荅礴科技股份有限公司","臺北市南港區忠孝東路6段159巷2弄10號","馬誌宏","1000000","1081118"
"1771","85041495","匯弘國際股份有限公司","臺北市中山區長安東路2段63號5樓之2","陳正宗","1000000","1081118"
"1772","85041517","武議國際股份有限公司","臺北市大安區信義路4段279號6樓之1","陳彥威","100000","1081118"
"1773","85041523","台灣儀器研發服務有限公司","臺北市南港區重陽路459號2樓","黃淑莉","1000000","1081118"
"1774","85041538","實語股份有限公司","臺北市南港區東新街180巷11號地下1層之11","陳孝慈","17700000","1081120"
"1775","85041544","駿奕捷客數位行銷有限公司","臺北市信義區和平東路3段341巷21號1樓","林立毫","2000000","1081118"
"1776","85041559","吉景數位有限公司","臺北市內湖區內湖路1段250號12樓","楊家政","5000000","1081118"
"1777","85041565","侑展資產股份有限公司","臺北市中山區中山北路1段83巷5號5樓之12","徐珍翌","300000","1081118"
"1778","85041571","樂兔子股份有限公司","臺北市大安區忠孝東路4段169號6樓之1","邱銘賢","950000","1081118"
"1779","85041586","波喜惠股份有限公司","臺北市中正區羅斯福路1段102號8樓","蘇柏瑞","1000000","1081118"
"1780","85041592","炮兒實業有限公司","臺北市北投區石牌路2段315巷28弄14號2樓","婁節","100000","1081118"
"1781","85041609","東林國際有限公司","臺北市大同區歸綏街209號3樓之1","陳進國","500000","1081118"
"1782","85041615","美夆實業有限公司","臺北市大安區復興南路2段11-1號3樓","楊健守","100000","1081118"
"1783","85042001","九源肉圓食品有限公司","臺南市新化區大德路15號1樓","莊雅雪","1000000","1081108"
"1784","85042017","三富霖有限公司","臺南市中西區五條港里西門路二段389號8樓","陳乃瑩","300000","1081108"
"1785","85042023","衛華天賜有限公司","臺南市東區崇明里大同路二段671號3樓","邱小殷","6000000","1081111"
"1786","85042038","龍泉能源有限公司","臺南市新營區民權里信義街72巷10號7樓之5","賴榮貴","100000","1081108"
"1787","85042044","科福發網路行銷有限公司","臺南市山上區南洲里130之32號","蔡明輝","100000","1081108"
"1788","85042059","幸義國際事業有限公司","臺南市南區建南里興隆路61號1樓","陳琮元","150000","1081101"
"1789","85042065","順風有限公司","臺南市永康區網寮里永和街260巷26弄12號1樓","郭惠婷","20000","1081112"
"1790","85042086","家冠興科技有限公司","臺南市安平區育平九街192巷37號1樓","陳家福","1000000","1081111"
"1791","85042092","詮上有限公司","臺南市東山區東原里班芝花坑24號1樓","李雨玲","100000","1081112"
"1792","85042109","富德薪不動產有限公司","臺南市永康區勝利里中華一路158號1樓","王薇馨","200000","1081111"
"1793","85042115","眾信能源科技有限公司","臺南市鹽水區岸內里朝琴路167巷30號","簡子竣","800000","1081112"
"1794","85042121","聖鎰投資有限公司","臺南市永康區勝利里勝利街32巷9號1樓","邱建中","100000","1081112"
"1795","85042142","長益長照事業有限公司","臺南市永康區中華路425號4樓之10","林義文","300000","1081111"
"1796","85042157","德盈建設有限公司","臺南市東區裕聖里裕義路686號1樓","謝明賢","2000000","1081112"
"1797","85042163","可裕貿易有限公司","臺南市永康區正強里正義街25號1樓","張晁瑞","200000","1081111"
"1798","85042179","毅佳置業股份有限公司","臺南市中西區民生路二段173巷4號","翁經博","10000000","1081112"
"1799","85042184","光鹽麥子有限公司","臺南市安平區健康三街165巷16號3樓","劉明珠","500000","1081112"
"1800","85042190","仲合醫藥生技股份有限公司","臺南市北區長興里公園北路136巷5號1樓","黃彩清","500000","1081112"
"1801","85042207","協爾電子科技有限公司","臺南市東區裕農路375號7樓之1","王榮笙","100000","1081112"
"1802","85042213","欣曜企業有限公司","臺南市安平區怡平里建平十二街148巷21弄12號1樓","王政芳","500000","1081112"
"1803","85042229","智茂事業有限公司","臺南市安平區育平里群平路１８１號十樓之３５","陳禮雄","1000000","1081112"
"1804","85042234","崇佐有限公司","臺南市南區文南里仁南四街24號1樓","林群堯","1000000","1081112"
"1805","85042240","良冠興業有限公司","臺南市安平區健康一街84號1樓","盧良珍","680000","1081113"
"1806","85042255","富勤國際商務有限公司","臺南市東區裕農里裕農路375號7樓之1","黃朝雍","200000","1081112"
"1807","85042261","小覓秘麵食所有限公司","臺南市南區新昌里西門路一段689巷17號","潘韋如","1001000","1081112"
"1808","85042277","鈺鎮科技有限公司","臺南市新市區新和里信義街15之2號1樓","蘇煌智","2000000","1081113"
"1809","85042282","綠昱建材有限公司","臺南市麻豆區東角里同仁街43號1樓","蔡金葉","1000000","1081114"
"1810","85042298","普立爾精密股份有限公司","臺南市永康區尚頂里中正二街250號","甘明達","1000000","1081113"
"1811","85042305","旺弘精密工業有限公司","臺南市麻豆區麻豆口32之38號","郭品希","2000000","1081114"
"1812","85042311","駿啟科技有限公司","臺南市東區東寧路西段1號1樓","黃健宏","100000","1081114"
"1813","85042327","大造興業有限公司","臺南市中西區淺草里金華路三段230號3樓之1","趙廷釗","200000","1081114"
"1814","85042332","儂儂愛漂亮有限公司","臺南市永康區大灣路836號","謝百泉","900000","1081114"
"1815","85042348","鋐韋有限公司","臺南市北區元寶里北園街8巷9弄10號1樓","金建華","300000","1081114"
"1816","85042353","樂米兒有限公司","臺南市南區新興里西門路一段477號2樓","王信喬","300000","1081114"
"1817","85042369","歐氪星科技有限公司","臺南市中西區永華一街70巷10號7樓之4","林育生","4000000","1081114"
"1818","85042375","特伏能源管理顧問有限公司","臺南市善化區文化路26號2樓之1","翁全賢","200000","1081118"
"1819","85042380","寰海展業有限公司","臺南市善化區文昌里大同路213巷21號1樓","毛淑寰","2000000","1081118"
"1820","85042396","長紘開發股份有限公司","臺南市新市區大營里大營126-38號1樓","陳秋燕","20000000","1081118"
"1821","85042403","慶和全投資股份有限公司","臺南市東區泉南里長榮路一段89號15樓","羅婉寧","3000000","1081114"
"1822","85042419","十晟有限公司","臺南市安南區溪頂里郡安路四段120巷32號1樓","邱惠娟","50000","1081114"
"1823","85042425","士康投資股份有限公司","臺南市東區崇明里大同路二段615號6樓","張明温","3000000","1081114"
"1824","85042430","任彩國際有限公司","臺南市永康區小北路56號1樓","吳建州","1000000","1081115"
"1825","85042446","上禾倫有限公司","臺南市永康區五王里中山東路146號9樓之1","張敏玄","100000","1081115"
"1826","85042467","善傳投資股份有限公司","臺南市東區崇明里大同路二段615號6樓","羅秀玉","3000000","1081115"
"1827","85042473","永康劍橋旅館有限公司","臺南市永康區塩行里新行街128號、128號3樓之1、128號3樓之2、128號4樓之1","林士祥","2000000","1081115"
"1828","85042488","泓駒國際有限公司","臺南市永康區西橋里中華西街６９號一樓","黃瓊妃","1000000","1081115"
"1829","85042494","眾誠資訊股份有限公司","臺南市永康區中華里21鄰中華路12號10樓之4","郭永誠","5000000","1081115"
"1830","85042500","康嘉科技有限公司","臺南市東區東明里東安路30巷10弄26號1樓","王平川","1500000","1081115"
"1831","85042516","水雲川文創有限公司","臺南市永康區崑山里永大路1段65巷62號1樓","徐翰翊","200000","1081118"
"1832","85042522","唐浤營造有限公司","臺南市善化區光文里民權路33巷10號1樓","劉益成","3600000","1081121"
"1833","85042537","祝陽工程有限公司","臺南市南區國宅里金華路二段21巷4-2號3樓","陳彥志","1000000","1081118"
"1834","85042543","日鷹建材有限公司","臺南市關廟區農會路42號","張旭良","51000","1081118"
