"序號","統一編號","公司名稱","公司所在地","代表人","資本額","核准設立日期"
"2442","85088358","岦軸創意有限公司","基隆市七堵區六堵里六堵一街22號","鄒至中","80000","1080813"
"2443","85088364","友晟信企業有限公司","彰化縣彰化市福山里山中街81巷121之1號","張允赫","700000","1080813"
"2444","85088370","威寶數位科技股份有限公司","基隆市七堵區東新街6巷1-2號","李泓儒","1000000","1080813"
"2445","85088385","白杰明文創有限公司","宜蘭縣冬山鄉永清路145巷28號1樓","白杰明 Hurley Benjamin Donald","500000","1080813"
"2446","85088391","圓夢投資股份有限公司","新竹市西大路772號2樓","梁國懋","1000000","1080813"
"2447","85088408","薩摩亞商百星數位智能股份有限公司","新北市汐止區新台五路一段97號18樓之5","張弼華","10000000","1080813"
"2448","85088414","亞立停車事業有限公司","苗栗縣苗栗市北苗里英才路283巷17弄1號1樓","李泰叡","1000000","1080814"
"2449","85088420","隆盛流行事業有限公司","南投縣草屯鎮富寮里富頂路一段122巷43號1樓","李秋菊","500000","1080814"
"2450","85088435","彬偉工業有限公司","宜蘭縣三星鄉尾塹村清洲三路56巷33號","陳云彬","1000000","1080814"
"2451","85088483","艾穎科技股份有限公司","新竹市東區柴橋里瑞麟路68號","高南榮","500000","1080814"
"2452","85088499","美商樂固納自動機械股份有限公司","臺北市內湖區港墘路183號9樓","Stephen Stoppenbrink","0","1080814"
"2453","85088505","博飛特開發管理顧問有限公司","彰化縣彰化市福安里民生南路76號","洪伃亭","500000","1080814"
"2454","85088511","天緣文化有限公司","金門縣金城鎮西門里珠浦北路48號","林玉潔","1000000","1080814"
"2455","85088532","龍圻精密機械有限公司","彰化縣彰化市香山里彰南路二段589巷18號一樓","張祐銘","500000","1080814"
"2456","85088548","岩宏電子有限公司","新竹市香山區埔前路248巷16號1樓","方子健","1000000","1080814"
"2457","85088553","天成環保有限公司","苗栗縣竹南鎮竹南里民權街51巷15號8樓","沈恆生","1000000","1080814"
"2458","85088569","小人物企業有限公司","彰化縣田中鎮北路里新生街150巷20弄18之1號","范明惠","200000","1080814"
"2459","85088603","力信物業公寓大廈管理維護股份有限公司","宜蘭縣宜蘭市中山路三段中央商場53-6號1樓","吳培錚","10000000","1080814"
"2460","85088619","新翊環境有限公司","花蓮縣花蓮市國裕里富裕七街84號1樓","曾庭綸","1200000","1080814"
"2461","85088625","鼎芯生技股份有限公司","彰化縣鹿港鎮復興路71號1樓","蘇琴媖","3000000","1080814"
"2462","85088630","美加人股份有限公司","臺東縣臺東市吉林路一段2巷19號一樓","陳美華","250000","1080814"
"2463","85088646","逐風踏浪戶外休閒活動有限公司","花蓮縣花蓮市明心街1-21號1樓","James Howard Scott","500000","1080814"
"2464","85088651","鑫聯能源有限公司","新竹市東區公園里東大路一段52巷1之1號8樓之7","梁雅惠","50000","1080814"
"2465","85088667","加樂工程有限公司","花蓮縣玉里鎮大禹里酸柑50-1號","王佳玉","1000000","1080814"
"2466","85088673","二林環保有限公司","彰化縣二林鎮南光里自強街32號1樓","洪愷蔚","1000000","1080814"
"2467","85088688","原初娛樂經紀有限公司","彰化縣彰化市龍山里中山路二段874巷2-5號7樓","葉禮豪","50000","1080814"
"2468","85088694","祐晟電子科技有限公司","嘉義縣民雄鄉北斗村北勢子56號之18","賴秀卿","500000","1080814"
"2469","85088701","香港商晶力半導體有限公司","新竹市東區光明里大學路21號","周家輝","2997400","1080815"
"2470","85088723","馬來西西商百科工程有限公司","臺北市文山區木新路二段79巷12弄10號2樓","吳泰成","0","1080815"
"2471","85088738","貝里斯商興碩有限公司","臺北市信義區忠孝東路5段1-1號8樓","黃俊能","0","1080815"
"2472","85088744","韓商全球快樂解決方案股份有限公司","臺北市信義區基隆路1段163號18樓之2","Kim Ju Hee","210000","1080815"
"2473","85088759","香港商高新特殊工程塑料有限公司","臺北市中山區民生東路3段8號7樓、10號7樓","譚沛君","500000","1080815"
"2474","85088765","日商吉田風組股份有限公司","臺北市大同區南京西路41號8樓之8","吉田成樹","5000000","1080815"
"2475","85088771","新加坡商技流創新有限公司","臺北市內湖區內湖路一段516號4樓","孫志強","500000","1080815"
"2476","85088786","美商玩樂時光有限公司","臺北市中山區民生西路3巷9號9樓","LI KEVIN ANSIA","150000","1080815"
"2477","85088792","香港商耀基設計室內裝修有限公司","臺北市中正區中山北路一段2號4樓之2","莊華東","100000","1080815"
"2478","85088809","東毅開發工程有限公司","苗栗縣頭份市田寮里9鄰自強路2段631號1樓","連仁祥","250000","1080815"
"2479","85088815","櫻花空間規劃有限公司","澎湖縣馬公市光復里光復路80號1樓","梁家豪","1000000","1080815"
"2480","85088821","弘鋆建設有限公司","雲林縣虎尾鎮立仁里安興街43號一樓","陳正耀","2000000","1080815"
"2481","85088836","晉康科技有限公司","彰化縣永靖鄉永北村永坡路74號","林金添","3000000","1080815"
"2482","85088842","承廣開發建設有限公司","彰化縣員林市浮圳里員東路一段155號一樓","江榮通","20000000","1080815"
"2483","85088857","首冠國際開發有限公司","彰化縣彰化市南興里中山路一段309號","游素蘋","5000000","1080815"
"2484","85088863","昕廣資訊整合股份有限公司","新竹縣竹北市斗崙里光明九路10-5號9樓","吳祝萍","1000000","1080815"
"2485","85088879","西湖休閒大飯店有限公司","宜蘭縣羅東鎮羅莊里光榮路32號1樓","林文隆","45000000","1080815"
"2486","85088884","屏軒生活館有限公司","屏東縣內埔鄉內田村學人路623號、德美路357號","郭盈利","10000000","1080815"
"2487","85088890","水利方企業有限公司","彰化縣花壇鄉文德村彰員路二段1130巷43號1樓","鄭凱祐","1010000","1080815"
"2488","85088907","澄思國際有限公司","屏東縣佳冬鄉羌園村羌光路2-3號一樓","鄭巧伶","500000","1080815"
"2489","85088913","玄峰體育休閒事業有限公司","新竹縣竹北市東興里4鄰嘉興路391號","林恩玄","200000","1080815"
"2490","85088929","樂活環保清潔有限公司","新竹縣竹東鎮五豐里北興路三段538號一樓","黃曉薰","300000","1080815"
"2491","85088934","容易創造顧問有限公司","宜蘭縣頭城鎮更新路203-1號","江俊嶙","500000","1080815"
"2492","85088955","米亞綠能科技有限公司","宜蘭縣羅東鎮大新里站前路60號一樓","林思祈","200000","1080816"
"2493","85088961","羅以室內裝修設計工程有限公司","新竹縣竹北市鹿場里27鄰成功十三街22號10樓","張偉麟","500000","1080816"
"2494","85088977","澄山建設有限公司","花蓮縣花蓮市國防里進豐街57巷7弄8號2樓","李自暐","3000000","1080816"
"2495","85088982","香港商創金科技有限公司","臺北市內湖區內湖路一段136號7樓","Natchaphan Rojanatanyanan","0","1080816"
"2496","85088998","享逸康健事業國際有限公司","南投縣草屯鎮炎峰里大成街36巷9號1樓","吳東穎","1000000","1080816"
"2497","85089005","騰駿建設有限公司","彰化縣彰化市華陽里華陽街3號五樓","林堃騰","5000000","1080816"
"2498","85089011","博暘建設有限公司","苗栗縣竹南鎮中美里功明街2-12號一樓","楊元隆","2000000","1080816"
"2499","85089027","釜金有限公司","雲林縣莿桐鄉大美村大美路98-6號1樓","張志誠","500000","1080816"
"2500","85089032","家居開發有限公司","基隆市安樂區武嶺街2號2樓","許世總","3000000","1080816"
"2501","85089048","愛美金饌有限公司","嘉義市西區光彩街505號6樓之二","黃詩閔","500000","1080816"
"2502","85089053","陞帆餐飲有限公司","新竹縣竹北市文化里文田街86號及88號","黃孟陞","600000","1080816"
"2503","85089069","得力室內裝潢有限公司","新竹市香山區埔前里埔前路252號一樓","梁世芳","1000000","1080816"
"2504","85089075","優購數位有限公司","彰化縣彰化市西興里景宗街66巷10號","洪上壹","500000","1080816"
"2505","85089080","品氏投資有限公司","宜蘭縣宜蘭市負郭里三清路164號","陳品璇","1000000","1080816"
"2506","85089096","合聯鋼構有限公司","宜蘭縣宜蘭市梅洲里梅洲一路26巷3號","陳椿方","1000000","1080816"
"2507","85089103","日商亞特星空股份有限公司","臺北市松山區南京東路四段1號11樓","神田龍之介","3000000","1080816"
"2508","85089119","康通科技有限公司","新竹縣湖口鄉鳳凰村中華路122之12號2樓","李俊佑","1000000","1080816"
"2509","85089125","大見投資有限公司","新竹縣竹北市鹿場里文興路179號四樓","梁素英","1000000","1080816"
"2510","85089130","萬嶸投資股份有限公司","臺北市大安區基隆路2段164號7樓","高忠義","10000000","1080813"
"2511","85089146","鹿多克有限公司","臺北市中山區松江路293之511號","李昱慶","20000","1080813"
"2512","85089151","緣滿實業有限公司","臺北市大安區基隆路2段136號6樓之2","柯俊良","500000","1080813"
"2513","85089167","創聚光顧問有限公司","臺北市松山區光復北路95號3樓","吳定樺","200000","1080813"
"2514","85089173","萬泉創意有限公司","臺北市中山區長安東路2段178號5樓","馬慶傑","500000","1080813"
"2515","85089188","濬揚有限公司","臺北市信義區基隆路1段155號8樓之8","吳佳樺","1000000","1080813"
"2516","85089194","群英興業股份有限公司","臺北市士林區福國路95號6樓之13","葉子禔","18000000","1080813"
"2517","85089201","五界機電消防有限公司","臺北市中正區忠孝東路1段152 號11樓之6","何幸芳","200000","1080813"
"2518","85089217","松江地磅有限公司","臺北市中正區羅斯福路3段100之93號","陳家豐","3000000","1080813"
"2519","85089223","日日好日國際有限公司","臺北市中山區民生東路2段83號5樓之3","朝井博之","500000","1080813"
"2520","85089238","廣綠空間創意有限公司","臺北市松山區南京東路4段1號8樓","林家明","100000","1080813"
"2521","85089244","維傑工程有限公司","臺北市萬華區長泰街73巷10號1樓","郭恒志","50000","1080813"
"2522","85089259","國際經典股份有限公司","臺北市大安區復興南路2段45號11樓","謝佳憲","1000000","1080813"
"2523","85089265","碩華環控科技有限公司","臺北市信義區莊敬路381號","傅貴珍","1000000","1080813"
"2524","85089271","天府實業有限公司","臺北市中山區錦州街48號10樓","張明豪","10000","1080813"
"2525","85089286","可靠度測試研究有限公司","臺北市內湖區陽光街351號7樓之3","林益良","1000000","1080814"
"2526","85089292","柏傑新能事業股份有限公司","臺北市士林區延平北路5段163巷40弄4號","張王春香","1500000","1080813"
"2527","85089309","飛帛網通有限公司","臺北市萬華區西寧南路72-1號","陳正憲","500000","1080813"
"2528","85089315","麗晶光電科技有限公司","臺北市中山區南京東路2段150號10樓","廖承暉","100000","1080813"
"2529","85089321","優安時有限公司","臺北市大安區復興南路1段259號8樓之1","蔡孟君","500000","1080813"
"2530","85089336","佳林參創業投資股份有限公司","臺北市中山區松江路139號7樓之2","廖世芳","322000000","1080814"
"2531","85089342","台灣旅人有限公司","臺北市中山區長安東路2段67號7樓之6","劉行偉","1000000","1080813"
"2532","85089357","瑪中生物科技有限公司","臺北市中山區長安東路2段118之5號7樓","李素津","1000000","1080813"
"2533","85089363","來軒有限公司","臺北市信義區信義路6段106號","賴婉綾","250000","1080813"
"2534","85089379","群鑫工程有限公司","臺北市萬華區艋舺大道120巷11弄9號","賴正文","2000000","1080813"
"2535","85089384","大園和平農場有限公司","臺北市大同區民生西路288號8樓","黃河洲","1000000","1080814"
"2536","85089390","三清科技股份有限公司","臺北市大同區承德路3段99巷6號1樓","丁明潔","10000","1080813"
"2537","85089407","台灣創新研發股份有限公司","臺北市中正區忠孝西路1段72號2樓之1","吳承德","1001000","1080814"
"2538","85089413","銘炫股份有限公司","臺北市松山區敦化南路一段2號4樓之1","陳泰峰","10000000","1080813"
"2539","85089429","暮光能源股份有限公司","臺北市中山區民權東路3段58號14樓","張建偉","1000000","1080813"
"2540","85089434","羽光能源股份有限公司","臺北市中山區民權東路3段58號14樓","張建偉","1000000","1080813"
"2541","85089440","為薪工程事業有限公司","臺北市中山區復興北路400號3樓之2","簡晴昀","200000","1080813"
"2542","85089477","福安機械有限公司","臺北市信義區忠孝東路5段1-2號5樓","龍念萱","1000000","1080814"
"2543","85089498","鈺斌國際有限公司","臺北市中山區南京東路3段127號1樓","蘇致富","500000","1080813"
"2544","85089504","維翊數位有限公司","臺北市松山區八德路4段656號4樓","林于傑","7000000","1080814"
"2545","85089510","美好時光餐飲有限公司","臺北市信義區信義路6段34號","郭茉蕎","3000000","1080814"
"2546","85089526","台科之星創業投資股份有限公司","臺北市大安區敦化南路2段97號25樓","李志豪","230000000","1080813"
"2547","85089531","創億半導體股份有限公司","臺北市信義區忠孝東路4段560號10樓之2","陳美玲","30000000","1080814"
"2548","85089552","智珵有限公司","臺北市中山區南京東路1段16號9樓之5","李鑑學","1000000","1080814"
"2549","85089589","嵿盛有限公司","臺北市中山區南京西路1-1號10樓","張瑞霖","1500000","1080814"
"2550","85089595","廣昀有限公司","臺北市中山區長安東路2段81號3樓之1","陳宏銘","5000000","1080717"
"2551","85089602","台灣隆翔貿易有限公司","臺北市內湖區新湖一路153號1樓","何雅靜","8880000","1080814"
"2552","85089618","俠居國際有限公司","臺北市松山區南京東路3段287號2樓","林全利","500000","1080814"
"2553","85089639","巧克奇力行銷有限公司","臺北市內湖區內湖路1段91巷17號2樓之1","蔡添財","1100000","1080814"
"2554","85089645","爾凱國際健康諮詢有限公司","臺北市大安區復興南路1段321號7樓之1","洪啟彰","1500000","1080814"
"2555","85089666","季婕有限公司","臺北市內湖區康寧路3段23號2樓之1","湯苓婕","360000","1080814"
"2556","85089672","汯興科技有限公司","臺北市北投區文化三路77號5樓","尹聖芝","100000","1080814"
"2557","85089687","門戶科技股份有限公司","臺北市中正區信義路2段253號","李玄","1400000","1080814"
"2558","85089700","恩納國際有限公司","臺北市大安區光復南路102號6樓(6B之6)","張琯臻","1000000","1080814"
"2559","85089716","台灣集富一號控股股份有限公司","臺北市信義區信義路5段7號46樓","Teo Tian Sing Melvin","2000000","1080814"
"2560","85089722","八達工程管理顧問有限公司","臺北市信義區莊敬路289巷3弄37號1樓","施貞如","200000","1080814"
"2561","85089737","錦程有限公司","臺北市大安區市民大道3段206號4樓","林聖傑","1000000","1080814"
"2562","85089743","羅西國際時尚美學有限公司","臺北市中山區松江路65號6樓","郭妘荺","200000","1080814"
"2563","85089758","布魯斯人事顧問有限公司","臺北市中正區北平東路30之3號4樓","邱奎嵐","5000000","1080814"
"2564","85089764","抱樸科技股份有限公司","臺北市內湖區內湖路1段66號10樓","丁肇誠","2000000","1080814"
"2565","85089770","台灣嘉利仕貿易有限公司","臺北市信義區基隆路二段23號8樓之1","陳擎天","2000000","1080814"
"2566","85089785","集美造型有限公司","臺北市中山區合江街73巷37號","黃瀞嫺","100000","1080814"
"2567","85089791","詠晨服飾有限公司","臺北市松山區南京東路4段93號12樓","吳盈瑩","1000000","1080814"
"2568","85089808","維爾國際有限公司","臺北市士林區中山北路5段500號7樓","汪婉甄","1000000","1080814"
"2569","85089814","欣動點科技有限公司","臺北市中山區復興北路166號5樓","陳玠伶","5000000","1080814"
"2570","85089820","堯風旅行社有限公司","臺北市中山區松江路131之25號13樓","王盈舜","6000000","1080814"
"2571","85089835","藝墅文化產業有限公司","臺北市大安區金山南路2段185巷14號","林佳融","600000","1080814"
"2572","85089841","穩泰多有限公司","臺北市大安區通化街38巷16號","張佑丞","100000","1080814"
"2573","85089856","有號空間股份有限公司","臺北市大同區南京西路185巷8號","方述山","2000000","1080814"
"2574","85089862","文曜國際科技有限公司","臺北市士林區延平北路5段72號2樓","李建祥","100000","1080814"
"2575","85089883","匯麥遠盈國際有限公司","臺北市信義區信義路4段415號12樓","林言修","2000000","1080815"
"2576","85089899","台灣艾貴環保股份有限公司","臺北市中山區樂群二路267號6樓之2","SECEN DAMIAN RONALD","100000","1080814"
"2577","85089906","就是設計有限公司","臺北市大安區忠孝東路4段333號11樓之1","魯家鳳","1000000","1080814"
"2578","85089928","捷邦能源規劃股份有限公司","臺北市中山區長春路328號8樓","陳霈旭","1500000","1080816"
"2579","85089933","天蔚生技有限公司","臺北市信義區光復南路495號7樓之6","童麟凱","3000000","1080815"
"2580","85089949","福動能運動股份有限公司","臺北市中山區中山北路2段45巷5號6樓","鄭文賓","10000","1080816"
"2581","85089954","秉緒貿易有限公司","臺北市中山區南京東路1段52號2樓","黃國明","3000000","1080815"
"2582","85089960","本事永業有限公司","臺北市北投區立功街79巷9號2樓","郭偉甫","3000000","1080815"
"2583","85089976","楷翔有限公司","臺北市信義區逸仙路26巷3號7樓","徐珮瑄","500000","1080815"
"2584","85089981","延本健康科技有限公司","臺北市內湖區康樂街131巷12號6樓","李家豪","1000000","1080815"
"2585","85089997","窩遊旅創顧問股份有限公司","臺北市萬華區忠孝東路2段38號10樓之1","吳文傑","1000000","1080815"
"2586","85090002","大俠國際流行餐飲有限公司","臺北市士林區文林路188號1樓","曾信翰","1000000","1080815"
"2587","85090018","鬼島傳播有限公司","臺北市內湖區堤頂大道2段285號10樓","吳怡慈","1000000","1080815"
"2588","85090024","聖和科研藥妝股份有限公司","臺北市南港區忠孝東路6段21號8樓之1","張有朋","1000000","1080815"
"2589","85090039","聯碩股份有限公司","臺北市大安區復興南路1段209號4樓","吳美惠","25000000","1080815"
"2590","85090045","廣健康國際有限公司","臺北市松山區八德路2段439號10樓","夏宏豪","1000000","1080815"
"2591","85090050","禾沐行銷有限公司","臺北市中山區松江路70巷3號1樓","黃照文","5000000","1080815"
"2592","85090066","貝達國際有限公司","臺北市信義區忠孝東路5段1之2號5樓","李政道","500000","1080815"
"2593","85090072","晴意結有限公司","臺北市松山區八德路4段656號4樓","李海晴","6000000","1080815"
"2594","85090087","人合室內裝修工程有限公司","臺北市文山區久康街159巷1號3樓","黃國洲","1000000","1080815"
"2595","85090093","維肯創意有限公司","臺北市信義區松德路65號11樓之2","陳詩涵","1500000","1080815"
"2596","85090100","心想成有限公司","臺北市大安區忠孝東路4段295號3樓","黃信嘉","300000","1080815"
"2597","85090116","你好公館股份有限公司","臺北市大安區信義路3段147巷5弄4號3樓","何萬緯","1800000","1080815"
"2598","85090122","浪花黑牛國際股份有限公司","臺北市南港區南港路3段130巷3弄6號1樓","森田孝利","100000","1080815"
"2599","85090137","亞洲區塊鏈整合行銷有限公司","臺北市中正區和平西路1段15號3樓","吳素珠","1000000","1080816"
"2600","85090143","矢砥刻有限公司","臺北市信義區基隆路2段51號9樓之6","黃偉軒","5000000","1080815"
"2601","85090158","大尾蝦有限公司","臺北市大安區忠孝東路4段216巷19弄17號","夏達偉","500000","1080815"
"2602","85090164","邦加文化有限公司","臺北市內湖區陽光街345巷12號4樓","李碩文","200000","1080815"
"2603","85090170","永樂國際企業有限公司","臺北市內湖區民權東路六段495號5樓之1","魏利玲","300000","1080815"
"2604","85090185","全球聯合策略行銷有限公司","臺北市大安區復興南路1段283號4樓","黃鵬仁","750000","1080815"
"2605","85090191","佈雷斯有限公司","臺北市中正區襄陽路3號7樓之1","土山裕和","1000000","1080815"
"2606","85090214","惠鑫不動產有限公司","新竹市東區龍山里埔頂路510號2樓","鄭孟茹","6000000","1080819"
"2607","85090220","東陽機電有限公司","新竹縣湖口鄉祥喜路201號","張正聰","2000000","1080819"
"2608","85090235","桀果有限公司","新竹市北區福林里境福街42號5樓之1","石文環","500000","1080819"
"2609","85090241","塞席爾商邁達微電子股份有限公司","臺北市士林區中山北路七段81巷9號9樓","陳怡穎","1800000","1080819"
"2610","85090256","薩摩亞商雄讚股份有限公司","臺北市中正區信義路2段251號3樓","陳永雄","700000","1080819"
"2611","85090262","塞席爾商陳果事業股份有限公司","高雄市三民區凱歌路101號","陳俊達","3000000","1080819"
"2612","85090278","頂品仔有限公司","嘉義縣番路鄉觸口村梅花一路18號1樓","楊騏鴻","10000","1080819"
"2613","85090283","香港商萬方家族辦公室(亞洲)有限公司","臺北市松山區南京東路三段287號2樓","陳文信","0","1080819"
"2614","85090299","韓商思可股份有限公司","臺北市信義區忠孝東路5段1-1號11樓","簡士傑","1500000","1080820"
"2615","85090312","安康機電有限公司","新竹縣竹東鎮商華里公園路170巷9弄12號1樓","葉雲安","50000","1080819"
"2616","85090328","芯視界科技股份有限公司","新竹縣竹北市光明三路71號","袁帝文","1000000","1080819"
"2617","85090333","澤仁科技有限公司","彰化縣彰化市和調里中山路三段121巷117弄1號1樓","賴坊濱","1000000","1080819"
"2618","85090349","興安光電股份有限公司","新竹縣湖口鄉光復北路10號4樓","葉垂景","40000000","1080819"
"2619","85090354","上匠建設有限公司","彰化縣二林鎮西平里建國路411號1樓","張錦桐","10000000","1080819"
"2620","85090360","誼上餐飲股份有限公司","彰化縣北斗鎮中和里中和路86巷11號","鍾韶容","2000000","1080819"
"2621","85090376","紘葦機械有限公司","彰化縣秀水鄉埔崙村埔鹿街85號","廖振嵐","500000","1080819"
"2622","85090397","定匯科技有限公司","新竹市北區西雅里北新街2巷11號","楊鎮臺","1500000","1080819"
"2623","85090404","百淳有限公司","南投縣草屯鎮山腳里太平路一段516號","簡宏諭","1000000","1080819"
"2624","85090410","錦築建設有限公司","金門縣金寧鄉安美村西浦頭110號","蔡妤昀","1000000","1080819"
"2625","85090426","億興包裝企業有限公司","嘉義市西區西平里中興路722-1號1樓","王芊文","10000000","1080819"
"2626","85090431","千尋貿易有限公司","南投縣埔里鎮杷城里民富巷2-5號","戴德馨","100000","1080819"
"2627","85090447","善多美管理顧問有限公司","新竹縣新豐鄉山崎村信義街18巷43弄2號4樓","李麗娟","100000","1080819"
"2628","85090452","原點餐飲有限公司","花蓮縣壽豐鄉鹽寮村大坑39號","張安迪","6000","1080819"
"2629","85090468","彩虹糖果屋文化創意產業有限公司","新竹市北區光華里13鄰湳雅街126巷30號","賴宛宓","300000","1080819"
"2630","85090474","英屬開曼群島商思捷優達股份有限公司","臺北市內湖區文湖街60巷35號3樓","胡海國","500000","1080819"
"2631","85090489","德昕有限公司","新竹市北區大同里大同路138號1樓","李俊德","29800000","1080820"
"2632","85090495","合鑫投資有限公司","新竹市東區豐功里公道五路二段365號2樓","李明儒","1000000","1080820"
"2633","85090517","百山藝術有限公司","南投縣草屯鎮山腳里太平路一段462號1樓","蕭任能","2000000","1080820"
"2634","85090523","彰貿有限公司","彰化縣埤頭鄉合興村文鄉南街107號1樓","張碧桃","300000","1080820"
"2635","85090538","華偉綠能科技有限公司","雲林縣虎尾鎮新興里新生路153-30號1樓","鐘志偉","1000000","1080820"
"2636","85090544","阿法綠色髮妝國際有限公司","彰化縣員林市三愛里建國路191號1樓","江偉銘","5000000","1080820"
"2637","85090565","育昱有限公司","彰化縣彰化市三民路358巷17號1樓","陳麗珍","3000000","1080820"
"2638","85090571","薩摩亞商無極資本股份有限公司","臺北市大安區仁慈里復興南路一段279巷26號1樓","何明倫","0","1080820"
"2639","85090609","美麗加有限公司","基隆市安樂區基金一路121巷10之3號1樓","孫建傑","3000000","1080820"
"2640","85090615","嶼者有限公司","屏東縣潮州鎮壽福路79號1樓","林家豪","500000","1080820"
