"序號","統一編號","公司名稱","公司所在地","代表人","資本額","核准設立日期"
"1","28114638","東風科技有限公司","宜蘭縣宜蘭市宜科南路15號4樓之2-404室","黃國銘","1000000","1080806"
"2","29187692","大海數據服務有限公司","高雄市前鎮區鎮北里復興四路12號12樓之5","郭佑展","1000000","1080815"
"3","50960030","睿歐科技股份有限公司","桃園市蘆竹區南崁路二段66之11號(8樓)","林鴻誠","1000000","1080731"
"4","50960117","冠恒建設股份有限公司","桃園市平鎮區環南路184號7樓之1","江俊昇","9000000","1080730"
"5","50960123","平安人力資源顧問有限公司","桃園市桃園區大樹里桃鶯路349號(1樓)","林德麗","5000000","1080730"
"6","50960138","明昱管理顧問有限公司","桃園市桃園區中和里1鄰博愛路44號","鄭明生","500000","1080731"
"7","50960159","天元資產開發有限公司","桃園市桃園區大德二街27號(1樓)","陳再河","30000000","1080731"
"8","50960171","壹零零壹國際有限公司","桃園市桃園區中原里宏昌七街62號6樓","陳琇鳳","1000000","1080731"
"9","50960186","華創聚智智能科技股份有限公司","桃園市平鎮區環南路二段11號21樓之3","吳水源","510000","1080731"
"10","50960215","東之階有限公司","桃園市桃園區新埔六街148號11樓之1","陳意梅","100000","1080731"
"11","50960221","彰隆有限公司","桃園市蘆竹區富竹里南竹路四段41巷7號","林於鍾","5000000","1080731"
"12","50960236","鼎新光學股份有限公司","桃園市觀音區草漯里大同二路10號2樓","鍾錦銘","6000000","1080731"
"13","50960263","運賀有限公司","桃園市八德區大福里力行街50巷12號（1樓）","林慧卿","999000","1080802"
"14","50960279","愛貝它有限公司","桃園市桃園區明德里中正路1223號14樓","吳昭樺","250000","1080731"
"15","50960284","晟展營造有限公司","桃園市中壢區過嶺里8鄰過嶺路二段192巷20弄53號","許淵泉","3600000","1080801"
"16","50960290","達程精密有限公司","桃園市桃園區大德一街96號9樓","王健銘","500000","1080801"
"17","50960307","富凱電機工程有限公司","桃園市大園區拔子林二路51巷18號（1樓）","蔡朝全","20000000","1080801"
"18","50960313","熾野有限公司","桃園市八德區大義里忠勇街219號1樓","賴筠潔","100000","1080801"
"19","50960329","鑫奧森國際貿易股份有限公司","桃園市中壢區水尾里環北路339號(2樓)","梁美華","5000000","1080801"
"20","50960334","勁力充電站有限公司","桃園市八德區福興里長興二路63號","劉家甫","1000000","1080801"
"21","50960340","正晞有限公司","桃園市龜山區南美里南祥路81之1號","詹璧榕","200000","1080801"
"22","50960355","銳斯德科技有限公司","桃園市桃園區寶安里同德十街20巷32號（1樓）","何健德","100000","1080801"
"23","50960361","閎群塑膠科技有限公司","桃園市龜山區萬壽里萬壽路一段666巷27號","呂明聰","1000000","1080801"
"24","50960377","宇馳有限公司","桃園市龍潭區龍潭里東龍路231號（1樓）","曾馳達","1000000","1080801"
"25","50960382","柏仁昌貿易有限公司","桃園市蘆竹區南崁路二段66之7號3樓","劉時達","30000000","1080802"
"26","50960398","她他日好有限公司","桃園市八德區和義二街55號八樓","黃怡潔","100000","1080801"
"27","50960405","良懋流體控制有限公司","桃園市桃園區西門里中福街32號","江明仁","1000000","1080801"
"28","50960411","凱恩化學有限公司","桃園市蘆竹區南崁里忠孝東路7號2樓","林韋彤","1000000","1080801"
"29","50960427","鼎豐不動產有限公司","桃園市中壢區至善里龍昌路118號(1樓)","崔傳平","500000","1080801"
"30","50960432","斯盟企業管理顧問有限公司","桃園市平鎮區華安里平東路239巷121弄22號(2樓)","杜信鋐","300000","1080802"
"31","50960453","詮盈通訊有限公司","桃園市桃園區中山路226號(1樓)","羅義宗","200000","1080802"
"32","50960469","宜富建設有限公司","桃園市龍潭區中正里新龍路219巷8號","江支良","10000000","1080802"
"33","50960475","宸聚實業有限公司","桃園市大園區橫峰里致遠一路61號(3樓)","林張玉英","20000000","1080802"
"34","50960480","盛剴科技有限公司","桃園市觀音區大同里環中路275巷17號","林嘉將","700000","1080802"
"35","50960496","翰陽室內空間設計有限公司","桃園市八德區仁德一路33號","謝松諭","1000000","1080802"
"36","50960502","六合寰宇有限公司","桃園市蘆竹區營盤里六福路292之29號(2樓)","吳浩宇","500000","1080802"
"37","50960518","傑勝精密股份有限公司","桃園市中壢區華勛里華仁街68巷2號","莊勝松","500000","1080802"
"38","50960524","悅品苑有限公司","桃園市中壢區中園路二段145號4樓","陳美能","30000","1080802"
"39","50960539","鴻光能源股份有限公司","桃園市中壢區青峰路一段35號7樓","蔡鴻文","1000000","1080802"
"40","50960545","聚康醫療儀器有限公司","桃園市蘆竹區上興里上興路65號1樓","陳俊丞","250000","1080802"
"41","50960550","真揅自動化有限公司","桃園市蘆竹區長興里興隆路13號1樓","高文海","3000000","1080802"
"42","50960566","雄芯綠能智慧科技股份有限公司","桃園市中壢區莒光路17號1樓","沈世安","350000","1080802"
"43","50960572","東信創新能源有限公司","桃園市中壢區高鐵站前西路一段286號7樓之5","許孟紀","10000","1080802"
"44","50960587","鉦欣科技有限公司","桃園市桃園區長安里長春路341號6樓之2","李素玲","2000000","1080805"
"45","50960593","丞風貿易有限公司","桃園市桃園區春日路85之1號7樓","李易","1000000","1080805"
"46","50960600","紳瑞國際有限公司","桃園市桃園區南華里南華街66號地下一樓","黃翔榆","300000","1080805"
"47","50960616","福盛環保有限公司","桃園市桃園區永安路1030號","李耀峰","100000","1080805"
"48","50960622","凱捷全球股份有限公司","桃園市桃園區同安里藝文一街86之1號4樓","史浩宇","6000000","1080805"
"49","50960637","蒸汽工坊有限公司","桃園市平鎮區義民里延平路二段430巷64弄36號(3樓)","陳俊任","116888","1080805"
"50","50960643","達蓮貿易有限公司","桃園市蘆竹區中正路295號7樓之7","李水蓮","30000000","1080805"
"51","50960658","北方大陸有限公司","桃園市平鎮區建安里建明路一段267之1號(1樓)","陳岡嵐","500000","1080805"
"52","50960664","蒂亞諾有限公司","桃園市大園區大園里中正三街98號(1樓)","陳志明","300000","1080807"
"53","50960670","擁吉實業股份有限公司","桃園市大溪區月眉里信義路553號","陳宏榆","1000000","1080805"
"54","50960685","致宏科技有限公司","桃園市中壢區興仁路三段116巷72號","陳志銘","300000","1080805"
"55","50960691","澄易空間設計有限公司","桃園市八德區介壽路一段938號","楊富翔","200000","1080805"
"56","50960708","瞬潔有限公司","桃園市觀音區新坡里新生路584號1樓","劉心雅","500000","1080805"
"57","50960714","寬庭家具有限公司","桃園市龜山區大華里文化五路86號3樓","朱兆聖","100000","1080805"
"58","50960720","東駿工程顧問有限公司","桃園市龍潭區三林里民族路486巷2號1樓","楊岡順","1500000","1080806"
"59","50960735","睿鈦企業有限公司","桃園市中壢區青埔里青商路139號三樓","李銘翔","500000","1080806"
"60","50960741","向陽文創國際事業有限公司","桃園市蘆竹區榮安路6巷66號(2樓)","陳凱森","2000000","1080806"
"61","50960756","宸鉅有限公司","桃園市中壢區內厝里高鐵南路三段727巷102號3樓","黎雅婷","500000","1080806"
"62","50960762","明彥實業有限公司","桃園市龜山區南美里南祥路45號(2樓)","王杏文","2000000","1080806"
"63","50960778","麗鳴有限公司","桃園市桃園區龍鳳里國豐三街100號14樓之3","許廣鳴","3000000","1080806"
"64","50960783","揚丞企業管理顧問有限公司","桃園市桃園區三民路三段284號14樓","石樂揚","100000","1080806"
"65","50960799","路得有限公司","桃園市桃園區中正路1058號11樓","邵素貞","500000","1080806"
"66","50960806","星球時空科技有限公司","桃園市桃園區永安里力行路7號7樓之2","張代季","1000000","1080806"
"67","50960812","誼芯有限公司","桃園市平鎮區廣明路32號7樓","唐孟君","100000","1080806"
"68","50960828","沃爾國際有限公司","桃園市桃園區同德12街183號1樓","張承洋","5000000","1080806"
"69","50960833","奈瓷工業股份有限公司","桃園市龜山區文興路132號(1樓)","蘇家正","2000000","1080806"
"70","50960854","鋁粒企業有限公司","桃園市平鎮區建安里平東路一段184號(1樓)","呂雅莉","200000","1080806"
"71","50960860","廣策精密機械股份有限公司","桃園市蘆竹區宏竹里大竹北路436號","龔明旭","5000000","1080806"
"72","50960876","宜康環保有限公司","桃園市大園區田心里華興路二段223號","葉宗諳","1000000","1080806"
"73","50960881","杏林美生技有限公司","桃園市桃園區慈文路419號3樓","王筠","1000000","1080806"
"74","50960897","十八度灰視覺商業有限公司","桃園市中壢區石頭里永樂路23巷16之3號","楊政翰","1000000","1080806"
"75","50960904","悠庭風格股份有限公司","桃園市平鎮區金陵里環南路三段187號8樓","葉佐霖","1000000","1080807"
"76","50960910","昭揚數位有限公司","桃園市龍潭區高原里渴望路185號之1","羅錦榮","500000","1080807"
"77","50960926","元太國際事業開發有限公司","桃園市中壢區榮安十四街5號(1樓)","陳世欽","100000","1080807"
"78","50960931","積富有限公司","桃園市蘆竹區蘆竹里南崁路二段166號(1樓)","吳銘修","2000000","1080807"
"79","50960947","仕輝企業有限公司","桃園市平鎮區復興里環南路18號11樓之3","林松本","100000","1080807"
"80","50960952","聯富開發股份有限公司","桃園市八德區大興里和平路276巷3號","黃鈺錂","10000000","1080807"
"81","50960968","新聖投資有限公司","桃園市中壢區龍東路312巷3弄26號","孫鳴雄","10000000","1080807"
"82","50960974","萬福開發建設有限公司","桃園市中壢區普慶里中山東路二段229號","呂理和","2000000","1080807"
"83","50960989","艾和股份有限公司","桃園市平鎮區高雙里長安路712巷5號(1樓)","林玲宇","50000","1080807"
"84","50960995","銘沛科技有限公司","桃園市楊梅區青山里獅一路3之1B號(1樓)","彭競槶","6600000","1080807"
"85","50961002","大立餐飲股份有限公司","桃園市桃園區自強里經國路268號(2樓)","卓得仁","10000000","1080807"
"86","50961018","真福顧問服務有限公司","桃園市中壢區洽溪里洽溪路359號5樓","王幗英","50000","1080807"
"87","50961024","翼升股份有限公司","桃園市中壢區新街里元化路245之2號3樓","鍾津芳","3360000","1080807"
"88","50961039","立兆國際有限公司","桃園市桃園區同安里藝文一街86之6號17樓","羅鎮宸","1000000","1080807"
"89","50961045","同隆彈性密封有限公司","桃園市中壢區新街里七和一街99號4樓之2","利子瓏","1000000","1080807"
"90","50961066","優利聯綠能股份有限公司","桃園市蘆竹區南崁路二段9號6樓之1","劉彥灸","300000","1080808"
"91","50961072","萬和玻璃股份有限公司","桃園市大溪區仁愛里埔頂六街316號","簡梓翔","1873000","1080808"
"92","50961087","上富事業開發有限公司","桃園市楊梅區青山一街149號","游明輝","10000","1080808"
"93","50961093","通臺有限公司","桃園市桃園區文昌里中山路207號(1樓)","潘昭彣","8000000","1080808"
"94","50961100","金實有限公司","桃園市龍潭區百年二街40號8樓","呂碧雲","100000","1080808"
"95","50961116","達飛有限公司","桃園市中壢區忠福里南園二路267號4樓","李謦安","500000","1080808"
"96","50961122","燿程金屬有限公司","桃園市八德區大安里15鄰興豐路1898號","蘇子鋒","200000","1080808"
"97","50961137","悅荃潁有限公司","桃園市桃園區龍壽街145巷64號1樓","賴重光","100000","1080808"
"98","50961143","大禾有限公司","桃園市桃園區豐林里三民路三段591號（1樓）","潘昭延","8000000","1080808"
"99","50961158","聖邦實業有限公司","桃園市桃園區鹽庫街17巷5之1號","沈聲棟","500000","1080808"
"100","50961164","宏立精密有限公司","桃園市中壢區仁義里中園路29號6樓","簡睿宇","500000","1080808"
"101","50961170","立昕投資有限公司","桃園市楊梅區青山一街149號","曾彥賓","10000","1080808"
"102","50961185","沃得資訊有限公司","桃園市桃園區武陵里復興路99號(1樓)","黃育恩","100000","1080808"
"103","50961191","振鑫益有限公司","桃園市桃園區同安里藝文一街86之6號17樓","林雨瑄","20000","1080808"
"104","50961208","京懋國際光電股份有限公司","桃園市龜山區南上里民生北路一段476號","林仁彥","3000000","1080808"
"105","50961214","德碩先進科技有限公司","桃園市楊梅區水美里新梅九街36號(1樓)","梁文侃","1000000","1080808"
"106","50961220","朝北科技有限公司","桃園市桃園區藝文一街86之6號17樓","林月麗","500000","1080808"
"107","50961235","三邑營造有限公司","桃園市楊梅區上湖里中山南路800巷170號","徐松","3602000","1080808"
"108","50961241","元景投資股份有限公司","桃園市中壢區中正路1274巷58號","劉連生","113500000","1080808"
"109","50961256","展益實業有限公司","桃園市八德區大宏里桃德路155巷109號（4樓）","陳啓旭","3000000","1080808"
"110","50961262","德鋼工程有限公司","桃園市平鎮區宋屋里廣泰路232巷87弄9號5樓","莫雲琁","800000","1080812"
"111","50961278","李物股份有限公司","桃園市中壢區五福里民族路316號（1樓）","李柏毅","10000000","1080812"
"112","50961283","達特豪斯室內裝修有限公司","桃園市中壢區中建里延平路552號地下一樓","周月嬌","2000000","1080812"
"113","50961299","鼎碩國際工業有限公司","桃園市平鎮區湧安里工業東路85號(1樓)","鍾隆和","1000000","1080812"
"114","50961306","艾麗星國際貿易有限公司","桃園市桃園區福林里介壽路495巷79號12樓","陳子翔","100000","1080812"
"115","50961312","采慧醫藥有限公司","桃園市龍潭區中山里龍華路一段39及41號（1樓）","江恩維","25000000","1080812"
"116","50961333","森語工程顧問有限公司","桃園市中壢區興平里元化路二段126號10樓","邱廷銳","100000","1080812"
"117","50961349","數字全息有限公司","桃園市桃園區新埔里同安街178號(1樓)","林卉羚","200000","1080812"
"118","50961354","亞碩停車事業股份有限公司","桃園市中壢區永光里民權路二段147號（3樓）","林子建","5000000","1080812"
"119","50961360","時詣國際投資股份有限公司","桃園市桃園區自強里經國路336巷78號10樓","朱昌碩","5000000","1080812"
"120","50961376","宗原環保科技有限公司","桃園市八德區大順里介壽路二段583巷146號（2樓）","楊宛禎","1000000","1080812"
"121","50961381","無限購有限公司","桃園市桃園區龍山里雙龍街37號","王世明","600000","1080812"
"122","50961397","芙蓉廣告股份有限公司","桃園市桃園區南埔里大興西路二段267號17樓之2","謝幸蓉","3000000","1080812"
"123","50961404","華軒生物科技有限公司","桃園市大園區五權里中正東路二段652之1號","許麗華","300000","1080812"
"124","50961410","越饗餐飲事業股份有限公司","桃園市桃園區南埔里大興西路二段171號","許瀚嶸","1000000","1080812"
"125","50961426","雲新健康股份有限公司","桃園市平鎮區環南路411號2樓之1","張煥禎","3000000","1080813"
"126","50961431","鴻健國際有限公司","桃園市平鎮區新富里德育路二段152號8樓","陳為漢","500000","1080813"
"127","50961452","甜心寶貝國際有限公司","桃園市中壢區金華里新生路336號","張芝靈","1000000","1080813"
"128","50961468","力浤貿易有限公司","桃園市龜山區兔坑里幸美九街46號5樓","王莉莉","500000","1080813"
"129","50961474","東一生技有限公司","桃園市桃園區中山路788巷17號","柯東揚","1000000","1080813"
"130","50961489","金山實業有限公司","桃園市龜山區嶺頂里幸美街103號","王明玉","280000","1080813"
"131","50961495","恩亦國際有限公司","桃園市平鎮區南東路104巷25弄6號(3樓)","徐國華","200000","1080813"
"132","50961501","吉強創意實業有限公司","桃園市桃園區文化里中華路10號9樓之7","陳雅雯","600000","1080815"
"133","50961517","三兆健康事業有限公司","桃園市中壢區環中東路241號14樓之10","余惠君","1000000","1080813"
"134","50961523","逸嘉國際有限公司","桃園市八德區陸光街60巷1號(1樓)","劉椿暉","150000","1080813"
"135","50961538","禾邑國際有限公司","桃園市桃園區龍鳳里國強七街108號7樓","許加和","1000000","1080813"
"136","50961559","晏捷股份有限公司","桃園市桃園區同安里新埔六街77號9樓之5","蘇建成","1000000","1080813"
"137","50961571","艾樂芬有限公司","桃園市大溪區仁愛里公園三街262號(1樓)","朱芷茵","150000","1080813"
"138","50961586","創業家彭氏兄弟企業有限公司","桃園市中壢區過嶺里松仁路38號（1樓）","鍾松嬌","2000000","1080813"
"139","50961592","曜家原有限公司","桃園市大園區高鐵南路一段109號10樓","唐千崴","500000","1080813"
"140","50961609","安吉星科技有限公司","桃園市桃園區東門里朝陽街9號7樓之12","謝佳伶","500000","1080813"
"141","50961615","紘竣精密科技有限公司","桃園市桃園區中平路183號4樓","徐譽宸","1000000","1080814"
"142","50961621","成幃有限公司","桃園市中壢區過嶺里民族路六段138號十二樓之2","王錡偉","600000","1080814"
"143","50961636","正白旗有限公司","桃園市大溪區三元一街46巷9號1樓","周君樺","100000","1080814"
"144","50961642","富珩有限公司","桃園市中壢區龍東里龍東路63號","葉城蓮","1000000","1080814"
"145","50961657","榯榯創作空間設計有限公司","桃園市中壢區後寮里龍興路717巷13號","湯佳倫","500000","1080814"
"146","50961663","天鎰特勤公寓大廈管理維護股份有限公司","桃園市龜山區萬壽路一段161號20樓之1","翁添木","10000000","1080814"
"147","50961679","臻精致貿易有限公司","桃園市龜山區迴龍里萬壽路一段69巷6弄59號","許櫻桃","5000000","1080814"
"148","50961684","塔而電通有限公司","桃園市龜山區迴龍里萬壽路一段98號(一樓)","錡志賢","1000000","1080814"
"149","50961690","瑞均土地開發建設有限公司","桃園市桃園區龍鳳里龍鳳三街65巷10號2樓","呂沛霖","1000000","1080814"
"150","50961707","翰林苑廣告行銷有限公司","桃園市觀音區吉祥街83號（1樓）","林蓁妤","1000000","1080814"
"151","50961713","鼎哲投資有限公司","桃園市中壢區新街里元化路236號10樓之2","江啓鼎","10000000","1080814"
"152","50961729","欣安展有限公司","桃園市桃園區中原里宏昌十一街26號5樓","藍偉倫","500000","1080814"
"153","50961734","銤嘉科技有限公司","桃園市桃園區南門里建國路348巷27號5樓","曾于晏","1000000","1080814"
"154","50961740","捷客車坊有限公司","桃園市中壢區內定里內定二街66之1號","沈宇軒","500000","1080815"
"155","50961755","易佳電子商務有限公司","桃園市觀音區新坡里中山路二段649號(1樓)","陳志誠","500000","1080816"
"156","50961761","優美健康生技有限公司","桃園市龜山區民生北路一段40之2號1樓之6","江忻庭","1000000","1080815"
"157","50961777","亨昌久投資股份有限公司","桃園市楊梅區瑞溪里梅獅路二段40號11樓","莊婉琪","20000000","1080815"
"158","50961782","芯創國際貿易有限公司","桃園市中壢區元化路224號12樓","官柏堅","100000","1080815"
"159","50961798","東耘國際有限公司","桃園市桃園區慈德街126號8樓","林穔秦","210000","1080815"
"160","50961805","豐益工業有限公司","桃園市桃園區桃鶯路382之1號4樓","邱子川","3000000","1080815"
"161","50961811","鑫旺開發有限公司","桃園市中壢區永光里環北路10號(2樓)","張昌永","500000","1080815"
"162","50961827","同羽科技有限公司","桃園市中壢區中央里元化路165巷72號4樓","郭見仲","100000","1080815"
"163","50961832","金爺科技有限公司","桃園市桃園區武陵里中正路48巷9之5號","林志隆","60000","1080815"
"164","50961848","禾羽有限公司","桃園市平鎮區龍南路210號","蘇怡羽","100000","1080816"
"165","50961853","活溢國際有限公司","桃園市蘆竹區南崁里經國路900號3樓","劉慶懿","1000000","1080816"
"166","50961869","萬升實業有限公司","桃園市桃園區莊敬里中正路1416號9樓","饒升","200000","1080816"
"167","50961875","藍鯨加水站有限公司","桃園市中壢區新街里元化路224號12樓","黃振祈","350000","1080816"
"168","50961880","阡森設計工程有限公司","桃園市中壢區華美三路281號","李俊翰","300000","1080816"
"169","50961896","正順搬家貨運有限公司","桃園市桃園區忠一路102號","賴淑蘭","10000000","1080816"
"170","50961903","澄久設計有限公司","桃園市觀音區富源里新富路765巷25號3樓","姜韋伶","200000","1080816"
"171","50961919","菇菇數位有限公司","桃園市桃園區中和里中山路72號(1樓)","李大誠","1000000","1080816"
"172","50961925","準碁精密有限公司","桃園市中壢區大仁街51號2樓之2","陳明崇","1000000","1080816"
"173","50961930","豐妍有限公司","桃園市桃園區大興里大業路一段432號(1樓)","鄧蕙君","300000","1080816"
"174","50961946","學廚烘焙模具有限公司","桃園市八德區介壽路二段618號（1樓）","蔡永傑","50000","1080816"
"175","50961967","椲凱投資有限公司","桃園市大園區菓林里18鄰三民路二段337巷30弄11號(1樓)","葉儀婷","575851","1080816"
"176","50961973","柏沅租賃有限公司","桃園市桃園區中德里國際路一段120巷13號（1樓）","周培華","50000","1080816"
"177","50961988","越饗越式料理有限公司","桃園市桃園區南埔里大興西路二段171號","許瀚嶸","6000000","1080816"
"178","50961994","越河香食品有限公司","桃園市中壢區維德街7號（1樓）","范金荷","200000","1080819"
"179","50962001","築玉資產管理顧問有限公司","桃園市桃園區大興里春日路748號","胡正益","1000000","1080819"
"180","50962017","尚穎國際興業有限公司","桃園市桃園區中山路595號2樓","林詠喬","1000000","1080819"
"181","50962023","鍵基科技有限公司","桃園市中壢區環北路400號17樓之7","王棟鎬","6300000","1080819"
"182","50962038","駿達管理顧問有限公司","桃園市中壢區仁美里仁慈路178號5樓之2","楊思亮","1000000","1080819"
"183","50962059","玉平有限公司","桃園市楊梅區四維二路15號(1樓)","楊瑞英","500000","1080819"
"184","50962065","聖酷堡有限公司","桃園市蘆竹區南興里南昌路81號13樓","張中禎","10000","1080822"
"185","50962071","均典電子有限公司","桃園市八德區力行街92號（1樓）","李仕頎","5000000","1080819"
"186","50962086","群裕建設有限公司","桃園市大園區大園里新生路75號","游智健","5000000","1080819"
"187","50962092","采邑廣告行銷有限公司","桃園市觀音區樹林里吉祥街65巷39號","張德君","500000","1080819"
"188","50962109","艾波夫有限公司","桃園市平鎮區北勢里金陵路111號（1樓）","陳鴻夫","500000","1080820"
"189","50962115","司宇實業有限公司","桃園市中壢區仁和里晉元路245號（1樓）","林士傑","100000","1080820"
"190","50962121","伽馬文創有限公司","桃園市大園區橫峰里青昇二街58號(1樓)","王家駿","200000","1080820"
"191","50962136","偉岑有限公司","桃園市楊梅區瑞坪里蘋果路108巷2弄72號","黃冠魁","1000000","1080820"
"192","50962142","熏宇投資有限公司","桃園市大園區菓林里18鄰三民路二段337巷30弄11號(1樓)","陳彥欽","569415","1080820"
"193","50962157","未秧有限公司","桃園市桃園區莊二街39號1樓之3","王禮萱","100000","1080820"
"194","50962163","金暉智慧科技有限公司","桃園市中壢區洽溪里領航北路二段83號10樓","林沅慶","200000","1080820"
"195","50962179","蓮成養殖場有限公司","桃園市八德區茄苳路93巷17號8樓","陳淑玲","2000000","1080820"
"196","50962184","上富開發有限公司","桃園市楊梅區青山一街149號","張彥淇","10000","1080820"
"197","50962190","風順生技有限公司","桃園市蘆竹區羊稠里仁愛路三段260巷33號6樓","陳靜風","600000","1080820"
"198","50962207","名額有限公司","桃園市大園區竹圍里成功街31巷2弄9號2樓","林典毅","100000","1080821"
"199","50962213","領潮文化有限公司","桃園市桃園區大興路318巷3號5樓","吳憲霖","1000000","1080820"
"200","50962229","宸銘建設有限公司","桃園市龍潭區高平里龍源路121巷63弄4街8號(1樓)","王霈宸","1000000","1080820"
"201","50962234","上富資本有限公司","桃園市楊梅區青山一街149號","張彥淇","10000","1080820"
"202","50962240","淦啥有限公司","桃園市桃園區成功路二段151之1號","呂宜憲","600000","1080820"
