"序號","統一編號","公司名稱","公司所在地","代表人","資本額","核准設立日期"
"2053","90586340","鑫食代有限公司","臺中市西屯區大鵬里文心路三段241號21樓之7","莊煒浩","200000","1101222"
"2054","90586355","喬新資訊有限公司","臺中市南屯區文心路一段218號23樓之1","楊哲宇","500000","1101222"
"2055","90586361","睿宸綠能有限公司","臺中市西屯區市政北七路186號15樓之6","楊翼隆","200000","1101222"
"2056","90586377","森築系統傢俱有限公司","臺中市石岡區德興里豐勢路214巷22號","鍾承穎","100000","1101222"
"2057","90586382","忠明德有限公司","臺中市西區公益路367號16樓之2","陳珍娜","9000000","1101223"
"2058","90586398","玖四五資訊科技有限公司","臺中市西區公民里五廊街29之4號4樓之2","李家豪","900000","1101222"
"2059","90586405","景永富實業有限公司","臺中市南屯區大業里公益路二段61號3樓之2","尤佳蓉","50000","1101222"
"2060","90586427","振允國際有限公司","臺中市西區民權路283號2樓","劉孟忻","500000","1101223"
"2061","90586432","聯合國際廣告有限公司","臺中市西屯區龍潭里環中路三段926之1號","張瑞鳳","500000","1101223"
"2062","90586448","菲思企業有限公司","臺中市西區臺灣大道二段285號14樓之3","黃琳雅","900000","1101223"
"2063","90586453","正宗有限公司","臺中市東勢區下城里東關路六段262巷22號1樓","陳錦純","400000","1101223"
"2064","90586469","新光教育事業有限公司","臺中市烏日區三榮北路126號6樓之5","魏王玉釵","400000","1101223"
"2065","90586475","智聯國際股份有限公司","臺中市南屯區新生里龍富路四段69號","黃俊維","500000","1101223"
"2066","90586480","龍贏新科技有限公司","臺中市西屯區何南里大墩二十街118號5樓之1","黄燦鵬","2000000","1101223"
"2067","90586496","新昌泰綠能實業有限公司","臺中市北區新北里三民路三段132號3樓","陳佳佩","500000","1101223"
"2068","90586502","誠逢國際股份有限公司","臺中市南屯區文山里文山三街138號2樓","周煒博","1000000","1101223"
"2069","90586518","山漵教育行銷有限公司","臺中市西屯區惠來里市政北七路186號10樓之3","孫瑞琦","5000000","1101223"
"2070","90586524","昀邑綠能股份有限公司","臺中市南屯區文山里精科中路22號2樓","許俊吉","200000","1101223"
"2071","90586539","鑫鴻國際有限公司","臺中市豐原區西湳里國豐路一段566巷6號1樓","廖晋平","100000","1101223"
"2072","90586545","芸明德有限公司","臺中市西區公益路367號16樓之2","蔡侑芸","15933000","1101223"
"2073","90586550","佳源興業有限公司","臺中市大里區立德里新甲路5號8樓之5","林曉岑","250000","1101223"
"2074","90586566","白遠有限公司","臺中市西屯區安和路20之5號1樓","廖松柏","80000","1101223"
"2075","90586572","力威工業有限公司","臺中市東區東信里振興路437巷59弄108號1樓","林金城","5800000","1101223"
"2076","90586587","黑熊體能有限公司","臺中市潭子區環中東路一段155號1樓","廖晏崧","950000","1101223"
"2077","90586593","天樞資訊科技有限公司","臺中市中區三民路二段136號4樓","李承翰","100000","1101223"
"2078","90586616","肌地台有限公司","臺中市北屯區東山路一段156之6號地下1層之3","陳煜中","100000","1101223"
"2079","90586622","泳鴻生技有限公司","臺中市大甲區渭水路25之45號1樓","廖沛彤","80000","1101223"
"2080","90586637","鴻聯工業有限公司","臺中市南屯區鎮平里筏子東街一段53號","江富婷","500000","1101223"
"2081","90586643","星宇公關媒體製作有限公司","臺中市西區民龍里臺灣大道二段295號4樓","江憲杰","100000","1101223"
"2082","90586658","卓越創興企業有限公司","臺中市西屯區何源里華美西街二段311號9樓之3","許容慈","30000","1101223"
"2083","90586664","美夢家不動產經紀股份有限公司","臺中市北區育德里健行路607號1至2樓、609巷1號1至2樓","江美淇","3500000","1101223"
"2084","90586670","橙益印刷事業有限公司","臺中市南屯區大墩十四街270號5樓","陳竑捷","200000","1101223"
"2085","90586685","富霖國際開發有限公司","臺中市西屯區何南里大聖街467巷1號1樓","蕭奕萱","1000000","1101223"
"2086","90586691","寶沛靴福康有限公司","臺中市西屯區福林里福康路30號1樓","張倚齊","2000000","1101223"
"2087","90586708","喬米有限公司","臺中市太平區德隆里工業二十路77號","許文憲","8000000","1101227"
"2088","90586714","塔克有限公司","臺中市西屯區潮洋里黎明路二段927號1樓","王嘉鴻","100000","1101224"
"2089","90586720","精品石材美容養護有限公司","臺中市北屯區松和里松和街49號1樓","程冠富","500000","1101224"
"2090","90586735","金派庫國際有限公司","臺中市南屯區永定里五權西路二段782號1樓","蔡宜芬","500000","1101224"
"2091","90586741","昀東綠能股份有限公司","臺中市南屯區文山里精科中路22號2樓","許俊吉","200000","1101224"
"2092","90586756","倍健科技有限公司","臺中市大雅區上雅里學府路404巷1號1樓","王秉毅","2000000","1101224"
"2093","90586762","順明不動產經紀有限公司","臺中市沙鹿區南勢里鎮南路二段14號1樓","顏鵬修","1000000","1101224"
"2094","90586778","玉富工業有限公司","臺中市潭子區嘉仁里嘉豐路96巷1號","林山富","200000","1101224"
"2095","90586783","程勝車業有限公司","臺中市梧棲區文雅街196巷66號1樓","張妤涵","1000000","1101224"
"2096","90586799","侑呈企業有限公司","臺中市神岡區岸裡里大圳路8巷31號1樓","邱仲雲","100000","1101224"
"2097","90586812","酉乾有限公司","臺中市南區和平里復興路二段71巷77弄66號1樓","許婷婷","200000","1101224"
"2098","90586828","甯好行銷有限公司","臺中市南屯區三和里河南路四段418號14樓之5","張羽甯","100000","1101224"
"2099","90586833","鈺庭食品有限公司","臺中市太平區聖和里長龍路一段197巷29號","何瓊玲","50000","1101224"
"2100","90586849","耐思服務有限公司","臺中市南屯區田心里五權西路二段501號10樓","吳信慶","1000000","1101224"
"2101","90586854","小陳良品有限公司","臺中市西屯區大鵬里文心路三段241號21樓之7","陳冠儒","200000","1101224"
"2102","90586860","鑫利旺租賃理財企業有限公司","臺中市北屯區平安里文心路四段752之3號","蕭嵐心","300000","1101224"
"2103","90586876","永琳健康事業股份有限公司","臺中市豐原區南陽里南陽路123巷81弄13號","林燕玲","1000000","1101224"
"2104","90593454","翔鶴建設有限公司","彰化縣秀水鄉莊雅村中山路133巷12弄8號一樓","許哲豪","1000000","1101230"
"2105","90593476","永利資訊有限公司","彰化縣鹿港鎮廖厝里鹿和路二段262巷157號一樓","許家豪","500000","1101230"
"2106","90599703","安理建設股份有限公司","臺中市西屯區協和里安和一街89號3樓","江衍瑾","30000000","1101208"
"2107","90599719","育承有限公司","臺中市南屯區同心里文心路一段186號20樓","林芳菱","1000000","1101208"
"2108","90599725","鑫豐生命事業有限公司","臺中市北屯區東光里北屯路298巷26弄116號1樓","翁煜鈞","900000","1101208"
"2109","90599730","聚儲柒號股份有限公司","臺中市西屯區市政北二路236號14樓之1","黃志文","100000","1101208"
"2110","90599746","盛儲伍號股份有限公司","臺中市西屯區市政北二路236號27樓之1","黃志文","100000","1101208"
"2111","90599751","寶儲伍號股份有限公司","臺中市西屯區市政北二路236號21樓之1","黃志文","100000","1101208"
"2112","90599767","寶儲捌號股份有限公司","臺中市西屯區市政北二路236號21樓之1","黃志文","100000","1101208"
"2113","90599773","寶儲參號股份有限公司","臺中市西屯區忠明南路758號14樓","黃志文","100000","1101208"
"2114","90599788","盛儲肆號股份有限公司","臺中市西屯區市政北二路238號22樓之1","黃志文","100000","1101208"
"2115","90599794","盛儲柒號股份有限公司","臺中市西屯區市政北二路236號27樓之1","黃志文","100000","1101208"
"2116","90599801","三儲柒號股份有限公司","臺中市北區文心路四段208之1號7樓之2","黃志文","100000","1101208"
"2117","90599817","三儲貳號股份有限公司","臺中市西屯區西屯路二段256巷6號2樓之2","黃志文","100000","1101208"
"2118","90599838","昇福不動產仲介經紀有限公司","臺中市潭子區甘蔗里雅潭路一段127號1樓","林晨玉","500000","1101208"
"2119","90599859","鼎笠工程有限公司","臺中市新社區永源里中和街一段山腳巷33號1樓","徐榮程","100000","1101208"
"2120","90599865","三儲伍號股份有限公司","臺中市西屯區西屯路二段256巷6號2樓之2","黃志文","100000","1101208"
"2121","90599871","寶儲貳號股份有限公司","臺中市西屯區忠明南路758號14樓","黃志文","100000","1101208"
"2122","90599886","博尼斯興業有限公司","臺中市大肚區王田里王福街113巷2號1樓","胡淑評","100000","1101208"
"2123","90599892","嶸康有限公司","臺中市大肚區遊園路二段133巷8號1樓","陳岱琦","100000","1101208"
"2124","90599915","陞侖有限公司","臺中市太平區新興里太興路13號","林宏昱","1000000","1101208"
"2125","90599921","源祿塑膠有限公司","臺中市北屯區水景里東山路一段199巷3號1樓","張巨岳","200000","1101208"
"2126","90599936","山曉食品科技有限公司","臺中市南區城隍里信義南街229號","張逢琪","6000000","1101208"
"2127","90599942","翔慶興實業有限公司","臺中市北區新北里錦新街30號11樓","劉和翔","100000","1101208"
"2128","90599957","長煬科技有限公司","臺中市北屯區廍子里太原路三段1359號3樓之1","陳敬傑","1000000","1101208"
"2129","90599963","上羽有限公司","臺中市西屯區何南里大墩十九街6號1樓","李輔元","20000","1101208"
"2130","90599979","雲鼎股份有限公司","臺中市西屯區皇城街82號9樓之5","陳建華","6000000","1101209"
"2131","90599984","致峰資源回收有限公司","臺中市大肚區瑞井里遊園路一段70巷2弄10號1樓","顏敏如","50000","1101209"
"2132","90599990","績旭股份有限公司","臺中市西屯區市政路386號21樓之6","陳金福","13070000","1101209"
"2133","90600005","巨謹股份有限公司","臺中市西屯區市政路386號21樓之6","張綉貞","13070000","1101209"
"2134","90600011","瑨佶股份有限公司","臺中市西屯區市政路386號21樓之6","陳柏豪","13070000","1101209"
"2135","90600027","中澤建材有限公司","臺中市南區福順里忠明南路789號38樓之2","吳岱澤","500000","1101209"
"2136","90600032","鉅典水電工程有限公司","臺中市北區建成里東光八街40號1樓","江榮吉","2000000","1101209"
"2137","90600075","聚儲捌號股份有限公司","臺中市西屯區市政北二路236號14樓之1","黃志文","100000","1101209"
"2138","90600080","宏觀土地開發有限公司","臺中市大雅區中山北路152巷36號1樓","張宏賓","100000","1101209"
"2139","90600103","聚儲陸號股份有限公司","臺中市西屯區市政北二路236號14樓之1","黃志文","100000","1101209"
"2140","90600119","聚儲參號股份有限公司","臺中市南區忠明南路758號11樓","黃志文","100000","1101209"
"2141","90600146","逸析有限公司","臺中市大雅區中山路83號1樓","徐逸","3000000","1101209"
"2142","90600167","盛儲玖號股份有限公司","臺中市西屯區市政北二路236號27樓之1","黃志文","100000","1101209"
"2143","90600173","盛儲壹號股份有限公司","臺中市西屯區市政北二路238號22樓之1","黃志文","100000","1101209"
"2144","90600188","美室家居股份有限公司","臺中市南屯區三厝里河南路四段612號2樓","陳國輝","25000000","1101209"
"2145","90600194","寶儲玖號股份有限公司","臺中市西屯區市政北二路236號21樓之1","黃志文","100000","1101209"
"2146","90600201","寶儲肆號股份有限公司","臺中市南區忠明南路758號14樓","黃志文","100000","1101209"
"2147","90600217","特順貿易有限公司","臺中市神岡區社南里中山路667巷107之1號1樓","陳彥勳","10000000","1101209"
"2148","90600223","三儲玖號股份有限公司","臺中市北區文心路四段208之1號7樓之2","黃志文","100000","1101209"
"2149","90600238","新華藝影業有限公司","臺中市西屯區何安里四川一街18號1樓","龔財華","10000000","1101209"
"2150","90600259","漫旅有限公司","臺中市南區五權南路185號2樓","黃冠誌","1000000","1101209"
"2151","90600265","多信工程有限公司","臺中市西區公民里貴和街203號1樓","江仲晏","1000000","1101209"
"2152","90600271","振崇有限公司","臺中市龍井區麗水里龍港路501巷36弄6號","張明裕","100000","1101209"
"2153","90600286","讚宇開發有限公司","臺中市北屯區松安里松安街198號2樓","陳威宇","2000000","1101209"
"2154","90600292","古斯塔夫有限公司","臺中市南屯區大業里公益路二段61號3樓之3","莊峰富","200000","1101209"
"2155","90600315","駿向股份有限公司","臺中市西屯區市政路386號21樓之6","陳金福","13070000","1101209"
"2156","90600321","水印國際有限公司","臺中市西屯區何安里重慶路99號5樓之3","徐千婷","100000","1101209"
"2157","90600336","安聖物業管理顧問有限公司","臺中市西區民生里法院前街15號5樓之1","王幸宜","300000","1101209"
"2158","90600342","星網數據股份有限公司","臺中市西屯區東興路三段373號","謝源一","100000","1101209"
"2159","90600357","品銓科技有限公司","臺中市大里區塗城里27鄰三民一街55巷1號1樓","歐子琳","100000","1101209"
"2160","90600363","聚儲貳號股份有限公司","臺中市南區忠明南路758號11樓","黃志文","100000","1101209"
"2161","90600379","聚儲伍號股份有限公司","臺中市西屯區市政北二路236號14樓之1","黃志文","100000","1101209"
"2162","90600384","盛儲參號股份有限公司","臺中市西屯區市政北二路238號22樓之1","黃志文","100000","1101209"
"2163","90600390","高熏科技有限公司","臺中市烏日區溪南路一段238巷138之3號1樓","吳敏毅","3000000","1101209"
"2164","90600413","星鱻電力股份有限公司","臺中市西屯區東興路三段373號","謝源一","100000","1101209"
"2165","90600429","惟寓企業有限公司","臺中市北屯區太原路三段991之1號","黃雅婷","1000000","1101209"
"2166","90600434","全美建設有限公司","臺中市神岡區豐洲里神洲路230巷31號","朱文吉","5000000","1101209"
"2167","90600440","松本國際股份有限公司","臺中市西屯區惠來里惠中路102號1樓","廖品政","5000000","1101209"
"2168","90600455","大眼界國際有限公司","臺中市東區東門里東光園路86巷95弄27號1樓","葉佩佩","500000","1101209"
"2169","90600461","盛儲陸號股份有限公司","臺中市西屯區市政北二路236號27樓之1","黃志文","100000","1101209"
"2170","90600477","麗膚企業有限公司","臺中市北區衛道路77之1號1樓","鄭麗玉","300000","1101209"
"2171","90600482","寶德興業有限公司","臺中市大甲區文武里中山路一段1075號1樓","林榆詔","10100000","1101209"
"2172","90600498","聚儲玖號股份有限公司","臺中市西屯區市政北二路236號14樓之1","黃志文","100000","1101209"
"2173","90600504","盛儲拾號股份有限公司","臺中市西屯區市政北二路236號27樓之1","黃志文","100000","1101209"
"2174","90600510","三儲拾號股份有限公司","臺中市南區忠明南路758號11樓","黃志文","100000","1101209"
"2175","90600526","三儲肆號股份有限公司","臺中市西屯區西屯路二段256巷6號2樓之2","黃志文","100000","1101209"
"2176","90600531","三儲陸號股份有限公司","臺中市北區文心路四段208之1號7樓之2","黃志文","100000","1101209"
"2177","90600547","三儲壹號股份有限公司","臺中市西屯區市政北二路236號21樓之1","黃志文","100000","1101209"
"2178","90600552","育成實業有限公司","臺中市潭子區東寶里大富路一段3巷16號1樓","林雅莕","500000","1101209"
"2179","90600568","寶儲陸號股份有限公司","臺中市西屯區市政北二路236號21樓之1","黃志文","100000","1101209"
"2180","90600574","崗益金屬建材有限公司","臺中市神岡區社南里中山路497巷57號1樓","陳依依","500000","1101209"
"2181","90600589","盛儲貳號股份有限公司","臺中市西屯區市政北二路238號22樓之1","黃志文","100000","1101209"
"2182","90600595","三儲參號股份有限公司","臺中市西屯區西屯路二段256巷6號2樓之2","黃志文","100000","1101210"
"2183","90600618","展祥精密有限公司","臺中市清水區高北里護岸路121號","王培芬","800000","1101209"
"2184","90600624","巨阜貿易有限公司","臺中市烏日區九德里長春街347巷22號1樓","管鵬銘","100000","1101209"
"2185","90600639","品淇服飾有限公司","臺中市太平區宜欣里仁和街35號3樓","周瑾萱","50000","1101209"
"2186","90600645","泰昇廣告有限公司","臺中市西屯區港尾里中平路1418號4樓","林伯樺","500000","1101210"
"2187","90600650","禾誌企業有限公司","臺中市大里區樹王里東興路631巷8號","葉麟豪","500000","1101209"
"2188","90600666","村田資本股份有限公司","臺中市潭子區潭富路二段160巷1號","羅秋香","100000000","1101209"
"2189","90600672","瑞成嘉宏投資股份有限公司","臺中市大雅區員林里神林路一段193之1號2樓","張德成","8000000","1101209"
"2190","90600687","元創事業有限公司","臺中市西區民龍里臺灣大道二段186號24樓之2","呂子斌","500000","1101210"
"2191","90600693","亭心生技有限公司","臺中市北區新北里錦新街30號11樓","洪怡婷","200000","1101210"
"2192","90600716","福林門有限公司","臺中市西屯區惠來里市政路55號4樓之2","蕭桂林","10000000","1101213"
"2193","90600722","濬弘股份有限公司","臺中市西屯區市政路386號21樓之6","陳弘澔","13070000","1101210"
"2194","90600737","宜順工程顧問股份有限公司","臺中市南屯區豐樂里文心南五路一段326號3樓","蕭弘典","3000000","1101210"
"2195","90600743","日木文創有限公司","臺中市西屯區上石里上石路132號1樓","陳威廷","100000","1101210"
"2196","90600758","吾樹有限公司","臺中市沙鹿區六路里北勢東路203號1樓","林韋生","1000000","1101210"
"2197","90600764","台中探戈藝文顧問有限公司","臺中市西屯區何安里重慶路99號5樓之2","胡祖同","100000","1101210"
"2198","90600770","寶儲壹號股份有限公司","臺中市南區忠明南路758號14樓","黃志文","100000","1101210"
"2199","90600785","旭豐工業有限公司","彰化縣永靖鄉新莊村永社路9巷19-18號","張錦造","500000","1101202"
"2200","90600808","祺墾有限公司","嘉義市東區民族里延平街115號一樓","楊東興","1000000","1101202"
"2201","90600814","大唐工程有限公司","臺東縣臺東市豐年里豐年路1段242號","蔣明道","500000","1101202"
"2202","90600820","冠鈞人力仲介有限公司","澎湖縣馬公市六合路9巷3號","林志盛","5000000","1101202"
"2203","90600835","萬畝農產有限公司","彰化縣埤頭鄉永豐村斗苑西路580號","施泰澤","6000000","1101202"
"2204","90600841","鞍點國際有限公司","新竹市世界街138號2樓","邱港升","1000000","1101203"
"2205","90600856","爵士馬有限公司","臺東縣臺東市民生里中正路430號1樓","朱士杰","100000","1101203"
"2206","90600862","映虹影視有限公司","苗栗縣頭份市中華路779號二樓","林明智","1000000","1101203"
"2207","90600878","岳泰顧問有限公司","新竹市東區錦華里經國路一段479巷53號十三樓","張傑睿","100000","1101203"
"2208","90600883","零八志龍有限公司","基隆市安樂區麥金路249號15樓","鄭騏寬","200000","1101203"
"2209","90600899","上禾水產有限公司","宜蘭縣冬山鄉丸山一路293號1樓","李良奕","300000","1101203"
"2210","90600912","尚發實業有限公司","雲林縣斗六市溝埧里三樂路33-3號1樓","尚筠栴","20000","1101203"
"2211","90600928","興傳家管理顧問有限公司","新竹市東區埔頂里慈濟路149號六樓","賴冠蓁","500000","1101203"
"2212","90600933","絃聞有限公司","基隆市中山區通仁街20巷61-2號3樓","李彥璋","100000","1101203"
"2213","90600949","救韌性整合服務有限公司","彰化縣秀水鄉安東村信義街34號2樓","陳偉軍","610000","1101203"
"2214","90600954","迴響文化有限公司","宜蘭縣羅東鎮漢民里忠孝路2號一樓","張孟玉","200000","1101203"
"2215","90600960","聯晨優有限公司","宜蘭縣宜蘭市茭白里大坡路一段32號2樓之7","吳伯豪","100000","1101203"
"2216","90600976","新塑應材股份有限公司","彰化縣彰化市福安里華山路37號7樓之2","張若軒","7500000","1101203"
"2217","90600981","精略科技有限公司","彰化縣彰化市向陽里崙平南路141之3號一樓","郭介連","500000","1101203"
"2218","90600997","卡蔓時尚美學有限公司","新竹市北區北大路346號13樓之1","賴詣君","50000","1101203"
"2219","90601010","厚生國際實業有限公司","宜蘭縣員山鄉同樂村同新路299號","蔡德揚","20000","1101203"
"2220","90601026","新花漾食品有限公司","嘉義市西區美源里興業路西路41號1樓","鍾永鵬","50000","1101203"
"2221","90601031","宏淇投資有限公司","新竹市香山區牛埔南路214號2樓","孫定淵","100000","1101203"
"2222","90601047","宸碩有限公司","新竹市北區磐石里文雅街118巷72號1樓","樊敏基","8000000","1101203"
"2223","90601052","慧豐農產有限公司","雲林縣西螺鎮福興路100號","賴慧櫻","2000000","1101203"
"2224","90601068","博勝生活國際有限公司","苗栗縣頭份市忠孝里8鄰信東路232號1樓","曾柏軒","300000","1101203"
"2225","90601074","朋基有限公司","彰化縣福興鄉番婆村彰鹿路六段414巷14-1號1樓","林燕樑","100000","1101203"
"2226","90601089","詠春投資股份有限公司","宜蘭縣羅東鎮光榮路91號","俞任維","5000000","1101203"
"2227","90601095","富懋工程顧問有限公司","雲林縣斗六市溪洲里中南路290巷13號","陳育賢","1000000","1101203"
"2228","90601102","優立科技工程有限公司","新竹縣竹北市嘉豐南路二段91號","李明懋","3000000","1101203"
"2229","90601118","喬泰食品有限公司","苗栗縣三灣鄉三灣村19鄰三灣33之1號","巫亞涵","500000","1101203"
"2230","90601124","晟毅營造有限公司","屏東縣屏東市中正路700巷10號1樓","曾昭春","3600000","1101203"
"2231","90601139","泓樂不動產經紀有限公司","彰化縣埔心鄉瓦中村員林大道七段5號1樓","巫胡政君","1000000","1101203"
"2232","90601145","泓圓科技有限公司","嘉義市東區興安里興美路250號","余劭婕","50000","1101203"
"2233","90601150","土足生活有限公司","臺東縣鹿野鄉瑞源村瑞景路二段326號1樓","吳紀昀","200000","1101206"
"2234","90601166","壹發工程有限公司","雲林縣西螺鎮新安里市場北路183號1樓","廖慈玫","1000000","1101206"
"2235","90601172","毅榮科技有限公司","新竹縣湖口鄉中正村中正七街18號一樓","江寀青","500000","1101206"
"2236","90601187","可立承有限公司","新竹縣竹東鎮大同路149巷2號","何莉君","1000000","1101206"
"2237","90601193","德力強股份有限公司","花蓮縣花蓮市中原路439號1樓","卓馨茹","15000000","1101206"
"2238","90601200","京通有限公司","基隆市暖暖區過港里8鄰過港路20之1號4樓","李秀鑫","100000","1101206"
"2239","90601216","捷泰科技有限公司","雲林縣斗六市鎮西里樂利街53號4樓之15","詹惟政","800000","1101206"
"2240","90601222","尚順事業股份有限公司","彰化縣溪州鄉尾厝村農家路200巷1號5樓","劉俊佑","3600000","1101206"
"2241","90601237","茗祐農業有限公司","彰化縣福興鄉福興村沿海路5段臨269號","周辰祐","300000","1101206"
"2242","90601258","立遠電器有限公司","宜蘭縣三星鄉集慶村集慶三路52號","林志遠","900000","1101206"
"2243","90601264","九曌貿易有限公司","花蓮縣吉安鄉慶豐村慶豐十二街166巷16號1樓","謝青華","100000","1101206"
"2244","90601270","禾宜工程有限公司","屏東縣潮州鎮豐年街1號1樓","林宏憲","500000","1101206"
"2245","90601285","好事發生商貿有限公司","彰化縣彰化市平和五街46號7樓","蔡任斐","3000000","1101206"
"2246","90601291","儲電新能源股份有限公司","新竹市東區光復路二段295號14樓之3","李衍飛","1000000","1101206"
"2247","90601308","新台簾股份有限公司","彰化縣鹿港鎮玉順里鹿草路一段51號2樓","施金成","1000000","1101206"
"2248","90601314","泰昇利有限公司","彰化縣彰化市阿夷里泰和路二段346巷13號","鐘士哲","1000000","1101206"
"2249","90601320","淦先生有限公司","彰化縣田中鎮北路里中路街87號1樓","陳詩涵","200000","1101206"
"2250","90601335","翔禾投資有限公司","新竹市東區南大路222號2樓","楊翔力","13950300","1101206"
"2251","90601341","焌圻有限公司","彰化縣埤頭鄉芙朝村文化路775巷69弄9之1號1樓","曾榆翔","250000","1101206"
"2252","90601356","邦布企業有限公司","新竹縣寶山鄉雙新村18鄰明湖三街78號2樓","王中丞","3000000","1101206"
