"序號","統一編號","公司名稱","公司所在地","代表人","資本額","核准設立日期"
"1","24996131","台灣國玉科技股份有限公司","臺中市梧棲區頂寮里中橫十路100號","柯美玲","1000000","1110214"
"2","29188170","曜吉智能製造有限公司","臺中市大里區東湖里中興路一段159之1號3樓A339","楊芳茲","1000000","1110217"
"3","88264527","寶錸證券投資顧問股份有限公司","臺北市信義區忠孝東路5段508號13樓","黃建華","25000000","1110225"
"4","90171118","金錸鑫貿易有限公司","嘉義縣布袋鎮岑海里新北五街71號","張勝元","1000000","1110222"
"5","90171124","齊聖國際有限公司","雲林縣二崙鄉中山路一段241號1樓","陳雅萍","138000","1110222"
"6","90204292","禾雍有限公司","南投縣埔里鎮西門里西門一巷5-1號","蔡仲凱","1000000","1110222"
"7","90204315","潮群生物科技有限公司","基隆市中正區港通里信二路296-1號8樓之2","黃泰群","2000000","1110222"
"8","90204321","勤鎰投資顧問有限公司","基隆市信義區東信路180巷50之4號5樓","尹瑾婷","100000","1110222"
"9","90204336","季源建設有限公司","雲林縣斗六市梅林里梅林路130號1樓","賴俊吉","3000000","1110222"
"10","90204342","堉原科技有限公司","雲林縣斗六市龍潭里仁愛路156號2樓","陳霖琳","200000","1110222"
"11","90204363","宏全光電有限公司","雲林縣斗六市社口里20鄰中堅東路130巷68號1樓","馬煥杰","30500","1110222"
"12","90204379","摩蔬鮮有限公司","宜蘭縣宜蘭市進士里進士路173巷5號1樓","游張松","1000000","1110222"
"13","90204384","竣佳股份有限公司","屏東縣屏東市歸仁路91巷6號","程家蓁","3000000","1110222"
"14","90204390","安隆陞工程顧問股份有限公司","嘉義縣水上鄉中庄村中庄320號","周俊融","500000","1110222"
"15","90204413","青睿投資有限公司","苗栗縣苑裡鎮客庄里11鄰信義路4巷8號","郭守青","1000000","1110222"
"16","90204429","熊好貨有限公司","彰化縣員林市興昌街100號","張環麟","100000","1110222"
"17","90204455","金萬鑫股份有限公司","彰化縣鹿港鎮溝墘里鹿和路三段620巷17號","葉彥呈","30000000","1110223"
"18","90204461","阡宇行銷有限公司","新竹市北區聖軍路62號5樓","符婷婷","1000000","1110223"
"19","90204477","敦耀建設有限公司","花蓮縣吉安鄉太昌村4鄰明太街18巷2號1樓","鄭光志","2000000","1110223"
"20","90204482","正威鋼鐵有限公司","彰化縣員林市南東里員草路926號1樓","曾威統","600000","1110223"
"21","90204498","日光永續能源股份有限公司","臺東縣臺東市卑南里南一街118巷3號1樓","廖紹安","3000000","1110223"
"22","90204510","擇愛行銷有限公司","新竹縣竹東鎮五豐里五豐街23巷15號3樓","謝俊漢","300000","1110223"
"23","90204526","洛城餐飲股份有限公司","新竹縣竹北市莊敬南路29號","邱泰翰","8330000","1110223"
"24","90204531","福虎生豐有限公司","新竹市香山區五福路二段707號","鄭羽珊","10000","1110223"
"25","90204547","聖耀開發有限公司","新竹市東區自由路69號9樓之2","張曣之","200000","1110223"
"26","90204552","三井國際環保股份有限公司","新竹縣竹北市福興路979號一樓","詹辰瑋","100000","1110223"
"27","90204568","竑雲科技有限公司","新竹縣湖口鄉東興村中山路三段208巷50弄20號3樓","蔡裕淑","500000","1110223"
"28","90204574","客臨行銷有限公司","宜蘭縣員山鄉員山路1段662巷6號2樓","田文宣","500000","1110223"
"29","90204589","三井國際物業股份有限公司","新竹縣竹北市福興路979號一樓","詹辰瑋","100000","1110223"
"30","90204595","水想文創設計有限公司","新竹市東區科園里科學園路104號1樓","李品翰","500000","1110223"
"31","90204602","即創投資有限公司","新竹市東區龍山里光復路一段576巷17號","顏誠廷","10000","1110223"
"32","90204618","金銘山興業有限公司","南投縣名間鄉新民村外埔巷1-17號","張明山","100000","1110223"
"33","90204624","新華電通有限公司","新竹市北區育英里四維路89巷2-1號五樓之2","傅秀華","1000000","1110223"
"34","90204639","生之美藝術創作股份有限公司","花蓮縣吉安鄉勝安村慈惠三街71號1樓","郭啟英","1000000","1110223"
"35","90204645","益川有限公司","彰化縣彰化市茄南里茄南街48號1樓","梁家新","1000000","1110223"
"36","90204650","葳澤精密有限公司","彰化縣花壇鄉花壇村金墩街341號1樓","卓佳立","100000","1110223"
"37","90204666","海波浪文化事業有限公司","宜蘭縣頭城鎮濱海路5段451號","黃建圖","500000","1110223"
"38","90204672","柔恬妮股份有限公司","金門縣金湖鎮山外里下莊中興路101之8號","柯佳雯","3000000","1110223"
"39","90204687","東川工程有限公司","雲林縣古坑鄉東和村文化路139之39號1樓之2","曾裕寬","300000","1110223"
"40","90204693","金喜美投資有限公司","雲林縣西螺鎮埤頭里籃厝18-3號","李正喜","5000000","1110223"
"41","90204700","杰博特企業有限公司","嘉義市東區文雅里文雅街116巷9號1樓","黃嗣淵","5000000","1110223"
"42","90204716","裕盛水工機械有限公司","雲林縣二崙鄉湳仔村湳子路66-3號","李玉英","3000000","1110223"
"43","90204722","紘創環保股份有限公司","雲林縣斗六市成功里成功二街50號1樓","黃品誠","1000000","1110223"
"44","90204737","電到創商有限公司","屏東縣屏東市北興里23鄰公裕街202號","許柏緯","3000","1110223"
"45","90204743","三聖元宇宙科技有限公司","南投縣草屯鎮敦和里信義街167巷2號1樓","陳惠青","1000000","1110223"
"46","90204758","錤鋒工程有限公司","新竹縣湖口鄉中勢村吳厝路82號三樓之1","詹武達","1000000","1110223"
"47","90204764","樂甜植萃商業有限公司","新竹縣竹北市光明六路87之5號11樓","簡竹蔚","500000","1110223"
"48","90204770","銘品水產有限公司","宜蘭縣宜蘭市南津里縣政一街96巷7弄9號一樓","黃健銘","1000000","1110223"
"49","90204785","若恩景觀有限公司","新竹市香山區朝山里中華路五段520-1號","彭聖淇","1000000","1110223"
"50","90204791","宇翊綠能科技有限公司","屏東縣佳冬鄉昌隆村東昌路5號一樓","盧怜佑","500000","1110223"
"51","90204808","宜章科技有限公司","苗栗縣苗栗市維祥里1鄰維祥街65巷15號四樓","鄧宜民","1000000","1110223"
"52","90204814","鑫礦科技有限公司","苗栗縣頭份市土牛里7鄰中正路337巷38號一樓","劉素賢","10000","1110223"
"53","90204820","阿法爾有限公司","彰化縣和美鎮柑井里美寮路二段116巷臨131-1號","許嘉芸","200000","1110223"
"54","90204841","旭穩股份有限公司","新竹縣竹北市北崙里博愛街69號3樓","徐逢懋","1000000","1110223"
"55","90204856","金寬富餐飲食材有限公司","南投縣埔里鎮同聲里南興街188號","林奕安","6000000","1110223"
"56","90204862","鉌羚貿易有限公司","基隆市中正區港通里信二路296-1號12樓","呂相葦","200000","1110223"
"57","90204878","奇畔有限公司","彰化縣芳苑鄉三合村工區一路118巷40號","陳建其","500000","1110223"
"58","90204883","友春有限公司","彰化縣永靖鄉港西村中山路一段594巷6號","蘇西沛","300000","1110223"
"59","90204899","秝濠有限公司","彰化縣溪湖鎮番婆里美溪路一段45號","陳境輯","1000000","1110223"
"60","90204906","偉嘉城科技有限公司","新竹縣竹北市北興里勝利十一路260號8樓之2","李佳珮","3000000","1110223"
"61","90204912","噢噢好日子有限公司","彰化縣溪州鄉張厝村中路巷17號","包宇宸","100000","1110223"
"62","90204928","加貝不動產經紀有限公司","新竹市東區復中里中央路162巷1號","楊嘉寶","1000000","1110223"
"63","90204933","宏平工程有限公司","新竹市香山區牛埔里育德街109號1樓","陳信宏","500000","1110223"
"64","90204949","愛邇發內在智慧有限公司","新竹縣竹北市高鐵東二路6號6樓之3","林淳蓉","100000","1110223"
"65","90204954","星朵有限公司","宜蘭縣礁溪鄉大忠村7鄰礁溪路四段63巷6號三樓","曾鈺秀","1000000","1110223"
"66","90204960","國興食品科技有限公司","彰化縣員林市崙雅里崙雅巷15弄69號","張宏銘","600000","1110224"
"67","90204976","鴻湖數位股份有限公司","新竹市東區光明里光復路二段101號(南育成創新育成大樓R419-S)","楊意暐","10000000","1110224"
"68","90204981","鑫宸投資有限公司","新竹縣竹北市福興一路100號十三樓","林海威","2000000","1110224"
"69","90204997","海宇宙有限公司","新竹縣竹北市東興里日興一街6號7樓","江柏君","100000","1110224"
"70","90205026","銓錸科技股份有限公司","新竹市香山區中埔里中華路四段270巷33號2樓","曾泳泰","10000000","1110224"
"71","90205031","威豐準有限公司","新竹市北區中寮里天府路一段511號9樓","龔威元","2000000","1110224"
"72","90205047","釀造好日文化有限公司","苗栗縣頭份市山下里12鄰翠亨路177巷8號","傅偉珊","1000000","1110224"
"73","90205052","捷思工程有限公司","新竹縣湖口鄉成功路419之2號1樓","彭慶輝","1000000","1110224"
"74","90205068","日勝發開發有限公司","宜蘭縣羅東鎮中正南路125號2樓","黃哲雄","1000000","1110224"
"75","90205074","玖憶有限公司","新竹縣湖口鄉貴州街100巷3號6樓之2","鄭立楷","100000","1110224"
"76","90205089","湯姆帕克有限公司","宜蘭縣宜蘭市茭白里中山路五段155號一樓","邱松筠","200000","1110224"
"77","90205095","傑閔股份有限公司","新竹縣竹東鎮學府東路336巷27弄6號","毛政智","100000","1110224"
"78","90205118","立達精密製造股份有限公司","苗栗縣竹南鎮聖福里建國路336-2號","劉其立","5000000","1110224"
"79","90205124","信蘊科技股份有限公司","新竹市香山區中隘里中華路六段647巷31弄115號1樓","林景方","1000000","1110224"
"80","90205139","立新食品有限公司","基隆市仁愛區光華里獅球路34號1樓","謝文欽","1000000","1110224"
"81","90205145","村榮生物科技有限公司","基隆市安樂區樂利二街62巷93號","蕭國枰","200000","1110224"
"82","90205150","曜帆休閒事業有限公司","屏東縣東港鎮南平路139號2樓","龔建隆","300000","1110224"
"83","90205166","鑫東工程有限公司","苗栗縣苗栗市新川里3鄰龍岡48號2樓","陳源東","500000","1110224"
"84","90205172","講講堂文教事業有限公司","宜蘭縣礁溪鄉吳沙村四結67之3號","蔣忠華","29800000","1110224"
"85","90205187","代達洛斯有限公司","新竹市東區頂竹里南大路241號3樓之1","柯明將","1000000","1110224"
"86","90205193","德謚建設有限公司","嘉義縣太保市春珠里8鄰152號","李東陵","2000000","1110224"
"87","90205216","溢港有限公司","新竹市東區龍山里長春街125號2樓之2","王德誠","500000","1110224"
"88","90205222","鎧爾實業有限公司","屏東縣內埔鄉光明路284巷1號五樓之3","柯乃綸","2000000","1110224"
"89","90205237","蕾愛綺有限公司","新竹縣竹北市六家八街271號3樓","黃郁涵","500000","1110224"
"90","90205243","鈦得瑞金屬有限公司","宜蘭縣羅東鎮大新里公正路65號3樓之1","林紋瑄","1900000","1110224"
"91","90205264","義竹儲能股份有限公司","嘉義縣義竹鄉龍蛟村義工二路2號","謝菁菁","1500000","1110224"
"92","90205270","鈜泰建築開發股份有限公司","嘉義市東區荖藤里忠孝路806號1樓","吳偉銓","20000000","1110224"
"93","90205285","慶豐齒輪有限公司","彰化縣和美鎮犁盛里東祥路臨166號","顏聰智","500000","1110225"
"94","90205291","東安股份有限公司","新竹市東區中央路128號7樓","鄭集鴻","102900000","1110225"
"95","90205308","圓巢室內裝修工程有限公司","苗栗縣頭份市興隆里興隆路一段6號一樓","林育州","100000","1110225"
"96","90205314","采拾室內裝修設計有限公司","新竹縣竹北市高鐵東二路6號5樓之6","王毓瑄","500000","1110225"
"97","90205320","德利根有限公司","宜蘭縣員山鄉同新路404巷1弄11號","李明德","100000","1110225"
"98","90205335","冠泉光電有限公司","南投縣竹山鎮中山里埔頭街1巷22號一樓","余宗輝","1000000","1110225"
"99","90205341","元飆股份有限公司","金門縣金寧鄉東洲79號","陳瑾昇","300000","1110225"
"100","90205356","默茶生有限公司","雲林縣虎尾鎮安慶里民主八路50號1樓","吳泓逸","50000","1110225"
"101","90205362","品登整合行銷有限公司","基隆市暖暖區八堵里水源路2巷102-2號","簡禕瓴","700000","1110225"
"102","90205378","酆鉅開發建設有限公司","宜蘭縣宜蘭市光復路74號","李宸雍","3000000","1110225"
"103","90205383","點一點網路行銷有限公司","宜蘭縣冬山鄉永美村冬山路三段301巷51弄20號","李翩翩","500000","1110225"
"104","90205399","祿元股份有限公司","彰化縣福興鄉福寶村新生路19號1樓","黃榮華","24000000","1110225"
"105","90205412","詠立家具有限公司","彰化縣福興鄉頂粘村頂粘街436-7號","粘翔閔","1000000","1110225"
"106","90205428","雷勝竹木業有限公司","苗栗縣後龍鎮校椅里4鄰圪仔路40之8號1樓","劉志龍","30000","1110225"
"107","90205433","逵和有限公司","彰化縣芳苑鄉漢寶村草漢路漢寶段268巷58-1號","陳榮農","200000","1110225"
"108","90205449","茂全股份有限公司","彰化縣福興鄉福寶村新生路19號1樓","黃榮清","20000000","1110225"
"109","90205454","宏譽實業有限公司","彰化縣永靖鄉瑚璉村瑚璉路154巷18號2樓","林宛儒","100000","1110225"
"110","90205460","明冠工業有限公司","彰化縣花壇鄉橋頭村學士街68號","花正修","300000","1110225"
"111","90205476","尉嘉企業有限公司","彰化縣永靖鄉湳港村永社路235巷臨103號","余為縢","300000","1110225"
"112","90205481","逵立有限公司","彰化縣彰化市忠權里自強南路168巷26號1樓","張筱尼","5000000","1110225"
"113","90205497","洋鋐廣告開發實業有限公司","苗栗縣苗栗市玉華里玉維路33巷25-1號","徐美鈴","300000","1110225"
"114","90205503","泉展有限公司","屏東縣潮州鎮泗林里開元路1-2號1樓","林宥妤","200000","1110225"
"115","90205519","得富漁業有限公司","屏東縣東港鎮鎮海路7-15號1樓","段雪鶯","5000000","1110225"
"116","90205525","宇海國際有限公司","宜蘭縣頭城鎮環鎮東路二段601巷2號","歐陽宇峰","200000","1110225"
"117","90205530","旺承汽車有限公司","彰化縣彰化市東芳里線東路一段臨155號","宋昆憲","500000","1110225"
"118","90205546","宏邦環保有限公司","苗栗縣苗栗市文聖里國華路600巷77號","陳柏穎","100000","1110225"
"119","90205551","傳家不動產有限公司","屏東縣屏東市華山里大連路58-51號","林殷任","300000","1110225"
"120","90205567","海納一投資股份有限公司","新竹市北區境福街29號","鄭聰傑","100000000","1110225"
"121","90205594","景陽園藝有限公司","彰化縣員林市南平里莒光路745巷36號一樓","歐昶毅","2000000","1110225"
"122","90546093","優必達台灣有限公司","臺北市松山區復興北路99號10樓","郭榮昌","60000000","1110215"
"123","90546137","沛佳生醫有限公司","臺北市中山區中山北路2段77巷10號2樓","徐千惠","100000","1110215"
"124","90546158","達康實業有限公司","臺北市中山區南京東路1段25號8樓之2","賴惠玲","500000","1110214"
"125","90546164","遊聲堂顧問有限公司","臺北市中山區長安東路2段189號9樓之8","洪耀","480000","1110214"
"126","90546170","酒條通重慶台北有限公司","臺北市大同區重慶北路2段96號","余奇姝","2000000","1110214"
"127","90546185","盛文實業有限公司","臺北市中山區民權東路2段18號2樓","李余信榮","100000","1110214"
"128","90546191","永澄饌股份有限公司","臺北市內湖區瑞光路335號11樓","廖宇綺","5000000","1110215"
"129","90546208","樺麗丹有限公司","臺北市中山區南京東路2段150號2樓","劉怡珊","500000","1110214"
"130","90546220","金三角國際有限公司","臺北市士林區承德路4段255號1樓","柯講韜","2000000","1110214"
"131","90546241","心綺媒體有限公司","臺北市松山區南京東路3段287號10樓","黃思綺","500000","1110214"
"132","90546256","新馥有限公司","臺北市信義區光復南路429號3樓","黃琬玲","3500000","1110215"
"133","90546262","烯異材料科技有限公司","臺北市中山區林森北路627號5樓之3","李訓能","1000000","1110215"
"134","90546278","火箭資本有限公司","臺北市信義區信義路5段7號37樓","范振淵","1000000","1110215"
"135","90546283","蕪璞文創有限公司","臺北市大安區和平東路1段91號10樓","蘇柏青","800000","1110215"
"136","90546299","電波澎澎有限公司","臺北市文山區辛亥路4段128之1號1樓","潘畇羽","500000","1110215"
"137","90546306","齊善投資股份有限公司","臺北市信義區忠孝東路5段1之1號9樓","黃齊貞","3000000","1110215"
"138","90546312","州道創新有限公司","臺北市松山區八德路4段636之2號","高廷榕","100000","1110215"
"139","90546349","品喀有限公司","臺北市內湖區東湖路143號1樓","林有為","4000000","1110215"
"140","90546354","興德隆國際有限公司","臺北市信義區光復南路429號3樓","孫祥驥","300000","1110216"
"141","90546360","拓質實業有限公司","臺北市信義區光復南路429號3樓","吳安喬","1000000","1110215"
"142","90546376","盈化科技有限公司","臺北市中山區長安東路2段184號11樓之5","陳麗如","300000","1110215"
"143","90546397","麥頓管理顧問有限公司","臺北市內湖區民權東路6段180巷6號9樓之11","麥頓投資有限公司","100000","1110215"
"144","90546431","潤嘉美股份有限公司","臺北市大安區忠孝東路4段148號4樓之3","白惠珠","1000000","1110216"
"145","90546452","龍木柏森投資管理顧問有限公司","臺北市大同區延平北路3段4號5樓","林宏柏","1000000","1110215"
"146","90546468","主要創意事業有限公司","臺北市內湖區民權東路6段56巷19號","吳忠謀","1000000","1110215"
"147","90546495","淞輝企業有限公司","臺北市中正區寧波西街181巷32號","侯玟婷","500000","1110215"
"148","90546517","大珈電供有限公司","臺北市中山區復興北路48號3樓","邱聖峰","1000000","1110215"
"149","90546559","綠光創藝股份有限公司","臺北市信義區信義路4段415號12樓","吳文欽","300000","1110216"
"150","90546565","禾青有限公司","臺北市中正區中華路2段459之1號1樓","曾娟燊","3500000","1110215"
"151","90546571","不要緊有限公司","臺北市中山區玉門街１號","辛容君","130000","1110215"
"152","90546586","品鈞投資有限公司","臺北市士林區基河路16號9樓之3","郭小萍","3000000","1110215"
"153","90546592","寶笙有限公司","臺北市松山區民生東路5段106號","胡寶中","2000000","1110215"
"154","90546609","穗花婆婆有限公司","臺北市松山區敦化北路244巷19號","高佳穗","1500000","1110215"
"155","90546615","富信醫療器材有限公司","臺北市信義區忠孝東路5段1之1號13樓","盧姵伊","1000000","1110216"
"156","90546636","銀河生醫有限公司","臺北市中山區南京西路1之1號6樓","楊雙鴻","500000","1110215"
"157","90546642","為烽設計有限公司","臺北市萬華區昆明街79號9樓之5","陳睿棋","12000","1110215"
"158","90546663","仕捷股份有限公司","臺北市萬華區西寧南路192之4號1樓","鄧仕杰","2400000","1110216"
"159","90546679","好好電影製作有限公司","臺北市信義區忠孝東路5段1之4號7樓","莊淳淳","1680000","1110215"
"160","90546684","龍華新傳媒有限公司","臺北市士林區士東路266巷11弄11號1樓","陳偉民","1000000","1110215"
"161","90546690","菊川國際有限公司","臺北市中山區建國北路1段71號3樓之1","徐淑鈺","60000000","1110216"
"162","90546707","牧豐投資有限公司","臺北市內湖區文德路66巷32弄11號","黃奕惠","1000000","1110215"
"163","90546740","若水創意有限公司","臺北市中山區南京東路2段150號10樓","黃少民","200000","1110215"
"164","90546755","歆動珠寶股份有限公司","臺北市大安區仁愛路4段151巷13號2樓","詹賀筑","300000","1110215"
"165","90546761","豐凱控股有限公司","臺北市內湖區陽光街345巷12號4樓","張智賢","200000","1110215"
"166","90546777","盈天市務有限公司","臺北市中山區南京西路5之1號5樓之1","梁思駿","500000","1110216"
"167","90546798","肯班娛樂有限公司","臺北市大安區忠孝東路4段162號12樓之3","倪于盛","500000","1110215"
"168","90546832","環陽工程有限公司","臺北市松山區南京東路4段171號10樓之4","張許壽美","3000000","1110216"
"169","90546848","商美客科技有限公司","臺北市大安區光復南路260巷54號2樓","林昌鴻","100000","1110216"
"170","90546853","看見本質創創有限公司","臺北市信義區景雲街22之1號地下","邱貞瑛","810000","1110216"
"171","90546869","歐能股份有限公司","臺北市中正區忠孝東路2段100號8樓之1","黃伯仲","6000000","1110216"
"172","90546875","先峰管理顧問有限公司","臺北市中正區重慶南路1段57號12樓之12","彭科穎","100000","1110217"
"173","90546880","確勵台灣電子有限公司","臺北市大安區光復南路72巷73號2樓","李家瑞","871640","1110216"
"174","90546896","陸斯特國際有限公司","臺北市松山區南京東路4段186號10樓之8","黃奕銘","1500000","1110216"
"175","90546903","騰加數位服務股份有限公司","臺北市信義區基隆路2段189號15樓之6","張婷婷","30000000","1110216"
"176","90546919","泱泱實業有限公司","臺北市大同區塔城街49號","周子鈞","1010000","1110216"
"177","90546925","想食數位股份有限公司","臺北市大同區民權西路136號10樓之5","何彥叡","100000","1110216"
"178","90546930","新一餐飲有限公司","臺北市中山區四平街56號2樓之1","郭芸杏","5000000","1110216"
"179","90546946","康允仁心股份有限公司","臺北市中正區羅斯福路2段140號11樓之2","薛博文","500000","1110216"
"180","90546951","欸抖咖啡有限公司","臺北市中山區大直街20巷15號","許明韶","3600000","1110216"
"181","90546967","皓然投資有限公司","臺北市中正區衡陽路36號5樓之6","黃坤鍵","5000000","1110216"
"182","90546973","因的波有限公司","臺北市中正區紹興北街3號2樓","張鈞端","1000000","1110217"
"183","90546994","元勤國際科技有限公司","臺北市大安區忠孝東路4段142號5樓之5","楊哲隆","1000000","1110216"
"184","90547001","凡德貿易有限公司","臺北市北投區裕民六路120號4樓","謝治勳","200000","1110216"
"185","90547017","鎂碁科技有限公司","臺北市內湖區陽光街345巷14號4樓","許峰銘","200000","1110216"
"186","90547023","凱樂衛浴股份有限公司","臺北市內湖區內湖路1段66號","徐析茗","2000000","1110216"
"187","90547038","北舍生活有限公司","臺北市松山區民生東路5段69巷23號","鄭廷緯","400000","1110216"
"188","90547059","長典生物科技股份有限公司","臺北市松山區敦化北路218號7樓","紫宸","1000000","1110217"
"189","90547065","開展洛城股份有限公司","臺北市大安區敦化南路2段77號17樓","邱泰翰","2000000","1110216"
"190","90547071","鵬耀有限公司","臺北市松山區民生東路5段175號6樓之7","孫辭涵","500000","1110216"
"191","90547086","北能投資股份有限公司","臺北市松山區敦化北路168號15樓","Jose Felipe Montero Mora","600000","1110216"
"192","90547092","北堂有限公司","臺北市松山區復興北路15號5樓之9","洪煜豪","200000","1110216"
"193","90547115","智鎧行有限公司","臺北市中山區復興北路48號3樓","郭鑄中","500000","1110216"
"194","90547121","興新隆國際股份有限公司","臺北市信義區基隆路1段155號11樓之5","黃皓暉","1000000","1110216"
"195","90547136","台灣大勇鋼結構有限公司","臺北市大安區敦化南路2段207號16樓","黎氏虹","3027992","1110216"
"196","90547142","妮家有限公司","臺北市中正區館前路20號5樓","鄭舜文","100000","1110216"
"197","90547157","那瓦國際股份有限公司","臺北市中山區敬業一路128巷51號6樓之2","楊國興","1005000","1110216"
"198","90547179","采奕有限公司","臺北市信義區基隆路2段81之1號12樓","邱敏倩","1000000","1110216"
"199","90547184","好事齊有限公司","臺北市中山區林森北路592之8號3樓","吳序騰","100000","1110216"
"200","90547207","台灣凸版電子股份有限公司","臺北市松山區民生東路3段109號10樓","植木 哲朗","230000000","1110216"
"201","90547229","星愷資訊有限公司","臺北市中山區松江路485號","郭思妤","200000","1110216"
"202","90547234","飛廉投資股份有限公司","臺北市大安區忠孝東路3段305號4樓之4","楊右任","1000000","1110216"
"203","90547240","光文創行銷有限公司","臺北市中山區四平街56號2樓之1","陳弈揚","100000","1110216"
"204","90547255","優霓裳國際有限公司","臺北市松山區八德路4段604號2樓之4","余政慧","200000","1110216"
"205","90547261","鯨智有限公司","臺北市大安區敦化南路1段228號4樓","許維恕","200000","1110216"
