"序號","統一編號","公司名稱","公司所在地","代表人","資本額","核准設立日期"
"1024","90280679","童衣閣有限公司","臺中市龍井區山腳里中山一路一段43巷43號1樓","林佩盈","200000","1110609"
"1025","90280684","集元科技有限公司","臺中市西區民龍里臺灣大道二段181號5樓之19","劉正仁","3000000","1110609"
"1026","90280690","禾寓投資有限公司","臺中市西屯區潮洋里朝富路213號10樓之3","鄭英奇","27000000","1110609"
"1027","90280707","拉繆斯股份有限公司","臺中市潭子區福潭路515巷7號1樓","林玉佩","5000000","1110609"
"1028","90280729","艾德客製光學有限公司","臺中市西區公平里忠明南路112號","黃志昌","1000000","1110609"
"1029","90280740","鈦金殿數位科技有限公司","臺中市潭子區家興里大通街93巷87弄12號1樓","黃崇愷","1200000","1110609"
"1030","90280755","領鮮家食品股份有限公司","臺中市西屯區何厝東二街23號9樓之3","楊秀容","200000","1110609"
"1031","90280761","君德國際開發有限公司","臺中市西區華美西街一段137號4樓之1","陳君風","1000000","1110609"
"1032","90280777","淩威實業有限公司","臺中市北屯區文心路三段447號4樓","林雪玉","500000","1110609"
"1033","90280782","金瑪國際貿易有限公司","臺中市豐原區圳寮里榮春街66號","呂章偉","1000000","1110609"
"1034","90280798","光海有限公司","臺中市西區土庫里五權西六街89號1樓","歐瑞龍","100000","1110609"
"1035","90280805","奇耀健康事業有限公司","臺中市西區美村路一段621號3樓","洪祥恩","300000","1110609"
"1036","90280811","巨德工業有限公司","臺中市神岡區岸裡里大豐路五段295巷76號","蕭駿森","1000000","1110609"
"1037","90280827","育培細胞科技有限公司","臺中市南屯區大墩十一街549號13樓之2","孫德惠","450000","1110609"
"1038","90280832","明桎有限公司","臺中市西區公舘里三民西路86號","童璽晉","300000","1110609"
"1039","90280848","金和唐建設有限公司","臺中市豐原區合作街118巷16號1樓","鄭志浩","3000000","1110609"
"1040","90280853","森暘清潔有限公司","臺中市北區新北里三民路三段132號3樓","石崇暘","100000","1110609"
"1041","90280869","大有綠能科技股份有限公司","臺中市新社區大復街16之1號1樓","劉亦翔","500000","1110609"
"1042","90280875","湧昇水電有限公司","臺中市太平區東汴里長龍路三段372號1樓","王祥恩","200000","1110609"
"1043","90280880","聚彩有限公司","臺中市沙鹿區六路里六路十街120號","石嘉偉","500000","1110609"
"1044","90280896","信誠美投資有限公司","臺中市西區東昇里公館路168號2樓","廖宏恩","500000","1110609"
"1045","90280903","成溱科技有限公司","臺中市北屯區和平里軍福九路550號1樓","劉媛薰","1000000","1110609"
"1046","90280919","木亦有限公司","臺中市潭子區潭陽里潭興路三段15號3樓之2","許嘉泰","2000000","1110609"
"1047","90280925","協行教育文化股份有限公司","臺中市西屯區市政北二路236號21樓之1","李育儒","1000000","1110609"
"1048","90280930","峻嘉精密股份有限公司","臺中市霧峰區甲寅里中正路1196號9樓","劉桓寓","3200000","1110609"
"1049","90280946","立寶通訊有限公司","臺中市龍井區龍新路76巷85號","張筱青","500000","1110609"
"1050","90280951","盈科綠能有限公司","臺中市西屯區市政北二路238號16樓之2","蕭永吉","50000","1110609"
"1051","90280967","陳氏姐弟廣告有限公司","臺中市北屯區忠平里陳平一街48號9樓之1","陳維新","80000","1110609"
"1052","90280973","金博康科技有限公司","臺中市大里區大里里大里街78號1樓","張博鈞","200000","1110609"
"1053","90280988","澤富富股份有限公司","臺中市西屯區協和里順和六街51號6樓之1","龔澤民","1000000","1110609"
"1054","90280994","丞欣精密有限公司","臺中市霧峰區舊正里豐正路158號1樓","李育丞","100000","1110609"
"1055","90281001","旺庭景觀有限公司","臺中市豐原區南嵩里水源路南坑巷3之1號","張仕宏","168000","1110609"
"1056","90281017","凱燕國際汽車有限公司","臺中市西屯區何厝里何厝東二街23號9樓之3","吳祥銘","100000","1110609"
"1057","90281023","慈喜貿易有限公司","臺中市西屯區惠來里市政北七路186號12樓之9","魏慈嫻","2000000","1110609"
"1058","90281038","晨玉科技有限公司","臺中市北屯區松和里松文街25號","李晨玉","200000","1110610"
"1059","90281059","本番股份有限公司","臺中市西區公益里公正路210巷40號1樓","楊哲浩","1000000","1110610"
"1060","90281065","晨本有限公司","臺中市西屯區何南里大墩二十街118號5樓之1","吳秉旭","100000","1110610"
"1061","90281071","積木互動娛樂股份有限公司","臺中市西區公德里忠明南路138號5樓之2","李健豪","3000000","1110610"
"1062","90281086","鏈結行銷有限公司","臺中市西屯區何成里大容東街90號7樓之1","鄭婷","100000","1110610"
"1063","90281092","新唐不銹鋼實業有限公司","臺中市太平區宜昌里宜欣路52巷2號4樓","唐又在","1000000","1110610"
"1064","90281115","日月言成投資有限公司","臺中市石岡區金星里明德路187巷7弄1號2樓","陸明誠","1000000","1110610"
"1065","90281121","境閣股份有限公司","臺中市烏日區九德里中華路60號1樓","康聰賢","1000000","1110610"
"1066","90281136","傑穗國際有限公司","臺中市西屯區何成里大恩街5號4樓之5","鄭仁傑","300000","1110610"
"1067","90281142","日泰金屬有限公司","臺中市北屯區仁美里豐樂路3巷2弄59號1樓","詹雅雯","1000000","1110610"
"1068","90281157","盈立有限公司","臺中市西區大忠里忠明南路270號7樓之1","楊軒怡","1000000","1110610"
"1069","90281163","喆城開發股份有限公司","臺中市西屯區協和里安和路33之5號1樓","戴媛芝","1400000","1110610"
"1070","90281179","裕興能源開發有限公司","臺中市南屯區豐樂里文心南路288號14樓之2","吳世國","6000000","1110610"
"1071","90281184","開啟投資開發有限公司","臺中市北區頂厝里進化北路238號10樓之3","陳秉均","500000","1110610"
"1072","90281190","妍呈有限公司","臺中市清水區南社里信義五街30號1樓","劉仲智","1200000","1110610"
"1073","90281213","三育紘工程有限公司","臺中市大雅區民豐街120號","黃竑騰","1000000","1110610"
"1074","90281229","益弘設計顧問有限公司","臺中市東區立德街180號2樓","魏弘翔","200000","1110610"
"1075","90281240","晴星實業有限公司","臺中市西屯區上明二街8號11樓之2","柯學毅","1000000","1110610"
"1076","90281255","綠研實業有限公司","臺中市北區賴興里文昌東二街68號1樓","徐銘薇","2000000","1110610"
"1077","90281261","騰浩昇通運股份有限公司","臺中市梧棲區中正里中和街170巷11號1樓","兵素珍","200000","1110610"
"1078","90281277","昇鉞貿易有限公司","臺中市西屯區大鵬里文心路三段241號21樓之7","古俊男","600000","1110610"
"1079","90281282","飛豪餐飲有限公司","臺中市北區健行里忠明路424地下一層之2號","林思瀚","100000","1110610"
"1080","90281305","宏恩美容中心有限公司","臺中市太平區環中東路四段61號1樓","董齊焜","500000","1110610"
"1081","90281311","日果乳坊股份有限公司","臺中市南屯區同心里文心路一段186號20樓","陳佑易","1200000","1110610"
"1082","90281327","臣原有限公司","臺中市西屯區臺灣大道四段847號12樓","施惠淇","1000000","1110610"
"1083","90281332","洪民維修有限公司","臺中市龍井區新東里臺灣大道五段3巷2號1樓","洪梓閔","100000","1110610"
"1084","90281348","杰森宙有限公司","臺中市南屯區田心里大墩四街321號地下一層","劉子杰","400000","1110610"
"1085","90281353","晴野行銷有限公司","臺中市西屯區何安里臺灣大道二段910號11樓之5","林淑真","200000","1110610"
"1086","90281369","日洵美學有限公司","臺中市西屯區中康街245之3號1樓","黃珮筠","1000000","1110610"
"1087","90281375","仃杉有限公司","臺中市西屯區臺灣大道三段390號","陳正倫","1562500","1110610"
"1088","90281380","豐沛綠能生技有限公司","臺中市西區民龍里臺灣大道二段239號13樓","楊偉華","100000","1110610"
"1089","90281396","富立亞實業有限公司","臺中市北屯區平順里昌平路一段388號9樓之1","俞筠芳","2000000","1110610"
"1090","90281419","台灣晶向科技有限公司","臺中市西區安龍里忠仁街163巷16號2樓","陳建宏","700000","1110610"
"1091","90281425","鑫菲有限公司","臺中市南屯區向上路一段167號3樓之2","何琬琳","1000000","1110610"
"1092","90281430","耘飛科技有限公司","臺中市神岡區豐洲里前寮路60之8號1樓","劉子耘","600000","1110610"
"1093","90281446","艾昌瑞實業有限公司","臺中市西屯區福聯里福順路821巷58號1樓","張世達","1000000","1110610"
"1094","90281451","佳研智聯股份有限公司","臺中市南屯區精科路2號","劉克振","93000000","1110610"
"1095","90281467","幸陽建設有限公司","臺中市龍井區南社路二段150號1樓","楊璽民","188588","1110610"
"1096","90281473","芳鄰家居設計有限公司","臺中市大甲區文武里五福街225號","劉芳玲","300000","1110610"
"1097","90281488","領先供應鏈與物流有限公司","臺中市西區平和里柳川東路二段147號12樓之13","簡坤芳","50000","1110610"
"1098","90281494","星貴投資有限公司","臺中市豐原區田心里育英路100巷28弄43號","江孟儒","1000000","1110613"
"1099","90281500","和鉅鋼鋁有限公司","臺中市大里區大明里東興路66之2號6樓之5","陳香吟","1000000","1110613"
"1100","90281516","帝封企業有限公司","臺中市大里區仁化里仁化路574號1樓","陳玉峰","1000000","1110613"
"1101","90281537","創優有限公司","臺中市南屯區公益路二段61號3樓之2","林子傑","1000000","1110613"
"1102","90281543","中龍防火科技建材股份有限公司","臺中市龍井區三港路水裡港巷21之49號","方俊格","5000000","1110613"
"1103","90281558","億龍投資有限公司","臺中市北區大德街13巷3號1樓","周奕緯","5000000","1110613"
"1104","90281564","皓準科技股份有限公司","臺中市南區和平里忠明南路758號10樓","王議弘","2500000","1110613"
"1105","90281570","十一室研有限公司","臺中市西區忠明里博館路117號3樓之2","朱玉軒","600000","1110613"
"1106","90281585","六福資本管理顧問股份有限公司","臺中市北區金華里雙十路二段101號2樓之5","謝明宏","200000","1110613"
"1107","90281591","幸品有限公司","臺中市南屯區惠中里文心路一段376號1樓、2樓","洪辰琳","1000000","1110613"
"1108","90281608","立佳軒有限公司","臺中市西區民龍里臺灣大道二段375號12樓之1","李育庭","1000000","1110613"
"1109","90281614","京城不動產經紀有限公司","臺中市太平區新高里樹德路372號","陳彥融","4000000","1110615"
"1110","90281620","德哥琍有限公司","臺中市西區土庫里忠明南路497號1樓","丁兆元","100000","1110613"
"1111","90281635","初元股份有限公司","臺中市西屯區市政北一路77號13樓之2","施江東","10000000","1110613"
"1112","90281641","宣傑科技股份有限公司","臺中市大里區西湖里草湖路261號1樓","陳宣宇","10000000","1110613"
"1113","90281656","純淨食品科研股份有限公司","臺中市西屯區何安里臺灣大道二段910號11樓之5","鄭巧妮","1289000","1110613"
"1114","90281678","聖葉不動產仲介有限公司","臺中市西屯區西安里逢甲路250號1樓","蔡叔朋","500000","1110613"
"1115","90281683","陳蓁設計室內裝修工程有限公司","臺中市南屯區黎明里干城街194巷3號","陳昱蓁","200000","1110613"
"1116","90281699","辰禹創新國際有限公司","臺中市西區忠明南路16號6樓之7","紀樹竹","100000","1110613"
"1117","90281712","人本自然食品股份有限公司","臺中市西屯區潮洋里市政北二路238號27樓之1","李玉玲","980000","1110613"
"1118","90281728","盼盼健康有限公司","臺中市南屯區同心里五權西路二段260號1樓","傅筠棋","100000","1110613"
"1119","90281733","濬揚國際股份有限公司","臺中市北區光大里中清路一段100號12樓之2","王俊雄","2400000","1110613"
"1120","90281749","金霖全球電商股份有限公司","臺中市北屯區天津路三段50號1樓","鄧潔婷","100000","1110613"
"1121","90281754","正德生技有限公司","臺中市沙鹿區六路里平等11街65號1樓","張志正","50000","1110613"
"1122","90281760","利休空間整合有限公司","臺中市西區民龍里臺灣大道二段307號24樓","楊詠寗","200000","1110613"
"1123","90281776","豐榮國際企業有限公司","臺中市西屯區港尾里中康街160號","王浩鎧","1000000","1110614"
"1124","90281781","瀚聯機電有限公司","臺中市南屯區文山里忠勇路52之256號1樓","黃至央","400000","1110614"
"1125","90281797","雄淋事業有限公司","臺中市大里區西湖里景庄街202巷35弄5號","謝文雄","1030000","1110614"
"1126","90281804","聚合數位股份有限公司","臺中市南屯區同心里文心路一段186號20樓","李宗錡","1000000","1110614"
"1127","90281810","富米股份有限公司","臺中市西區五權路1之67號5樓","邱俊叡","500000","1110614"
"1128","90281826","裕鑫有限公司","臺中市西區民龍里臺灣大道二段285號22樓之5","何繼云","10000000","1110614"
"1129","90281831","灃玉有限公司","臺中市東區十甲里東英九街87號1樓","周宇廷","400000","1110614"
"1130","90281847","九醬動畫設計有限公司","臺中市北屯區太和一街123號3樓之2","劉昭慶","100000","1110614"
"1131","90281852","睿畇有限公司","臺中市西區東興路三段156之1號2樓","王繹鈞","300000","1110614"
"1132","90281868","永昌泰營建有限公司","臺中市潭子區頭家東里中山路一段184巷37號1樓","楊小燕","3600000","1110614"
"1133","90281874","雅寬開發建設股份有限公司","臺中市大甲區蔣公路287號2樓","王永寬","80000000","1110614"
"1134","90281889","昺燊能源股份有限公司","臺中市北屯區陳平里雷中街19巷7號6樓之3","陳麗娟","100000","1110614"
"1135","90281895","日澈設計制作有限公司","臺中市西屯區工業區一路6號12樓之5","何思佑","200000","1110614"
"1136","90281902","大盛欣典實業股份有限公司","臺中市西屯區西墩里上墩西街68號1樓","吳靜宜","2500000","1110614"
"1137","90281918","均億生技國際有限公司","臺中市太平區新福路18號1樓","賴雍翔","1000000","1110614"
"1138","90281924","金界金屬事業有限公司","臺中市西屯區西平里西安街111號1樓","廖智輝","1000000","1110614"
"1139","90281939","金岳科技有限公司","臺中市南屯區義芳街25號7樓之1","邱婷妮","100000","1110614"
"1140","90281945","海帝有限公司","臺中市西區忠義街51巷21號1樓","柯霖","800000","1110614"
"1141","90281950","青庭國際有限公司","臺中市南屯區永定里永春東七街642號3樓","劉郁青","500000","1110614"
"1142","90281966","凡木文化有限公司","臺中市西屯區何安里臺灣大道二段910號8樓之6","王韻茿","200000","1110616"
"1143","90281972","華研國際生醫股份有限公司","臺中市太平區福隆里光興路1886號1樓","張稟旭","3000000","1110614"
"1144","90281987","築雅居室內裝修設計有限公司","臺中市北屯區中清路二段1166巷28弄119號3樓","黃經哲","100000","1110614"
"1145","90281993","大育精密有限公司","臺中市大里區東湖里忠孝路11號","潘昰瑋","5000000","1110614"
"1146","90282000","唷齁齁有限公司","臺中市西屯區大鵬里中平路212號7樓之2","游琬芯","1000000","1110614"
"1147","90282016","第二人生國際有限公司","臺中市南屯區同心里文心路一段218號16樓之1","賴忠毅","1000000","1110614"
"1148","90282022","鴻誠國際顧問有限公司","臺中市北區中清路一段447號10樓之7","周哲雄","300000","1110614"
"1149","90282037","抖印傳播媒體有限公司","臺中市南區和平里忠明南路758號17樓","李大任","500000","1110614"
"1150","90282043","虎頭蜂投資有限公司","臺中市北屯區和平里和祥三街78號1樓","李佩靜","6500000","1110614"
"1151","90282058","傑勝有限公司","臺中市新社區中和街五段99號","巫智晉","1500000","1110614"
"1152","90282064","潔雙有限公司","臺中市大雅區民生路一段137號","陳思穎","2000000","1110614"
"1153","90282070","霓德實業有限公司","臺中市南區南和里忠明南路916號21樓之2","鍾丑智","1000000","1110614"
"1154","90282085","新德工程股份有限公司","臺中市西區大忠里忠明南路270號7樓之1","張菀貽","22500000","1110614"
"1155","90282091","晶立佳有限公司","臺中市北屯區平和里安順東二街10號1樓","陳翰陞","500000","1110614"
"1156","90282114","閎茂有限公司","臺中市豐原區南嵩里水源路南坑巷28之3號1樓","林永欽","100000","1110614"
"1157","90282120","旭耀健康顧問有限公司","臺中市北屯區崇德五路107號","黃荻坭","1000000","1110614"
"1158","90282135","晶流投資有限公司","臺中市西區民龍里臺灣大道二段239號13樓","劉丞修","100000","1110614"
"1159","90282141","碩宇生技有限公司","臺中市北區頂厝里崇德路一段629號19樓之2","王玉芬","1000000","1110614"
"1160","90282156","中馹股份有限公司","臺中市大肚區瑞井里遊園路一段87號1樓","陳麗雯","1000000","1110614"
"1161","90282162","公主奶茶有限公司","臺中市西區公平里大業路2號1樓","侯君誼","200000","1110615"
"1162","90282178","鋅享有限公司","臺中市潭子區頭張路一段86巷9號12樓","黃薇蒨","100000","1110615"
"1163","90282183","古蘿蔔遊戲有限公司","臺中市清水區清水里星海路18巷29號3樓","王政煒","1500000","1110615"
"1164","90282199","凱文精密有限公司","臺中市西區美村路一段668號2樓","陳相文","500000","1110615"
"1165","90282206","騉鵬科技有限公司","臺中市大里區仁德里仁愛路10巷6號1樓","林士雋","1000000","1110615"
"1166","90282212","旭升昌投資有限公司","臺中市南屯區同心里南屯路二段290號12樓之2","陳丁嘉","5000000","1110615"
"1167","90282228","木森綠能股份有限公司","臺中市西屯區重慶路298之10號","魏瑞雲","100000","1110615"
"1168","90282233","恆威股份有限公司","臺中市太平區宜欣二街28號","魏辰光","2000000","1110615"
"1169","90282249","利易達半導體設備股份有限公司","臺中市北屯區四平路51巷7之2號","陳美娟","1200000","1110615"
"1170","90282254","品昱國際貿易有限公司","臺中市沙鹿區星河路280之1號3樓","林盈君","3500000","1110615"
"1171","90282260","京劍網路科技有限公司","臺中市南屯區同心里文心路一段186號20樓","孔盈婷","600000","1110615"
"1172","90282276","格棋化合物半導體股份有限公司","臺中市后里區公安路一段33號","張忠傑","64000000","1110615"
"1173","90282281","辰冊自造企劃有限公司","臺中市西區臺灣大道二段307號6樓之1","陳湘筠","1000000","1110615"
"1174","90282297","煌朝有限公司","臺中市西區和龍里臺灣大道二段2號6樓之2","黃昱程","500000","1110615"
"1175","90282304","華美建材五金有限公司","臺中市神岡區北庄里中山路1200號1樓","李易炫","400000","1110615"
"1176","90282310","兆碩生活館有限公司","臺中市大里區新仁里新仁路一段59巷20之6號1樓","賴彥吟","500000","1110615"
"1177","90282326","開鎰機械有限公司","臺中市烏日區五光里五光路189巷112之18號","魏韋毅","2000000","1110615"
"1178","90282347","古中寮有限公司","臺中市南區樹義里大慶街一段271號","潘信儀","2000000","1110615"
"1179","90282352","元興順工業有限公司","臺中市梧棲區草湳里自強二街96巷42號1樓","林世忠","4000000","1110615"
"1180","90282368","芯耀科技有限公司","臺中市南屯區河南路四段350巷12號15樓之3","陳煌恩","100000","1110615"
"1181","90282374","玩美科創有限公司","臺中市西區大忠里大忠南街55號7樓之5","許芷榕","100000","1110615"
"1182","90282389","假期溫水休閒有限公司","臺中市大里區文心南路1310號","陳吉政","500000","1110615"
"1183","90282395","沐沐地瓜球行銷有限公司","臺中市太平區新吉里育德路256號3樓","許翔廷","200000","1110615"
"1184","90282418","巨榮企業股份有限公司","臺中市龍井區三港路水裡港巷21之48號1樓","柯心榆","2000000","1110615"
"1185","90282424","禾聯工業有限公司","臺中市南屯區大興里精誠路730號1樓","沈佳宜","15000000","1110615"
"1186","90282439","圖爾工業有限公司","臺中市南區和平里忠明南路758號11樓","李珮","5000000","1110615"
"1187","90282445","格芮絲國際企業有限公司","臺中市西屯區逢福里河南路二段262號12樓之8","徐登康","1000000","1110615"
"1188","90282450","美好笑容有限公司","臺中市北區大義街29巷18號3樓之3","黃淳逸","5000","1110615"
"1189","90282466","無畏町有限公司","臺中市北屯區北京里北屯路56巷13號1樓","何衛","300000","1110615"
"1190","90282472","齊天五權有限公司","臺中市西區後龍里五權路38之1號","湯俊銘","250000","1110615"
"1191","90282487","真善美能源有限公司","臺中市南區崇倫街72巷42號1樓","黎昱佑","600000","1110615"
"1192","90282493","斯獵克有限公司","臺中市南屯區干城街240巷3弄5號2樓","馮顏嶸","900000","1110615"
"1193","90282509","億縱電腦有限公司","臺中市北區新北里一中街160之32號2樓","黃傑鍵","500000","1110615"
"1194","90282515","可宸有限公司","臺中市太平區新福里旱溪西路二段216號1樓","張淑惠","300000","1110615"
"1195","90282521","山春良泉國際股份有限公司","臺中市潭子區大通街53巷18號1樓","張居正","10000000","1110615"
"1196","90282536","禮享生物科技有限公司","臺中市霧峰區錦榮里成功路102巷6號3樓","林政義","1000000","1110615"
"1197","90282542","科宇國際開發有限公司","高雄市鼓山區美術東四路69號6樓","張柳淳","1000000","1110621"
"1198","90282557","鈺程資源回收有限公司","高雄市鳳山區公園一街26巷7號","林榮吉","300000","1110621"
"1199","90287223","循蕈房農業科技有限公司","高雄市前金區文武二街163號4樓","彭裕軒","100000","1110531"
"1200","90287259","福舫資產管理股份有限公司","高雄市鼓山區翠華路130號1樓","余福能","50000","1110601"
"1201","90287265","陞豪實業有限公司","高雄市燕巢區瓊林路76之1號1樓","曾琳珊","3000000","1110531"
"1202","90287321","欣嘉健康事業有限公司","高雄市三民區博愛一路70號11樓","鄧欣宜","100000","1110601"
"1203","90287342","馨禾生醫股份有限公司","高雄市左營區文學路25號4樓","蔡甄眞","2000000","1110531"
"1204","90287363","珀豐有限公司","高雄市仁武區成功路60號1樓","何之甫","300000","1110531"
"1205","90287379","群杰環保企業有限公司","高雄市苓雅區建國一路62巷55弄2號1樓","盧昌敏","1000000","1110601"
"1206","90287384","古潤行銷有限公司","高雄市前鎮區民權二路380號8樓之1","林俊竹","600000","1110601"
"1207","90287390","零碳資本股份有限公司","高雄市橋頭區橋頭路91號","藍鈺荃","1000000","1110601"
"1208","90287413","富必加一國際有限公司","高雄市新興區民權一路251號11樓之1","徐麗凰","100000","1110601"
"1209","90287429","貝妮斯甜點有限公司","高雄市鼓山區壽山街13之3號","張婷惠","500000","1110601"
"1210","90287434","宇正數位工程有限公司","高雄市苓雅區中正一路315號10樓之1","葉得勝","1000000","1110601"
"1211","90287440","銡泰工業有限公司","高雄市楠梓區立仁街96巷80號1樓","嚴宏杰","1500000","1110601"
"1212","90287455","宸星工程有限公司","高雄市鳳山區鳳埤街96號1樓","吳凱揚","150000","1110601"
"1213","90287461","竹中有限公司","高雄市新興區民權一路251號11樓之1","陳英傑","100000","1110601"
"1214","90287477","芊庭開發工程有限公司","高雄市前鎮區鎮東一街406巷1號1樓之3","金芸庭","7200000","1110601"
"1215","90287482","亨駒汽車有限公司","高雄市左營區政德路771號1樓","余志國","2000000","1110601"
"1216","90287498","宏定康企業有限公司","高雄市楠梓區楠梓路456巷31號1樓","梁品洋","3000000","1110601"
"1217","90287504","方舟開發建設有限公司","高雄市鳳山區和成路65號3樓","黃加安","5000000","1110601"
"1218","90287510","雲石建設有限公司","高雄市大樹區大坑路50之7號1樓","吳啟銘","50000","1110601"
"1219","90287526","逸石室內設計有限公司","高雄市新興區中山一路14號9樓之11","林柳妘","300000","1110601"
"1220","90287531","興泰物流有限公司","高雄市小港區翠亨南路187號1樓","陳小雲","500000","1110601"
"1221","90287552","唯修精密有限公司","高雄市前鎮區育群街1之1號15樓","鄭閔獻","500000","1110601"
"1222","90287568","信映塑膠有限公司","高雄市仁武區竹後里竹工一巷3號","陳謝麗玉","500000","1110601"
"1223","90287574","八吉企業有限公司","高雄市仁武區八德一路321號4樓","蔡學昌","1000000","1110601"
