"序號","統一編號","公司名稱","公司所在地","代表人","資本額","核准設立日期"
"2855","90355426","飛天馬資產管理股份有限公司","臺北市大安區忠孝東路4段270號3樓之1","林依伶","7200000","1110623"
"2856","90355431","數位創億股份有限公司","臺北市內湖區南京東路6段501號4樓","楊利永","3000000","1110624"
"2857","90355447","原屴投資股份有限公司","臺北市中山區長安東路2段31號4樓之7","呂淑娥","4000000","1110623"
"2858","90355468","唯實顧問有限公司","臺北市中山區復興北路288號5樓之1","陸正康","300000","1110623"
"2859","90355474","禹宣有限公司","臺北市中山區南京東路2段137號14樓","朱姵萱","200000","1110623"
"2860","90355489","聚樂有限公司","臺北市士林區中山北路7段14巷30弄9之1號1樓","謝功振","2000000","1110623"
"2861","90355495","聚氟貿易有限公司","臺北市中山區南京西路1之1號11樓","黃婷怡","5000000","1110623"
"2862","90355501","潮洋整合有限公司","臺北市中山區南京東路1段34號7樓","張嘉麒","100000","1110623"
"2863","90355517","佳麗聯通有限公司","臺北市中正區開封街1段2號7樓之1","李旭東","2000000","1110623"
"2864","90355523","燕新國際股份有限公司","臺北市大安區安和路2段213號3樓之2","宋威臣","3000000","1110623"
"2865","90355538","文禧創作行銷整合有限公司","臺北市中山區南京東路2段150號2樓","邵韋蓉","1000000","1110623"
"2866","90355559","春盛志業有限公司","臺北市萬華區環河南路2段276號6樓之6","吳念眞","500000","1110623"
"2867","90355565","享元食健康管理顧問有限公司","臺北市松山區復興北路179號6樓之8","顏元瀅","100000","1110623"
"2868","90355571","夸克電能股份有限公司","臺北市松山區敦化北路207號11樓之1","蔡明儒","1000000","1110623"
"2869","90355586","富貴吉祥有限公司","臺北市信義區基隆路1段141號13樓之7","沈倢宇","110000","1110623"
"2870","90355592","凱叡物業股份有限公司","臺北市士林區天母北路32號2樓","KELLY LEE","5000000","1110623"
"2871","90355609","康特旅行社股份有限公司","臺北市中山區北安路780號6樓之5","葉國煌","6000000","1110623"
"2872","90355615","霏荳有限公司","臺北市內湖區康寧路3段189巷155弄8號2樓","林錫鋒","4000000","1110623"
"2873","90355621","躁音音樂製造所股份有限公司","臺北市內湖區堤頂大道2段407巷20弄39號5樓","段鍾潭","3000000","1110623"
"2874","90355636","宥晟室內裝修工程有限公司","臺北市內湖區陽光街68巷64號","陳柏憲","1000000","1110623"
"2875","90355642","徐行探索有限公司","臺北市中山區敬業二路69巷8號3樓之1","李雪如","100000","1110624"
"2876","90355657","永建無限投資有限公司","臺北市松山區寶清街21號","丁永建","2000000","1110623"
"2877","90355663","台恩國際有限公司","臺北市信義區虎林街239號","林桂有","8000000","1110623"
"2878","90355679","泓庭科技顧問有限公司","臺北市大同區民生西路236號2樓","布蘭德","200000","1110623"
"2879","90355684","頤碩夥伴貳股份有限公司","臺北市大安區敦化南路2段333號18樓","鄭敦謙","200000","1110623"
"2880","90355690","安翊實業有限公司","臺北市萬華區萬青街151號2樓","劉致安","5000000","1110624"
"2881","90355713","遠碩有限公司","臺北市中山區民生東路1段29號6樓之2","劉致遠","5000000","1110624"
"2882","90355729","指舞春秋養生國際有限公司","臺北市中山區新生北路3段19巷26號1樓","謝雯妍","100000","1110623"
"2883","90355734","泰申智能有限公司","臺北市中山區南京東路2段150號2樓","吳泰均","500000","1110623"
"2884","90355740","國楓規劃設計顧問有限公司","臺北市松山區南京東路3段305號5樓","呂珮綺","1000000","1110624"
"2885","90355755","模麗飛國際股份有限公司","臺北市信義區松山路130號7樓之1","蕭素秋","1000000","1110624"
"2886","90355761","老黑米餐飲股份有限公司","臺北市大同區太原路46號1樓","林明佑","1000000","1110624"
"2887","90355777","凱祥文化事業有限公司","臺北市中山區長安東路2段67號10樓之1","劉宸宇","300000","1110624"
"2888","90355782","鈞禾生活有限公司","臺北市大安區青田街2巷16之1號","李鄞君","1000000","1110623"
"2889","90355798","戀念股份有限公司","臺北市大安區安和路2段7號11樓之1","蘇明芬","5000000","1110623"
"2890","90355805","延元工程有限公司","臺北市中山區南京西路1之1號10樓","洪碩聰","30000","1110624"
"2891","90355811","衍創股份有限公司","臺北市內湖區內湖路1段66號3樓","張嘉洲","2000000","1110624"
"2892","90355827","東巖國際有限公司","臺北市中正區館前路20號5樓","吳政濃","100000","1110623"
"2893","90355832","鉅鑫生科股份有限公司","臺北市內湖區民權東路6段109號5樓之2","壹鑫材料股份有限公司","25000000","1110623"
"2894","90355848","贏欣生技有限公司","臺北市大同區華陰街91號2樓之1","李佳欣","1000000","1110624"
"2895","90355853","嵐伊生技有限公司","臺北市文山區辛亥路4段128之1號1樓","林瀅芸","1000000","1110624"
"2896","90355869","思佳瑪有限公司","臺北市中正區許昌街42號8樓","劉芸菲","100000","1110624"
"2897","90355875","伴犬研究社有限公司","臺北市中正區忠孝西路1段72號2樓之5","孫筱瑜","10000","1110624"
"2898","90355880","賦名生醫有限公司","臺北市大安區忠孝東路4段300號5樓","鄒世緯","3000000","1110624"
"2899","90355896","恒如投資股份有限公司","臺北市中正區羅斯福路2段18號4樓","王銘流","29870400","1110627"
"2900","90355903","翰可能源股份有限公司","臺北市大安區復興南路1段222號9樓","陳洋淵","280000000","1110627"
"2901","90355919","育勁媒體行銷有限公司","臺北市中山區南京東路2段101號9樓","劉仰庭","1000000","1110624"
"2902","90355925","光奇昱股份有限公司","臺北市中正區杭州南路1段27號9樓","吳哲宇","500000","1110624"
"2903","90355930","聯合草本生技有限公司","臺北市北投區致遠三路6號4樓","彭溫雅","1000000","1110624"
"2904","90355946","獨角伙伴股份有限公司","臺北市信義區忠孝東路4段560號13樓","山田康晴","5000000","1110624"
"2905","90355951","寶開能源股份有限公司","臺北市內湖區行善路463號8樓","蔡佳晋","2000000","1110624"
"2906","90355967","海格室內裝修設計有限公司","臺北市中山區復興北路38號10樓","洪玉祥","600000","1110624"
"2907","90355973","益大投資有限公司","臺北市信義區基隆路1段155號11樓之5","鄧俊男","1800000","1110624"
"2908","90355988","力暄企業有限公司","臺北市萬華區漢中街135號9樓之1","林淑嬌","1000000","1110624"
"2909","90355994","賦語科技有限公司","臺北市大安區敦化南路2段77號7樓之4","張凱鈞","1000000","1110624"
"2910","90356001","翰華企業有限公司","臺北市中山區復興南路1段36之1號3樓","朱大鵬","10000","1110624"
"2911","90356017","和漾旅行社股份有限公司","臺北市中山區松江路433號4樓","吳品璁","10000000","1110624"
"2912","90356023","樂宥宥有限公司","臺北市南港區研究院路1段110號","王渟鈞","360000","1110627"
"2913","90356038","馬蒂餐飲有限公司","臺北市萬華區成都路129號","羅偉峰","65000","1110627"
"2914","90356059","極光媒體行銷有限公司","臺北市內湖區新湖二路164號3樓","陳靜雯","1000000","1110624"
"2915","90356065","台灣德光動能股份有限公司","臺北市內湖區瑞光路168號9樓","白凌青","1050000","1110624"
"2916","90356071","韓森管理顧問有限公司","臺北市松山區南京東路3段287號10樓","林明輝","100000","1110624"
"2917","90356086","倢德斯有限公司","臺北市大安區復興南路2段12巷27號","黃玉琳","3000000","1110624"
"2918","90356092","貳肆加一行銷有限公司","臺北市中正區懷寧街82號1樓","林雨萱","100000","1110624"
"2919","90356109","育博國際股份有限公司","臺北市文山區景興路193號1樓","郭科佑","30000","1110624"
"2920","90356115","傑緯國際貿易有限公司","臺北市中山區松江路65號10樓之1","廖舜昌","5000000","1110624"
"2921","90356121","興倫實業有限公司","臺北市萬華區莒光路148號1樓","李政倫","200000","1110624"
"2922","90356163","亨潤貿易股份有限公司","臺北市松山區南京東路5段194號","劉修宏","1000000","1110624"
"2923","90356179","虎豐國際投資股份有限公司","臺北市大安區四維路192巷16號3樓","周成虎","20000000","1110624"
"2924","90356184","亞睿股份有限公司","臺北市松山區八德路4段91巷3弄41號1樓","劉雅芬","1000000","1110624"
"2925","90356190","鑫丞有限公司","臺北市中正區忠孝西路1段50號20樓之43","范成旻","3000000","1110624"
"2926","90356207","台杉七號生技股份有限公司","臺北市信義區基隆路1段333號18樓","沈志隆","500000","1110624"
"2927","90356213","華寶行銷有限公司","臺北市大同區南京西路103號4樓之1","林建松","80000","1110624"
"2928","90356229","慧強投資有限公司","臺北市中正區忠孝東路2段80號3樓","齊自強","2000000","1110624"
"2929","90356234","韓醫姐姐股份有限公司","臺北市大安區光復南路72巷7弄9號1樓","陳芳雯","500000","1110627"
"2930","90356240","全人拉法股份有限公司","臺北市信義區基隆路1段147巷32號1樓","林修宇","120000","1110627"
"2931","90356255","青央貿易有限公司","臺北市信義區忠孝東路5段1之8號11樓","陳威儒","5000000","1110624"
"2932","90356261","陶籽食事有限公司","臺北市信義區忠孝東路5段1號2樓","謝文達","500000","1110624"
"2933","90356277","林檎有限公司","臺北市大安區大安路1段16巷23號","洪亜璇","5000000","1110627"
"2934","90356282","奈蒔有限公司","臺北市大安區杭州南路2段93巷38號1樓","宮銘駿","2000000","1110627"
"2935","90356298","昕鼎投資有限公司","臺北市中山區松江路82號11樓","林衍伯","1680000","1110627"
"2936","90356305","美感問答股份有限公司","臺北市大同區南京西路62號7樓","何富菁","1000000","1110627"
"2937","90356311","科爾迪股份有限公司","臺北市信義區基隆路2段51號14樓","藤利千晶","6000000","1110624"
"2938","90356327","久泓室內裝修工程有限公司","臺北市大同區延平北路2段60巷10號","陳品潓","2000000","1110627"
"2939","90356332","毅昇音樂事業有限公司","臺北市中正區羅斯福路4段68號7樓之10","黃鈞毅","200000","1110627"
"2940","90356348","面面股份有限公司","臺北市中山區松江路76號7樓之1","吳素珠","38300000","1110610"
"2941","90356353","榮恒創新股份有限公司","臺北市大安區敦化南路2段77號4樓","許媛媛","500000","1110610"
"2942","90356369","旭佳科技有限公司","臺北市中山區建國北路3段92號4樓","陳建霖","100000","1110610"
"2943","90356375","儷舍日研室內裝修設計工程有限公司","臺北市大同區長安西路150號14樓","許蕙萱","1000000","1110610"
"2944","90356380","新頡投資有限公司","臺北市大安區復興南路1段368號13樓","蔡高明","15000000","1110610"
"2945","90356396","宥元申有限公司","臺北市信義區基隆路1段333號33樓","曾宥澈","100000","1110610"
"2946","90356419","點亮微光社會企業有限公司","臺北市大同區南京西路62號7樓","林意盛","300000","1110610"
"2947","90356425","榮利創新股份有限公司","臺北市大安區敦化南路2段77號4樓","許顯榮","500000","1110610"
"2948","90356430","腦波弱太太有限公司","臺北市北投區中央南路2段113之1號1樓","洪瑤","100000","1110610"
"2949","90356446","她們有限公司","臺北市大安區忠孝東路四段71之6號","魏妤蓁","800000","1110610"
"2950","90356451","聚聚行銷有限公司","臺北市中山區中山北路2段170號8樓","林盈君","100000","1110610"
"2951","90356467","霂金國際整合行銷股份有限公司","臺北市松山區民權東路3段142號10樓之7","林于琛","150000","1110610"
"2952","90356473","永華資產投資有限公司","臺北市大安區仁愛路4段376號7樓","藍天佑","100000","1110610"
"2953","90356494","豐宇國際有限公司","臺北市中山區建國北路3段92號3樓","林佳樺","1000000","1110610"
"2954","90356516","凱西林藝術有限公司","臺北市中正區和平西路1段15號4樓","林凱珊","200000","1110613"
"2955","90356522","麟美有限公司","臺北市內湖區港墘路60巷26號1樓","吳韋成","3000000","1110610"
"2956","90356543","英聖影業有限公司","臺北市大安區光復南路260巷48號2樓","吳思儀","2000000","1110613"
"2957","90356558","榮隆創新股份有限公司","臺北市大安區敦化南路2段77號4樓","許莉玟","500000","1110613"
"2958","90356564","樂益康有限公司","臺北市大同區承德路1段35號8樓之1","蕭志堅","500000","1110610"
"2959","90356570","溫文儒雅有限公司","臺北市信義區信義路4段397號1樓","黃中岳","1200000","1110610"
"2960","90356585","奎爾特國際有限公司","臺北市士林區中山北路5段512號3樓","郭盈吟","3000000","1110613"
"2961","90356591","願景策略投資股份有限公司","臺北市信義區基隆路1段155號11樓之5","鄭嘉信","2851200","1110613"
"2962","90356620","合木文化藝術教育有限公司","臺北市南港區忠孝東路6段90號","吳丞恩","1100000","1110613"
"2963","90356635","璞兆管理顧問股份有限公司","臺北市中山區中山北路2段65巷10號2樓","江晴淑","1200000","1110613"
"2964","90356641","不在辦公室股份有限公司","臺北市信義區忠孝東路5段17之3號1樓","何依華","10000000","1110613"
"2965","90356656","意德實業有限公司","臺北市松山區民族東路691號1樓","蕭育豐","250000","1110613"
"2966","90356662","格林蘭德有限公司","臺北市中山區中山北路1段92號3樓之2","蔡立農","300000","1110613"
"2967","90356678","一致室內裝修有限公司","臺北市中山區民生東路3段57號2樓之1","徐兆立","200000","1110613"
"2968","90356683","山恩實業股份有限公司","臺北市中山區長安東路1段23號11樓之3","賴正庭","10000000","1110613"
"2969","90356699","馬萊達網絡科技有限公司","臺北市中正區羅斯福路3段302號4樓","郭長霖","50000","1110613"
"2970","90356712","伐謀管理顧問有限公司","臺北市信義區忠孝東路5段508號4樓","劉詠廷","10000","1110613"
"2971","90356728","福祿食堂有限公司","臺北市松山區光復北路82號11樓","連家揚","300000","1110613"
"2972","90356733","好睡王國際有限公司","臺北市中山區新生北路2段31之1號11樓之6","周紜希","2000000","1110613"
"2973","90356749","禎季國際有限公司","臺北市松山區敦化北路145巷9號1樓","陳又禎","600000","1110613"
"2974","90356754","祥福投資有限公司","臺北市中正區汀州路3段188號2樓","施麗月","150000000","1110615"
"2975","90356760","弘筠有限公司","臺北市大安區忠孝東路4段311號6樓之1","魏伯任","100000","1110613"
"2976","90356797","奧肯塔爾有限公司","臺北市松山區八德路3段2號6樓","黃詩佳","1000000","1110613"
"2977","90356804","全通財務顧問有限公司","臺北市中山區南京東路2段150號2樓","陳筱婷","99000","1110613"
"2978","90356810","冰山有限公司","臺北市信義區基隆路2段149之49號11樓之4","陳香蘭","1000000","1110613"
"2979","90356826","豪穎科技股份有限公司","臺北市松山區南京東路3段287號2樓","陳怡君","202000","1110613"
"2980","90356831","聯有材料科技股份有限公司","臺北市信義區基隆路2段109號6樓之2","唐振盛","250000","1110613"
"2981","90356847","紀華不動產經紀有限公司","臺北市文山區木新路2段218巷35號","林春美","1000000","1110613"
"2982","90356852","豐向有限公司","臺北市中山區民生東路2段143號5樓","王俊人","200000","1110613"
"2983","90356868","瑞芯達科技有限公司","臺北市信義區基隆路1段163號14樓之1","KIM HYUNG GI","27000000","1110613"
"2984","90356874","翊登生化有限公司","臺北市士林區永平街39號1樓","張雅婷","100000","1110613"
"2985","90356889","福甜吉兆有限公司","臺北市中山區長安東路1段45之2號1樓","傅渝維","800000","1110613"
"2986","90356895","爵沛科技股份有限公司","臺北市大安區敦化南路1段205號14樓之3","楊沛峰","3200000","1110613"
"2987","90356918","代山文化有限公司","臺北市中山區敬業一路128巷20號6樓","莊岱雯","300000","1110613"
"2988","90356924","希望國際文化教育有限公司","臺北市大安區忠孝東路4段2號5樓之1","陳靜宜","1000000","1110613"
"2989","90356939","恆馥欣業有限公司","臺北市大同區南京西路163號2樓之28","藍國瑋","3000000","1110613"
"2990","90356945","秝宸投資有限公司","臺北市中山區松江路75之1號7樓","簡家宸","1000000","1110613"
"2991","90356950","晉軒服飾有限公司","臺北市中山區長春路40號8樓之9","朱瑞玫","580000","1110613"
"2992","90356966","普魯托斯數位資產管理股份有限公司","臺北市中山區南京東路2段150號2樓","馮聖哲","600000","1110613"
"2993","90356972","森盟資訊有限公司","臺北市信義區吳興街284巷22弄84號","胡東樺","300000","1110613"
"2994","90356987","吉程國際有限公司","臺北市信義區忠孝東路5段410號12樓之2","童婉貞","16888","1110614"
"2995","90356993","集登設計工程有限公司","臺北市信義區松信路55號","杜建宏","2000000","1110613"
"2996","90357016","共生池股份有限公司","臺北市士林區至誠路2段25號2樓","許丕政","1000000","1110613"
"2997","90357022","歐立德生物科技股份有限公司","臺北市信義區松德路6號8樓","陳源德","500000","1110613"
"2998","90357037","吉立元投資有限公司","臺北市北投區三合街1段36巷29號2樓","許月森","3000000","1110614"
"2999","90357043","煒恆有限公司","臺北市中山區天祥路59號4樓之1","周祐誼","1000000","1110614"
"3000","90357058","華如建設股份有限公司","臺北市中山區民權東路3段4號4樓","白燿嘉","66000000","1110613"
"3001","90357064","品芳緣餐飲有限公司","臺北市大安區通化街17之1號1樓","鄭舒媛","3000000","1110613"
"3002","90357070","尊藝娛樂有限公司","臺北市信義區光復南路429號3樓","郭俊良","500000","1110614"
"3003","90357085","士宸實業有限公司","臺北市南港區忠孝東路6段398巷2號1樓","張軒瑋","1000000","1110614"
"3004","90357091","門裡有文有限公司","臺北市中正區許昌街42號8樓","詹琇閔","100000","1110615"
"3005","90357108","相鐵國際台灣股份有限公司","臺北市信義區基隆路2段51號14樓","大嶋茂","5000000","1110614"
"3006","90357114","席夢文創有限公司","臺北市信義區松德路6號8樓","吳培鈴","200000","1110614"
"3007","90357120","知逅創意策劃有限公司","臺北市文山區景興路188號15樓","陳紘緯","1000000","1110614"
"3008","90357135","愛璽興業股份有限公司","臺北市中山區新生北路2段29之1號5樓","小倉秀明","100000","1110614"
"3009","90357141","御富康有限公司","臺北市文山區秀明路1段103巷6弄9號","王水明","500000","1110613"
"3010","90357156","台灣碳淨零股份有限公司","臺北市大安區忠孝東路4段300號5樓","呂同塵","1000000","1110614"
"3011","90357162","鹿石室內裝修設計工程有限公司","臺北市大安區忠孝東路4段300號5樓","陳美萱","1000000","1110613"
"3012","90357178","宸裔有限公司","臺北市信義區永吉路30巷119弄7號","賀裔喧","500000","1110614"
"3013","90357183","澄岳設計開發有限公司","臺北市松山區南京東路4段164號3樓之3","呂和洋","200000","1110614"
"3014","90357199","大漠水澤有限公司","臺北市信義區松隆路18號","王柏皓","300000","1110614"
"3015","90357206","群昊工程有限公司","臺北市文山區辛亥路4段128之1號1樓","朱芷萱","5000000","1110614"
"3016","90357212","吉田設計有限公司","臺北市中正區羅斯福路2段70號10樓之6","梁庭瑋","1500000","1110614"
"3017","90357228","捷勝美國留學顧問有限公司","臺北市文山區羅斯福路5段35號1樓","宋智堯","1000","1110614"
"3018","90357233","黑杰投資股份有限公司","臺北市中山區中山北路3段26號8樓","白介宇","1000000","1110614"
"3019","90357249","久享股份有限公司","臺北市中山區林森北路477號地下1層","李勁毅","3500000","1110614"
"3020","90357254","新藝欣有限公司","臺北市大同區華陰街130號3樓","林玉玲","100000","1110614"
"3021","90357260","大內水手有限公司","臺北市中山區中山北路3段27號4樓之9","林猷鈞","3000000","1110614"
"3022","90357276","澄明映像有限公司","臺北市松山區南京東路3段287號10樓","林秉毅","66666","1110614"
"3023","90357281","是家建設有限公司","新竹市北區康樂里東大路三段510巷8號7樓","李益葳","1000000","1110620"
"3024","90357297","峻達開發營造有限公司","嘉義縣中埔鄉富收村興化2-21號2樓","王志勝","3600000","1110620"
"3025","90361567","台灣蒟蒻有限公司","高雄市岡山區菜寮路2號","陳孝聞","1680000","1110614"
"3026","90361573","薪睿精密科技有限公司","高雄市大社區中山路673之20號","蘇兆平","1000000","1110614"
"3027","90361588","瑞盈教育有限公司","高雄市左營區重立路158號7樓","鄭惟謙","20000","1110614"
"3028","90361594","德上投資有限公司","高雄市苓雅區林森二路87號6樓之1","邱莉雯","16000000","1110614"
"3029","90361601","景紅有限公司","高雄市橋頭區經武路52號7樓之7","廖淑雯","300000","1110614"
"3030","90361617","名翔營造有限公司","高雄市鳳山區鳳甲一街91號1樓","李迪","3600000","1110615"
"3031","90361659","億臻貿易有限公司","高雄市新興區和平一路199號12樓","王彥臻","100000","1110614"
"3032","90361665","峻愷科技有限公司","高雄市林園區廣應里頂磘溝119巷71號1樓","吳亦玲","200000","1110615"
"3033","90361671","誠浤企業有限公司","高雄市仁武區大灣里大義巷29號1樓","許基政","1000000","1110615"
"3034","90361686","鈺佳科技有限公司","高雄市左營區孟子路605號9樓之1","施正中","2000000","1110615"
"3035","90361692","日眾國際企業有限公司","高雄市前鎮區天后街68號2樓","莊太龍","300000","1110615"
"3036","90361709","正盛食品有限公司","高雄市前鎮區瑞和街17號2樓","王振甫","3000000","1110615"
"3037","90361715","鴉羽形象設計有限公司","高雄市苓雅區新光路62巷20號21樓之1","陳紋芯","1000000","1110615"
"3038","90361721","聯儀貿易有限公司","高雄市前鎮區鎮川一巷62號1樓","謝敏儀","1000000","1110615"
"3039","90361736","豐醫生技有限公司","高雄市苓雅區四維三路80號4樓","陳駿傑","1600000","1110615"
"3040","90361742","瑪吉姆姆有限公司","高雄市新興區南華橫二路65號2樓","余卓越","1000000","1110615"
"3041","90361757","上豫科技有限公司","高雄市鼓山區中華一路21之1號1樓","張哲夫","100000","1110615"
"3042","90361763","閎富國際開發有限公司","高雄市前鎮區瑞北路131號","黃國隆","3000000","1110615"
"3043","90361779","永泉富地產開發實業有限公司","高雄市鳳山區文中街232巷7號13樓","張昭隆","500000","1110615"
"3044","90361784","淶鍚有限公司","高雄市三民區大昌一路24號1樓","林育城","100000","1110615"
"3045","90361790","芫東有限公司","高雄市鳳山區五常街5號","沈恒儀","200000","1110615"
"3046","90361807","宅宅系統家居室內裝修有限公司","高雄市左營區鼓山三路395號15樓之1","林亞男","300000","1110615"
"3047","90361813","廣城餐飲有限公司","高雄市鳳山區武慶二路106號3樓","鄭以忠","1000000","1110615"
"3048","90361829","冷慶企業有限公司","高雄市前鎮區一心二路206號8樓之2","冷紹剛","500000","1110615"
"3049","90361834","廣洪有限公司","高雄市左營區新庄仔路614號1樓","董行軒","300000","1110615"
"3050","90361840","京之中股份有限公司","高雄市前鎮區成功二路8之2號","郭定","1000000","1110615"
"3051","90361861","煜栩昶有限公司","高雄市鼓山區河西一路163之1號1樓","林家輝","1000000","1110615"
"3052","90361877","金必錸國際有限公司","高雄市苓雅區成功一路232號20樓之1","郭偉宏","500000","1110616"
"3053","90361882","豪億汽車服務諮詢有限公司","高雄市小港區永順街47號9樓之2","容培智","300000","1110616"
"3054","90361898","興橋科股份有限公司","高雄市橋頭區經武路58號17樓之8","陳修成","2000000","1110616"
"3055","90361911","大環宇國際資訊有限公司","高雄市前金區中華三路7號11樓之1","李永富","300000","1110616"
"3056","90361927","昶元工程有限公司","高雄市鳳山區頂新六街36號3樓之2","紀秀秀","5000000","1110616"
"3057","90361932","曜宙科技有限公司","高雄市前鎮區一心二路119號9樓之7","黃崑展","400000","1110616"
"3058","90361948","沐辰空間設計有限公司","高雄市左營區重立路379號8樓之1","張健偉","100000","1110616"
"3059","90361953","立亨行有限公司","高雄市小港區高坪五路118巷10號1樓","林俞秀","1000000","1110616"
"3060","90361969","森心國際開發有限公司","高雄市鳳山區武營路52巷29弄46號","吳怡臻","1000000","1110616"
