"序號","統一編號","公司名稱","公司所在地","代表人","資本額","核准設立日期"
"2051","90324000","惠宣友善教育有限公司","新北市新店區安忠路159巷13號3樓","賴信元","1000000","1110624"
"2052","90324016","健翔汽車有限公司","新北市板橋區陽明街279巷35號10樓","楊健一","1000000","1110624"
"2053","90324022","日星益電腦有限公司","新北市汐止區建成路59巷73號16樓","游士鳴","500000","1110624"
"2054","90324037","青年奇蹟工作室有限公司","新北市三重區重新路1段84號(2樓)","蔡旺霖","300000","1110624"
"2055","90324043","鴻恩長照有限公司","新北市中和區中正路515號3樓","鄭婉蓉","200000","1110624"
"2056","90324058","慶穎投資有限公司","新北市新店區安成街2巷5號","李明慶","25500000","1110624"
"2057","90324064","原力工程有限公司","新北市新店區黎明路53巷23號3樓","陳弘毅","100000","1110624"
"2058","90324070","前晨億數影業有限公司","新北市永和區林森路33號","林信良","5000000","1110624"
"2059","90324085","月田國際有限公司","新北市板橋區裕民街134號(1樓)","田宗堯","200000","1110624"
"2060","90324091","宏爍科技有限公司","新北市汐止區大同路1段122號3樓","張育豪","6000000","1110624"
"2061","90324108","湘芯有限公司","桃園市中壢區中堅里台貿三街26號(四樓)","洪湘茗","1000000","1110531"
"2062","90324114","日益興能股份有限公司","桃園市桃園區同安里新埔六街99號19樓","蔡忠志","1000000","1110601"
"2063","90324120","日嵐電能股份有限公司","桃園市桃園區同安里新埔六街99號19樓","蔡忠志","1000000","1110601"
"2064","90324135","易企秀行銷科技有限公司","桃園市桃園區中山路551號6樓","黃穧磊","1000000","1110601"
"2065","90324141","諾禾國際有限公司","桃園市龍潭區工七路10號2樓","林震豪","1000000","1110601"
"2066","90324156","盛太建設開發股份有限公司","桃園市蘆竹區錦中里南崁路1段83號16樓之2","王福漲","10000000","1110601"
"2067","90324162","信義顧問有限公司","桃園市桃園區同安里大興西路一段225號8樓之2","黃鴻清","1000000","1110601"
"2068","90324178","禾榮興有限公司","桃園市中壢區中園路168之1號3樓","李秀","1000000","1110601"
"2069","90324183","美佳國際貿易有限公司","桃園市桃園區中路里國際路二段178號1樓","蕭實在","50000","1110602"
"2070","90324199","上源投資有限公司","桃園市桃園區永安路1360巷67弄45號","洪嘉釧","15000000","1110601"
"2071","90324212","鑫強人力顧問有限公司","桃園市中壢區忠義里中華路一段743巷1弄33號(1樓)","徐敦頡","1000000","1110601"
"2072","90324228","杏合聯醫股份有限公司","桃園市平鎮區義民里復旦路二段23巷28弄8號（1樓）","許益成","100000","1110601"
"2073","90324233","文建輪胎有限公司","桃園市中壢區永福里南園二路11號2樓","羅秀霞","100000","1110601"
"2074","90324249","璞香園有限公司","桃園市觀音區福祥街133號（1樓）","黃育薇","100000","1110601"
"2075","90324254","恩昌農業生技有限公司","桃園市觀音區福祥街133號(1樓)","黃育薇","100000","1110601"
"2076","90324260","金鉉實業股份有限公司","桃園市桃園區中寧里中正路927號10樓","劉政佑","1000000","1110601"
"2077","90324276","格斯托有限公司","桃園市大溪區僑愛一街8巷15號","蘇羽巾","200000","1110601"
"2078","90324281","翔顥工藝有限公司","桃園市龜山區大崗里20鄰大湖一路228巷7號","彭鄭綺雯","500000","1110602"
"2079","90324297","萬興實業有限公司","桃園市龜山區嶺頂里萬壽路二段349號","林育洋","1000000","1110602"
"2080","90324304","歐氯科技股份有限公司","桃園市中壢區舊明里明德路60號(5樓)","呂哲瑋","450000","1110602"
"2081","90324310","勵生生活計畫有限公司","桃園市中壢區中央里復興路29號2樓","徐瑞容","2000000","1110602"
"2082","90324326","理想居家裝潢設計有限公司","桃園市桃園區汴洲里健行路110之2號4樓","陳俊菘","500000","1110602"
"2083","90324331","禾昕汽車有限公司","桃園市楊梅區文化街218巷1弄28號（1樓）","彭采彤","1000000","1110602"
"2084","90324347","胖黃有限公司","桃園市楊梅區大同里楊新北路21巷2弄22號","黃怡清","100000","1110602"
"2085","90324352","嘉鎱有限公司","桃園市桃園區春日里大業路2段97號5樓之1","鄭嘉玲","1500000","1110602"
"2086","90324368","鉅鹿國際有限公司","桃園市桃園區龍安里國強十街79之2號10樓","王畯憲","3000000","1110602"
"2087","90324374","愛乒乓桌球用品有限公司","桃園市大溪區仁和里仁和九街6號（1樓）","陳沛恩","100000","1110602"
"2088","90324389","職人創意活動整合有限公司","桃園市平鎮區新榮里新德街283號(2樓)","廖先皓","1000000","1110602"
"2089","90324395","瓅地有限公司","桃園市楊梅區四維里文化街218巷5弄21號","林婉琪","100000","1110602"
"2090","90324402","極道武術運動有限公司","桃園市大園區橫峰里領航北路四段352之3號2樓","陳嘉村","200000","1110602"
"2091","90324418","杰為投資顧問科技有限公司","桃園市楊梅區梅溪里三元街164號5樓","楊東穎","5880000","1110602"
"2092","90324439","慧愛植物飲股份有限公司","桃園市中壢區忠孝路56號","林雅慧","500000","1110602"
"2093","90324466","好享科技有限公司","桃園市桃園區莊敬里新埔八街113號(2樓)","柴佩瓏","100000","1110602"
"2094","90324472","昊斯房屋檢驗股份有限公司","桃園市大溪區東二路100號2樓","蕭宗禮","900000","1110602"
"2095","90324487","威捷通運有限公司","桃園市蘆竹區大興十街382號(1樓)","伏峰山","25000000","1110602"
"2096","90324493","泰宏建設股份有限公司","桃園市桃園區三民路三段288號15樓","陳彩潔","100000000","1110602"
"2097","90324515","倍吉達網通有限公司","桃園市桃園區中平里中平路109號","陳志達","500000","1110602"
"2098","90324521","允辰國際股份有限公司","桃園市中壢區中原里興農路80號2樓","許珮甄","300000","1110602"
"2099","90324536","勝祥科技股份有限公司","桃園市桃園區文中里文中三路153號12樓","蘇守全","1000000","1110606"
"2100","90324542","祥荃實業有限公司","桃園市龜山區文化里華亞二路39號（2樓）","鄭信義","5000000","1110606"
"2101","90324557","琉洺科技有限公司","桃園市平鎮區平南里漢口街170號9號4樓","劉永章","200000","1110606"
"2102","90324563","昇泰房屋有限公司","桃園市中壢區興仁里興安一街36號11樓之1","朱協成","200000","1110606"
"2103","90324579","信富工程有限公司","桃園市平鎮區漢口街120巷23弄3號(1樓)","林芸竹","250000","1110606"
"2104","90324584","九韌科技股份有限公司","桃園市桃園區雲林里桃鶯路78號(2樓)","黃州立","1000000","1110606"
"2105","90324590","浩鼎科技有限公司","桃園市龍潭區烏林里中豐路461巷182號10樓","陳家榮","5000000","1110606"
"2106","90324607","緒紳實業有限公司","桃園市新屋區頭洲里新榮路174號(1樓)","彭緒騰","1000000","1110606"
"2107","90324613","亞頌電商國際有限公司","桃園市大園區南港里大觀路600巷12弄18號(1樓)","李緁玲","2100000","1110606"
"2108","90324634","禾盛國際人力顧問有限公司","桃園市龜山區文青路290號6樓之5","李張蘭英","5000000","1110607"
"2109","90324640","頂壹工程有限公司","桃園市新屋區大坡里民有二路2段60號(1樓)","郭文宇","100000","1110607"
"2110","90324655","豐康生技有限公司","桃園市平鎮區湧光里湧光路136巷16弄5號","郭益誠","900000","1110607"
"2111","90324661","大東家資本有限公司","桃園市楊梅區梅新里中山路121巷5弄7號","莊錫達","3000000","1110607"
"2112","90324677","滿閣有限公司","桃園市觀音區新林路191巷319號","張彩蘋","300000","1110607"
"2113","90324682","永嫄有限公司","桃園市楊梅區新榮里7鄰新榮路65號","周含臻","300000","1110607"
"2114","90324698","達富照明科技有限公司","桃園市八德區福興里中正路8號12樓","林漢威","2000000","1110607"
"2115","90324711","和氣生健康管理顧問有限公司","桃園市中壢區新街里環北路398號18樓之5","劉振鋒","1000000","1110607"
"2116","90324727","三朝呼吸有限公司","桃園市桃園區東埔里大華九街37號（1樓）","邱姚嘉","500000","1110607"
"2117","90324732","泓順不動產仲介有限公司","桃園市龍潭區龍潭里北龍路26號(1樓)","葉日舜","6000000","1110607"
"2118","90324748","德享國際有限公司","桃園市平鎮區自強街37巷52號","黃正宏","600000","1110607"
"2119","90324753","傘電智能科技有限公司","桃園市桃園區中正路1071號14樓之7","洪于晴","100000","1110608"
"2120","90324769","圓達風電水下基礎有限公司","桃園市大園區南港里園航路405號7樓","羅宇凱","3000000","1110608"
"2121","90324775","金泳建設有限公司","桃園市中壢區東興里龍岡路一段159巷10號（1樓）","湯博鈞","8100000","1110608"
"2122","90324780","高科生技股份有限公司","桃園市中壢區昆明街21號(1樓)","羅仁隆","500000","1110608"
"2123","90324796","宏龍興業有限公司","桃園市平鎮區廣達里民族路二段23巷42號10樓","劉貞新","2000000","1110608"
"2124","90324803","品嘉行國際土地開發有限公司","桃園市平鎮區金星里南京路125巷46號","邢麗鵑","1000000","1110608"
"2125","90324819","茂吉有限公司","桃園市桃園區中山路658巷4弄5號","鄭旭志","100000","1110608"
"2126","90324825","元清科技有限公司","桃園市桃園區東山里成功路二段2號3樓之2號","黃來善","1000000","1110608"
"2127","90324830","和洋綠能股份有限公司","臺北市信義區忠孝東路5段68號14樓","徐偉強","15000000","1110622"
"2128","90324846","庇卡任意門健康顧問有限公司","臺北市中山區中山北路2段99號4樓之1","蔡文玉","5000000","1110622"
"2129","90326083","紫熹珠寶有限公司","臺北市中山區林森北路119巷29號3樓之3","陳醞芝","10106","1110627"
"2130","90326099","赫然國際海洋有限公司","臺北市大安區忠孝東路4段71之6號","江家葳","2200000","1110627"
"2131","90326112","涵吉有限公司","臺北市信義區基隆路1段155號12樓之6","簡以涵","1000000","1110629"
"2132","90326128","聯盛國際貿易股份有限公司","臺北市大安區光復南路102號10樓","譚力國","5000000","1110627"
"2133","90326133","種草影視行銷股份有限公司","臺北市松山區民生東路3段113巷6弄7號1樓","湯昇榮","5000000","1110627"
"2134","90326149","台安細胞生物科技有限公司","臺北市松山區南京東路5段356號13樓","詹坤泉","6000000","1110627"
"2135","90326154","安珠精準健康股份有限公司","臺北市中正區信義路2段23號3樓之1","陳驄文","300000","1110627"
"2136","90326176","皮拉拉股份有限公司","臺北市南港區忠孝東路6段21號14樓之1","李懿恆","5000000","1110627"
"2137","90326181","電子鳥科技有限公司","臺北市大安區忠孝東路4段300號5樓","陳勁佑","100000","1110627"
"2138","90326197","定源股份有限公司","臺北市內湖區港墘路99號5樓","陳東揚","2000000","1110627"
"2139","90326204","沛怡國際有限公司","臺北市北投區文林北路286號4樓","周怡廷","2000000","1110627"
"2140","90326210","必立弗台灣股份有限公司","臺北市松山區南京東路3段287號8樓","希范德 (Sylvain DELANGE)","4800000","1110627"
"2141","90326226","柏暐實業股份有限公司","臺北市內湖區民權東路6段160號7樓","徐柏超","100000","1110627"
"2142","90326231","淡海資訊科技有限公司","臺北市中山區南京東路2段140號4樓","許偉彥","3000","1110627"
"2143","90326247","髎育學堂股份有限公司","臺北市松山區南京東路3段346之3號8樓","曾為儀","2100000","1110627"
"2144","90326252","啓勛投資股份有限公司","臺北市大安區復興南路1段243號6樓","劉安立","5000000","1110628"
"2145","90326268","磊嘉貿易有限公司","臺北市大安區忠孝東路4段297號5樓","葉子嘉","200000","1110627"
"2146","90326274","騰躍聖有限公司","臺北市大同區甘谷街26號5樓","吳坤益","100000","1110627"
"2147","90326289","東鎮勝虎有限公司","臺北市大安區羅斯福路3段29號6樓","金躍庭","100000","1110627"
"2148","90326295","名祿投資有限公司","臺北市中山區建國北路2段33號10樓之3","黃銘世","5000000","1110628"
"2149","90326302","果多夥房有限公司","臺北市大安區通安街81號1樓","李昀庭","750000","1110627"
"2150","90326318","僑園建築開發股份有限公司","臺北市中山區吉林路369號2樓之20","黃雋","2000000","1110627"
"2151","90326324","富洋創新股份有限公司","臺北市中山區長安東路1段16號10樓之6","陳亮祖","100000","1110627"
"2152","90326339","樺瑋空間設計有限公司","臺北市中山區中山北路2段185號9樓之1","黃士瑋","200000","1110627"
"2153","90326345","玩一玩音樂有限公司","臺北市中正區漢口街1段134號地下樓","于傳勇","1500000","1110627"
"2154","90326350","渠石工程顧問有限公司","臺北市內湖區星雲路68巷13號3樓","盧逸晨","1200000","1110628"
"2155","90326366","沃特企業有限公司","臺北市大安區光復南路102號10樓","曹允中","500000","1110627"
"2156","90326372","積聚科技股份有限公司","臺北市大安區信義路4段98號4樓之1","鄒慧玟","1000000","1110628"
"2157","90326387","騰大電源科技股份有限公司","臺北市中正區杭州南路1段27號3樓","易明進","500000","1110628"
"2158","90326393","戰火科技股份有限公司","臺北市信義區光復南路429號3樓","沈士猷","1000000","1110628"
"2159","90326416","彼特網路服務有限公司","臺北市松山區南京東路3段287號5樓","張景信","500000","1110628"
"2160","90326422","奧研科技股份有限公司","臺北市內湖區瑞光路618號10樓","樓昱","3000000","1110628"
"2161","90326437","高鏈科技有限公司","臺北市信義區信義路4段415號9樓之3","賴勇志","100000","1110627"
"2162","90326443","輝騰投資股份有限公司","臺北市大安區信義路4段1號2樓","費金輝","500000","1110628"
"2163","90326458","碁泰興業有限公司","臺北市文山區景文街43號4樓","羅皓泰","2000000","1110627"
"2164","90326464","財蜜傳媒有限公司","臺北市中正區北平東路30之2號4樓","彭翊","100000","1110628"
"2165","90326470","旺富實業有限公司","臺北市大同區延平北路2段288號3樓","葉雅琳","500000","1110627"
"2166","90326485","三岫生物科技股份有限公司","臺北市內湖區安泰街91號5樓","林蔚姍","600000","1110628"
"2167","90326491","雅居室內設計裝潢有限公司","臺北市萬華區廣州街253巷29號3樓","許華軒","1000000","1110627"
"2168","90326507","樂優國際有限公司","臺北市大安區忠孝東路4段181巷8號1樓","陳俊宇","2000000","1110627"
"2169","90326513","潮判藝術有限公司","臺北市大安區忠孝東路4段250號3樓","黃中","1000000","1110628"
"2170","90326529","發福有限公司","臺北市中山區復興北路2號6樓之6","陳韋寧","50000","1110628"
"2171","90326534","遠旭企業有限公司","臺北市中正區重慶南路3段129號3樓","劉寶端","5000000","1110628"
"2172","90326540","墨者星媒體股份有限公司","臺北市松山區八德路3段2號12樓","楊媛如","1000000","1110628"
"2173","90326555","珍蓁食品有限公司","臺北市大安區羅斯福路2段91號4樓之2","劉家蓁","1000000","1110628"
"2174","90326561","安提資本亞洲有限公司","臺北市信義區基隆路1段206號16樓","彭柏文","595501","1110627"
"2175","90326577","欣隆事業股份有限公司","臺北市中山區南京東路3段70號4樓","陳德仁","2000000","1110628"
"2176","90326582","主意品牌創建股份有限公司","臺北市中山區遼寧街201巷9號","高啓晃","2500000","1110629"
"2177","90326598","佶利安有限公司","臺北市中山區長安東路2段106號10樓之2","蔡明修","500000","1110628"
"2178","90326605","大明星專業國際管理顧問股份有限公司","臺北市中正區博愛路60號","黃聰仁","3000000","1110628"
"2179","90326611","翔服有限公司","臺北市信義區忠孝東路5段1之2號5樓","生瑞根","200000","1110628"
"2180","90326627","多元智慧股份有限公司","臺北市大安區仁愛路4段34號2樓","高錦安","1010000","1110628"
"2181","90326632","台灣牙科材料股份有限公司","臺北市大安區忠孝東路3段136號11樓","吳秉寰","2500000","1110628"
"2182","90326648","波比科技有限公司","臺北市大安區敦化南路2段180號6樓之1","姜靜汝","3000000","1110628"
"2183","90326653","近結有限公司","臺北市中正區公園路13號10樓","近藤昭宏","500000","1110630"
"2184","90326669","承享行銷有限公司","臺北市大安區羅斯福路2段91號4樓之2","陳宥余","1000000","1110628"
"2185","90326675","艾達介面有限公司","臺北市大安區羅斯福路3段29號6樓","陳遠達","1000000","1110629"
"2186","90326680","柒家有限公司","臺北市大同區民生西路132號1樓","周泱宏","2500000","1110628"
"2187","90326696","日出印加有限公司","臺北市信義區基隆路2段133號4樓","歐奕均","300000","1110628"
"2188","90326703","隆欣事業股份有限公司","臺北市中山區南京東路3段70號4樓","陳德仁","5000000","1110628"
"2189","90326719","森上娛樂國際有限公司","臺北市大安區忠孝東路4段222號3樓","莫林森","200000","1110628"
"2190","90326725","耘想生活有限公司","臺北市中山區建國北路3段94號4樓","吳欣穎","800000","1110628"
"2191","90326730","智巡科技有限公司","臺北市信義區基隆路1段155號5樓之8","賈漢文","100000","1110628"
"2192","90326746","尼斯妮絲股份有限公司","臺北市士林區德行西路52號1樓","于崇仁","1000000","1110628"
"2193","90326751","泰洋餐飲顧問有限公司","臺北市中正區博愛路52號11樓","沈暉國","20000","1110628"
"2194","90326767","酒林有限公司","臺北市松山區復興南路1段31號1樓","林暐勛","500000","1110628"
"2195","90326788","普萊森頓生技有限公司","臺北市大安區忠孝東路4段300號5樓","柯松明","1000000","1110628"
"2196","90326794","森呼吸行銷有限公司","臺北市萬華區萬大路31號","黃淑惠","3000000","1110628"
"2197","90326817","宸豐創意媒體有限公司","臺北市大安區復興南路2段237號12樓之16","鄭珮羽","500000","1110628"
"2198","90326823","安捷立資訊科技有限公司","臺北市中山區南京東路2段137號14樓","吳佩珊","100000","1110628"
"2199","90326838","高普科技有限公司","臺北市南港區重陽路461號7樓","蔡明錡","3000000","1110628"
"2200","90326859","煜泰源有限公司","臺北市中山區南京東路2段101號12樓","李國煜","100000","1110628"
"2201","90326865","穩健科技股份有限公司","臺北市大安區忠孝東路4段270號17樓","許韶芳","15000000","1110628"
"2202","90326871","凡希有限公司","臺北市信義區虎林街239號","周彥宏","999991","1110628"
"2203","90326886","筑色有限公司","臺北市中山區合江街102巷2號","廖伯軒","300000","1110628"
"2204","90326892","舊窩棚有限公司","臺北市大同區華陰街91號2樓之1","林俊佑","1000000","1110628"
"2205","90326909","庫客斯科技有限公司","臺北市中山區民生東路2段143號8樓","李依庭","2000000","1110628"
"2206","90326915","恆富資產管理有限公司","臺北市信義區忠孝東路5段1之1號12樓","吳思漢","5000000","1110629"
"2207","90326921","豐順盛股份有限公司","臺北市大同區長安西路301號1樓","莊榮德","20000000","1110628"
"2208","90326942","朔鼎統合股份有限公司","臺北市大安區信義路3段27之4號5樓","張璨","2000000","1110628"
"2209","90326957","梁陳吉時有限公司","臺北市大安區信義路4段296號15樓","陳聖婷","1000000","1110628"
"2210","90326963","謙兑有限公司","臺北市大安區文昌街128號","蔡世文","20000","1110628"
"2211","90326979","頂邑有限公司","臺北市中正區重慶南路3段129號3樓","黃芳珍","1000000","1110629"
"2212","90331282","尚嫣國際有限公司","桃園市楊梅區大成路204號(1樓)","楊政融","500000","1110608"
"2213","90331298","高優淨實業有限公司","桃園市桃園區同安里藝文一街86之5號十二樓","張芸嫚","100000","1110608"
"2214","90331305","昌鴻發國際有限公司","桃園市桃園區西埔里富國路409巷150弄20號","林舒怡","1000000","1110608"
"2215","90331311","拾壹拾壹有限公司","桃園市龜山區文化里復興二路10巷37弄6號2樓","楊佾璁","100000","1110608"
"2216","90331327","陞墉工程有限公司","桃園市中壢區忠孝里成章二街438號五樓","張雅惠","500000","1110608"
"2217","90331332","源保消防工程有限公司","桃園市桃園區永安里永康街27之1號","許弘傑","1000000","1110608"
"2218","90331348","兆詠有限公司","桃園市中壢區忠福里福安二街70號","呂政駿","500000","1110609"
"2219","90331353","聖羚精密機械有限公司","桃園市楊梅區紅梅里秀才路50巷20號","張喬惟","300000","1110609"
"2220","90331369","偉昌企業有限公司","桃園市桃園區大業路二段15號7樓","黃弘杰","200000","1110609"
"2221","90331375","泰晟工程股份有限公司","桃園市平鎮區龍恩里游泳路120巷2弄3號4樓","張世賓","3000000","1110609"
"2222","90331380","光銀實業有限公司","桃園市桃園區同安里中正路1092號25樓","阮光輝","500000","1110609"
"2223","90331396","亞品都實業有限公司","桃園市蘆竹區安中街15巷1號(二樓)","陳翠蓮","390000","1110609"
"2224","90331419","泉盈消防有限公司","桃園市龜山區文化二路299號5樓","周曉琦","1000000","1110609"
"2225","90331425","秋禾文創娛樂有限公司","桃園市蘆竹區大竹里大興十一街100巷12號","吳鎧宇","100000","1110609"
"2226","90331430","至尊寶國際有限公司","桃園市桃園區長安里力行路86之3號4樓","施邵夫","500000","1110609"
"2227","90331446","智升企業有限公司","桃園市桃園區中正路1092號25號","黃士華","5000000","1110609"
"2228","90331451","晉詠實業股份有限公司","桃園市蘆竹區瓦窯里五福路106巷10號8樓","廖秋蓮","1000000","1110609"
"2229","90331467","宣達不動產有限公司","桃園市桃園區寶安里中埔六街137之1號5樓","游睿騰","200000","1110609"
"2230","90331473","府尹投資開發股份有限公司","桃園市桃園區中正路1092號10樓","尹立豪","8000000","1110609"
"2231","90331488","宏順人力派遣有限公司","桃園市中壢區新生路537號(1樓)","李誌宏","1000000","1110609"
"2232","90331494","木川支撐架工程股份有限公司","桃園市大園區橫峰里青峰路二段176號六樓","鍾毓銘","10000000","1110609"
"2233","90331500","富宏土地開發有限公司","桃園市楊梅區大平里秀才路175巷1之2號（2樓）","羅家宏","200000","1110609"
"2234","90331516","誠信監測股份有限公司","桃園市中壢區環北路5號3樓","熊仁逸","2700000","1110609"
"2235","90331522","興昶富股份有限公司","桃園市蘆竹區福祿里五福一路50巷30號(2樓)","游文志","1000000","1110609"
"2236","90331537","更曜企業有限公司","桃園市龜山區同心二路27號(1樓)","汪宗翰","1000000","1110609"
"2237","90331543","漍鼎睿展有限公司","桃園市桃園區國鼎一街16號","張睿謙","500000","1110610"
"2238","90331558","芙德納科技股份有限公司","桃園市中壢區元化路226號10樓","閻恭明","1000000","1110610"
"2239","90331564","佳翔工業有限公司","桃園市桃園區忠五路2號(2樓)","廖昱祈","500000","1110610"
"2240","90331570","玉山光電有限公司","桃園市龍潭區中山里大昌路一段82號10樓","曾雅芳","2000000","1110610"
"2241","90331585","成璟有限公司","桃園市中壢區中建里延平路500號10樓之3","游坤能","1000000","1110610"
"2242","90331591","家拓工程有限公司","桃園市桃園區中興街18號8樓之15","陳鴻彬","1000000","1110610"
"2243","90331608","頂勝開發建設有限公司","桃園市楊梅區上湖里楊湖路三段751巷36弄55號（1樓）","黃建中","4500000","1110610"
"2244","90331614","合泰創新科技有限公司","桃園市龍潭區龍祥里聖亭路300巷120號(1樓)","邱銘隆","1000000","1110610"
"2245","90331635","樂迪汽車有限公司","桃園市桃園區文中里文中三路63號13樓","李彥勳","1000000","1110610"
"2246","90331641","思沛智庫有限公司","桃園市桃園區縣府路332之８號","李怡卿","800000","1110610"
"2247","90331656","痞客創意行銷股份有限公司","桃園市桃園區南門里南興街35號(1樓)","蔡佾璋","1000000","1110610"
"2248","90331662","凱安物流有限公司","桃園市中壢區中正里興仁路二段463巷3之3號2樓","陳憲正","5000000","1110610"
"2249","90331678","峖傑工程有限公司","桃園市中壢區新街里延平路261號10樓","曾紀喬","1000000","1110610"
"2250","90331683","春展智能科技有限公司","桃園市八德區興中里建德路266號14樓","江榮展","60000","1110610"
"2251","90331699","榮光泰生醫科技股份有限公司","桃園市中壢區石頭里建國路86號(3樓)","黃裕斌","12000000","1110610"
"2252","90331706","延昕有限公司","桃園市龜山區興華一街238號5樓","蘇以理","500000","1110610"
