"序號","統一編號","公司名稱","公司所在地","代表人","資本額","核准設立日期"
"1","28115221","北極星生醫股份有限公司","宜蘭縣宜蘭市宜科南路15號4樓之6-418室","陳鴻文","1000000000","1110602"
"2","29188307","日月光社會企業股份有限公司","高雄市楠梓區經三路26號","吳田玉","50000000","1110613"
"3","89121914","瓦拉米工程企業有限公司","新北市新店區檳榔路86巷2號","于維華","200000","1110616"
"4","89121920","景凡程控有限公司","新北市鶯歌區國際一路120巷1號(1樓)","鄧福閔","1000000","1110616"
"5","89121935","翊聖國際工程有限公司","新北市蘆洲區光華路186巷39號5樓","林國聖","5000000","1110616"
"6","89121941","生塏工程有限公司","新北市八里區中華路一段300號","鄭丞傑","50000","1110616"
"7","89121956","旺嘉科技有限公司","新北市新莊區新樹路244巷6弄15號(1樓)","何昇遠","1000000","1110616"
"8","89121962","木木日升有限公司","新北市板橋區大觀路3段160巷34弄7號6樓","許芸禎","1000000","1110616"
"9","89121978","宥宥有限公司","新北市淡水區沙崙路1段126巷32號2樓","蘇靜媚","30000","1110616"
"10","89121983","夏謙工程有限公司","新北市蘆洲區民權路3巷26號(1樓)","余瑋庭","1000000","1110616"
"11","89121999","朾興有限公司","新北市板橋區中山路1段1號13樓之26","李佳興","100000","1110616"
"12","89122006","眾庭環球開發實業有限公司","新北市新莊區新樹路207號之7","楊宗翰","500000","1110616"
"13","89122012","承錠工程有限公司","新北市林口區自強一街34號4樓","劉鈞鋕","200000","1110617"
"14","89122028","海青有限公司","新北市板橋區文化路1段309之23號13樓","陳姍姍","300000","1110616"
"15","89122033","東日國際有限公司","新北市鶯歌區育賢街6號6樓","陳仕杰","500000","1110617"
"16","89122049","祥鴻資源管理顧問有限公司","新北市三峽區光明路75巷34之2號7樓","朱彥錫","1000000","1110616"
"17","89122054","埕信企業有限公司","新北市永和區永利路94巷2號","張哲信","200000","1110616"
"18","89122060","林好健康有限公司","新北市三峽區復興路297號2樓","劉婉瑜","500000","1110616"
"19","89122076","晉酉全有限公司","新北市三重區三信路200號7樓","陳一賢","300000","1110616"
"20","89122081","威順消防設備有限公司","新北市三重區中央南路95巷25之3號","江偉進","1000000","1110616"
"21","89122097","鑫富瀚有限公司","新北市三重區正義北路123號3樓之8","林瀚文","1500000","1110617"
"22","89122104","台東知本海洋深層水有限公司","新北市土城區中華路1段215號6樓","蔡秀蓮","100000","1110617"
"23","89122110","式達科技有限公司","新北市泰山區中央路5巷17弄34號","戴佑芳","1000000","1110617"
"24","89122126","慧達科技股份有限公司","新北市汐止區康寧街169巷29之1號9樓之1","曾謀宏","6000000","1110617"
"25","89122131","盛日儲能科技股份有限公司","新北市新店區中興路2段192號8樓","陳忠廷","2000000","1110617"
"26","89122147","灃鉅資訊有限公司","新北市中和區景平路241巷24號(1樓)","蔡易如","500000","1110617"
"27","89122152","創晟建設開發股份有限公司","新北市樹林區學勤路224號16樓","周忠皜","1000000","1110617"
"28","89122168","群恩國際行銷股份有限公司","新北市土城區中華路1段36號9樓之5","楊政達","2000000","1110617"
"29","89122174","立悅投資有限公司","新北市泰山區仁愛路220巷34號","徐顥瑋","1000000","1110617"
"30","89122189","好漾創意有限公司","新北市中和區景安路28巷7號3樓","曾竣培","500000","1110617"
"31","89122195","津寬實業有限公司","新北市三重區仁政街45號6樓","邱寶玉","500000","1110617"
"32","89122202","鵬呈土地開發有限公司","新北市板橋區篤行路3段87號4樓","林俊呈","1000000","1110617"
"33","89122218","優翔有限公司","新北市鶯歌區尖山路215號","張羽妗","200000","1110617"
"34","89122224","禾兆豐股份有限公司","新北市汐止區大同路1段239號12樓之7","蔡淑惠","7000000","1110617"
"35","89122245","木雅有限公司","新北市新店區碧潭路77巷1號14樓之2","黃雅伶","500000","1110617"
"36","89122250","宏柏建設有限公司","新北市林口區仁愛路2段632號12樓","葉松宏","1000000","1110617"
"37","89122266","咨爾龍生技股份有限公司","新北市板橋區福德街25號","陳俊宏","1200000","1110617"
"38","89122272","和鋐租賃有限公司","新北市板橋區廣和街136號13樓之1","許毓隆","5000000","1110617"
"39","89122287","齊發廚房餐飲設備有限公司","新北市三重區重新路4段65號13樓之3","葉祖豪","200000","1110617"
"40","89122293","樺康智雲股份有限公司","新北市中和區建康路10號6樓","林建志","30000000","1110617"
"41","89122300","和盛新創股份有限公司","新北市板橋區中山路2段443巷76號3樓","魏行政","6000000","1110617"
"42","89122316","晶伶有限公司","新北市三重區新北大道1段123號11樓","劉姿伶","500000","1110617"
"43","89122322","魔魔貓文創有限公司","新北市板橋區華江一路550號7樓","李亦苡","100000","1110617"
"44","89122337","米爾法國際貿易有限公司","新北市五股區天乙路16號","陳一安","700000","1110617"
"45","89122343","虹飛資訊科技有限公司","新北市三重區五谷王北街42巷2號(2樓)","李宇勳","100000","1110617"
"46","89122358","睿宏有限公司","新北市三峽區中山路299巷15弄21號3樓","林孟睿","50000","1110617"
"47","89122364","台灣氣體有限公司","新北市樹林區光興街294號","林嘉聲","3000000","1110620"
"48","89122370","伊泰企業有限公司","新北市五股區成泰路2段147巷35號(1樓)","蕭仲崴","50000","1110620"
"49","89122391","恆旭能源有限公司","新北市中和區秀朗路3段10巷14弄53號","林玎諺","100000","1110620"
"50","89122414","果然新鮮有限公司","新北市新店區北新路1段10號3樓之1","高若軒","1000000","1110620"
"51","89122420","萬得富爸爸有限公司","新北市板橋區莒光路18號之1","李濃輝","500000","1110620"
"52","89122435","展德國際諮詢顧問有限公司","新北市新莊區中德路23號11樓","張蕙蘭","500000","1110620"
"53","89122441","盛心有限公司","新北市鶯歌區二橋街1號","黃品心","1000000","1110620"
"54","89122456","擎華科技有限公司","新北市中和區建康路21號3樓","郭襄潁","1000000","1110620"
"55","89122462","洛卡巴萊企業有限公司","新北市三重區力行路2段69號7樓","寶杜巴燕","36888","1110620"
"56","89122505","震坤國際貿易有限公司","新北市汐止區新台五路1段93號21樓之6","王熙仁","500000","1110620"
"57","89122511","泰居有限公司","新北市泰山區明志路1段492巷2號","白晴方","5000000","1110620"
"58","89122527","乘佳有限公司","新北市泰山區信華五街112號","歐珮怡","4000000","1110620"
"59","89122532","榮邑有限公司","新北市林口區文化北路1段412巷15號","陳韋翰","5000000","1110620"
"60","89122548","盛璿企業有限公司","屏東縣潮州鎮福星路101號一樓","梁家豪","2000000","1110609"
"61","89122553","商富士電有限公司","花蓮縣花蓮市公正街37-5號一樓","湯善鈞","100000","1110609"
"62","89122569","默默有限公司","嘉義市東區後庄里林森東路707巷24號4樓","俞宥吟","500000","1110609"
"63","89122575","具漢有限公司","雲林縣虎尾鎮中山里中正路149號1樓","張庭維","2000000","1110609"
"64","89122580","銑剛精密工業有限公司","宜蘭縣冬山鄉安平村大安路293號","王瀧賢","3000000","1110609"
"65","89122596","勵迪爾投資顧問股份有限公司","新竹縣竹北市光明十街36巷3號","陳詩尹","9200000","1110609"
"66","89122603","創能源股份有限公司","屏東縣新園鄉田洋村仙鯉路2-1號","林建佑","100000","1110609"
"67","89122619","樺興開發股份有限公司","新竹縣竹北市嘉政二街9號","陳建芳","5000000","1110609"
"68","89122625","香象素食餐廳有限公司","宜蘭縣羅東鎮中山路二段413號一樓","張清龍","300000","1110609"
"69","89122630","宏正國際餐飲有限公司","屏東縣屏東市工業路21號","邱宏儒","1000000","1110609"
"70","89122646","毅力能源開發有限公司","嘉義市東區興安里大業街127巷41號1樓","袁圖英","400000","1110609"
"71","89122651","顥嚴有限公司","臺東縣東河鄉都蘭村都蘭路339號","胡顥嚴","100000","1110609"
"72","89122667","齊賦消防有限公司","南投縣南投市福山里八卦路650巷3號","鄭百祥","350000","1110609"
"73","89122673","得睿軒投資有限公司","彰化縣伸港鄉彰新路七段580號1樓","柯尊池","7300000","1110610"
"74","89122688","岦昂有限公司","新竹縣竹北市光明六路87之5號7樓","張其驤","1000000","1110610"
"75","89122694","九德企業有限公司","新竹縣竹東鎮榮華里北興路3段16巷22號1樓","褚重光","5000000","1110610"
"76","89122701","永登精密有限公司","新竹市東區忠孝路62號","陳惠琳","50000","1110610"
"77","89122717","農森科技股份有限公司","彰化縣大村鄉平和村山腳路170之6號1樓","黃燕","3000000","1110610"
"78","89122723","鉑泉有限公司","南投縣草屯鎮富寮里富德街11巷1號1樓","張丹齡","1000000","1110610"
"79","89122738","山川開發建設股份有限公司","新竹縣竹北市北崙里縣政十六街19號","呂家蒼","2000000","1110610"
"80","89122759","金冠達食品貿易有限公司","彰化縣彰化市向陽里向陽街99巷49弄21號1樓","楊詠傑","500000","1110610"
"81","89122765","誠富漁業有限公司","屏東縣東港鎮朝安里博愛街186-2號一樓","陳宗誠","300000","1110610"
"82","89122771","汎得能源有限公司","基隆市七堵區俊賢路59號五樓","簡淑慧","10000000","1110610"
"83","89122786","亞力營造股份有限公司","新竹市北區仁德里長安街43號二樓之3","祁志雄","22500000","1110610"
"84","89122792","溱醇潔企業有限公司","屏東縣內埔鄉內田村民生路41號1樓","陳文進","10000","1110610"
"85","89122809","春溢建設股份有限公司","彰化縣鹿港鎮自由路21-5號","王明信","10000000","1110610"
"86","89122815","天邑鋁業股份有限公司","彰化縣福興鄉三汴村番花路一段442號","李振寬","30000000","1110610"
"87","89122836","喬芝富建設企業有限公司","雲林縣虎尾鎮成和三街20號1樓","廖苑君","500000","1110610"
"88","89122842","育洲有限公司","南投縣草屯鎮中山里草溪路779號1樓","李瑞河","1700000","1110610"
"89","89122857","道管理顧問股份有限公司","宜蘭縣羅東鎮河濱路23巷一弄16號","林世麒","10500000","1110610"
"90","89122863","村唐營造有限公司","苗栗縣後龍鎮中山路147號1樓","蔡明佐","3600000","1110610"
"91","89122879","鈦鍠有限公司","雲林縣西螺鎮正興里中正路81-6號1樓","邱彥睿","1500000","1110610"
"92","89122884","台灣機器能源有限公司","嘉義縣梅山鄉梅南村3鄰南興街38號1樓","劉淑娟","30000","1110610"
"93","89122890","德鋁金屬有限公司","彰化縣和美鎮四張里和興路23號1樓","吳四民","500000","1110610"
"94","89122907","好想出去玩有限公司","新竹市東區金山里金山七街9號一樓","鄭家昌","200000","1110610"
"95","89122913","展州室內裝修有限公司","宜蘭縣蘇澳鎮聖愛路6號1樓","林彥廷","1000000","1110610"
"96","89122929","惹鍋民雄有限公司","嘉義縣民雄鄉福樂村建國路三段52號","張銀良","550000","1110610"
"97","89122934","澄燿有限公司","彰化縣員林市惠來里惠明街19巷31號","陳筠方","250000","1110610"
"98","89122940","藝展捲門有限公司","新竹縣峨眉鄉石井村4鄰石井27號1樓","周信忠","200000","1110613"
"99","89122955","鑫祥時程有限公司","嘉義市西區湖內里民生南路1000號3樓之13","游全鑫","300000","1110613"
"100","89122961","龍邁建設股份有限公司","屏東縣屏東市一心里復興路223號三樓","宋國瑋","28000000","1110613"
"101","89122977","奇星儲能有限公司","嘉義縣朴子市大葛里吉祥六街27號3樓","蘇惠珠","100000","1110613"
"102","89122982","科學鏈股份有限公司","新竹市東區光復路二段101號(創新育成中心光復培育室311-AJ)","陳映滕","100000","1110613"
"103","89122998","硅富應用材料股份有限公司","嘉義縣太保市安仁里祥和三路東205巷3號1樓","詹益富","1000000","1110613"
"104","89123005","樂智科技有限公司","新竹市東區豐功里公道五路二段379號4樓之1","盧盟仁","80000","1110613"
"105","89123011","鑫貝投資有限公司","新竹縣竹北市中興里復興三路168號9樓之5","邱純玉","5000000","1110613"
"106","89123027","厚昇工程有限公司","彰化縣鹿港鎮平和路103巷1號","孫鳳香","2500000","1110613"
"107","89154105","崑軍有限公司","新竹縣湖口鄉中正村達生八街117號1樓","李佩玉","500000","1110613"
"108","89154111","尤其是有限公司","新竹縣竹北市嘉豐七街139號9樓","談念中","2500000","1110613"
"109","89154127","宏諭有限公司","苗栗縣南庄鄉蓬萊村11鄰八卦力19號","高璿蕎","200000","1110613"
"110","89154132","安薰秀有限公司","嘉義縣民雄鄉西安村西安路30-1號","郭玟秀","2100000","1110613"
"111","89154148","王振瑋藝術有限公司","彰化縣芬園鄉芬園村芬草路二段臨31之52號","王振瑋","500000","1110613"
"112","89154153","鑫采不動產仲介有限公司","新竹縣橫山鄉內灣村中山街2段51-4號","彭若涵","150000","1110613"
"113","89154169","允富帆有限公司","彰化縣埔心鄉太平村太平路34號1樓","劉仲智","1000000","1110613"
"114","89154175","碁翊有限公司","彰化縣彰化市永生里民族路416號","吳宗霖","100000","1110613"
"115","89154180","九里松健康顧問股份有限公司","新竹縣竹北市自強北路418號2樓","楊程偉","1000000","1110613"
"116","89154196","海灃企業有限公司","屏東縣新園鄉共和村光復路3之7號","林建宏","130000","1110613"
"117","89154203","富特麗工程有限公司","新竹縣竹東鎮仁愛里6鄰沿河街697巷2號1樓","郭宗平","800000","1110613"
"118","89154219","芯揚半導體股份有限公司","新竹市香山區東香里富街97巷3號1樓","曾寶璇","400000","1110613"
"119","89154225","新集集新材料有限公司","彰化縣彰化市快官里彰南路四段424號1樓","黄阿好","100000","1110613"
"120","89154230","禾曜配管工程有限公司","宜蘭縣五結鄉季新村季水路66-2號1樓","康庭維","1000000","1110613"
"121","89154246","嘉世工程有限公司","基隆市暖暖區源遠路179之10號七樓","李冠緯","1000000","1110613"
"122","89154251","散策文創整合有限公司","彰化縣員林市三條里忠孝街81號一樓","汪峻毅","1000000","1110613"
"123","89154267","渼芯健康顧問股份有限公司","宜蘭縣冬山鄉珍珠村幸福一路236號3樓","陳彥甫","100000","1110613"
"124","89154273","祝昌工程有限公司","屏東縣九如鄉東寧村東明街6號","許慧蘭","500000","1110613"
"125","89154288","央盛科技有限公司","新竹縣竹北市興安里光明一路9號9樓","林文盛","300000","1110613"
"126","89154294","京川有限公司","宜蘭縣羅東鎮國華里公正路537號","張彥絜","1750000","1110613"
"127","89154301","潘貴蘭有限公司","臺東縣鹿野鄉龍田村光榮路143號","潘貴蘭","500000","1110613"
"128","89154317","浤暘建設有限公司","宜蘭縣冬山鄉群英路20號1樓","游博輝","4000000","1110613"
"129","89154323","古寶漢方草本股份有限公司","彰化縣大村鄉擺塘村擺塘巷10之38號","古興棟","1000000","1110613"
"130","89154338","日昇精密科技有限公司","彰化縣秀水鄉鶴鳴村永興巷47號","陳尚瑋","5000000","1110613"
"131","89154359","怡澄國際有限公司","彰化縣彰化市莿桐里彰水路7號","黃昱睿","250000","1110613"
"132","89154365","栢映建設有限公司","彰化縣溪州鄉溪厝村溪林路195號1樓","胡栢堅","800000","1110613"
"133","89154371","光譜數位國際有限公司","基隆市中正區義一路87號9樓之2","古佳永","1000000","1110613"
"134","89154386","正泰建設有限公司","苗栗縣苑裡鎮苑東里20鄰慈祥街29號","洪晃琦","600000","1110613"
"135","89154392","唯粹設計有限公司","苗栗縣頭份市流東里11鄰老崎6-66號4樓","陳俞中","100000","1110613"
"136","89154409","日金投資有限公司","新竹縣新豐鄉埔和村埔頂38號2樓","許家銓","10000000","1110613"
"137","89154415","序曲室內裝修設計有限公司","南投縣草屯鎮富頂路一段43巷27號","趙仁君","1000000","1110613"
"138","89154421","康品國際有限公司","彰化縣秀水鄉福安村村西巷20之1號一樓","曾淑敏","300000","1110613"
"139","89154436","新竹都更顧問有限公司","新竹縣竹北市東興里52鄰興海街103巷131弄2號","吳素琴","100000","1110614"
"140","89154457","羅格普爾數位行銷科技股份有限公司","金門縣金城鎮北門里民生路31號","何知一","1000000","1110614"
"141","89154463","安網網路科技有限公司","新竹市北區台溪里中華路三段9號7樓之8","詹鎮安","20000","1110614"
"142","89154479","真本事城鄉育成股份有限公司","花蓮縣新城鄉新城村中山路68之3號","高偉凱","1000000","1110614"
"143","89154490","如煙餐酒館有限公司","屏東縣屏東市勝義巷10號","郭宥婕","500000","1110614"
"144","89154506","嵩暘實業有限公司","新竹縣橫山鄉橫山村橫山街一段208號1樓","陳運暘","1000000","1110614"
"145","89154512","台上精密機械有限公司","彰化縣埔心鄉經口村中山路101號","黃綉芳","100000","1110614"
"146","89154528","稑路國際貿易有限公司","南投縣竹山鎮延山里鹿山路613-1號","楊采蓉","100000","1110614"
"147","89154533","寶乾紙工業有限公司","宜蘭縣五結鄉福興村仁一路1巷19號1樓","魏坤池","300000","1110614"
"148","89154549","上瑪鋼鐵企業有限公司","雲林縣斗南鎮僑真里守成街132號1樓","林信佑","500000","1110614"
"149","89154554","藍盾永續文化有限公司","新竹市東區綠水里光復路二段295號16樓之6","林秀叡","140000","1110614"
"150","89154560","城鄉數位科技整合有限公司","嘉義縣朴子市開元路474巷36弄40-3號1樓","莊鴻凱","2000000","1110614"
"151","89154576","海盛有限公司","宜蘭縣頭城鎮中崙路95巷18號（1樓）","蕭鳴宏","500000","1110614"
"152","89154581","有租有限公司","新竹市東區復興里自由路67號8樓之2","鄭佳玲","300000","1110614"
"153","89154597","偉驄有限公司","雲林縣麥寮鄉三盛村仁德西路一段139巷86弄77號1樓","許宸碩","500000","1110614"
"154","89154604","瑞鶴國際企業有限公司","屏東縣里港鄉潮厝村潮厝路94-1號1樓","陳建霖","1000000","1110614"
"155","89154610","博恩室內裝修有限公司","苗栗縣頭份市民族路394巷46號一樓","林博文","100000","1110614"
"156","89154631","逸遠有限公司","彰化縣彰化市延和里中山路一段220號1樓","何秋燕","100000","1110614"
"157","89154647","昱響國際貿易有限公司","新竹縣竹北市泰和里水瀧三街107號1樓","李濬丞","5000000","1110614"
"158","89154652","海口峰水產企業有限公司","澎湖縣白沙鄉赤崁村大赤崁32之2號一樓","邱國峰","400000","1110614"
"159","89154668","大響電子有限公司","宜蘭縣礁溪鄉玉石村健康一街87號五樓之20","洪嘉徽","300000","1110614"
"160","89154674","儕冠開發工程有限公司","花蓮縣吉安鄉慶豐村慶南三街458巷15號1樓","潘定綸","7000000","1110614"
"161","89154689","樂夥國際整合行銷有限公司","新竹市香山區富群街29號二樓","潘孝慈","3000000","1110614"
"162","89154695","信弈消防有限公司","雲林縣大埤鄉尚義村尚義5之28號","詹政儒","2000000","1110614"
"163","89154702","長隆油品有限公司","彰化縣秀水鄉福安村通鹿巷188弄2號1樓","段明廷","100000","1110614"
"164","89154718","展和有限公司","宜蘭縣頭城鎮新建里新興路128號","林偉民","1000000","1110614"
"165","89154724","吉時雨有限公司","南投縣集集鎮田寮里楓林巷9-3號","林欣頡","50000","1110614"
"166","89154739","興台源環境科技股份有限公司","彰化縣鹿港鎮東石里工業西六路22號","莊鋐洋","20000000","1110614"
"167","89154745","梭羅國際教育有限公司","新竹市北區北門里城北街148號1樓","羅一舜","1000000","1110614"
"168","89154750","信卉實業有限公司","彰化縣彰化市新興里金馬路二段臨696號","張惠君","100000","1110614"
"169","89154766","大脾氣國際貿易有限公司","彰化縣花壇鄉南口村5鄰中山路 2段291-15號2樓","林聖凱","500000","1110614"
"170","89154772","鈞賀國際美容有限公司","新竹市北區湳中里湳中街54巷16號一樓","駱渟鈺","3000000","1110614"
"171","89154787","靖澤國際有限公司","苗栗縣頭份市文化里15鄰八德二路206號1樓","黃文勇","4000000","1110615"
"172","89154793","泉朗科技有限公司","新竹市北區民富里經國路2段261號1樓","陳瑞華","100000","1110615"
"173","89154800","永睿國際投資有限公司","新竹縣竹北市復興三路二段168號9樓之5","張瑞玫","21300000","1110615"
"174","89154816","下班厚有限公司","新竹縣竹北市中興里復興三路二段56號1樓","林季葳","200000","1110615"
"175","89154822","金易暘金屬有限公司","屏東縣里港鄉塔樓路55之10號一樓","楊詒珺","1000000","1110615"
"176","89154837","德薇絲緹國際有限公司","苗栗縣頭份市和平里和平路67號1樓","簡梓皓","500000","1110615"
"177","89154843","百超營造工程有限公司","嘉義縣民雄鄉雙福村雙福78-201號","游秀卿","3600000","1110615"
"178","89154858","科豪有限公司","基隆市安樂區基金一路121巷38號1樓","徐菁秀","1000000","1110615"
"179","89154864","沛無限有限公司","澎湖縣馬公市朝陽里林森路15巷50號","林儀宗","5000000","1110615"
"180","89154870","珍惜食光有限公司","基隆市安樂區麥金路153-3號12樓","郭得暐","2050000","1110615"
"181","89154885","高功電器有限公司","南投縣南投市營北里營北路116巷1號2樓","吳宜蓁","380000","1110615"
"182","89154891","躍賢車業有限公司","臺北市松山區民生東路5段255號1樓","李姿妮","20000000","1110621"
"183","89154908","華彤國際有限公司","臺北市北投區中央北路2段52號1樓","萬儀德","1000000","1110621"
"184","89154914","核作健康事業有限公司","臺北市大安區忠孝東路3段192號2樓","陳登翔","1000000","1110621"
"185","89154920","大慶小客車租賃有限公司","臺北市大安區和平東路3段330號3樓","周宜德","5000000","1110621"
"186","89154935","皇菲有限公司","臺北市大同區南京西路163號2樓之38號","張芷瑜","500000","1110621"
"187","89154941","創麗廣告行銷有限公司","臺北市松山區復興北路201號3樓之4","林立羣","6000000","1110621"
"188","89154956","贏淵生技有限公司","臺北市大同區華陰街91號2樓之1","邱呈淵","1000000","1110621"
"189","89154962","沛首國際有限公司","臺北市內湖區內湖路1段91巷35弄23號1樓","蘇湘嵐","550000","1110621"
"190","89154978","唐成國際有限公司","臺北市信義區虎林街239號","時維志","100000","1110621"
"191","89154983","頌泉股份有限公司","臺北市信義區虎林街239號","劉洵綺","300000","1110621"
"192","89154999","始源音樂有限公司","臺北市松山區南京東路5段66巷22弄36號","吳浚瑋","100000","1110621"
"193","89155006","王長怡投資有限公司","臺北市信義區松勇路37號3樓","王長怡","2000000","1110621"
"194","89155012","杰誠投資有限公司","臺北市中山區長安東路2段162號7樓","古文傑","10000000","1110621"
"195","89155028","食常文創有限公司","臺北市士林區文林路730號","曾繁榮","1000000","1110621"
"196","89155033","畫加命藝術設計股份有限公司","臺北市中山區林森北路381號5樓之15","陳則旻","1000000","1110621"
"197","89155049","郭怡美商行有限公司","臺北市大同區迪化街1段129號1樓","趙偉仁","8000000","1110621"
"198","89155054","毅珈國際有限公司","臺北市南港區成功路1段36巷6號4樓之3","許思琦","1000000","1110622"
"199","89155060","天使長生醫科技股份有限公司","臺北市信義區福德街300巷2號1樓","吳啓誠","300000","1110623"
"200","89155076","杉尚企業有限公司","臺北市內湖區民權東路6段127號","劉保印","200000","1110621"
"201","89155081","奇果食品運銷有限公司","臺北市中正區紹興北街3號2樓","呂彥霆","500000","1110621"
"202","89155097","家騰投資有限公司","臺北市大安區忠孝東路4段221號12樓","賴思婕","500000","1110622"
"203","89155104","完備有限公司","臺北市中山區長春路192號4樓","袁至誠","30000","1110621"
"204","89155110","築僑空間設計工程有限公司","臺北市中正區南昌路2段128號8樓之3","陳冠羽","500000","1110621"
"205","89155131","艾爾文股份有限公司","臺北市中正區懷寧街82號1樓","江信緯","100000","1110621"
"206","89155147","詠欣資本股份有限公司","臺北市信義區基隆路1段155號13樓之5","温永昌","5000000","1110622"
"207","89155152","家洗衣有限公司","臺北市松山區南京東路3段287號2樓","黃敬華","6000000","1110622"
