"序號","統一編號","公司名稱","公司所在地","代表人","資本額","核准設立日期"
"2048","00196084","凱立數位有限公司","新竹市北區石坊里中山路163號2樓之3","羅宇安","20000","1130821"
"2049","00196090","朔望科技有限公司","彰化縣和美鎮鎮平里南平路45號1樓","謝喬袽","1000000","1130829"
"2050","00196107","昇晉生技有限公司","桃園市大溪區仁善里埔頂路一段357巷942弄40號2樓","吳心瑜","66000","1130823"
"2051","00196129","友誼小船有限公司","臺中市南屯區大聖街348巷6號","江季軒","1000000","1130815"
"2052","00196211","英倫生命事業有限公司","桃園市楊梅區瑞塘里中山北路2段373號(1樓)","鍾友倫","600000","1130812"
"2053","00196492","龍騰九州有限公司","桃園市楊梅區民族路五段249號(1樓)","劉立亮","500000","1130830"
"2054","00196514","采邦有限公司","新北市永和區仁愛路306巷18弄7號13樓","沈孟暵","200000","1130820"
"2055","00196556","雅緻美學行銷有限公司","高雄市三民區六合路10巷38號","温展逸","300000","1130827"
"2056","00196578","众謹國際人力仲介有限公司","雲林縣斗南鎮僑真里延平路二段572-2號2樓之2","蔡玫芳","5000000","1130829"
"2057","00196628","在路上無限文化有限公司","新北市板橋區東門街30之2號5樓之1","慕里諾恩.達里拉旦","100000","1130828"
"2058","00196676","生利工程有限公司","桃園市桃園區三民里成功路二段171號14樓","朱建龍","1000000","1130814"
"2059","00196789","丞富管理顧問有限公司","臺北市中山區復興北路2號11樓之8","詹惠如","2200000","1130823"
"2060","00196866","德合工程有限公司","臺北市中山區中山北路1段121巷15號2樓之10","楊文宏","500000","1130830"
"2061","00197083","億希企業有限公司","臺北市中山區松江路169號1樓","葉億權","2600000","1130813"
"2062","00197128","沂申工程有限公司","苗栗縣南庄鄉西村5鄰中山路70號1樓","黃照翔","1000000","1130815"
"2063","00197247","長石陶瓷有限公司","桃園市桃園區玉山里德壽二街3號","李福全","600000","1130814"
"2064","00197302","好仕達生醫股份有限公司","臺北市北投區立功街165巷5號7樓之1","林璟渝","1000000","1130823"
"2065","00197324","金桐投資有限公司","臺南市安南區溪心里智安四街66號1樓","洪靖惠","1000000","1130815"
"2066","00197627","永佳長照有限公司","桃園市楊梅區永寧里校前路346號(2樓)","楊文婷","1000000","1130819"
"2067","00197746","雋訊科技有限公司","新竹市北區水田里北大路166巷98號5樓","黃俊傑","1000000","1130827"
"2068","00197838","芳義通運有限公司","嘉義市西區蘭州一街113號3樓","朱珮芳","25000000","1130808"
"2069","00197865","艾普吉有限公司","臺北市信義區基隆路2段23號9樓之5","陳潔彥","200000","1130823"
"2070","00197963","潤錩控股企業有限公司","高雄市左營區明潭路110巷1號","紀宇牧","100000","1130821"
"2071","00197979","侑緯有限公司","臺中市神岡區民權二街205巷22弄11號1樓","曾晋育","200000","1130826"
"2072","00198034","邑謙室內裝修有限公司","新北市林口區仁愛路1段386巷8號10樓之2","李昕謙","8000000","1130815"
"2073","00198040","數字能源科技股份有限公司","新竹市北區仁德里北大路307號9樓之3","張竣渝","100000","1130814"
"2074","00198082","元億粿光電有限公司","屏東縣萬巒鄉佳佐村16鄰民生路46-1號","陳萱容","680000","1130809"
"2075","00198219","吃三原有限公司","高雄市苓雅區中正一路120號5樓之4","李宥蓁","300000","1130814"
"2076","00198631","妍發餐飲有限公司","苗栗縣苑裡鎮慈和街270號","楊伯俊","7000000","1130826"
"2077","00198647","品川燒肉有限公司","彰化縣彰化市忠孝里辭修路199號1樓、2樓","陳政揚","2000000","1130812"
"2078","00198674","八八企業有限公司","臺中市外埔區水美里水美路50之1號1樓","張日騰","100000","1130822"
"2079","00198689","家業廣告有限公司","桃園市桃園區中正路1247號二十二樓之2","林勤智","5000000","1130816"
"2080","00198864","青青拾伍創意有限公司","桃園市桃園區介壽路495巷65號14樓","呂曜任","400000","1130815"
"2081","00198956","富達陽投資股份有限公司","臺南市安南區怡安路2段597號2樓","李建輝","1000000","1130814"
"2082","00199033","風昇水綺有限公司","臺北市信義區信義路4段456號6樓","楊昇達","200000","1130815"
"2083","00199104","雄昱顧問有限公司","高雄市三民區大連街245巷33號","蘇文暉","100000","1130822"
"2084","00199250","宥澄環保有限公司","桃園市桃園區中泰里國聖一街194號11樓","李新文","200000","1130826"
"2085","00199364","誠三股份有限公司","臺中市龍井區東海里藝術街101號","林燕君","1250000","1130823"
"2086","00199414","河合精測科技股份有限公司","臺北市大安區忠孝東路4段148號8樓之1","呂秉洋","200000","1130815"
"2087","00199505","超益機電股份有限公司","臺北市松山區基隆路1段8號13樓","黃煒盛","3000000","1130827"
"2088","00199603","兆億興業有限公司","臺北市松山區復興北路15號5樓之9","吳牧達","200000","1130816"
"2089","00199815","竹崎交流道加油站有限公司","嘉義市西區美源里新庄街146號1樓","盧立志","6000000","1130819"
"2090","00199955","鎂億國際企業有限公司","屏東縣內埔鄉豐田村龍鳳路66巷54號1樓","劉詩涵","100000","1130814"
"2091","00199977","宏宇環保有限公司","苗栗縣公館鄉尖山村尖山296-3號","陳宏志","100000","1130829"
"2092","00200215","益東投資有限公司","臺北市中山區復興北路48號3樓","羅薏玲","60000","1130822"
"2093","00200279","貨好多有限公司","臺北市大同區長安西路288號2樓","吳秀容","100000","1130822"
"2094","00200361","維樂環境事業有限公司","桃園市桃園區新埔六街77號9樓之5","林辰達","3000000","1130829"
"2095","00200382","心聚郭餐飲股份有限公司","高雄市楠梓區藍田路1號2樓","郭思妤","1500000","1130814"
"2096","00200427","力鍀科技有限公司","雲林縣虎尾鎮德興里德新街68號1樓","杜枝梅","600000","1130823"
"2097","00200502","家豪國際不動產股份有限公司","臺北市中山區區建國北路2段3巷15號3樓之12","張育豪","2401000","1130830"
"2098","00200622","三十未央有限公司","臺北市大安區師大路91號1樓","林巧玉","4010000","1130822"
"2099","00200670","晨悅開發有限公司","桃園市平鎮區育達路228號（3樓）","楊境軒","400000","1130826"
"2100","00200714","熊印屋有限公司","新竹市東區東園里忠孝路416號1樓","何展飛","550000","1130826"
"2101","00200876","維嘉投資有限公司","臺北市中山區南京西路1之1號6樓","陳思維","60000","1130822"
"2102","00200968","慶豪數位資訊有限公司","臺中市西區中興里中興街183號4樓之1","簡嘉慶","500000","1130828"
"2103","00201039","圓山視光有限公司","高雄市苓雅區建國一路268號1樓","張俊卿","3000000","1130821"
"2104","00201072","佳遠企業有限公司","臺南市佳里區忠仁里延平路282號1樓","楊士賢","300000","1130815"
"2105","00201278","長永交通有限公司","新北市汐止區新台五路2段238巷85號6樓","柯思羽","300000","1130814"
"2106","00201312","好生活創意科技有限公司","臺北市中正區重慶南路1段57號4樓之1","曾正興","100000","1130829"
"2107","00201431","好感未來投資有限公司","高雄市苓雅區苓雅一路270巷24之1號","湯雅涵","1000000","1130815"
"2108","00201571","嘉順發國際貿易有限公司","高雄市阿蓮區民族路238巷13弄50號2樓","程新評","1000000","1130816"
"2109","00201642","保歐仕生醫有限公司","臺中市大里區永隆里東明路570號1樓","陳璂　","800000","1130827"
"2110","00201679","唯客優餐飲有限公司","臺中市中區民族路64號6樓之5","李駿凱","36000","1130828"
"2111","00201761","普氏地產有限公司","臺中市西屯區櫻城三街56號14樓之1","葉仁豪","1000000","1130829"
"2112","00201777","擎暘科技股份有限公司","臺北市內湖區潭美街285號","陳憲惠","12000000","1130822"
"2113","00201782","泊媞實物資產有限公司","臺北市內湖區民權東路6段180巷6號4樓","黃韻如","200000","1130820"
"2114","00201827","長田工程有限公司","宜蘭縣三星鄉大隱村大埔中路202號","李宗杰","300000","1130827"
"2115","00201832","閃能電子科技有限公司","臺北市萬華區成都路76巷5號2樓","李宇傑","50000","1130814"
"2116","00201853","宏富發建設有限公司","南投縣埔里鎮杷城里民治三街7號1樓","王西美","1000000","1130812"
"2117","00201994","強威皇院車體有限公司","高雄市苓雅區成功一路80號1樓","許育強","500000","1130814"
"2118","00202059","有丞不鏽鋼有限公司","臺中市大雅區上楓里樹德街155號","劉郡湲","1000000","1130826"
"2119","00202115","承越企業有限公司","新北市板橋區文化路1段421巷3號（1樓）","蔡雲雀","100000","1130814"
"2120","00202142","名埔股份有限公司","高雄市新興區文化路66號1樓","許家惠","2000000","1130828"
"2121","00202207","盈創認證測試有限公司","彰化縣溪州鄉尾厝村中山路三段598號一樓","謝易瑾","100000","1130808"
"2122","00202277","慶鴻營造興業有限公司","高雄市三民區汾陽路24號1樓","郭婷","6000000","1130816"
"2123","00202353","新磊營造有限公司","桃園市大園區後厝路100巷75號(二樓)","黃宗侯","5000000","1130829"
"2124","00202419","畢思科技有限公司","臺北市大安區復興南路1段352號2樓","周彥儒","1000000","1130821"
"2125","00202608","弘御建設股份有限公司","桃園市八德區瑞源街23號","柯明煌","30000000","1130813"
"2126","00202760","昇陽起重工程有限公司","連江縣南竿鄉清水村117-2號1樓","陳偉強","500000","1130821"
"2127","00202797","康晴食品有限公司","臺北市中山區南京東路2段160號6樓","羅敏慈","100000","1130823"
"2128","00202945","春錦旅行社有限公司","雲林縣麥寮鄉橋頭村仁德路236巷78號1樓","陳美汶","6000000","1130827"
"2129","00203070","寶億營造有限公司","嘉義縣太保市春珠里8鄰春珠148號1樓","高瑞憶","5000000","1130828"
"2130","00203183","星雲有限公司","臺中市西區大忠里忠明南路270號7樓之1","余哲豪","1000000","1130823"
"2131","00203206","昌盛寰宇有限公司","臺中市北區立人里華美街二段246號8樓之5","蘇讚昌","5000000","1130829"
"2132","00203304","新穎車業有限公司","臺南市新營區嘉芳里復興路1069號1樓","吳忠憲","1680000","1130820"
"2133","00203418","幸慈有限公司","臺南市白河區永安里一心街14號1樓","黃川炫","201000","1130816"
"2134","00203424","星域美學顧問有限公司","新北市中和區中正路909號10樓","簡廷芳","200000","1130822"
"2135","00203493","玧承企業有限公司","高雄市仁武區八德東路23巷3號1樓","陳品家","200000","1130827"
"2136","00203536","智煜投資股份有限公司","新北市樹林區大安路632號4樓","詹家榮","30000000","1130823"
"2137","00203613","韋恩節能有限公司","臺北市萬華區忠孝西路2段20號4樓","李鸛庭","10000","1130814"
"2138","00203677","泛鉅國際有限公司","彰化縣彰化市中華西路371號11樓之2","鐘偉嘉","60000","1130822"
"2139","00204042","廣川國際貿易有限公司","新北市泰山區文程路18巷35號","郭祐豪","100000","1130829"
"2140","00204211","安佳數位行銷有限公司","臺北市大安區信義路4段210號11樓","羅安","100000","1130828"
"2141","00204269","益福康國際生物科技有限公司","宜蘭縣羅東鎮信義里興東路249號1樓","郭榮村","100000","1130822"
"2142","00204296","宇叡工程有限公司","臺中市龍井區龍津里臨港東路一段255巷32號1樓","紀彥宇","1500000","1130819"
"2143","00204535","炎展科技企業有限公司","新竹縣新埔鎮田新里信義街5號一樓","鄭竣訓","200000","1130819"
"2144","00204612","虛擬夢想科技有限公司","臺北市大安區忠孝東路3段305號4樓之4","林靖巄","1000000","1130828"
"2145","00204893","包嘉機械工程有限公司","臺北市萬華區萬大路425號2樓","錢冠廷","1000000","1130827"
"2146","00204937","雷成機電有限公司","新北市汐止區忠一街1號2樓","楊堂志","100000","1130819"
"2147","00205008","諾恩投資有限公司","彰化縣鹿港鎮頂番里彰頂路255號二樓","王敏如","5000000","1130808"
"2148","00205041","丞辰科技有限公司","臺北市大安區忠孝東路4段300號5樓","FOO SWEE SENG","1000000","1130826"
"2149","00205210","積發建設事業有限公司","臺中市南屯區文山里保安十街37號","蘇俊凱","300000","1130809"
"2150","00205485","荃盈企業有限公司","臺南市歸仁區中山路3段226號1樓","何光能","500000","1130819"
"2151","00205529","右宇國際有限公司","桃園市桃園區長安里中正路633號（1樓）","邱右予","400000","1130823"
"2152","00205788","帝沅投資有限公司","桃園市蘆竹區榮興路22巷26號8樓","王雅萍","3000000","1130829"
"2153","00205859","庭一有限公司","新北市板橋區府中路126號2樓之25","廖庭蓁","250000","1130822"
"2154","00205871","青穎蔬果有限公司","嘉義縣中埔鄉鄉和美村大義路326巷9號","吳智穎","3800000","1130826"
"2155","00205957","臺灣特斯肯有限公司","臺北市信義區忠孝東路4段560號8樓","Jean-Charles Fadzhong Chen","5000000","1130815"
"2156","00206034","高平方有限公司","臺北市萬華區忠孝西路2段20號3樓","高德凱","200000","1130816"
"2157","00206061","迪飛欣業有限公司","新北市永和區中正路417號11樓之1","董貴麗","200000","1130816"
"2158","00206077","註議有限公司","臺北市大安區信義路4段380號2樓","朱音裕","100000","1130830"
"2159","00206148","廉明德有限公司","新北市新店區花園六路2段7號9樓之1","周民強","500000","1130820"
"2160","00206294","曆智投資有限公司","新竹縣竹東鎮公園路47號1樓","張文政","9000000","1130813"
"2161","00206317","視界魔方創意行銷有限公司","臺北市中山區長安東路2段31號3樓之1","吳昆霖","200000","1130813"
"2162","00206359","宏興資產管理股份有限公司","臺北市中正區中華2段57號1樓","蔡莉馨","29000000","1130821"
"2163","00206386","利康工程有限公司","新北市板橋區三民路2段33號14樓","徐健銘","100000","1130828"
"2164","00206463","致誼資訊有限公司","臺中市南屯區惠中里向上路一段680號4樓之2","王宇晴","500000","1130823"
"2165","00206490","元曙工程管理顧問有限公司","臺中市西區公民里五權路2之106號5樓","劉亭均","1000000","1130821"
"2166","00206724","喜萊國際有限公司","臺中市外埔區水美里山美路451巷130號1樓","陳寶惠","500000","1130822"
"2167","00206772","蔚藍海投資顧問有限公司","臺南市東區龍山里長榮路1段234巷22號","沈佑霖","100000","1130815"
"2168","00206870","良方室內裝潢有限公司","高雄市前金區自強二路102之7號12樓","何岳霖","100000","1130828"
"2169","00207012","佐翼控股股份有限公司","臺南市東區東聖里中華東路2段73巷2-1號11樓","謝承翰","3000000","1130827"
"2170","00207104","雄陽工程有限公司","高雄市苓雅區四維四路2號4樓之4","張志成","500000","1130830"
"2171","00207131","金美奇整合行銷有限公司","臺南市永康區復國路87巷19號","賴美琪","500000","1130820"
"2172","00207152","容奕有限公司","臺北市大安區敦化南路1段205號12樓之6","王潔德","28000000","1130819"
"2173","00207287","長豐投資與管理顧問股份有限公司","新竹市光復路一段609號2樓","黄鋕銘","100000","1130813"
"2174","00207364","仕心不動產仲介經紀股份有限公司","新竹縣竹北市復興二路86號一樓","陳嘉宏","3000000","1130820"
"2175","00207462","瀧瀧國際身心靈有限公司","臺北市內湖區瑞光路335號3樓","王鑫貴","500000","1130827"
"2176","00207580","沐曜昕有限公司","臺北市北投區石牌路2段90巷24號3樓","陳柏翰","500000","1130827"
"2177","00207701","上欣密封科技有限公司","彰化縣和美鎮源埤里南安路46號1樓","黃慧玲","300000","1130830"
"2178","00207771","皮特佛生技有限公司","臺中市西區民龍里臺灣大道二段285號14樓之1","楊方妤","200000","1130830"
"2179","00207879","天銘投資有限公司","苗栗縣頭份市中華路1514號3樓","林銘賢","100000","1130822"
"2180","00207961","台灣斯萊特有限公司","高雄市前鎮區瑞隆路427巷19號","王勝騏","300000","1130821"
"2181","00208130","金陣有限公司","臺南市歸仁區新厝里大成二街19號1樓","陳金陣","200000","1130827"
"2182","00208146","軒逸工程有限公司","彰化縣員林市忠孝里員水路二段404巷16號一樓","鄭美玲","2000000","1130808"
"2183","00208342","川泰欣有限公司","桃園市中壢區林森里執信一街173之46號六樓","劉湘婷","2000000","1130814"
"2184","00208379","大魚朶朶設計整合有限公司","臺北市松山區民生東路5段153之8號","于上雯","500000","1130830"
"2185","00208700","廣展科技有限公司","新竹縣湖口鄉愛勢村中山路二段482巷102弄8號二樓","李宛璇","50000","1130823"
"2186","00208722","富翔基因科技有限公司","臺南市安南區公學路5段697巷171號8樓之1","王䇐媗","90000","1130829"
"2187","00208737","閎茂國際車業有限公司","臺中市北區頂厝里進化北路238號10樓之3","林志豪","100000","1130826"
"2188","00208743","壹陸捌科技有限公司","臺北市中正區武昌街1段1之2號","王特成","150000","1130819"
"2189","00208808","智新科達有限公司","臺中市西屯區臺灣大道三段677號","尤荏平","100000","1130816"
"2190","00208933","山賀大健康股份有限公司","桃園市平鎮區義民里復旦路2段209號(1樓)","陳嚴明","1000000","1130826"
"2191","00209150","品嘉保潔有限公司","臺北市中正區金山北路1號6樓之3","張瑋婷","500000","1130820"
"2192","00209200","哈啦國際股份有限公司","新北市深坑區文化街66號2樓","蒲淳豪","5000000","1130830"
"2193","00209399","邁凱實業股份有限公司","臺北市松山區八德路2段451巷1號3樓","洪怡芳","1000000","1130814"
"2194","00209546","際洋文化有限公司","高雄市前鎮區一心一路243號10樓之3","莊宜庭","1000000","1130815"
"2195","00209709","裕程空間設計有限公司","臺中市潭子區大豐里潭富二街68號1樓","王慧娟","500000","1130826"
"2196","00209763","崧城室內設計有限公司","臺中市豐原區西安里圓環南路146號3樓","蔡承諺","300000","1130821"
"2197","00209840","永麗工程興業有限公司","臺中市豐原區中興里三村路98巷29弄25號1樓","黃品慈","1000000","1130822"
"2198","00210038","傑力工程有限公司","新北市五股區芳洲九路46號19樓","曹晏甄","200000","1130813"
"2199","00210229","常富資產管理有限公司","新北市板橋區華江一路592號","蔡繹丞","500000","1130819"
"2200","00210234","好藝車體有限公司","新竹縣竹北市自強北路223號","黃承淵","6000000","1130821"
"2201","00210419","六槻設計室內裝修有限公司","高雄市小港區復華路42巷18號1樓","林家宏","100000","1130815"
"2202","00210494","鉑爾有限公司","桃園市桃園區中山東路104號","丘逸恆","500000","1130829"
"2203","00210608","澄析室內設計有限公司","臺中市北屯區舊社里順興街272號","李泳燁","1000000","1130819"
"2204","00210620","旭智光通有限公司","新北市三重區重新路4段85巷17號3樓","邱德炎","2000000","1130827"
"2205","00210852","杰立利投資股份有限公司","臺北市內湖區內湖路1段66號10樓","柯明濃","5000000","1130829"
"2206","00210924","昀凱有限公司","臺北市中正區汀州路3段160巷4之1號3樓","吳慧彤","1000000","1130820"
"2207","00211260","秝淇科技有限公司","桃園市楊梅區光裕南街98巷30號","詹麗琦","200000","1130830"
"2208","00211590","東台灣茶有限公司","彰化縣員林市民生里永昌街88巷5號10樓之1","張韶芸","500000","1130813"
"2209","00211677","蹇賁有限公司","臺南市永康區中華里中華路12號18樓之3","魏志紘","100000","1130819"
"2210","00211727","翊潼飛翔運動行銷有限公司","新北市林口區文化北路1段60巷73號9樓","李愷諺","100000","1130819"
"2211","00211819","鋭恒國際有限公司","桃園市桃園區大有里大有路401號11樓","簡詩瑾","500000","1130813"
"2212","00211986","凱爾生物科技有限公司","臺中市南區西川里忠明南路582之15號8樓","謝啓富","2000000","1130821"
"2213","00211992","三文環保股份有限公司","新北市新莊區中正路829巷43號","王高級","1000000","1130821"
"2214","00212296","笙森有限公司","高雄市新興區民生一路206號10樓之2","蔡依姗","3000000","1130830"
"2215","00212367","仁緯科技股份有限公司","桃園市楊梅區中山南路800巷98弄2-2號","謝東連","40000000","1130815"
"2216","00212492","洛可特有限公司","新北市汐止區連興街52號9樓","王宗傑","300000","1130816"
"2217","00212710","萊加企業有限公司","高雄市楠梓區海專路201號1樓","孫稜雅","250000","1130829"
"2218","00212774","宇宙溫度有限公司","臺北市中山區長安東路2段31號3樓之1","周凌瑄","500000","1130827"
"2219","00212802","嘉豐健康生活股份有限公司","新北市板橋區沙崙街29之7號","何珊","800000","1130821"
"2220","00213008","鼎王有限公司","高雄市三民區鼎力路351號","溫茗秀","100000","1130829"
"2221","00213231","鑫成長有限公司","臺南市中西區小西門里和意路66號1樓","莫素玲","1200000","1130813"
"2222","00213491","永立資產管理有限公司","高雄市新興區信守街115之5號2樓","陳永霖","3000000","1130827"
"2223","00213507","優鋼有限公司","臺北市中正區中華路2段105之1號1樓","蔡秀容","1000000","1130821"
"2224","00213534","奧斯汀台北汽車有限公司","新北市永和區文化路113巷28弄7號5樓","王錦寶","60000000","1130815"
"2225","00213598","開德企業有限公司","新北市三峽區中正路2段83巷20號4樓","林金龍","500000","1130816"
"2226","00213653","鴻五金有限公司","臺中市南屯區三厝里永春東七路736號2樓","江青宜","500000","1130819"
"2227","00213680","鼎成開發股份有限公司","臺北市中山區南京東路2段150號7樓","陳金龍","1000000","1130822"
"2228","00213865","杰奏室內裝修有限公司","臺中市南區忠明南路758號14樓","陳柏州","300000","1130812"
"2229","00214040","閎博國際有限公司","臺中市西屯區林厝里福雅路482巷110號1樓","楊凱廸","88888","1130827"
"2230","00214077","優遊育樂有限公司","桃園市平鎮區忠孝路2號12樓之１","吳傑堯","5000000","1130814"
"2231","00214082","祿露通國際有限公司","臺中市大里區立仁里立仁路16號1樓","陳瑞武","500000","1130822"
"2232","00214196","杰崴工程有限公司","高雄市前鎮區中山二路91號17樓之8","張皓崴","1000000","1130826"
"2233","00214246","維樂科技有限公司","臺中市北區立人里陝西路108號15樓之2","劉欣浩","1500000","1130822"
"2234","00214371","永鴻展業有限公司","新北市板橋區自強新村61號5樓","施政宏","1000000","1130816"
"2235","00214415","鼎勝不動產顧問有限公司","臺北市中正區衡陽路10號12樓","王睿杰","200000","1130820"
"2236","00214421","永晁國際有限公司","臺北市中山區新生北路2段31之1號11樓之6","歐儼霆","10000","1130827"
"2237","00214463","金日晟有限公司","嘉義縣竹崎鄉昇平村14鄰昇平36號","曾于哲","300000","1130815"
"2238","00214724","埕溢科技有限公司","高雄市鳳山區鳳南路2巷7弄17號1樓","呂財枝","5000000","1130820"
"2239","00214787","泰旺建材有限公司","新北市八里區中山路2段129巷1弄7號","林建佑","3000000","1130821"
"2240","00214793","竹昕智慧產權有限公司","新竹縣竹北市興安里11鄰縣政一街268號九樓","毛麗娟","100000","1130822"
"2241","00214891","漳霖工程有限公司","高雄市鳳山區濱山街31號8樓","曾譯漳","1000000","1130815"
"2242","00215147","昊瀧有限公司","高雄市大社區和成街1巷14號","李欣學","5000000","1130819"
"2243","00215370","勝期工程有限公司","高雄市新興區民生一路56號17樓之1","黃瓊慧","1200000","1130829"
"2244","00215391","華燊健康事業股份有限公司","宜蘭縣宜蘭市大福路2段198號1樓","陳奕丞","1000000","1130816"
"2245","00215462","芯融有限公司","臺中市西屯區工業區三十八路148巷25號6樓之1","林言芯","1000000","1130812"
"2246","00215511","鯉魚資本股份有限公司","臺北市中正區開封街1段66號5樓","喻銘鐸","5000000","1130813"
"2247","00215955","顯擇水產生技股份有限公司","彰化縣芳苑鄉漢寶村芳漢路漢1段511巷45號1樓","楊家豪","1000000","1130822"
"2248","00215977","極合投資開發有限公司","桃園市八德區力行街182巷5弄3號","鄧進利","11000000","1130815"
"2249","00216173","星易辰國際有限公司","高雄市左營區重信路608號2樓","李易澤","500000","1130827"
"2250","00216217","晨光綠能有限公司","雲林縣麥寮鄉後安村後安路201-20號1樓","林孟嫻","100000","1130815"
"2251","00216407","全瑨關鍵電力科技有限公司","南投縣草屯鎮明正里忠孝街379巷1弄12號1樓","李其興","1000000","1130821"
