"序號","統一編號","公司名稱","公司所在地","代表人","資本額","核准設立日期"
"1848","96779750","巨圖印像有限公司","臺南市新市區永福街16巷32弄16號1樓","彭啓鈞","1000000","1130605"
"1849","96779800","湧鋮企業有限公司","桃園市中壢區新街里延平路261號7樓","黃文彬","500000","1130607"
"1850","96779870","煦時有限公司","臺中市西屯區何厝里何厝東二街23號9樓之3","田容瑜","100000","1130604"
"1851","96779914","美商瑞富資本股份有限公司","臺北市松山區復興北路101號9樓之10","李健魁","0","1130606"
"1852","96780010","禾寵實業有限公司","高雄市大社區中山路665之6號","陳韋翰","1200000","1130604"
"1853","96780166","承上創意有限公司","臺北市信義區基隆路1段186號7樓之3","高文君","1000000","1130627"
"1854","96780200","旌揚實業股份有限公司","嘉義市東區中央里光彩街388號1樓","羅玲芬","12000000","1130607"
"1855","96780222","富隆奧特有限公司","桃園市龜山區文化里文昌三街128號","陳尚宇","100000","1130614"
"1856","96780237","采昀有限公司","新北市新店區安興路85之10號","黃彥軒","200000","1130620"
"1857","96780291","好吉資訊有限公司","臺北市大安區信義路4段45號4樓","周昇鴻","500000","1130604"
"1858","96780378","高飛電信股份有限公司","高雄市三民區覺民路168號1樓","洪梓強","3000000","1130617"
"1859","96780530","自在天食文化有限公司","臺中市南區福順里新和街194巷8號","朱黃鈞","4000000","1130607"
"1860","96780588","京見未來有限公司","高雄市前鎮區一心一路243號10樓之2","顏琬婷","1000000","1130614"
"1861","96780601","築丞室內裝潢有限公司","高雄市苓雅區四維一路138號1樓","劉丞曜","2000000","1130604"
"1862","96780877","帝津企業有限公司","臺中市西屯區市政北七路186號12樓之9","張誌利","1000000","1130603"
"1863","96780911","兆煜豐實業股份有限公司","臺中市南區高工一街55號3樓之15","曾韋鈞","850000","1130612"
"1864","96780932","辰豐清潔服務有限公司","高雄市楠梓區興楠路151巷75弄11之2號2樓","廖政郁","1000000","1130606"
"1865","96780953","昀叡設計室內裝修有限公司","高雄市三民區春陽街53之1號","宋驀如","2400000","1130613"
"1866","96781101","鉑晶儀器生物晶片股份有限公司","宜蘭縣冬山鄉永清路278巷17號（1樓）","許淑惠","10000000","1130624"
"1867","96781329","鶯喨聽語文教研發中心有限公司","新北市鶯歌區龍三路59號5樓","丁瑞泰","1000000","1130621"
"1868","96781539","八睿設計有限公司","臺北市中正區許昌街42號8樓","蘇承英","100000","1130617"
"1869","96781643","夢想加行銷有限公司","臺南市中西區南美里民生路1段100號","柯清勳","500000","1130620"
"1870","96781714","福田自動化資訊整合有限公司","臺南市安南區怡安路1段181號","莊欣峯","1000000","1130603"
"1871","96781720","益晨醫療器材有限公司","臺北市中正區館前路2號12樓","吳吉祥","200000","1130611"
"1872","96781783","緯樂數位有限公司","新北市新莊區中華路2段11號9樓","劉長沛","100000","1130617"
"1873","96781812","八斗餐飲有限公司","臺中市烏日區榮泉里榮和路7號、9號","楊欣陵","200000","1130627"
"1874","96781952","加洋企業有限公司","新北市汐止區新台五路1段99號4樓","林勝勇","500000","1130613"
"1875","96781995","卉楹貿易有限公司","新北市新莊區富貴路492號6樓","李家卉","150000","1130627"
"1876","96782018","日陞消毒環保有限公司","新北市五股區自強路135號9樓","簡志陞","200000","1130620"
"1877","96782024","翰林開發有限公司","臺北市中正區羅斯福路1段7號11樓","黃宋翰","1000000","1130607"
"1878","96782093","善待自然股份有限公司","高雄市苓雅區永康街51號4樓","黃子紜","2000000","1130612"
"1879","96782122","智億工程有限公司","臺中市大肚區新興里沙田路二段132巷1弄31號1樓","蔡明智","200000","1130624"
"1880","96782256","東菱數碼股份有限公司","臺北市中正區館前路34號11樓","黃玉梅","2000000","1130604"
"1881","96782278","悟朝有限公司","臺北市中正區館前路2號12樓","林庭伊","100000","1130617"
"1882","96782376","堤外禔投資有限公司","臺北市大同區南京西路57號5樓之10","戴鼎祐","1000000","1130612"
"1883","96782410","鼎鈊工程有限公司","高雄市阿蓮區民生路840巷112號","鄭鼎祺","1000000","1130531"
"1884","96782447","姿妤有限公司","新北市三峽區民生街106之2號3樓","陳姿秀","500000","1130620"
"1885","96782452","百歐尼克國際生技有限公司","嘉義市東區興村里溪興街2-18號3樓","諶業文","1000000","1130603"
"1886","96782474","貝特兒股份有限公司","臺中市北屯區平興里遼寧路一段162號1樓","葉可喬","600000","1130603"
"1887","96782565","力功科技股份有限公司","新北市新店區北新路2段262號3樓之3","林敬鈞","2500000","1130625"
"1888","96782621","橘麟建設股份有限公司","臺中市西區大和路17號","劉佳展","12000000","1130621"
"1889","96782636","品牌五零壹有限公司","臺北市信義區基隆路1段163號14樓之1","YU KYOUNG HWA","200000","1130619"
"1890","96782679","優康生命科學有限公司","臺北市大同區西寧北路78之18號","魏可青","500000","1130603"
"1891","96782684","亦品營造有限公司","臺中市豐原區東勢里育才街37巷18號1樓","陳仲廉","8000000","1130621"
"1892","96782761","鈞鉞國際有限公司","桃園市龜山區文化里復興北路6巷21號","王珮鈞","500000","1130628"
"1893","96782805","能量叢林有限公司","新北市新莊區中平路198巷21號(1樓)","陳玉鴛","6000000","1130626"
"1894","96782875","森德創意行銷股份有限公司","臺北市萬華區西園路1段220巷50之3號1樓","張茜如","3000000","1130603"
"1895","96782946","泉成國際有限公司","新北市林口區後湖17之4號","何松祐","8736000","1130613"
"1896","96783023","思汗裝潢設計有限公司","新北市三重區後竹圍街277巷2號(1樓)","呂思漢","500000","1130625"
"1897","96783261","昇佑冷凍空調有限公司","苗栗縣頭份市顯會路73巷40弄3衖26號1樓","邱聖崴","2000000","1130611"
"1898","96783305","矽安不動產有限公司","新竹縣竹北市東平里嘉政一街35巷6號","柯玫君","500000","1130614"
"1899","96783419","邑啟有限公司","新北市板橋區三民路2段33號14樓","李欣庭","500000","1130612"
"1900","96783570","熊好輪輪業有限公司","彰化縣溪湖鎮湖東里員鹿路二段198號1樓","楊濬瑋","2000000","1130617"
"1901","96783712","永欣旺開發建設股份有限公司","新竹市東區金山十街90號1樓","羅源德","14000000","1130605"
"1902","96783733","尋獵科技有限公司","新北市中和區中原二街28號18樓","郭綾婕","100000","1130624"
"1903","96783852","淨全力有限公司","屏東縣瑪家鄉排灣村排灣65號","呂玟雅","10000","1130619"
"1904","96783889","摯信工程有限公司","臺中市西區臺灣大道二段181號地下一層","詹念庭","1000000","1130621"
"1905","96783950","綠世得科技有限公司","桃園市中壢區幸福里福壽六街7號9樓之1","王得旭","500000","1130605"
"1906","96784022","綺義不動產仲介股份有限公司","高雄市苓雅區興中一路227號","廖云暘","6000000","1130612"
"1907","96784037","崴宬工程有限公司","臺中市大里區立德里立新二街9號1樓","張宥葳","1200000","1130626"
"1908","96784085","晨曦開發有限公司","新竹市東區東園里公園路227巷17號1樓","陳妍蓁","660000","1130617"
"1909","96784297","大合冷凍國際有限公司","高雄市大社區中里里盬埕巷11之52號","何黛伶","1000000","1130612"
"1910","96784331","仟米國際股份有限公司","桃園市龍潭區聖德里德林路121巷36弄5號","曾學明","3000000","1130627"
"1911","96784347","竹淵投資有限公司","新竹市北區台溪里林森路275號11樓之11","許清淵","20000000","1130612"
"1912","96784374","尚紘工程有限公司","臺中市西屯區舊社里松竹路二段74巷4號2樓","張籃今","3000000","1130618"
"1913","96784395","三隻貓國際股份有限公司","臺中市西屯區潮洋里市政北二路236號14樓之1","楊勝翔","333000","1130613"
"1914","96784418","日青醫療器材有限公司","桃園市平鎮區南勢里中豐路南勢二段117號(4樓)","王曉倩","200000","1130604"
"1915","96784466","馬雅科技有限公司","花蓮縣花蓮市富國路135號","陳智國","1000000","1130611"
"1916","96784493","唐羽顧問有限公司","新竹市北區台溪里中華路三段9號8樓之7","陳宗愚","1000000","1130624"
"1917","96784509","仁和實業有限公司","桃園市桃園區藝文一街86之1號15樓","聶祚亨","3000000","1130628"
"1918","96784515","泰威輪胎有限公司","屏東縣萬丹鄉後村村後庄路129號1樓","施玥岑","1000000","1130621"
"1919","96784563","環球運動管理顧問有限公司","臺北市松山區民生東路3段156號9樓","闞超俊","1000000","1130625"
"1920","96784590","匕禾頁有限公司","南投縣南投市內新里新興路518號","曾建穎","500000","1130606"
"1921","96784613","菲祥實業有限公司","新北市新莊區公園一路108號","唐守威","100000","1130607"
"1922","96784711","連恩樂讚股份有限公司","新竹市東區新莊里22鄰關東路235號6樓","陳培煒","500000","1130625"
"1923","96784819","毓展工程有限公司","高雄市鳳山區甲智路230巷8號1樓","蘇恆生","200000","1130624"
"1924","96784917","亞滿國際有限公司","桃園市中壢區龍平里前龍街56號","童凡芸","150000","1130627"
"1925","96784923","鴻霆實業有限公司","桃園市龍潭區上華里金龍路347巷64號","趙正傑","500000","1130604"
"1926","96784992","湖心亭國際有限公司","臺北市中正區羅斯福路4段52巷1之1號1樓","卓琮翔","3600000","1130614"
"1927","96785129","緣夢餐飲有限公司","臺北市萬華區長沙街2段114號","蘇揚竣","350000","1130620"
"1928","96785177","四正勤關懷照護有限公司","臺北市大同區延平北路3段4號5樓之1","李佩華","1800000","1130603"
"1929","96785351","穀宇科技有限公司","新北市新莊區思源路406號3樓","謝梓建","3000000","1130624"
"1930","96785394","雄禾建設有限公司","桃園市中壢區內定里合圳北路二段331巷68號(1樓)","吳淑玲","26000000","1130619"
"1931","96785401","維創餐飲股份有限公司","臺中市西區大業路32號","王維德","2000000","1130612"
"1932","96785423","帛鴻汽車有限公司","彰化縣埔鹽鄉瓦磘村光明路二段176號","施文玲","800000","1130619"
"1933","96785535","心月采門茶文化事業有限公司","花蓮縣花蓮市國興五街120號1樓","張簡安","100000","1130617"
"1934","96785839","萬京國際企業有限公司","桃園市桃園區光興里縣府路110號4樓之2","莊柏善","100000","1130626"
"1935","96785900","清秀投資有限公司","臺中市南區積善里興大路190號3樓之15","朱清田","7500000","1130626"
"1936","96785970","羽浤科技有限公司","臺北市中山區新生北路3段43號7樓之28","許峻榕","3000000","1130613"
"1937","96786197","喨騰有限公司","臺中市清水區槺榔里港口路200巷10之19號1樓","莊清吉","100000","1130626"
"1938","96786302","悉達波健康生活股份有限公司","臺北市中正區館前路20號5樓","吳芷耘","1000000","1130604"
"1939","96786318","龍富有限公司","臺中市南屯區新生里龍富路四段498號","張仁豪","1300000","1130619"
"1940","96786350","富育建材有限公司","臺南市新營區土庫里土庫130之6號1樓","蔡崑樺","100000","1130607"
"1941","96786470","翼鋒吊桿有限公司","新北市淡水區中山北路1段149巷31號7樓","李銘欽","100000","1130620"
"1942","96786485","澈澈品牌行銷有限公司","臺北市大安區忠孝東路4段290號10樓","彭薇心","1000000","1130619"
"1943","96786513","山粹室內裝修設計有限公司","臺東縣臺東市民生里22鄰開封街369號2樓之2","林楷峯","500000","1130603"
"1944","96786555","鵬雲國際有限公司","基隆市信義區孝忠里深美街200巷19之7號","陳怡伶","1000000","1130530"
"1945","96786632","愛高室設計有限公司","高雄市仁武區八德一路239之3號1、2樓","蔡世芬","3000000","1130619"
"1946","96786703","星祥行銷有限公司","臺中市西屯區漢翔東路39號8樓之2","古雅筑","1000000","1130626"
"1947","96786751","恩全機械工程有限公司","新竹市香山區頂福里中山路640巷528弄45號3樓","張俊孋","1000000","1130626"
"1948","96786788","峻陞實業有限公司","桃園市大溪區福安里三層老街68巷13號","江俊杰","200000","1130606"
"1949","96786871","赫拓有限公司","臺中市北區金華里進化路351巷32號1樓","林怡君","2000000","1130603"
"1950","96786936","家仕佺傢俱有限公司","彰化縣員林市惠來里中山路一段454號","劉泉宏","1000000","1130617"
"1951","96786984","以瑟列有限公司","臺北市內湖區內湖路1段115號3樓","魏道民","250000","1130607"
"1952","96786990","妍威國際有限公司","新北市汐止區福德二路125巷7號2樓","謝一寧","200000","1130604"
"1953","96787098","琦麗聯合有限公司","高雄市苓雅區四維四路216號10樓之3","何銀雄","250000","1130617"
"1954","96787219","陽潾有限公司","高雄市鳥松區大華路1巷2弄8號1樓","李昆翰","200000","1130628"
"1955","96787267","崑羽工程有限公司","臺中市大里區新里里德芳一街45號","潘新德","300000","1130625"
"1956","96787273","白日夢冒險王股份有限公司","臺中市北區新北里錦新街28號3樓","李詩詩","2800000","1130617"
"1957","96787317","凱栢昇有限公司","桃園市中壢區興南里九和一街6號20樓之10","祁栢慶","2100000","1130621"
"1958","96787436","沐橙室內設計有限公司","高雄市新興區民生一路56號18樓之1","李哲維","300000","1130612"
"1959","96787442","樂滐食品有限公司","嘉義縣民雄鄉頂崙村崙子頂104-52號1樓","林宜憬","1000000","1130613"
"1960","96787484","裕忠有限公司","臺中市西屯區何安里重慶路99號5樓之3","吳啟賓","100000","1130620"
"1961","96787506","科技夢有限公司","臺北市中正區師大路170號11樓之４","涂君安","1500000","1130617"
"1962","96787652","一塊股份有限公司","臺中市南屯區同心里文心路一段64巷10號1樓","張亞琇","500000","1130617"
"1963","96787858","天海盛國際有限公司","臺南市中西區赤嵌里民族路2段76-10號5樓之1","李美思","10000","1130617"
"1964","96787870","看上有限公司","臺北市中山區松江路220號9樓","蘇晏霈","500000","1130614"
"1965","96787941","美商艾普斯股份有限公司","臺北市信義區永吉路30巷148弄27號","RAMBKE KEVIN MICHAEL","0","1130607"
"1966","96787962","資匯科技股份有限公司","臺北市中正區三元街172巷1弄1之1號4樓","許智凱","3700000","1130603"
"1967","96787983","基思工程解決方案有限公司","臺北市松山區復興北路181號7樓","GILLIVER JOSEPH EDWARD","500000","1130625"
"1968","96788006","淋雨珊瑚有限公司","嘉義市東區安寮里興業東路98號","廖秉霖","368888","1130614"
"1969","96788028","試飾看有限公司","臺北市中山區中山北路2段20巷18之1號1樓","黃恩慈","200000","1130628"
"1970","96788033","豐品投資有限公司","臺南市學甲區仁得里自強路67號3樓","柳品妤","100000","1130612"
"1971","96788131","好客不動產管理顧問有限公司","新竹縣竹北市隘口二路366號1樓","黃勝源","1000000","1130626"
"1972","96788168","比思可企業有限公司","高雄市美濃區民生路40號1樓","鍾怡箴","1000000","1130621"
"1973","96788245","昀柔有限公司","彰化縣社頭鄉廣興村中興路103號1樓","陳怡君","100000","1130604"
"1974","96788250","匯緣食品有限公司","新北市板橋區中山路1段9號(4樓)","吳宇軒","2400000","1130604"
"1975","96788414","築青庭有限公司","臺北市文山區木新路2段135號5樓","吳韻青","100000","1130603"
"1976","96788532","唏望有限公司","臺中市大里區瑞城里成功路523號2樓","汪惟媛","2400000","1130607"
"1977","96788569","偲成投資有限公司","新北市蘆洲區復興路123號2樓","呂淑蘭","1000000","1130618"
"1978","96788580","順仁科技工業有限公司","臺南市中西區民生路1段167號3樓","曾順忠","1000","1130618"
"1979","96788630","勵邦國際有限公司","南投縣南投市內興里南新路332號1樓","林思宇","3000000","1130604"
"1980","96788646","連恩永續股份有限公司","新竹市東區新莊里22鄰關東路235號6樓","陳培煒","500000","1130626"
"1981","96788717","睦荷有限公司","臺北市南港區忠孝東路7段610之1號2樓","李郁舒","2500000","1130617"
"1982","96788842","虎山有限公司","新竹市香山區遊樂街29巷52號2樓","蔡美華","666666","1130614"
"1983","96788884","華晨邑建設有限公司","臺南市安南區安富里富東路5號","彭素蘭","6000000","1130607"
"1984","96789075","官勝國際股份有限公司","南投縣南投市康壽里中山街312巷16號","官芷婕","2000000","1130618"
"1985","96789146","新立系統實業有限公司","桃園市桃園區春日里春日路1046巷26弄12號(1樓)","陳炎秋","1000000","1130617"
"1986","96789173","欣淇股份有限公司","臺北市松山區寶清街21號4樓之1","羅遠琦","22184500","1130621"
"1987","96789223","晟毅整合有限公司","臺北市中正區忠孝東路2段80號6樓","詹程傑","1000000","1130607"
"1988","96789238","角宿建設有限公司","高雄市三民區大順二路147號11樓之3","陳又嘉","3000000","1130607"
"1989","96789271","昕悅廣告股份有限公司","高雄市左營區自由四路372號","黃科詔","1000000","1130619"
"1990","96789315","泛宇光學科技有限公司","高雄市鹽埕區五福四路229巷27號1樓","翁菁霞","1000000","1130626"
"1991","96789321","穩陽貿易有限公司","屏東縣東港鎮東津里沿海路97號1樓","黃緣溱","1000000","1130611"
"1992","96789363","鑫北樹木工程有限公司","新北市汐止區新台五路1段95號20樓之6","黃奕愷","100000","1130607"
"1993","96789477","琦謹有限公司","新北市蘆洲區長安街131巷25號","曾馨慧","5000000","1130619"
"1994","96789547","鑫工程有限公司","新竹縣湖口鄉中正村中興街3號四樓之3","温兆鴻","300000","1130612"
"1995","96789595","益承金屬有限公司","彰化縣彰化市延平里岸頭巷10之10號二樓","宋英芬","3000000","1130624"
"1996","96789700","海維有限公司","高雄市鼓山區裕誠路1691號31樓","具松謨","1000000","1130626"
"1997","96789722","亭寧租賃住宅服務有限公司","臺南市永康區塩行里新行街33巷35號","蔣婉婷","2500000","1130607"
"1998","96789835","與我股份有限公司","臺北市中正區忠孝西路1段7號6樓之2","黃心盈","5000000","1130618"
"1999","96789954","維江有限公司","高雄市鼓山區明華路253號14樓","林紘緯","300000","1130628"
"2000","96790045","仲伸國際有限公司","新北市板橋區四川路1段23號9樓之2","許宇軒","100000","1130621"
"2001","96790116","愛禮創新科技有限公司","臺北市中山區中山北路1段92號2樓之1","張少榕","100000","1130628"
"2002","96790164","山河樂國際文化事業有限公司","臺北市大同區民權西路136號10樓之1","林俊慶","1000000","1130624"
"2003","96790191","威綸數位設計有限公司","新北市三重區中正北路430之4號(1樓)","張芝綺","1000000","1130611"
"2004","96790262","克洛依國際貿易有限公司","高雄市左營區明誠二路491號9樓","蔡奇君","80000","1130627"
"2005","96790523","思慕魚設計工程有限公司","新北市新店區建安街5號2樓","陳淑玲","1000000","1130613"
"2006","96790559","云詠廣告有限公司","新北市板橋區民生路1段129號4樓","蘇建宇","3000000","1130628"
"2007","96790586","礎石貿易有限公司","高雄市楠梓區清平街34巷4號6樓","林祺祥","2000000","1130620"
"2008","96790663","宏略廣告有限公司","新北市樹林區柑園街1段116巷8號","黃家宏","500000","1130614"
"2009","96790679","穩丞投資有限公司","彰化縣秀水鄉復新街8號4樓","賴柏丞","100000","1130607"
"2010","96790734","馨葶國際有限公司","臺北市中正區林森南路4之1號2樓","蘇凱馨","1000000","1130628"
"2011","96790805","釀造媒體股份有限公司","臺北市中山區合江街102巷54號1樓","陳名偉","500000","1130612"
"2012","96790853","誠鋒有限公司","新北市板橋區南雅西路2段224號3樓","李昱謹","800000","1130606"
"2013","96790946","叡創數位科技有限公司","臺北市中山區松江路111號地下","陳諱亭","10000000","1130618"
"2014","96790994","食山樂章有限公司","臺中市沙鹿區居仁里臺灣大道七段1080巷8號4樓","葉曉琪","500000","1130621"
"2015","96791142","宜群工程事業有限公司","新北市蘆洲區正和街12號","劉威宏","1000000","1130619"
"2016","96791332","富永樂有限公司","金門縣金城鎮東門里菜市場路3號1樓","陳正陽","2000000","1130606"
"2017","96791380","量畫資訊股份有限公司","新北市永和區永和路2段57號7樓","李典融","1000000","1130621"
"2018","96791430","龍穎有限公司","臺北市中山區南京東路2段76號4樓","劉品巖","1000000","1130617"
"2019","96791467","探索智慧科技有限公司","臺南市歸仁區南保里文化街3段61巷9號1樓","郭宸毓","1000000","1130607"
"2020","96791473","滿天星文創事業有限公司","嘉義市西區湖內里健康十街139號1樓","黃衿恩","8000000","1130607"
"2021","96791494","赫星有限公司","臺中市沙鹿區福興里鎮南路二段299巷21號1樓","何秀珠","1000000","1130627"
"2022","96791500","來貴有限公司","新北市鶯歌區鶯桃路365巷9號","王珮筠","150000","1130624"
"2023","96791522","虹青艇運動休閒事業有限公司","臺中市西區平和里中華路一段8之4號1樓","葉斯皓","1380000","1130614"
"2024","96791543","百合貓有限公司","臺北市中山區民生東路2段127巷6號2樓之3","蕭伊倫","500000","1130603"
"2025","96791662","壕鐸有限公司","桃園市蘆竹區蘆竹里富國路二段755巷162號(1樓)","邱啟豪","500000","1130605"
"2026","96791712","宏庭電器有限公司","新竹市北區石坊里西大路371號1樓","鄭宏甫","500000","1130620"
"2027","96791776","諾境投資股份有限公司","高雄市燕巢區安招路439巷3號","高凡鈞","7550000","1130617"
"2028","96791831","三霖開發建築股份有限公司","高雄市苓雅區中正二路175號16樓之1","鍾育霖","5000000","1130618"
"2029","96791852","日本一七夫婦有限公司","桃園市中壢區龍興路668巷6號2樓","黃于芠","30000","1130621"
"2030","96791868","台灣碩貝設計有限公司","臺中市豐原區豐原里三豐路一段43號8樓","陳俊傑","1000000","1130627"
"2031","96791902","蔚景國際有限公司","臺中市龍井區龍泉里龍社路75巷11號1樓","方睿富","500000","1130621"
"2032","96791918","軒揚工程有限公司","桃園市中壢區仁福里仁美二街88巷1號(1樓)","徐茂修","3000000","1130620"
"2033","96791966","艾佳有限公司","宜蘭縣羅東鎮東安里光榮路269-17號11樓","吳佳璋","50000","1130620"
"2034","96792085","允烽企業有限公司","高雄市左營區富民路277號17樓之2","曾于庭","1000000","1130607"
"2035","96792156","弘輔建設開發股份有限公司","臺中市西屯區潮洋里朝富路213號28樓之2","楊濬輔","5000000","1130605"
"2036","96792178","英商森迪卡優健樂活有限公司","臺北市大同區民生西路236號2樓","SENDYKA PAWEL JAN","0","1130628"
"2037","96792183","亦力有限公司","新北市三重區重新路2段21號8樓","鄧志偉","100000","1130621"
"2038","96792297","墨云室內裝潢有限公司","臺中市西屯區河南路二段262號3樓之10","莊耿翰","500000","1130625"
"2039","96792368","辰叡工程有限公司","高雄市新興區光耀里民生一路56號18樓之1","簡湋哲","1500000","1130625"
"2040","96792374","誠藝資產有限公司","臺北市中山區植福路308號5樓之7","王金蘭","8000000","1130614"
"2041","96792424","喬伊投資有限公司","新北市中和區建康路8號4樓","周伊淋","7140000","1130614"
"2042","96792439","飛燿工程有限公司","雲林縣水林鄉後寮村55號1樓","王竣民","500000","1130613"
"2043","96792493","名嶼股份有限公司","新北市板橋區民族路37之2號(1樓)、37之3號(1樓)","王崧錡","4000000","1130611"
"2044","96792509","聯曜不動產投資有限公司","臺南市中西區赤嵌里民族路2段76-10號10樓之2","李雅琪","800000","1130607"
"2045","96792515","撼動未來整合行銷有限公司","高雄市鳳山區國光路130號1樓","蘇恩","2000000","1130620"
"2046","96792677","祐意有限公司","新竹縣湖口鄉鳳山村榮光路8號","李遠龍","200000","1130617"
"2047","96792769","螞蟻傳媒有限公司","臺中市西區博館路117號6樓之2","林烜利","2000000","1130607"
"2048","96792901","騰畇有限公司","基隆市中山區復興路205號10樓之1","黃騰緯","1000000","1130620"
"2049","96793015","冠金工程有限公司","彰化縣員林市南平里28鄰新生路309巷22號","李琬婷","3200000","1130614"
"2050","96793113","途銳資訊股份有限公司","臺北市南港區興中路12巷21號5樓","梁育楠","2000000","1130605"
"2051","96793129","提惟科技有限公司","臺北市信義區基隆路1段186號5樓之6","林冠廷","100000","1130621"
