"序號","統一編號","公司名稱","公司所在地","代表人","資本額","核准設立日期"
"3068","95484510","霓霓餐飲有限公司","臺中市西區公益路207號","車稊疌","2000000","1130805"
"3069","95484568","美袋子包裝設計股份有限公司","臺中市西區公民里五廊街107號6樓之3","致鑫國際股份有限公司","500000","1130805"
"3070","95484770","汎興國際貿易有限公司","新北市淡水區濱海路1段145號9樓","周敬傑","1000000","1130812"
"3071","95484791","織女星智能股份有限公司","桃園市中壢區普仁里新中北路61號(1樓)","卓昂滄","2000000","1130801"
"3072","95485308","上煜工程有限公司","新北市鶯歌區德昌街140巷55號(1樓)","彭文俊","1000000","1130808"
"3073","95485320","誠軒不動產有限公司","桃園市中壢區芝芭里領航南路一段65號","戴志軒","2000000","1130808"
"3074","95485362","鉅緯實業有限公司","臺中市北區中達里英才路201號1樓","簡心慧","50000","1130809"
"3075","95485503","誠勝開發有限公司","新北市板橋區三民路2段33號14樓","劉朝勝","200000","1130801"
"3076","95485567","花朵高雄婚紗有限公司","高雄市新興區中山一路148號1樓","劉義蕾","500000","1130809"
"3077","95485638","鴻霖國際物業有限公司","臺北市中正區忠孝西路1段72號2樓之1","李智丞","300000","1130807"
"3078","95485736","智點直銷股份有限公司","臺北市信義區吳興街284巷17之6號2樓","林忠儒","500000","1130805"
"3079","95485877","漁健客有限公司","新北市板橋區新海路382巷1號4樓","劉韋成","500000","1130808"
"3080","95486051","寬達環保有限公司","臺中市太平區宜昌里宜昌路465巷12弄25號1樓","陳冠勛","2000000","1130805"
"3081","95486067","緯運工程有限公司","桃園市蘆竹區大竹路539號","黃培益","1500000","1130805"
"3082","95486073","鑫鋯有限公司","臺北市中山區北安路537之2號3樓","潘世樺","30000","1130808"
"3083","95486094","滇緬餐飲有限公司","新北市板橋區龍泉街90巷1號8樓之2","TIN TIN SAN蔣家敏","6997000","1130812"
"3084","95486257","大日中文化有限公司","高雄市前鎮區中山二路2號13樓之3","陳信堯","500000","1130731"
"3085","95486427","富力洋工程有限公司","新北市板橋區四川路1段23號3樓之2","王姵云","1000000","1130807"
"3086","95486616","永鉌建設有限公司","新北市八里區商港七路1號3樓","陳籽庭","200000","1130805"
"3087","95486741","尚邑投資有限公司","臺北市中山區松江路23號3樓","鄭學鴻","6000000","1130802"
"3088","95487066","台京弘建設有限公司","雲林縣北港鎮新街里5鄰新德路395號1樓","魏添圻","1400000","1130730"
"3089","95487116","旭境廣告企劃有限公司","臺中市北區文祥街128號10樓之8","林哲旭","200000","1130806"
"3090","95487220","銳思克環保有限公司","桃園市龍潭區休閒街72巷10號","許仟萬","5000000","1130812"
"3091","95487256","卓然悅顏有限公司","新竹縣竹北市東平里六家五路一段316號二樓","劉小葉","200000","1130806"
"3092","95487262","草木瓦石設計室內裝修有限公司","臺南市安南區國安里樂活一街22號11樓","石蕙文","100000","1130802"
"3093","95487360","城美廣告股份有限公司","新北市新店區安民街322巷8號4樓","張同欽","2000000","1130802"
"3094","95487376","呼呼易德股份有限公司","新北市三重區重新路2段20號(1樓)","黃冠融","2000000","1130805"
"3095","95487468","海盛實業有限公司","新北市新店區北新路1段10號17樓之1","黃鈴惠","1000000","1130808"
"3096","95487559","仁寶企業有限公司","新北市板橋區民生路2段226巷8弄1號4樓","王國柱","20000","1130808"
"3097","95487690","永星有限公司","臺南市南區文南路342巷11之4號","李汶昇","1000000","1130730"
"3098","95487707","澄義投資股份有限公司","彰化縣線西鄉線西村線工路6號","洪明山","6000000","1130801"
"3099","95487777","木言有限公司","臺北市大安區大安路1段51巷50號","李祐成","1000000","1130807"
"3100","95488229","鉅紳國際有限公司","高雄市三民區遼寧二街173號","胡正翰","1200000","1130809"
"3101","95488488","至勝機械有限公司","宜蘭縣五結鄉協和村公園三路78號1樓","歐至胤","500000","1130806"
"3102","95488776","有福同享有限公司","高雄市鼓山區臨海二路54號8樓之1","林子翔","1016800","1130807"
"3103","95489368","無塵清潔有限公司","澎湖縣馬公市石泉里石泉1之293號1樓","劉沂潔","1500000","1130801"
"3104","95489466","鯤島有料設計製作有限公司","花蓮縣花蓮市國聯里國聯五路3號4樓之14","張哲瑋","200000","1130805"
"3105","95489971","佑晴數位國際有限公司","新北市永和區永貞路107號3樓","巫宗諭","1680000","1130805"
"3106","95490132","瑋喬資訊科技有限公司","臺中市后里區甲后路一段916號","王妍喬","100000","1130808"
"3107","95490251","凱瑞數位科技有限公司","新北市土城區學享街32號2樓","丁品予","200000","1130808"
"3108","95490338","旺喵原宿股份有限公司","臺南市北區大興里公園路630號1樓","陳思妤","4000000","1130731"
"3109","95490506","強茂投資股份有限公司","高雄市永安區永工一路17之1號","方敏宗","15000000","1130809"
"3110","95490626","毅品工程有限公司","新竹縣竹北市自強七街33號五樓","潘氏紅碧","500000","1130806"
"3111","95490745","沃土良宇開發事業有限公司","新北市板橋區中山路1段1號13樓之26","陳韜宇","200000","1130805"
"3112","95490822","善行生技有限公司","臺北市中山區林森北路356號7樓","顏秀卿","100000","1130805"
"3113","95491012","詠富宥有限公司","彰化縣溪湖鎮番婆里彰水路2段231號","林凡雅","500000","1130801"
"3114","95491097","富遊有限公司","高雄市新興區中正四路53號8樓之3","劉韋廷","1000000","1130731"
"3115","95491266","榮匯股份有限公司","臺北市中山區建國北路2段1號7樓","林建成","11500000","1130805"
"3116","95491358","全勝詳投資有限公司","新北市五股區芳洲路63號9樓","褚美雲","10500000","1130808"
"3117","95492259","閎瀚建設股份有限公司","臺北市士林區承德路4段307號4樓","林鴻坤","20000000","1130809"
"3118","95492363","秉呈開發建設有限公司","高雄市三民區黃興路105號9樓之2","陳盈呈","10000000","1130807"
"3119","95492770","詠詮室內裝修有限公司","桃園市桃園區大業里春日路632巷19號(1樓)","涂家偉","6000000","1130809"
"3120","95493145","佑宇精密有限公司","桃園市中壢區內定里內定二街636巷3號","蔡成林","2000000","1130801"
"3121","95493172","翊躍有限公司","屏東縣萬丹鄉崙頂路226號1樓","蕭朝榮","1000000","1130801"
"3122","95493341","妙富清潔有限公司","新北市三重區正義南路55號6樓","林俊全","200000","1130808"
"3123","95493476","博升科技有限公司","新北市新莊區富貴路492號6樓","林琨庭","1000000","1130802"
"3124","95493546","伊凡伊娃有限公司","臺北市大安區忠孝東路3段305號6樓之1","近藤和也","1000000","1130808"
"3125","95493715","香港商緁瑀興貿易有限公司","臺北市中山區民權東路3段37號11樓","蔡嘉華","500000","1130801"
"3126","95493905","聯冠光電投資有限公司","新北市三重區碧華街137號","陳冠宇","6000000","1130806"
"3127","95493980","良木策略有限公司","臺北市中正區衡陽路85號6樓之6","莊士德","1000000","1130812"
"3128","95493996","更興國際有限公司","新北市板橋區中山路1段69號6樓","楊永源","500000","1130812"
"3129","95494019","榮界無介顧問有限公司","臺中市后里區中和里公安路199號1樓","林青宏","1000000","1130801"
"3130","95494165","高壓流體科技有限公司","高雄市前鎮區一心二路44號2樓","何玉蟬","500000","1130731"
"3131","95494186","耘唐顧問有限公司","新北市林口區文化二路1段390號5樓","盧志強","4500000","1130808"
"3132","95494263","匯弘企業有限公司","新竹縣竹北市四維街95巷10之2號","曾國雯","1000000","1130731"
"3133","95494290","眾誠興業有限公司","宜蘭縣壯圍鄉忠孝村順和路25-18號","高御哲","500000","1130802"
"3134","95494398","宸通搬家貨運有限公司","桃園市中壢區新中北路896號","陳守德","10000000","1130802"
"3135","95494616","羽金國際有限公司","臺南市東區泉南里林森路1段153巷9號1樓","楊涵羽","2000000","1130801"
"3136","95494762","民英健康科技有限公司","新北市板橋區中山路2段412巷38號","陳右英","3000000","1130806"
"3137","95495191","財驊投資有限公司","新北市淡水區淡金路2之1號18樓","李慧滿","1000000","1130805"
"3138","95495349","奇達集成有限公司","新北市土城區中央路4段27巷10弄13號（1樓）","林正達","25000000","1130802"
"3139","95495397","晶湛跨境有限公司","桃園市中壢區仁愛里功學路182號(1樓)","阮馨儀","500000","1130802"
"3140","95495501","揚銘餐飲設備企業有限公司","新北市樹林區太順街51巷6號2樓","歐陽娟","500000","1130807"
"3141","95495565","禾豐水晶晶有限公司","臺北市北投區裕民二路49巷7號","張聖傑","500000","1130812"
"3142","95495811","香港商鼎浩科技有限公司","臺北市中山區天祥路6號地下室","鍾德健","0","1130821"
"3143","95495869","賦成實業有限公司","新北市中和區南山路515號(1樓)","吳懿峰","200000","1130802"
"3144","95495946","宏錡建設股份有限公司","花蓮縣花蓮市國富里莊敬路297號1樓","施俊宏","3000000","1130807"
"3145","95496023","旭捷高効科技有限公司","雲林縣斗南鎮舊社里新生三路110號1樓","蔣政村","1000000","1130801"
"3146","95496092","祥琦興業股份有限公司","高雄市鼓山區美術東四路473號及475號","江狄成","3000000","1130801"
"3147","95496585","羽菟能源科技有限公司","臺北市大安區和平東路3段338號4樓","陳安榮","300000","1130809"
"3148","95496614","奇藝企業有限公司","新竹市東區中華路二段37號","郭政宇","300000","1130806"
"3149","95496868","螺旋肌力體能有限公司","臺北市中正區懷寧街76號1樓","賴威霖","100000","1130813"
"3150","95496902","傳家國際工程有限公司","臺北市中山區建國北路2段127號10樓","盧韋志","1000000","1130805"
"3151","95497402","悅望國際有限公司","雲林縣斗南鎮東明里雲林路三段611號1樓","盧怡萱","200000","1130802"
"3152","95497748","鉅慧投資有限公司","臺中市西屯區市政北二路238號30樓之5","楊淨雅","1000000","1130805"
"3153","95497888","力鑫資融有限公司","屏東縣屏東市豐榮里勝利東路73號二樓","黃星翰","300000","1130802"
"3154","95498140","美淘國際有限公司","臺南市安定區安定里安定58號之43","王仕翰","1200000","1130808"
"3155","95498198","瑞特自動化設備有限公司","高雄市鳳山區五甲一路750號7樓之3","呂明鴻","2000000","1130808"
"3156","95498227","安藤衫有限公司","桃園市桃園區永安路449號1樓","曾千育","2000000","1130731"
"3157","95498280","品心餐酒有限公司","臺北市大安區市民大道4段230號1樓","林心彤","1000000","1130813"
"3158","95498459","振興環保有限公司","臺南市安平區平通里建平八街551號9樓之12","丁國智","200000","1130805"
"3159","95498535","喬妃國際有限公司","新北市中和區錦和路195巷1弄2號","宋沛珊","300000","1130806"
"3160","95498583","新淯奇資源有限公司","高雄市阿蓮區中正路467巷31號1樓","黃郁仁","8000000","1130802"
"3161","95498599","駿豪茶業有限公司","南投縣名間鄉三崙村口寮巷12之2號一樓","羅素春","500000","1130801"
"3162","95498654","禾嘉管理顧問有限公司","臺中市西屯區何福里河南路一段89號","洪嘉璿","2000000","1130808"
"3163","95498660","新瑩記有限公司","臺中市西區大業路25號13樓之7","王鐙瑩","100000","1130805"
"3164","95498922","楷心健康股份有限公司","新北市新莊區新泰路279號2樓","呂建甫","300000","1130807"
"3165","95499035","庚城汽車有限公司","臺中市北屯區平田里文心路四段955號10樓之6","劉俊佑","3000000","1130807"
"3166","95499062","芮安景觀有限公司","臺中市大里區東興里東榮路428號3樓","何芮安","500000","1130801"
"3167","95499133","三峰科技有限公司","高雄市鼓山區明誠四路286號23樓","楊家鴻","900000","1130808"
"3168","95499400","初禾空間美學有限公司","新北市蘆洲區仁愛街62巷8號5樓","張凱傑","500000","1130802"
"3169","95499458","久富開發建築有限公司","臺中市神岡區中山路968號1樓","賴忠宏","1000000","1130806"
"3170","95499680","正裕興餐飲有限公司","高雄市前鎮區中山二路55巷72號1樓","夏朝興","300000","1130806"
"3171","95499725","鈞晨室內裝修有限公司","高雄市三民區遼寧一街2之6號1樓","陳廷睿","200000","1130806"
"3172","95499979","呈盛股份有限公司","桃園市大園區水源路907號","黃立升","20000000","1130806"
"3173","95511501","宇過天晴有限公司","桃園市大園區青峰里大豐一街62號7樓之三","鄭宇芩","300000","1130805"
"3174","95547917","越峰有限公司","臺中市西區中興里公正路163巷15號","陳文聰","100000","1130802"
"3175","95554509","敘恆有限公司","高雄市鼓山區美術東四路379號10樓","楊文石","1000000","1130731"
"3176","95575315","清翔行銷有限公司","新竹縣湖口鄉中興村吉安街17號","魏圓清","300000","1130806"
"3177","95625005","新春金屬有限公司","新北市土城區中華路2段188號3樓","林元椿","300000","1130802"
"3178","96002575","碩通散熱股份有限公司","新竹縣湖口鄉鳳山村自強路18號","張維正","20000000","1130731"
"3179","96017514","長金會社有限公司","高雄市三民區十全三路6號8樓之10","梁長呈","200000","1130808"
"3180","96038807","鑫盛貿易有限公司","臺中市北屯區平田里文心路四段993號8樓之1","簡政宇","200000","1130801"
"3181","96039968","喬申建設有限公司","桃園市中壢區龍岡路3段257巷29號5樓之1","劉邦烜","2500000","1130802"
"3182","96060618","百橙國際股份有限公司","臺北市大同區寧夏路23之1號2樓","余俊澤","4000000","1130806"
"3183","96066606","鴻笠營造股份有限公司","臺中市南屯區大墩十四街194號2樓","陳靜茹","25000000","1130808"
"3184","96086309","宥丞臻有限公司","臺南市中西區南廠里永華路1段252號8樓之5","蘇畇臻","200000","1130807"
"3185","96088003","瑞擎國際股份有限公司","桃園市桃園區春日路1434巷32號(1樓)","林中川","1000000","1130802"
"3186","96131607","威琪商貿有限公司","新北市三重區重新路2段78號6樓之11","陳信宏","1000000","1130807"
"3187","96157818","凜藝文化股份有限公司","臺北市大安區敦化南路2段46號12樓之1","江承彬","5000000","1130807"
"3188","96159549","徐華事業有限公司","新北市中和區中正路738號17樓之1","花國興","190000","1130807"
"3189","96159800","任華實業股份有限公司","桃園市中壢區興仁里興仁路2段99號10樓之89","趙崧任","100000","1130806"
"3190","96161019","永鼎精機股份有限公司","桃園市龍潭區富華街315巷28之15號","張裕昌","3000000","1130806"
"3191","96161735","鐳舶克有限公司","高雄市前金區中華三路154號1樓、2樓","郭飛助","500000","1130801"
"3192","96165107","子宸有限公司","高雄市苓雅區中正一路249號5樓之2","江佳俊","100000","1130730"
"3193","96182801","圖開創意國際有限公司","高雄市前鎮區中山二路2號8樓之2","陳頎倫","300000","1130812"
"3194","96194807","巨芯電子有限公司","臺南市北區振興里開元路148巷31之3號","王俊堯","100000","1130731"
"3195","96209007","百錩達有限公司","新北市新莊區新北大道4段173號2樓","張哲誠","1000000","1130809"
"3196","96209105","擎暄工程有限公司","屏東縣屏東市崇德一路82之1號3樓之2","趙之瑄","5000000","1130802"
"3197","96220903","富臣投資有限公司","新北市三重區集美街112巷27號5樓","陳國偉","2000000","1130808"
"3198","96230509","零零伍零生技有限公司","高雄市前鎮區中山二路2號12樓之7","江忠軒","100000","1130808"
"3199","96231704","欣嶸國際有限公司","高雄市前鎮區瑞春街61號3樓","沈元生","3000000","1130808"
"3200","96252658","箴星幸福有限公司","桃園市八德區建德路261號(1樓)","楊佩菁","150000","1130807"
"3201","96269709","昌群海運股份有限公司","連江縣北竿鄉芹壁村24號","陳勁源","6000000","1130731"
"3202","96280704","善享企業有限公司","桃園市八德區和平路1346巷35號","余健陽","500000","1130801"
"3203","96292201","柱愛葉投資股份有限公司","桃園市桃園區中成里永安路435號(3樓)","葉源芳","9000000","1130806"
"3204","96296804","新加坡商奎德半導體有限公司","新竹縣竹東鎮二重里民族路27巷3號1樓","吳韋兵","1000000","1130821"
"3205","96302708","謙勝電器有限公司","桃園市蘆竹區錦華路35號","蘇政安","100000","1130807"
"3206","96303002","福元儀器股份有限公司","臺北市大同區重慶北路2段188號8樓","許家寶","6000000","1130807"
"3207","96312902","慈芸有限公司","臺中市北屯區和平里軍和街439之1號1樓","張芸溱","1000000","1130806"
"3208","96322113","上作美器設計有限公司","臺北市大同區昌吉街61巷9弄4號","曾靖驍","1000000","1130801"
"3209","96343829","隨新所育智慧文創股份有限公司","臺中市西屯區逢福里河南路二段262號3樓之10","何欣柔","21000","1130802"
"3210","96358821","帝一消防工程有限公司","高雄市小港區康莊路88巷7號9樓","呂世源","1000000","1130808"
"3211","96368807","台灣新資實業有限公司","桃園市龜山區迴龍里26鄰龍鳳街32巷6號8樓","蔣韻","1000000","1130809"
"3212","96377215","暮潶映像會社有限公司","臺中市北區新北里錦南街31號2樓","蔡承恩","1000000","1130808"
"3213","96377904","天使魚有限公司","高雄市鹽埕區瀨南街37之2號","董淑仁","500000","1130807"
"3214","96378805","淳玉建設有限公司","高雄市苓雅區中正一路120號10樓之4","葉奕青","5000000","1130806"
"3215","96571013","盛心資訊顧問有限公司","高雄市前鎮區中山二路2號12樓之7","黃祝鴻","100000","1130801"
"3216","96571323","樸正投資有限公司","臺北市內湖區瑞光路34號6樓","汪子杰","2000000","1130813"
"3217","96573259","采彤實業有限公司","桃園市楊梅區富民街143巷250弄62號","胡郁華","200000","1130731"
"3218","96573384","廷畇太陽能有限公司","高雄市左營區文守路168巷6弄2號1樓","蘇美惠","1000000","1130805"
"3219","96575361","美霖國際投資有限公司","高雄市岡山區育才路56巷11號","蘇美倫","23397880","1130802"
"3220","96578043","樹億環境資源整合有限公司","臺中市南區樹義里樹義六巷5之9號1樓","龔怡樺","1500000","1130806"
"3221","96578655","亨弛有限公司","臺北市大安區信義路4段296號6樓之4","林瑞欽","100000","1130808"
"3222","96584002","上毅洗衣有限公司","高雄市鳳山區文澄街36號2樓","郭俍麟","5000000","1130801"
"3223","96584973","克林環衛有限公司","新北市汐止區樟樹一路139巷4號5樓","蔡育中","3000000","1130805"
"3224","96586070","富聚庫行銷有限公司","新北市淡水區中山路45號(1樓)","葉豐彥","500000","1130801"
"3225","96586228","沛陽建設有限公司","臺北市松山區八德路3段2號6樓之5","江韋炫","4000000","1130805"
"3226","96586917","鵝肉大王國際美食餐飲有限公司","臺中市大里區永隆里永隆路455號","阮燦澤","3000000","1130814"
"3227","96588387","一成國際興業有限公司","臺北市松山區南京東路5段33號7樓","白裕全","1000000","1130808"
"3228","96589040","絕對光度有限公司","彰化縣社頭鄉社頭村員集路二段385巷11號1樓","劉欣宜","500000","1130731"
"3229","96589766","林弎山商號股份有限公司","新北市新店區寶橋路152號4樓","高憲鴻","600000","1130807"
"3230","96591340","宗揚投資顧問有限公司","高雄市鼓山區龍勝路291號10樓","楊宗憲","1000000","1130808"
"3231","96591432","嗨圃股份有限公司","臺北市大安區敦化南路1段190巷2號","張晉寧","1000000","1130812"
"3232","96591600","好螺嗦餐飲實業有限公司","桃園市桃園區北埔里莊敬路二段68號（1樓）","周濟安","1000000","1130809"
"3233","96614809","日暮里文創有限公司","臺中市北區錦平里育才北路100號2樓","黃文舉","1000000","1130806"
"3234","96620247","宇博有限公司","屏東縣屏東市重慶路119-1號2樓","吳思叡","1000000","1130805"
"3235","96623379","彩越興業有限公司","桃園市中壢區後寮里中山東路三段70號（1樓）","陳林照","2000000","1130801"
"3236","96623477","悅寵生活有限公司","高雄市苓雅區中山二路489號8樓之2","郭于菱","50000","1130805"
"3237","96627282","大新國際通路有限公司","新竹市東區東山里食品路113號1樓","高偉誠","2000000","1130806"
"3238","96627895","寵物好事股份有限公司","臺中市西屯區何仁里文心路三段138之10號1樓","洪莉金","10000000","1130805"
"3239","96640089","蚓陸農業生物科技有限公司","臺中市豐原區南村里水源路395巷23號1樓","黃祈勝","200000","1130807"
"3240","96642283","華邑有限公司","桃園市桃園區汴洲里水岸三街9號","鍾華美","256168000","1130805"
"3241","96644260","漢凌生技有限公司","臺南市西港區中山路469-12號","吳俊龍","10000","1130813"
"3242","96647787","淘淘企業股份有限公司","臺北市松山區復興北路311號12樓之1","謝佩芬","15000000","1130801"
"3243","96649103","富有愛有限公司","臺北市中正區許昌街42號8樓","謝富貴","500000","1130802"
"3244","96649194","華鑫冷凍科技設備有限公司","臺南市永康區甲頂里中央路23巷51弄6號1樓","蔡翰霆","200000","1130806"
"3245","96649413","冠運有限公司","桃園市大溪區員林路二段338號","蕭啓仁","500000","1130807"
"3246","96650776","威提德資本股份有限公司","臺北市松山區南京東路3段287號14樓","吳泳璋","25500000","1130806"
"3247","96650847","廣岳綜合工程有限公司","新北市蘆洲區長安街23巷1號8樓之6","邱温雅","1050000","1130806"
"3248","96650895","突圍智創有限公司","臺北市大安區羅斯福路3段335號12樓之2","羅凱揚","100000","1130801"
"3249","96651965","立瑋數位科技有限公司","臺南市西港區後營里後營236號1樓","李中傑","1000000","1130808"
"3250","96656954","秝澄貿易有限公司","臺中市西區精誠二十二街23號1樓","邱雅齡","2000000","1130801"
"3251","96658876","耀揚運動行銷股份有限公司","臺北市內湖區康寧路3段189巷127號地下1樓","陳崇民","2000000","1130808"
"3252","96659024","峻泰貿易有限公司","彰化縣鹿港鎮東崎里祥和二街6巷13號","林可妮","500000","1130802"
"3253","96659122","凡朵有限公司","臺北市中山區南京東路2段101號11樓","朱元楷","100000","1130806"
"3254","96659158","今鶴公益有限公司","高雄市三民區文安南街170號","簡偉智","500000","1130806"
"3255","96659404","韻升有限公司","新北市五股區成泰路3段577巷54弄58號","李美芳","1000000","1130805"
"3256","96659811","曉美健康設計事業有限公司","臺北市中山區南京西路1之1號11樓","邱詠心","500000","1130808"
"3257","96659827","普博爾系統有限公司","臺北市內湖區新湖三路122號5樓","林治宏","1000000","1130807"
"3258","96660346","禾豐木坊有限公司","新北市中和區中正路218之4號6樓","陳奕程","100000","1130809"
"3259","96660373","華頡工程有限公司","臺南市安南區溪頂里北安路2段32巷13號1樓","蔡叔華","100000","1130805"
"3260","96660394","易達速運有限公司","高雄市苓雅區四維四路216號10樓之2","吳紘名","6000000","1130730"
"3261","96663673","圓城管理顧問股份有限公司","桃園市桃園區坤成街67之3號1樓","楊國成","400000","1130808"
"3262","96663759","魚藝有限公司","臺中市南區工學里大慶街一段84號3樓之2","謝佳儒","100000","1130807"
"3263","96668776","新重佑有限公司","桃園市龜山區長峰路126號4樓","郭子健","500000","1130802"
"3264","96670111","沐埕股份有限公司","臺中市沙鹿區斗抵里天池街85號1樓","林宥辰","10100000","1130805"
"3265","96670175","咕嚕科技有限公司","新北市林口區文化二路1段390號6樓","張玉姍","500000","1130805"
"3266","96670442","綠鎰國際有限公司","臺北市大安區光復南路260巷5號","胡玉瑩","200000","1130809"
"3267","96671224","昕奕國際有限公司","新北市新店區北宜路1段105巷4弄4號5樓","黃義涵","100000","1130807"
"3268","96671462","賦御地產事業有限公司","高雄市三民區天祥二路38號","邱采瑄","2000000","1130802"
"3269","96672510","博來得投資有限公司","新北市土城區中央路4段340號","何健德","300000","1130808"
"3270","96673074","萬宜國際資產管理股份有限公司","高雄市左營區文守路337號2樓","莊金陵","1000000","1130807"
"3271","96673193","紳士實業有限公司","臺北市大同區涼州街6號2樓之2","游煒鏮","100000","1130802"
"3272","96676918","金鑫拓有限公司","臺北市松山區南京東路4段75號4樓之1","金昱輝","50000","1130801"
