"序號","統一編號","公司名稱","公司所在地","代表人","資本額","核准設立日期"
"2863","96844909","協長國際有限公司","高雄市左營區民族一路901巷26弄2號5樓之1","王竣立","1000000","1130613"
"2864","96844915","晨耀不動產有限公司","臺中市北屯區中平路980號1樓","何晨維","2000000","1130607"
"2865","96844963","辰翎金屬有限公司","臺南市安定區新吉里9鄰新吉146之29號","洪瑋辰","5000000","1130617"
"2866","96845034","萌芽小種子有限公司","臺北市大安區安居街8巷6弄2號1樓","洪慧珊","150000","1130603"
"2867","96845055","樊恩生命有限公司","臺中市西區大忠里忠明南路270號7樓之1","彭敬玶","300000","1130606"
"2868","96845082","歐登貿易有限公司","臺中市西區後龍里梅川西路一段85號4樓之1","孫曉彤","500000","1130627"
"2869","96845203","勤唯有限公司","臺南市麻豆區成功街7號7樓之6","劉映廷","500000","1130617"
"2870","96845225","順楊利有限公司","高雄市鼓山區裕誠路1505號3樓","潘家順","100000","1130625"
"2871","96845267","涅陽造鎮股份有限公司","臺北市內湖區內湖路1段73號3樓","涅所未來股份有限公司","2000000","1130621"
"2872","96845273","立隆有限公司","南投縣草屯鎮玉峰里博愛路307巷13號一樓","曾勇學","100000","1130626"
"2873","96845479","國烽營造工程有限公司","臺中市北屯區和平里和祥街35號2樓","陳酩喆","3660000","1130614"
"2874","96845506","嚮遇有限公司","臺南市東區大同路1段119號1樓","吳旻真","100000","1130607"
"2875","96845533","弘以齊有限公司","臺北市南港區忠孝東路7段610之1號2樓","王慧琪","2500000","1130621"
"2876","96845560","騜騰企業有限公司","臺北市士林區承德路5段34號4樓","林奕君","3000000","1130611"
"2877","96845668","晶笙企業有限公司","臺南市下營區中山路二段40號1樓","沈秉垣","99085","1130614"
"2878","96845885","玖號設計有限公司","臺北市士林區承德路4段188號3樓","洪詩涵","50000","1130611"
"2879","96845891","橋柯國際有限公司","臺北市大安區仁愛路3段127號4樓","柯莉娟","100000","1130624"
"2880","96845914","大心福國際有限公司","彰化縣埤頭鄉陸嘉村中華路163號","張秀美","1000000","1130611"
"2881","96845920","詠美達國際有限公司","桃園市平鎮區平東路68巷17弄6號","林翠萍","1000000","1130626"
"2882","96846202","呈宇工程有限公司","臺中市大里區新仁里新仁七街21巷1號1樓","蕭盟薰","1000000","1130617"
"2883","96846224","圓仁投資有限公司","臺北市中山區松江路131之27號14樓","張聖翊","13000000","1130625"
"2884","96846300","振豪生技有限公司","彰化縣鹿港鎮街尾里復興南路30號","李逸成","1000000","1130619"
"2885","96846370","澗瀞生活時尚有限公司","臺北市中山區農安街6號12樓","黃靜惠","500000","1130612"
"2886","96846385","凱磁科技股份有限公司","新竹縣竹北市聯興里新工六路9號","陳日開","1000000","1130617"
"2887","96846483","呈駱工程有限公司","桃園市楊梅區金山街275巷72號12樓","游冠宇","1000000","1130627"
"2888","96846580","博可投資有限公司","臺北市中山區南京東路2段101號11樓","鄭涵勻","900000","1130625"
"2889","96846625","汎宸室內裝修有限公司","新北市新莊區思源路166巷22號12樓","吳俊忠","2000000","1130627"
"2890","96846771","栯呈空間設計有限公司","臺南市安南區安順里台江大道1段859巷2弄22號1樓","方奕棠","100000","1130624"
"2891","96846842","三協精密有限公司","臺中市外埔區大同里中山路246巷26號1樓","鄭妃雯","500000","1130618"
"2892","96846884","柏杰企業有限公司","新北市五股區芳洲二路146號4樓","李昱霖","1200000","1130624"
"2893","96846961","聿泓科技有限公司","臺北市信義區基隆路1段143號11樓之3","林星辰","200000","1130624"
"2894","96847027","惠明工程有限公司","臺北市大同區長安西路287號6樓之9","謝姵瑩","1200000","1130628"
"2895","96847096","鋐鑫精密有限公司","高雄市仁武區赤西三街27號1樓","郭泰鑫","500000","1130620"
"2896","96847173","詹佳投資股份有限公司","臺北市中山區樂群二路164號","詹麗珠","100000","1130621"
"2897","96847194","佳心一號股份有限公司","新北市新店區北新路1段89號6樓之2","彭盈碩","1000000","1130618"
"2898","96847286","川阜石材有限公司","嘉義縣水上鄉靖和村南靖糖廠81號1樓","胡濰岱","1000000","1130606"
"2899","96847336","浩瀚運動行銷顧問有限公司","高雄市小港區廠新街119號1樓","酆士豪","2700000","1130618"
"2900","96847504","新豐開發投資股份有限公司","臺北市松山區敦化北路167號9樓","蔡裕隆","1000000","1130607"
"2901","96847510","尚允租賃有限公司","高雄市燕巢區中西路7之1號","薛百琪","5000000","1130603"
"2902","96847589","承平有限公司","臺北市大安區忠孝東路3段303號2樓之2","孫永青","500000","1130604"
"2903","96847624","興禾科技股份有限公司","臺中市大雅區三和里建興路192巷21號1樓","余佳龍","2000000","1130617"
"2904","96847639","悠生活科技股份有限公司","臺北市中山區新生北路2段113號1樓","張巍瀚","100000","1130617"
"2905","96847693","溜溜捌捌有限公司","臺中市東區富仁里復興路五段156號1樓","陳哲豐","300000","1130626"
"2906","96847770","弘展設計工程有限公司","臺北市松山區民權東路3段104號5樓","何尤娟","1000000","1130621"
"2907","96847785","萬豐實業有限公司","桃園市桃園區大有路401號11樓","謝偉呈","2000000","1130603"
"2908","96847835","反抗者股份有限公司","桃園市中壢區民族路五段96號","李京憲","100000","1130628"
"2909","96847856","安園事業有限公司","彰化縣彰化市延和里大埔路182、184號","施美鈺","250000","1130619"
"2910","96848004","益利車業有限公司","高雄市仁武區永仁街386號1樓","趙珮伶","100000","1130624"
"2911","96848187","藍海洋實業股份有限公司","新北市三重區後竹圍街66號(1樓)","李俊德","400000","1130627"
"2912","96848216","創智動能股份有限公司","新北市三重區重新路2段21號12樓","莊志仁","10000000","1130614"
"2913","96848258","越忠海有限公司","桃園市大園區大園里中正東路13號(1樓)","NGUYEN SY TRUNG","500000","1130603"
"2914","96848362","伯睿機械工程有限公司","雲林縣西螺鎮大園里中山東路79巷21號1樓","李政憲","2000000","1130624"
"2915","96848481","湧強股份有限公司","雲林縣斗南鎮新光里光民路55號","曾文謙","3000000","1130607"
"2916","96848623","麗安守護有限公司","臺南市新營區新東里東興路328號1樓","王麗麗","2000000","1130607"
"2917","96848829","鎧西有限公司","臺北市大安區忠孝東路4段248巷6號","張郁柔","20000","1130626"
"2918","96848877","禹羿檢驗國際有限公司","宜蘭縣羅東鎮光榮路36號二樓","陳奕慈","1000000","1130624"
"2919","96848948","君尉股份有限公司","新北市蘆洲區信義路222巷43弄7號(1樓)","李毓雯","600000","1130606"
"2920","96848953","上禾國際科技實業有限公司","新北市林口區文化二路1段68巷8號7樓之7","陳育佐","500000","1130618"
"2921","96849025","格羅泰克有限公司","臺北市中山區龍江路412巷27號","王泰國","5000000","1130611"
"2922","96849088","艾眾股份有限公司","高雄市鼓山區中華一路350號3樓之1","洪碧原","1600000","1130626"
"2923","96849117","玉如有限公司","臺北市大安區信義路4段380號2樓","孫玉如","1000000","1130625"
"2924","96849123","很美國際有限公司","新北市新莊區昌平街59巷9號7樓","高秀雯","88888","1130607"
"2925","96849138","詠椽投資控股股份有限公司","新竹市北區湳中里武陵路175巷13號5樓之3","蔣睿","6000000","1130617"
"2926","96849263","裕之豐有限公司","臺北市松山區南京東路5段213號5樓","薛婷憶","1000000","1130614"
"2927","96849279","瀚品股份有限公司","新竹縣竹北市北崙里縣政九路153號1樓","易子雅","500000","1130604"
"2928","96849284","澎果室內裝修設計工程有限公司","澎湖縣馬公市鐵線里1鄰鐵線尾86號","陳松霖","1000000","1130613"
"2929","96849290","庚凌國際有限公司","新北市土城區員林街8號12樓","葉峰富","500000","1130611"
"2930","96849361","嘉盛金屬科技有限公司","臺中市大甲區大安港路407號","鍾嘉泰","1600000","1130621"
"2931","96849382","光華國際股份有限公司","臺中市南區忠明南路758號10樓","洪麗卿","500000","1130627"
"2932","96849398","次序空間設計有限公司","臺北市大同區重慶北路1段30號3樓","陳維祥","2000000","1130626"
"2933","96849566","敬好事業有限公司","高雄市小港區孝先街78號1樓","徐浩恆","1000000","1130604"
"2934","96849658","宸鈴有限公司","新竹市東區柴橋里明湖路648巷104弄7號1樓","張苡靖","2800000","1130603"
"2935","96849756","禾顏月季有限公司","臺北市大同區赤峰街53巷21號1樓","李孟穎","2700000","1130613"
"2936","96849860","進喜貿易有限公司","新北市三峽區學成路295號12樓","林顯逵","1000000","1130606"
"2937","96849897","寶植麗酵股份有限公司","臺中市西屯區臺灣大道4段839號7樓","蔡昀蓁","4500000","1130619"
"2938","96849995","欣云貿易有限公司","高雄市苓雅區苓雅二路26號2樓","吳瑞哲","3000000","1130619"
"2939","97376571","永新汽車租賃有限公司","臺北市松山區南京東路3段346號4樓","王世璋","5000000","1130613"
"2940","97380272","精研工程有限公司","臺中市西屯區潮洋里市政北二路238號27樓之1","洪偉倫","1000000","1130618"
"2941","97392170","易上雲股份有限公司","新北市三重區三和路4段111號8樓","林儀","32000000","1130614"
"2942","97395373","云創數位有限公司","臺北市中山區南京東路2段150號7樓","賴俊霖","100000","1130614"
"2943","97398575","騰茂木業工程有限公司","新北市新莊區化成路395號","葉東利","1000000","1130625"
"2944","97403970","竣喬有限公司","桃園市桃園區玉山街179巷12號","謝承偉","5000000","1130620"
"2945","97415379","全權有限公司","臺南市東區虎尾里富農街1段36巷8號1樓","羅淑瑤","500000","1130604"
"2946","97416476","自由之翼生醫有限公司","新北市三重區集美街126巷24號6樓","林詳崴","100000","1130603"
"2947","97418571","輕鬆丸漁樂有限公司","新北市新店區安平路35巷6號之1","周書偉","300000","1130624"
"2948","97419570","全富貿易有限公司","高雄市岡山區大德二路12號5樓","陳翔宇","1000000","1130625"
"2949","97422771","夏嵐國際旅行社有限公司","新北市新莊區幸福路645號(1樓)","蔡璧嵐","6000000","1130612"
"2950","97423574","京墩有限公司","新北市三重區三民街274號7樓","林祈位","1500000","1130614"
"2951","97482475","本地人娛樂有限公司","臺北市大安區忠孝東路4段142號4樓之2","何書維","50000","1130619"
"2952","97483679","禹夆股份有限公司","新竹縣竹北市高鐵八路188號1樓","陳建宏","1000000","1130613"
"2953","97484570","誠宥事業有限公司","臺北市信義區基隆路2段77號5樓之2","胡祖誠","300000","1130626"
"2954","97484678","台灣類比自動化股份有限公司","新竹市四維路21巷43號","宋明儒","10000","1130624"
"2955","97485579","富秀儷有限公司","新北市三峽區大學路85號11樓之26","王秀如","100000","1130614"
"2956","97496371","赫米科技有限公司","臺中市北區中清路一段372號10樓","董仲原","1000000","1130620"
"2957","97498379","鼎勝蛋品有限公司","高雄市岡山區柳橋西路1段66號1樓","曾建綸","500000","1130603"
"2958","97499074","哈克藝術文創有限公司","南投縣竹山鎮桂林里大同街175號1樓","林旻慶","1000000","1130625"
"2959","97499378","皇富國際有限公司","苗栗縣苑裡鎮田心里田心91之6號1樓","林紹穎","1000000","1130619"
"2960","97500059","酪梨世家有限公司","新北市淡水區水源街1段122巷11弄2號","沈玟彤","200000","1130624"
"2961","97500136","鑫辰實業有限公司","臺南市安平區億載里郡平路388號4樓之3","湯子瑩","500000","1130605"
"2962","97500157","白蓉股份有限公司","臺中市西屯區逢福里福上巷243之1號1樓","湯憲志","300000","1130611"
"2963","97500240","盛偉一能源股份有限公司","桃園市中壢區高鐵站前西路一段268號二樓之5","黃振聲","100000","1130627"
"2964","97500255","筌制國際有限公司","新北市萬里區玉田2之13號3樓之5","郭富翔","50000","1130607"
"2965","97500683","避風港映像事業有限公司","臺南市中西區淺草里金華路3段230號3樓之1","張皓馮","1000000","1130603"
"2966","97500699","是日家居有限公司","新北市中和區景平路574號2樓","曾彥霖","100000","1130612"
"2967","97500733","心傳國際股份有限公司","臺北市信義區東興路47號4樓","李依玲","1000000","1130614"
"2968","97500804","楊光能源股份有限公司","新竹市東區慈雲路118號13樓之7","葉孟恒","100000","1130620"
"2969","97500902","嘉富信股份有限公司","臺北市大安區敦化南路1段205號2樓之5","張育菁","1000000","1130626"
"2970","97501178","木谷有限公司","臺北市中山區大直街86號1樓","詹雅晴","2000000","1130620"
"2971","97501873","旺三代地產有限公司","臺中市西屯區惠來里市政路500號22樓之5","陳志彬","1000000","1130605"
"2972","97502681","伊文工程顧問有限公司","桃園市八德區大興里和平路276巷29號8樓","陳原維","500000","1130628"
"2973","97502850","亞萬海洋國際有限公司","臺南市安平區永華三街333號7樓之1","郭畇呈","90000","1130603"
"2974","97503318","亭匠企業有限公司","桃園市大園區青山里春德路140號(一樓)","鍾慧","500000","1130604"
"2975","97503979","呈畇國際材料有限公司","新北市汐止區新台五路1段93號21樓之6","魏妤喬","3000000","1130628"
"2976","97504013","三感有限公司","臺北市信義區基隆路1段398號5樓之1","葉盈君","1000000","1130617"
"2977","97504105","兆咖大業有限公司","新北市三重區鄰環河北路1段356號","羅國卿","6000000","1130607"
"2978","97504549","殿基有限公司","高雄市左營區南屏路268巷42號1樓","陳昕蔓","600000","1130627"
"2979","97504604","富勝顧問有限公司","嘉義縣太保市北港路二段102號2樓","許富貴","102000","1130624"
"2980","97504647","全球淨零策略股份有限公司","臺北市信義區信義路5段7號57樓之1","黃金恩","2000000","1130619"
"2981","97504956","洋倢綠能股份有限公司","臺北市大安區大安路1段31巷41號1樓","鄭旭捷","5009900","1130620"
"2982","97505174","木瓜廣告行銷有限公司","臺北市中正區信義路2段33號5樓之4","蔡木林","2680000","1130607"
"2983","97505189","集食有限公司","宜蘭縣五結鄉成興村五濱路一段18號","林峰","10000000","1130531"
"2984","97505272","遠近科技股份有限公司","新竹縣湖口鄉光復北路20-1號","蔡國新","5000000","1130617"
"2985","97505364","卯時三特有限公司","臺中市西屯區何成里臺灣大道二段825號2、3樓","葉宇杰","1000000","1130625"
"2986","97505478","瑞茂國際貿易有限公司","臺中市南區福興里五權南路167號地下一樓之6","何偉歆","1000000","1130617"
"2987","97505723","竹品原香有限公司","臺北市大同區重慶北路3段277號2樓","曾文凱","10000","1130621"
"2988","97506075","夏至能源股份有限公司","臺北市信義區松高路1號10樓之1","林麗珍","1000000","1130613"
"2989","97506384","銓賀空壓能源有限公司","新北市樹林區大安路592號(1樓)","林偉政","6000000","1130628"
"2990","97506568","麒龍奕工程有限公司","臺北市士林區承德路4段294之3號1樓","林佳育","1000000","1130624"
"2991","97506700","臺巴木顧問有限公司","臺南市東區大同里大同路1段173號6樓之2","徐加儒","3300000","1130613"
"2992","97507074","祥瑞裝潢有限公司","新北市新店區民權路108號地下1層","高瑞智","300000","1130612"
"2993","97507383","佳世邦投資有限公司","臺中市北屯區中清路二段1166巷28弄113號1樓","張雄世","200000","1130614"
"2994","97507623","春謙投資股份有限公司","新北市新莊區思源路166巷27號6樓","廖智毅","6000000","1130628"
"2995","97507877","靖達企業有限公司","臺南市新化區豐榮里民治路150號2樓","林珊如","100000","1130603"
"2996","97507905","天一成科技有限公司","高雄市三民區九如一路855號","陳耀千","1000000","1130621"
"2997","97507911","悠矽股份有限公司","新竹市北區中華路三段9號8樓之5","宋昇祐","10000000","1130606"
"2998","97507980","永鑫樂活有限公司","彰化縣彰化市台鳳里一心東街68號1樓","洪敏晟","100000","1130626"
"2999","97508469","吉億餐飲有限公司","臺中市北區淡溝里臺灣大道二段346號1樓","徐嘉鴻","300000","1130607"
"3000","97508496","新妍有限公司","臺中市西屯區逢甲路15號","許芝熙","1000000","1130625"
"3001","97508550","雲屏嶺企業有限公司","臺南市中西區赤嵌里中山路193號","吳國豪","350000","1130617"
"3002","97508691","味饗珍餐飲有限公司","新北市淡水區中山北路1段75號(1樓)","陳家凱","3200000","1130625"
"3003","97509208","益新環境有限公司","彰化縣埔心鄉東門村員鹿路二段383號","張偉勝","1000000","1130611"
"3004","97509523","民郡建設有限公司","澎湖縣馬公市東衛里東衛176號1樓","胡馨云","1000000","1130617"
"3005","97509657","涵澄運動有限公司","臺北市信義區和平東路3段391巷8弄6號1樓","鄂鈺涵","1000000","1130627"
"3006","97509707","藍眼有限公司","臺南市善化區大成路228號3樓","穆漢仁","600000","1130627"
"3007","97510351","薾斌科技有限公司","臺北市信義區松德路65號11樓之1","郭熙盛","500000","1130606"
"3008","97510649","蓋美國際貿易有限公司","新竹市香山區埔前里牛埔南路13號","郭宗諺","1000000","1130606"
"3009","97510795","詠富國際實業有限公司","臺北市中山區南京東路2段150號7樓","駱詠濂","2000000","1130626"
"3010","97510850","多向度有限公司","臺北市萬華區武昌街2段83之6號3、4樓","朱柏豪","10000000","1130604"
"3011","97511008","育途有限公司","臺北市大同區南京西路163號2樓之54","謝依庭","300000","1130606"
"3012","97511210","熱血種子國際事業有限公司","新北市永和區成功路2段28號地下1層之10","陳豪恩","10000","1130628"
"3013","97511252","禾滿堂宗教文物有限公司","桃園市龜山區萬壽路二段586號10樓","郭彥昇","200000","1130625"
"3014","97511416","星品禾有限公司","新北市蘆洲區民義街61巷8號(1樓)","梁明煌","60000","1130617"
"3015","97511534","健康載體生技有限公司","新北市新莊區五工五路5號2樓","陳俊傑","5000000","1130620"
"3016","97511605","嘉君派乘有限公司","臺北市中正區羅斯福路2段14號2樓","王君嵐","200000","1130628"
"3017","97511675","銀仲有限公司","臺中市沙鹿區北勢里北勢東路511巷21號1樓","鄭竹欣","6000000","1130613"
"3018","97511746","品冠金屬有限公司","臺南市中西區西湖里頂美一街7號6樓之6","黃士嘉","10000","1130603"
"3019","97512365","彤宥國際貿易有限公司","彰化縣秀水鄉馬興村彰馬街97巷26弄6號","林億昌","500000","1130612"
"3020","97512463","巨麟室內裝修有限公司","臺中市南區福興里五權南路167號地下一層樓之6","温智凱","470000","1130607"
"3021","97512745","正見有限公司","臺中市南區平和里南平路158號1樓","楊志文","1000000","1130607"
"3022","97512891","鋭鑫國際有限公司","臺中市豐原區中興里大明路198號1樓","謝睿襄","1000000","1130625"
"3023","97513505","秝洋食品開發有限公司","臺南市安平區平通里慶平路539號17樓之16","楊嵐鈞","100000","1130619"
"3024","97513688","參孫行銷有限公司","新北市汐止區大同路2段184巷1號10樓之5","黃婕妤","300000","1130606"
"3025","97513961","龍聯機械興業有限公司","臺中市豐原區東湳里國豐路二段366巷96弄58號1樓","詹美桂","3000000","1130611"
"3026","97514048","約泡麵有限公司","臺北市萬華區內江街51號1樓","謝承晏","1000000","1130627"
"3027","97514167","蒔尚室內設計有限公司","臺中市潭子區福仁里大新路39號1樓","林湘穎","300000","1130625"
"3028","97514477","思馳國際有限公司","臺中市西區民龍里臺灣大道二段285號4樓之2","廖學輝","1000000","1130613"
"3029","97515145","運紘國際有限公司","高雄市楠梓區後勁南路35巷12弄12號1樓","林姮吟","300000","1130611"
"3030","97515383","台灣相艾股份有限公司","臺北市中山區明水路672巷36號2樓","王為祺","8000000","1130611"
"3031","97515567","浤倢科技有限公司","新北市蘆洲區民生街10號","粘智勛","3000000","1130624"
"3032","97515715","星品清潔修繕有限公司","新北市新店區民族路182號（1樓）","李家銓","200000","1130624"
"3033","97515898","富淇投資有限公司","新北市板橋區自由路51巷24弄7之2號3樓","羅思虹","300000","1130624"
"3034","97515927","山川木有限公司","桃園市楊梅區四維里益新二街46號(4樓)","葉作鈞","200000","1130613"
"3035","97515975","碩盈資產股份有限公司","臺中市北屯區三和里東山路一段140巷2弄77之7號","林更穎","1000000","1130617"
"3036","97516398","夢家有限公司","宜蘭縣宜蘭市嵐峰路一段220號1樓","王詩婕","100000","1130617"
"3037","97516691","豪氣貿易有限公司","臺北市中正區忠孝東路1段152號11樓之6","焦志豪","30000","1130621"
"3038","97516756","南英有限公司","臺北市大安區信義路2段192號","楊紀華","10000000","1130617"
"3039","97516904","奇鋒國際有限公司","臺北市內湖區石潭路27號3樓之5","吳昭奇","5000000","1130611"
"3040","97517002","京宸交通有限公司","新竹縣湖口鄉東興村德和路60巷8弄3號1樓","王宗淦","25000000","1130607"
"3041","97517565","弘信投資有限公司","新北市三重區泉州街69之3號","蔡家閑","1000000","1130626"
"3042","97517571","鑫榮建設股份有限公司","桃園市中壢區月眉里青山一路461巷26號","何君平","10000000","1130618"
"3043","97517690","禾崌室內裝修設計有限公司","高雄市苓雅區福德一路134巷12弄22之1號","戴培恩","2000000","1130627"
"3044","97518023","瑞優投資有限公司","彰化縣彰化市牛埔里彰南路3段115號","周淑慧","300000","1130624"
"3045","97518797","法奕貿易有限公司","臺中市西屯區潮洋里市政北二路238號27樓之1","江麗君","1000000","1130606"
"3046","97519249","金威投資股份有限公司","臺北市大安區忠孝東路4段142號5樓之5","黄淑卿","2000000","1130611"
"3047","97519254","風采國際傳媒有限公司","臺中市北區賴興里梅川西路四段228號","蔡均諺","100000","1130617"
"3048","97519374","竹山交通有限公司","雲林縣虎尾鎮廉使里虎興東二路196號1樓","張皓傑","25000000","1130628"
"3049","97519698","英登人力仲介有限公司","新竹市北區竹光路345號1樓","曾國凱","5000000","1130614"
"3050","97519851","道數位台灣有限公司","臺北市信義區市民大道6段288號6樓之3","魏瑞吉(Rajkumar VELAGAPUDI)","5000000","1130625"
"3051","97520082","恒翊搬家貨運股份有限公司","桃園市平鎮區太平西路217巷7號","詹鐘華","10000000","1130607"
"3052","97520626","良唯醫療器材有限公司","新北市三重區仁和街100號","陳執中","300000","1130621"
"3053","97520816","世乾工程有限公司","高雄市楠梓區興楠路355巷56弄5號4樓","顏于翔","50000","1130627"
"3054","97520885","御淵國際有限公司","新北市淡水區民權路23號4樓之2","張子文","100000","1130628"
"3055","97521081","妥妥創意資訊股份有限公司","臺北市萬華區貴陽街2段114巷19號1樓","林志慶","150000","1130603"
"3056","97521126","萊恩國際健康有限公司","臺中市北屯區文昌東十一街47號地下底1層","林懷恩","100000","1130606"
"3057","97521131","雅客居工程有限公司","高雄市茄萣區莒光路三段115巷18號4樓","曾柏瑋","150000","1130605"
"3058","97521717","華韻花藝有限公司","臺中市西區館前路57號1樓","吳淑娟","2500000","1130531"
"3059","97521738","微蟲科教有限公司","臺中市北屯區軍功里軍和街107號","黃悠然","2000000","1130625"
"3060","97522053","藝驛有限公司","臺北市信義區基隆路1段206號18樓","黃映慈","300000","1130614"
"3061","97522119","泗川好有限公司","高雄市三民區鐵道街300號","張瑞麟","5000000","1130620"
"3062","97522292","映庭企業有限公司","臺中市大肚區頂街里大德六街43號","陳依婷","500000","1130605"
"3063","97522808","驊紜人才管理顧問有限公司","臺中市西屯區朝富路213號20樓之2","黃志龍","5000000","1130624"
"3064","97523200","耀億建設有限公司","高雄市三民區漢口街166號7樓","蔡耀億","3000000","1130606"
"3065","97523573","揚運有限公司","花蓮縣吉安鄉慶豐村慶北二街363號一樓","楊曜鴻","1000000","1130603"
"3066","97523638","文咖啡食品有限公司","臺中市西屯區府會園道169號1樓","張肇文","1000000","1130606"
"3067","97523840","上上明股份有限公司","高雄市鳳山區仁愛路60巷41號1樓","潘志勤","29000000","1130626"
