"序號","統一編號","公司名稱","公司所在地","代表人","資本額","核准設立日期"
"1028","00102333","威龍運動有限公司","臺中市西屯區港尾里黎明路三段1210號","王柏凱","300000","1130814"
"1029","00102397","歇脚巷有限公司","嘉義市西區竹村里1鄰竹子腳3之45號2樓","許廷嘉","50000","1130814"
"1030","00102447","牧暮有限公司","高雄市鳳山區鳳南一路87號10樓","黎均驛","200000","1130826"
"1031","00102474","翔閎國際有限公司","臺中市北屯區東山路一段156之11巷8號地下室","潘思如","200000","1130819"
"1032","00102571","購精彩股份有限公司","臺北市信義區基隆路2段77號7樓之3","胡恒士","3000000","1130820"
"1033","00102621","加賀設計有限公司","臺中市烏日區三榮十五路40號","王文奇","1000000","1130827"
"1034","00102729","欣甲工程有限公司","屏東縣屏東市建國里自由路79巷14號","洪文博","2000000","1130816"
"1035","00102811","宏家鴻投資有限公司","臺中市大里區瑞城里成功路12巷58號","林俊良","4000000","1130829"
"1036","00102832","神威電氣工程有限公司","臺中市后里區墩北里月湖路61巷1號","蔡寳燕","1000000","1130826"
"1037","00102919","馨元有限公司","臺中市西屯區市政北二路238號27樓之1","羅珮今","100000","1130822"
"1038","00103017","里原資產管理股份有限公司","臺中市南區福順里忠明南路787號37樓","謝雅蓉","12000000","1130821"
"1039","00103065","夏皙國際企業有限公司","新北市土城區中華路1段36號7樓之1","徐子茜","1000000","1130822"
"1040","00103086","快樂男孩有限公司","桃園市桃園區藝文一街86之1號15樓","施修仁","100000","1130826"
"1041","00103092","堯順有限公司","臺南市永康區埔園里四維街140巷9號2樓","許君如","500000","1130813"
"1042","00103348","頓金科技工程有限公司","桃園市觀音區大同里環中路105巷8號（1樓）","曾仁暉","1000000","1130813"
"1043","00103369","佳泰積有限公司","雲林縣斗六市長安里科邨一路346號1樓","廖偉聖","5000000","1130809"
"1044","00103419","惟迅科技有限公司","高雄市新興區七賢一路301號4樓之6","林昕儀","500000","1130816"
"1045","00103537","誠砌塗裝有限公司","臺東縣臺東市卑南里南一街80巷19號1樓","林威治","100000","1130809"
"1046","00103570","路米歐國際事業有限公司","臺北市信義區忠孝東路5段410號12樓之2","林郁庭","500000","1130827"
"1047","00103776","今有勝有限公司","臺中市豐原區三豐路二段550號1樓","陳鉦傑","1000000","1130815"
"1048","00103889","喬騰室內裝修有限公司","臺中市南屯區大同里大墩六街84號1樓","廖擴鈞","300000","1130814"
"1049","00103950","問號科技有限公司","臺中市西區公舘里柳川西路二段42之1號1樓","謝昱丞","400000","1130820"
"1050","00104120","凱榆有限公司","臺中市大甲區水源路255號1樓","郭勻緁","50000","1130819"
"1051","00104135","磐力地工技術工程股份有限公司","臺北市大安區安和路1段102巷28號2樓","劉泉枝","20000000","1130828"
"1052","00104212","緣圓地產股份有限公司","桃園市大園區大成路一段10號6樓","朱昌碩","10000000","1130828"
"1053","00104254","硯田室內設計有限公司","臺北市中正區懷寧路76號","彭士豪","500000","1130816"
"1054","00104521","悅穎健康顧問有限公司","新北市新店區安興路127之6號12樓","周政璋","200000","1130816"
"1055","00104677","鑫中澄清眼科技股份有限公司","高雄市鼓山區美術東五路8號6樓","吳孟憲","1000000","1130820"
"1056","00104780","神采創意有限公司","彰化縣和美鎮山犁里愛國路63號1樓","姚采貝","100000","1130826"
"1057","00105009","築葳設計美學有限公司","臺南市歸仁區仁愛南街132號1樓","劉葳妤","1000000","1130821"
"1058","00105079","珸有限公司","臺南市南區大成里興昌路38巷6號10樓之9","黄旭廷","1000000","1130828"
"1059","00105182","熊本組建設股份有限公司","桃園市楊梅區永寧里環南路223巷39號5樓","林建村","1010000","1130830"
"1060","00105275","科莫國際貿易有限公司","新竹縣竹北市竹仁里18鄰文化街82之1號二樓","李縯勝","100000","1130827"
"1061","00105394","友誼貿易有限公司","桃園市大園區三民路一段122巷12之3號2樓","黃岱營","600000","1130829"
"1062","00105556","波羅工程有限公司","高雄市大寮區鳳屏一路271巷3號3樓","鄭惠敏","500000","1130821"
"1063","00105628","耒禾文創有限公司","臺北市內湖區行善路行善路383巷27號2樓","張太耒","300000","1130830"
"1064","00105633","土本工程有限公司","高雄市左營區文天路128號3樓","林艾蔆","1000000","1130821"
"1065","00105649","遠曜居家有限公司","臺北市文山區忠順街1段16號","黃瑋翔","300000","1130813"
"1066","00105676","築大心健康事業有限公司","高雄市岡山區壽華路20號1樓","蔡大鉅","1000000","1130823"
"1067","00105710","靚宏科技有限公司","臺中市西區公益里忠明南路237號5樓之2","曾源祥","2000000","1130821"
"1068","00105752","台灣萌選有限公司","臺北市中山區錦州街426巷1弄22號","蘇慧中","300000","1130819"
"1069","00105795","佰億大企業有限公司","嘉義縣大林鎮中坑里大埔美園區三路32號1樓","蔡柄男","3000000","1130821"
"1070","00105818","永澄豐盛股份有限公司","新北市瑞芳區大埔路東泰新村6號","謝宥莉","5000000","1130820"
"1071","00105824","寶麗金建設有限公司","宜蘭縣宜蘭市中山路二段288號1樓","張榮訓","8000000","1130820"
"1072","00105839","宏泰興實業有限公司","彰化縣埔心鄉東門村武聖路527號","張佳莘","2000000","1130814"
"1073","00106041","億新汽車有限公司","桃園市蘆竹區大竹里大竹路588號(1樓)","闕育凡","1000000","1130813"
"1074","00106247","金礜娛樂有限公司","新北市三重區光復路1段85號9樓","蘇翊傑","10000","1130829"
"1075","00106295","莯禾貿易有限公司","臺南市東區中西里長榮路2段157號5樓","蔡佩芳","300000","1130829"
"1076","00106345","立鑫開發建設股份有限公司","宜蘭縣羅東鎮北成路3段57巷3號3樓","江信賢","2500000","1130829"
"1077","00106443","采富有限公司","臺北市中山區民生東路1段29號5樓之5","楊喆旭","200000","1130826"
"1078","00106458","同原建設有限公司","花蓮縣花蓮市鎮國街85號1樓","孫郁雄","1000000","1130819"
"1079","00106513","舍予月巴有限公司","新北市永和區水源街46號","謝奇恩","300000","1130827"
"1080","00106627","長億貨櫃有限公司","臺中市龍井區龍泉里沙田路五段龍目井116巷5號1樓","陳欽立","5000000","1130826"
"1081","00106725","政冠實業有限公司","臺南市新營區中營里中山路20號4樓之5","王添丁","9000","1130819"
"1082","00106817","應通投資有限公司","彰化縣彰化市民生里永安街175之1號1樓","王應時","8260000","1130813"
"1083","00106915","品律科技有限公司","新北市新莊區中央路572號5樓","謝政倫","300000","1130816"
"1084","00106984","康暘建設有限公司","苗栗縣後龍鎮埔頂里中興路119-8號1樓","張新利","20000000","1130815"
"1085","00107013","篙林食品有限公司","新北市樹林區學府路306號7樓","古鏡","600000","1130819"
"1086","00107077","文祥金屬股份有限公司","臺中市東區三賢街178號1樓","葉秀玲","4000000","1130814"
"1087","00107175","陞川室內裝修有限公司","臺中市西區忠明里美村路一段131號2樓","楊肇軒","1000000","1130820"
"1088","00107230","森凱建設開發有限公司","新北市蘆洲區集賢路306號4樓","李新興","50000000","1130814"
"1089","00107267","幸福憶之味有限公司","苗栗縣苗栗市南勢里國馨67號一樓","張艷君","800000","1130819"
"1090","00107317","星樂活健康長期照顧股份有限公司","臺北市萬華區中華路1段106號8樓","吳宗霖","1000000","1130828"
"1091","00107338","興連興業有限公司","臺中市豐原區北陽里北陽路132之1號1樓","張連興","500000","1130819"
"1092","00107365","協陞投資有限公司","臺中市北區賴旺里青島西街60號2樓","張瓊月","2500000","1130830"
"1093","00107463","佑升國際股份有限公司","宜蘭縣羅東鎮興東南路269號二樓","張淑芬","1500000","1130820"
"1094","00107528","瑭馥有限公司","臺北市松山區長安東路2段219號8樓之7","陳瑭安","1000000","1130828"
"1095","00107581","元澔企業有限公司","臺中市北屯區后庄里后庄二街90號8樓之3","蒲琮元","1000000","1130814"
"1096","00107695","理察老饕食品有限公司","臺北市松山區復興北路191號號15樓之5","李偉煌","500000","1130820"
"1097","00107772","澄鼎工程有限公司","桃園市中壢區龍安里龍城新村17號","蔡賢毅","200000","1130814"
"1098","00107935","樂安居不動產仲介有限公司","南投縣草屯鎮上林里太平路1段109號","林欣怡","700000","1130809"
"1099","00107978","龍泉地熱能源股份有限公司","臺中市大肚區沙田路一段320巷50號","李世斌","1000000","1130826"
"1100","00107999","來佳倍投資管理顧問有限公司","高雄市鹽埕區河西路7號9樓之2","林玲","100000","1130828"
"1101","00108126","迅銷美食有限公司","臺中市西區公益里忠明南路237號5樓之2","田穎","100000","1130821"
"1102","00108189","勝閎水電興業有限公司","屏東縣竹田鄉履豐村豐興路78號1樓","邱建鈞","300000","1130816"
"1103","00108293","廣宇數位科技有限公司","臺中市南區五權南路167號地下一樓之6","沈俊廷","200000","1130814"
"1104","00108364","早點設計有限公司","新竹縣竹北市復興三路二段168號6樓之1","張建邦","1310000","1130822"
"1105","00108596","青湘國際有限公司","彰化縣彰化市平和里中華西路340號","劉禎祥","300000","1130820"
"1106","00108879","創尹有限公司","臺中市沙鹿區北勢里鎮南路二段408號1樓","呂博遠","1000000","1130829"
"1107","00108929","醴仕空調工程企業有限公司","桃園市龜山區幸美三街36巷1號","單醴仕","200000","1130829"
"1108","00109005","水樂多廣告行銷有限公司","臺南市中西區西湖里26鄰湖美一街108巷3號","王敦豪","100000","1130814"
"1109","00109103","豫橋企業有限公司","桃園市蘆竹區五福一路32巷6號","王中杰","5000000","1130813"
"1110","00109146","禾豐汽車有限公司","新北市淡水區中正東路1段111巷25號2樓","陳文寶","1000000","1130814"
"1111","00109194","心心婦嬰生活館有限公司","臺北市南港區研究院路2段36號","黃雅慧","100000","1130826"
"1112","00109321","瑾蓉有限公司","臺中市南屯區惠中里文心路一段324號11樓之1","許錦蓉","100000","1130829"
"1113","00109384","哈哈哈國際股份有限公司","新北市板橋區板新路17號2樓","李翊","1111000","1130816"
"1114","00109434","益菖鋐有限公司","臺中市霧峰區吉峰里吉峰路120號1樓","陳瑛玲","5000000","1130819"
"1115","00109574","艾瑞斯有限公司","新竹縣湖口鄉信義村中山二街25巷10號1樓","鄭宇孜","100000","1130809"
"1116","00109693","燕福來有限公司","臺南市新市區大營里豐榮59-20號2樓","李家宏","100000","1130820"
"1117","00109758","富寅投資有限公司","臺中市南區江川里建成路1908號1樓","劉華宮","100000","1130822"
"1118","00109933","祐順設計有限公司","臺中市南屯區田心里文心路一段73號12樓之1","王怡人","200000","1130814"
"1119","00109976","水水股份有限公司","新北市林口區竹林路606巷2號1樓","黃郁夫","3000000","1130828"
"1120","00110116","佑信資訊有限公司","臺北市士林區至誠路2段37號3樓","周俊利","100000","1130827"
"1121","00110312","德謙國際開發有限公司","臺中市潭子區仁愛路二段226號1樓","陳重佑","1000000","1130813"
"1122","00110447","鉦閎工業有限公司","彰化縣秀水鄉福安村民意街325之3號1樓","吳綉惠","1000000","1130813"
"1123","00110609","軒誠車業有限公司","新北市林口區吉祥路191號3樓","楊凱翔","2000000","1130820"
"1124","00110679","毛棧股份有限公司","臺中市西區中興里美村路一段245號1至3樓","李庸彰","211000","1130813"
"1125","00111059","韓僧設計國際有限公司","新北市土城區水源街48號5樓","郭恆生","1000000","1130821"
"1126","00111109","子呈有限公司","新北市三重區中正北路428巷7弄44號(1樓)","林怡安","500000","1130821"
"1127","00111403","白老鳳醫療用品有限公司","彰化縣社頭鄉協和村後路巷13-8號3樓","劉志偉","200000","1130826"
"1128","00111425","緻豐投資股份有限公司","臺北市中山區南京東路3段89巷27弄3號3樓","王智永","29000000","1130830"
"1129","00111488","柘盟行銷有限公司","屏東縣屏東市維新里和平路354號3樓","謝婕崴","100000","1130813"
"1130","00111641","錦昇股份有限公司","高雄市三民區九如一路502號28樓之4","謝依玲","25000000","1130823"
"1131","00111706","富茆工程有限公司","臺中市烏日區自強街43號1樓","王喆","100000","1130814"
"1132","00111712","翔氏有限公司","高雄市鳳山區王生明路150之9號1樓","張簡光翔","500000","1130822"
"1133","00111733","彩虹心樹有限公司","新北市板橋區文化路1段329號4樓","陳淑琴","300000","1130815"
"1134","00111760","暐裕能源有限公司","屏東縣麟洛鄉麟蹄村中山路382-102號1樓","蔣沄釩","200000","1130809"
"1135","00111939","熹原材料有限公司","高雄市新興區民生一路56號18樓之1","李嬋娟","100000","1130826"
"1136","00111993","善明有限公司","臺北市松山區南京東路5段2號3樓","蕭淑華","100000","1130815"
"1137","00112141","鎰享國際有限公司","臺中市霧峰區四德里新埔路66之1號","林仁祥","200000","1130828"
"1138","00112162","神能國際開發有限公司","臺北市中山區林森北路50號9樓之6","張好主","100000","1130821"
"1139","00112212","展碩基礎建設有限公司","新北市三芝區樂全街74號5樓","魏育琳","100000","1130827"
"1140","00112233","宏誠工程有限公司","桃園市桃園區春日里大業路二段17號2樓","曾慶華","1000000","1130828"
"1141","00112297","宸誠投資有限公司","臺北市中山區松江路123巷7號6樓","黃裕傑","3000000","1130821"
"1142","00112445","總佳配管材料有限公司","臺南市西港區慶安里慶安路59巷4號1樓","陳盈源","5000000","1130815"
"1143","00112515","極致鮮有限公司","臺北市大同區南京西路57號6樓之10","郭承霖","1000000","1130829"
"1144","00112607","妘豐有限公司","新竹市東山街27巷7號2樓","張正文","100000","1130814"
"1145","00112634","久力國際有限公司","新北市新莊區明中街43巷8號4樓","陳俊諺","1000000","1130814"
"1146","00112640","豐御建設有限公司","桃園市中壢區松勇一街71號6樓","徐盛璽","1200000","1130826"
"1147","00112677","鄧氏技研企業有限公司","新北市三峽區介壽路1段57號3樓","鄧家正","200000","1130829"
"1148","00112682","摩爾開發投資有限公司","新北市鶯歌區中山路138巷3號之6四樓","呂昌隆","1000000","1130816"
"1149","00112803","官和實業有限公司","高雄市小港區宏林街51號","官嘉慶","300000","1130822"
"1150","00113063","順達彩色有限公司","新北市五股區五工一路122號(4樓)","陳雅萍","1000000","1130814"
"1151","00113084","四時好有限公司","嘉義市東區中央里光華路74號","林孟辰","2000000","1130826"
"1152","00113177","興澤地產有限公司","臺中市太平區新興里新興路125號1樓及127號1樓","顏毓萍","1000000","1130820"
"1153","00113373","丸辰有限公司","臺中市北區健行里忠明路424號20樓之1","吳奕辰","10000","1130827"
"1154","00113459","美泌花園文創有限公司","臺北市北投區立功街165巷5號7樓之1","林璟渝","1000000","1130826"
"1155","00113514","勝漳水電材料有限公司","高雄市楠梓區興楠路261巷2弄8號2樓","郭王鴛","100000","1130828"
"1156","00113789","農田心食有限公司","新北市中和區新生街52號2樓","吳皇英","200000","1130814"
"1157","00113943","上楷建設股份有限公司","彰化縣員林市三多里8鄰永裕街39號","林明言","5000000","1130815"
"1158","00114008","勝式有限公司","臺中市沙鹿區埔子里屏西路69號1樓","蔡勝男","100000","1130816"
"1159","00114099","川南印象股份有限公司","新竹縣竹北市鹿場里成功十一街97號六樓","姚琴","1600000","1130826"
"1160","00114160","睏霸數位科技有限公司","臺北市大安區信義路4段380號2樓","江品緒","100000","1130829"
"1161","00114197","致智科技股份有限公司","高雄市新興區民生一路56號22樓之4","李春億","1000000","1130826"
"1162","00114231","卓健有限公司","臺北市北投區新興路72號1樓","劉俊星","1000000","1130827"
"1163","00114247","五吉興業有限公司","臺北市松山區八德路4段108號","張瑜彬","300000","1130820"
"1164","00114350","創萌國貿股份有限公司","臺北市南港區重陽路218之1號7樓","莊惠敏","1600000","1130813"
"1165","00114387","五龍建設有限公司","臺中市北屯區仁和里后庄路868號1樓","曹嘉駿","5000000","1130814"
"1166","00114491","想想國際直營南部股份有限公司","臺中市西屯區惠來里市政北七路186號8樓之5","吳宣芃","200000","1130829"
"1167","00114611","神睬有限公司","臺南市北區臨安路2段319號1樓","陳默","10000","1130819"
"1168","00114865","奕大投資控股股份有限公司","基隆市信義區義六路22號12樓之1","陳品曦","10000000","1130821"
"1169","00114921","家輔工程有限公司","南投縣國姓鄉長流村大長路500之6號1樓","劉晏輔","500000","1130820"
"1170","00114979","天神國際投資有限公司","臺北市中山區中山北路2段33號6樓","高旭旭","100000","1130813"
"1171","00115029","拓遠智能有限公司","新竹市東區民族路173巷1弄19號1樓","梁為弘","100000","1130829"
"1172","00115034","多億生物工程股份有限公司","金門縣金湖鎮正義里瓊徑路320號","吳及齡","3000000","1130827"
"1173","00115055","沅泰資產鑑定股份有限公司","臺北市松山區南京東路5段188號6樓之5","簡恭凡","500000","1130819"
"1174","00115077","弘曜行銷股份有限公司","臺北市南港區園區街3號17樓","劉子瑜","1000000","1130827"
"1175","00115105","南碩建設開發股份有限公司","雲林縣臺西鄉五港村五港路342號","林思維","2000000","1130826"
"1176","00115175","獨領世紀股份有限公司","桃園市中壢區和平里3鄰文成北街46號","蔡宗翰","400000","1130827"
"1177","00115267","同星開發有限公司","新竹縣竹北市福興一路88號1樓","林亞穎","3000000","1130809"
"1178","00115533","黑科創科技文化傳媒股份有限公司","臺中市北屯區平德里青島路三段27號6樓","謝亦廷","100000","1130826"
"1179","00115581","小豆芽股份有限公司","嘉義市東區中山路284號1樓","黃思敏","2500000","1130827"
"1180","00115668","賀笙工程有限公司","雲林縣二崙鄉崙東村仁和路182號1樓","吳漢正","1000000","1130809"
"1181","00115908","沐家有限公司","桃園市桃園區新埔六街77號9樓之5","江依宸","2000000","1130822"
"1182","00115956","高力熱能科技股份有限公司","桃園市中壢區自強四路8之1號","谷泓道","1000000","1130826"
"1183","00115999","智奧普視股份有限公司","新竹縣竹北市隘口里高鐵七路65號11樓之8","黃俊琅","1800000","1130812"
"1184","00116028","鉑沁科技有限公司","臺中市北區文莊里中清一段89號7樓之6","林映戎","100000","1130829"
"1185","00116060","龍鋒投資事業有限公司","雲林縣斗六市長安里科班三路8號","洪建財","20000000","1130816"
"1186","00116131","崴鑫投資有限公司","高雄市前鎮區新光路27號23樓","胡家碩","1000000","1130826"
"1187","00116370","禾強工程有限公司","桃園市桃園區中山里宏昌十三街634之2號","温正譽","500000","1130829"
"1188","00116435","利元輪業有限公司","新北市新莊區中平路184巷10弄8號2樓之4","洪偉嘉","1000000","1130814"
"1189","00116462","屋諾義式餐飲有限公司","新北市淡水區新市一路1段99巷16號(1樓)","顏宇擷","1000000","1130826"
"1190","00116580","緻星整合有限公司","新北市永和區保生路1號12樓之5","李靜慈","1000000","1130823"
"1191","00116630","宭聚空間設計有限公司","新北市土城區順風路46號3樓","周起鑫","500000","1130813"
"1192","00116673","彩虹島視覺有限公司","臺南市北區公園北路154巷1之2號","徐睿孺","500000","1130822"
"1193","00117011","三勝開發有限公司","新竹縣竹東鎮中豐路二段315號(1樓)","葉銓凱","1000000","1130808"
"1194","00117032","恩群國際有限公司","高雄市楠梓區新昌街50巷6之1號","李翊溱","500000","1130828"
"1195","00117048","當好食有限公司","澎湖縣馬公市西文里西文澳55號1樓","曾右鑫","250000","1130809"
"1196","00117292","黑潮良品有限公司","新北市永和區民權路53號3樓","朱思穎","100000","1130820"
"1197","00117379","石川建設股份有限公司","臺北市信義區基隆路2段51號8樓之7","林洪範","300000","1130821"
"1198","00117384","澄成文創有限公司","臺中市西區民龍里臺灣大道二段186號24樓之3","蔡亞晞","500000","1130816"
"1199","00117510","馬汀國際實業有限公司","臺中市西屯區何福里寧夏東四街16號","鄭惟哲","5000000","1130820"
"1200","00117716","固拓奇有限公司","臺北市大安區和平東路1段6號11樓","鄭勝媛","300000","1130813"
"1201","00117737","允捷實業有限公司","臺中市潭子區大富里民族路三段99巷46號1樓","黃仲俊","200000","1130813"
"1202","00117878","恆益生物科技有限公司","臺中市大里區大明里中興路二段729號9樓之5","陳軒如","1000000","1130820"
"1203","00117906","台印科技有限公司","新北市新莊區中安街1號5樓之1","葉蘇珊","1000000","1130826"
"1204","00117960","叡杰投資有限公司","新北市板橋區新府路1之9號21樓","黃斐敏","10000000","1130816"
"1205","00117976","盛采豐投資事業有限公司","臺北市大安區新生南路3段88號6樓","吳慧玲","300000","1130826"
"1206","00117981","柏思琳服飾有限公司","新北市三重區大同北路148巷57號5樓","劉祐愼","400000","1130827"
"1207","00118047","榮環泵閥有限公司","桃園市桃園區同安里新埔六街77號9樓之5","王淑虹","500000","1130826"
"1208","00118068","向泰建設有限公司","臺北市中山區伊通街66巷13號1樓","張群威","10000000","1130829"
"1209","00118074","雲霄科技有限公司","臺中市北屯區文心路四段669號3樓之1","張銘修","150000","1130812"
"1210","00118089","先達貿易有限公司","臺中市大里區東湖里東南路3號1樓","王孝慈","100000","1130821"
"1211","00118166","雙蠔聯合有限公司","臺南市安南區安東里安和路1段340巷11號1樓","何怡靜","500000","1130828"
"1212","00118193","築念空間有限公司","臺北市中山區松江路293之705號","吳念謙","500000","1130826"
"1213","00118623","允晟建設有限公司","彰化縣鹿港鎮東石里永祥街118號一樓","黃俊誠","13000000","1130828"
"1214","00118807","冠築工務整合有限公司","新北市三芝區淺水灣街9之6號6樓","陳冠霖","250000","1130816"
"1215","00118861","民傑實業有限公司","臺中市北區頂厝里進化北路238號6樓之3","梁佳音","1000000","1130813"
"1216","00118882","田浦建設股份有限公司","臺北市信義區松隆路215巷4弄8號3樓","姚彥誠","10000000","1130814"
"1217","00118932","台灣吉燕有限公司","臺中市西屯區何德里漢口路二段151號14樓之5","林辰典","500000","1130809"
"1218","00118996","聚美時尚股份有限公司","高雄市苓雅區光華一路12號11樓之1","王意婷","500000","1130828"
"1219","00119067","元達停車場有限公司","高雄市內門區內門里內門22之6號","卓勝宏","1200000","1130814"
"1220","00119101","米之諾有限公司","新北市新莊區新北大道4段171號2樓","劉志慶","1000000","1130821"
"1221","00119480","賦活生醫醫材有限公司","臺北市信義區基隆路1段141號4樓之1","劉榮田","1000000","1130830"
"1222","00119539","湧旭綠環科技有限公司","高雄市新興區和平一路199號12樓","黃桂君","1000000","1130820"
"1223","00119637","宏堡工程股份有限公司","彰化縣社頭鄉廣興村中山路一段703號1樓","詹宏崙","1000000","1130807"
"1224","00119860","逸福實業有限公司","臺北市信義區基隆路2段149之49號8樓之13","曾逸騰","500000","1130820"
"1225","00120058","桂福工程有限公司","臺中市北區健行里忠明路424號5樓之1","鄧楹榛","1000000","1130816"
"1226","00120254","提攜有限公司","新北市永和區中山路1段232號6樓之1","趙惠芬","3000000","1130822"
"1227","00120389","菲尼克有限公司","新北市樹林區樹新路36號7樓","陳柏亨","8500000","1130829"
"1228","00120466","華詠創意行銷有限公司","新北市汐止區水源路1段168巷12號3樓","鄒仁淳","500000","1130816"
"1229","00120682","沂佳裝潢有限公司","臺南市安定區新吉里新吉146-19號","李郁真","1000000","1130827"
"1230","00120698","福洣有限公司","桃園市蘆竹區錦中里南崁路265號6樓之6","徐婉嫣","350000","1130815"
"1231","00120819","翔雀有限公司","臺北市中正區忠孝西路1段21號7樓","黃詩霓","100000","1130827"
