"序號","統一編號","公司名稱","公司所在地","代表人","資本額","核准設立日期"
"1642","95430971","好禮物活動創意有限公司","臺中市東勢區新盛里東坑路133巷30號1樓","汪君佑","500000","1140227"
"1643","95431009","旭展科技股份有限公司","苗栗縣造橋鄉朝陽村6鄰中洲仔1-2號1樓","余鉦鋒","18500000","1140214"
"1644","95431388","灰鯨生技股份有限公司","臺中市清水區中社里忠誠路238之8號1樓","林育慶","300000","1140217"
"1645","95431628","日日成開發有限公司","嘉義市西區書院里中山路691號1樓","蔡永鑫","5000000","1140214"
"1646","95431887","苑雲有限公司","新北市新店區民權路153號4樓","簡語萱","200000","1140225"
"1647","95431900","青出宜蘭有限公司","宜蘭縣三星鄉集慶二路18號1樓","林意評","1000000","1140224"
"1648","95431991","米飛財務顧問有限公司","臺北市中山區南京東路2段172號6樓","蘇盈潔","100000","1140210"
"1649","95432106","知事餐飲股份有限公司","臺北市大安區大安路1段52巷5號1樓","鄭翔哲","15000000","1140220"
"1650","95432128","美商第一國民旅遊股份有限公司","南投縣草屯鎮中原里中和路81之63巷2號(2樓)","黃朝明","0","1140217"
"1651","95432149","貝好利有限公司","新北市汐止區仁愛路339號2樓","陳瑞成","3600000","1140219"
"1652","95432252","多禾投資有限公司","新北市樹林區復興路376之6號","藍云杉","1000000","1140211"
"1653","95432400","艾澄興業有限公司","臺中市南屯區三和里永春東七路868號1樓","陳喬湘","1800000","1140218"
"1654","95432605","元溢方有限公司","新北市中和區中正路736號14樓之3","顏光正","200000","1140217"
"1655","95432653","星號國際有限公司","臺中市南屯區黎明路一段1022號1樓","林志偉","100000","1140207"
"1656","95432680","鉅濠國際資產管理股份有限公司","臺北市信義區信義路5段7號57樓之1","鍾浚霖","1010000","1140227"
"1657","95432696","浤誠管理顧問有限公司","臺中市南屯區惠中里文心路一段324號11樓之2","張志誠","1000000","1140207"
"1658","95432725","昆崙工程顧問有限公司","新北市板橋區文化路2段313號8樓","李杰","5000000","1140218"
"1659","95432957","締康美學有限公司","花蓮縣吉安鄉慶豐村中山路三段107號1樓","洪寶惠","200000","1140203"
"1660","95432990","鮮漁郎有限公司","屏東縣東港鎮鎮海路117巷58號1樓","曾信宏","1500000","1140220"
"1661","95433077","隆昇投資股份有限公司","彰化縣社頭鄉平和村水井巷5-2號2樓","温祐章","1980000","1140220"
"1662","95433169","雙禾有限公司","臺中市后里區月湖路2巷30弄45號1樓","鍾孟娟","600000","1140225"
"1663","95433273","正翠生醫股份有限公司","高雄市左營區榮總路267號2樓","許峻達","100000","1140214"
"1664","95433288","大立工業有限公司","南投縣鹿谷鄉秀峰村仁愛路153-1號1樓","黃俊銅","500000","1140206"
"1665","95433816","酈靖琨國際股份有限公司","新北市新店區北新路1段10號16樓","黃彥賢","500000","1140205"
"1666","95434511","宸炘投資有限公司","雲林縣虎尾鎮平和里平和6-20號3樓","李嘉章","3000000","1140221"
"1667","95434580","廣上益有限公司","彰化縣永靖鄉港西村五福巷199號1樓","翁照恩","200000","1140218"
"1668","95434771","勤翊科技有限公司","臺中市西區和龍里臺灣大道二段16號19樓之2","許丞諺","500000","1140225"
"1669","95434913","大喜國際藝術有限公司","桃園市龜山區樂學二路66號","郭書萍","1000000","1140210"
"1670","95434998","榆尼有限公司","臺中市西屯區逢甲里西屯路二段256巷6號3樓之5","賴怡慈","100000","1140211"
"1671","95435048","維望股份有限公司","新北市新莊區新北大道4段199號10樓","黃玉妮","1000000","1140220"
"1672","95435103","智宇精機有限公司","新竹縣竹東鎮五豐里忠孝街122巷26號一樓","鍾鎔開","300000","1140213"
"1673","95435119","國企聯合股份有限公司","高雄市燕巢區湖內巷2之8號","顏峻昇","3010000","1140203"
"1674","95435194","寓優選有限公司","新北市樹林區學府路376號16樓","廖文瀚","1000000","1140203"
"1675","95435390","未來生活公寓大廈管理維護實業有限公司","臺南市永康區新中街337號1樓","傅順轅","10000000","1140208"
"1676","95435510","升鼎科技工程有限公司","高雄市楠梓區旗楠路長安巷30弄5號5樓","曾琪雅","100000","1140206"
"1677","95435624","承敬室內裝修設計有限公司","彰化縣彰化市向陽里崙平南路臨274-1號","李承晏","1000000","1140206"
"1678","95435666","峻宏管理顧問有限公司","臺北市中山區林森北路259巷13號","莊淑嬋","300000","1140207"
"1679","95435687","文華舟創意有限公司","臺中市西屯區逢甲路301巷22弄24號1樓","洪聖華","50000","1140220"
"1680","95435785","七喜社會創意股份有限公司","臺中市西區自治街30號2樓","楊七喜","2000000","1140203"
"1681","95435814","翼鑫通運有限公司","臺南市永康區龍中街97號1樓","黃沚涵","100000","1140218"
"1682","95435912","大有頤餐飲事業股份有限公司","新北市新莊區思源路553號（1樓）","林協健","5000000","1140226"
"1683","95436074","雷克斯科技有限公司","臺東縣臺東市豐谷里東峯街29巷52號一樓","張皓閔","2000000","1140214"
"1684","95436118","皓勝五金有限公司","彰化縣員林市三多里龍富二街6號1樓","劉志偉","1000000","1140218"
"1685","95436172","崎盛金屬工程有限公司","高雄市大寮區鳳屏一路237巷19號","黃佩怡","1000000","1140219"
"1686","95436264","聖倡國際有限公司","臺中市東區東信里旱溪東路一段214巷3號1樓","彭懿瑋","1000000","1140225"
"1687","95436341","禾言空間設計有限公司","高雄市前鎮區中山二路2號13樓之3","胡正馨","200000","1140206"
"1688","95436362","附子花文創有限公司","臺北市信義區虎林街202巷44號1樓","鄒沛淇","3020000","1140217"
"1689","95436784","智富鑫實業有限公司","桃園市桃園區莊敬里莊敬路一段210巷23號8樓","李啓智","300000","1140203"
"1690","95436927","耘晨有限公司","高雄市新興區民權一路251號20樓之1","陳冠賓","5000000","1140227"
"1691","95436932","合璽有限公司","新北市淡水區中正路2段32巷12號18樓","涂凱淋","100000","1140225"
"1692","95437003","是我的菜有限公司","高雄市鳳山區中山東路168巷98號1樓","吳晉寬","500000","1140226"
"1693","95437496","山隱有限公司","宜蘭縣頭城鎮武營里武營路61巷23號","蔡承軒","2000000","1140207"
"1694","95437670","心寧生物科技股份有限公司","臺北市中山區長春路380號6樓之1","林宏達","5000000","1140219"
"1695","95437778","銳亞工程有限公司","桃園市八德區大華里介壽路二段133巷105號四樓","陳文龍","500000","1140208"
"1696","95437910","誠郡有限公司","高雄市前金區旺盛街93號1樓","徐偉郡","250000","1140211"
"1697","95438066","無添加創意料理有限公司","臺北市松山區八德路4段123號地下","林威志","100000","1140211"
"1698","95438072","萬全工程顧問有限公司","臺中市西區中美街76號","陳俊偉","1000000","1140213"
"1699","95438116","興耘科技國際有限公司","高雄市楠梓區瑞屏路60之5號9樓","方任瑋","2000000","1140226"
"1700","95438349","南十禾建築團隊股份有限公司","嘉義市東區東川里公園街125號","戴俊郎","1000000","1140208"
"1701","95438517","入厝有限公司","臺中市潭子區大富里大富路三段165巷12之10號","王力申","1000000","1140214"
"1702","95438827","星智電子有限公司","臺北市大安區忠孝東路3段248巷19弄38號1樓","羅際平","100000","1140214"
"1703","95438853","蓋亞支付技術股份有限公司","臺北市信義區忠孝東路5段510號17樓之1","Lo Chun Kit Andrew","10085650","1140227"
"1704","95438875","梟視影像製作有限公司","臺中市北屯區北屯路291之10號6樓","蕭定軒","100000","1140203"
"1705","95438880","綠燦投資股份有限公司","高雄市前鎮區中山二路210號5樓","吳信寬","1101000","1140227"
"1706","95439353","特福瑞企業有限公司","新北市新莊區中港路92號7樓","彭書緯","200000","1140226"
"1707","95439369","正暐系統工程股份有限公司","新竹縣竹北市興安里縣政一街92之1號1樓","傅民權","20000000","1140212"
"1708","95439425","塔諾西有限公司","桃園市桃園區西埔里富國路962巷32弄8號2樓","趙劭杰","1000000","1140221"
"1709","95439430","科秀塗料有限公司","新北市樹林區東順街70號","林智敏","3000000","1140221"
"1710","95439516","義姿有限公司","臺中市西屯區何仁里文心路三段272號及272之1號","吳姿岭","1000000","1140208"
"1711","95439591","圓方股份有限公司","臺北市內湖區星雲街168巷29號1樓","羅寶冀","50000","1140219"
"1712","95439712","雙恩有限公司","臺北市中山區松江路469巷1號4樓之2","游竣偉","29000000","1140213"
"1713","95439966","知軒庭開發有限公司","新竹市東區光復路二段295號20樓之一","鍾喬鈞","6000000","1140224"
"1714","95440289","堡星科技有限公司","桃園市中壢區青心路212號5樓","陳方俞","500000","1140212"
"1715","95440366","聲鐵科技有限公司","桃園市楊梅區梅溪里中山北路二段82巷13號七樓","蕭安陞","60000","1140220"
"1716","95440605","酷樂部旅行社股份有限公司","臺北市松山區民生東路3段128號14樓","蔡靜芳","6000000","1140225"
"1717","95440963","普明投資有限公司","臺北市中正區漢口街1段110號5樓之3","黃柏軒","500000","1140205"
"1718","95441127","米莉行銷有限公司","高雄市左營區大順一路392號1樓","楊立瑜","100000","1140227"
"1719","95441597","太元室內裝修有限公司","臺北市松山區南京東路5段343號3樓之2","陳淇銨","2000000","1140220"
"1720","95441718","京鉅建築營造有限公司","彰化縣彰化市卦山里公園路一段287巷16號1樓","黃子秦","3600000","1140205"
"1721","95441739","紘沛管理顧問有限公司","臺北市中山區民權西路20號2樓","汪沛縈","200000","1140213"
"1722","95441766","箱根養生有限公司","雲林縣斗六市社口里大學路二段425號","蔡逸甄","300000","1140213"
"1723","95441885","潤智教育有限公司","新北市板橋區四川路1段23號9樓之1","簡妤真","1000000","1140226"
"1724","95442028","協晟營造有限公司","苗栗縣苗栗市福麗里民族路157號5樓","張享珅","5000000","1140213"
"1725","95442202","大穎運輸設備有限公司","臺中市南屯區永定里益文一街165號","陳位炫","1500000","1140203"
"1726","95442765","晉昌機電工程有限公司","雲林縣虎尾鎮興南里興南6號1樓","陳省昌","6000000","1140211"
"1727","95442977","遠東文具企業有限公司","臺北市士林區德行西路33號3樓","彭修治","500000","1140227"
"1728","95443125","金釜食品生技有限公司","臺北市中山區松江路123巷8之2號1樓","林昆澤","100000","1140225"
"1729","95443265","酒條通大安通化有限公司","臺北市大安區通化街14號","余奇姝","3000000","1140217"
"1730","95443602","微笑環保科技有限公司","彰化縣大村鄉美港村中山路一段144號一樓","呂宗翰","1000000","1140214"
"1731","95443835","樵森國際有限公司","桃園市中壢區新明里中央西路二段164巷14弄12號（1樓）","周儀君","200000","1140225"
"1732","95443883","久和資本股份有限公司","臺北市松山區八德路4段604號2樓之15","林瑩松","4500000","1140203"
"1733","95445209","綻新食品股份有限公司","臺中市北屯區后庄里敦化路一段265號","賴冠吾","1500000","1140212"
"1734","95445637","富士旺實業股份有限公司","桃園市八德區茄苳里永豐路226巷37之1號","林恬伊","2000000","1140207"
"1735","95446235","盛永誠企業有限公司","新北市新莊區中華路1段128號(1樓)、2樓","李翁慶","3000000","1140221"
"1736","95446278","台灣港海創意有限公司","臺北市中正區寧波西街1號3樓","林宇星","800000","1140208"
"1737","95446501","王飲國際茶飲有限公司","臺北市中山區樂群二路196號","張仕偉","250000","1140214"
"1738","95446657","榮鑫模具貿易有限公司","臺中市西屯區至善里逢甲路301巷22弄24號1樓","張雁婷","250000","1140226"
"1739","95446827","新舊貴享有限公司","高雄市前鎮區中山二路91號17樓之9","王惠月","100000","1140217"
"1740","95446875","米奇創意有限公司","新北市新店區安德街60巷7之2號5樓","張毓珊","300000","1140213"
"1741","95447059","澄境互動有限公司","苗栗縣竹南鎮科專七路377號(1樓)","黃毓淳","50000","1140213"
"1742","95447179","醫健適科技股份有限公司","臺北市大安區忠孝東路4段142號5樓之5","康鈞尉","5000000","1140220"
"1743","95447635","青耕股份有限公司","臺中市潭子區嘉仁里仁愛路二段140巷23之10號","梁慧娟","1000000","1140205"
"1744","95447683","永寓工程有限公司","新竹市東區中正路96巷16號3樓","詹勲揚","200000","1140218"
"1745","95448162","奕錡有限公司","臺南市安南區幸福里府安路6段94巷40號1樓","戴奕豪","2000000","1140208"
"1746","95448281","盛南冷鏈物流有限公司","臺南市新市區民生路49號2樓","吳南宗","100000","1140225"
"1747","95448521","紘昇環保有限公司","新竹縣湖口鄉鳳山村三民一路28號","華紘昇","400000","1140220"
"1748","95448698","富爾捷投資股份有限公司","花蓮縣新城鄉復興路259號","林冠汝","1100000","1140224"
"1749","95449009","維妍美學有限公司","新北市鶯歌區鳳三路61號","王祥齡","1000000","1140224"
"1750","95449036","艾沙吉科技有限公司","桃園市龜山區萬壽路一段492之9號7樓之3","吳明奇","5000000","1140212"
"1751","95449232","緻富國際有限公司","臺北市信義區忠孝東路4段563號11樓","呂麗婷","1000000","1140217"
"1752","95449253","碁力肌力股份有限公司","臺北市大安區和平東路3段106號6樓之11","杜月禎","700000","1140205"
"1753","95449520","沐逸有限公司","新北市板橋區文化路2段88號18樓","江逸萱","1000000","1140221"
"1754","95449726","忠款資產管理有限公司","臺北市北投區文林北路80巷59弄9號2樓","洪楷茗","1000000","1140211"
"1755","95449731","蕾江國際有限公司","臺中市西區民龍里臺灣大道二段285號4樓之2","羅碧玲","500000","1140213"
"1756","95449922","耀赫有限公司","新竹市東區埔頂里埔頂二路58號1樓","傅京傑","1680000","1140204"
"1757","95450151","荃盛交通器材有限公司","彰化縣和美鎮竹營里忠全路213巷11號","陳柏彰","1000000","1140124"
"1758","95450167","泓冠實業有限公司","新北市三重區仁義街225巷40號","林浚紘","1000000","1140214"
"1759","95450194","億保發有限公司","臺中市潭子區民族路三段213巷10之1號","王軼","1000000","1140212"
"1760","95450336","安家家業有限公司","彰化縣員林市溝皂里員集路二段319巷30號一樓","蔡瑞峯","50000","1140220"
"1761","95450363","憶念光舟科技股份有限公司","新北市三重區大智街179巷7號4樓","李厚豪","1000000","1140203"
"1762","95450510","安妤生物科技有限公司","臺中市西區臺灣大道二段186號9樓之1","顏崇文","1000000","1140220"
"1763","95450574","祖樹有限公司","桃園市桃園區玉山里復興路367巷20號","王志賢","500000","1140217"
"1764","95450589","程宗駿生醫股份有限公司","臺北市信義區莊敬路423巷2弄10號","程宗駿","1000000","1140208"
"1765","95450764","聿澤工程有限公司","新竹縣竹北市竹仁里中正東路146號","林呂隆","500000","1140203"
"1766","95451150","卓越動力台灣有限公司","新北市中和區建一路176號17樓之3","葉凱琳 Kalin Hoi Lam YIP","1429000","1140226"
"1767","95451237","龍吉昌工程有限公司","高雄市左營區大中一路412號1樓","蔡仕賢","500000","1140226"
"1768","95451291","茗暘機械有限公司","臺中市潭子區潭陽里中山路二段283巷8號5樓之5","官義雄","200000","1140210"
"1769","95451341","成遠建設有限公司","澎湖縣馬公市興仁里雙頭掛123號1樓","黃美嬌","120000","1140217"
"1770","95451736","万端食飲有限公司","臺北市松山區民權東路3段160巷19弄36號","林諭均","100000","1140218"
"1771","95451840","睿鴻興建設股份有限公司","彰化縣埔鹽鄉太平村番金路34-8號","蔡佐臨","100000000","1140220"
"1772","95452025","構玖設計有限公司","臺中市西屯區逢甲里永新巷南2弄40號","張介祜","200000","1140225"
"1773","95452067","賺醬飽股份有限公司","新北市中和區中原街120號9樓","徐詩晴","1500000","1140206"
"1774","95452593","益循投資有限公司","臺北市文山區羅斯福路6段146號15樓之7","吳哲安","100000","1140214"
"1775","95452828","博睿智能有限公司","新北市三重區新北大道一段129號4樓","陳偉正","150000","1140211"
"1776","95453018","丞詠科技實業有限公司","臺中市龍井區龍崗里祥瑞街86巷10號1樓","阮宥錡","2000000","1140203"
"1777","95453214","品样有限公司","桃園市大園區田心里大興路63巷2號","許朝清","1000000","1140227"
"1778","95453241","招福國際有限公司","新北市五股區御史路45巷9號(2樓)","葉福良","1000000","1140219"
"1779","95453349","全商雲股份有限公司","臺北市信義區松德路6號8樓","李彥儒","500000","1140225"
"1780","95453489","友銓科技有限公司","金門縣金寧鄉湖埔村湖下152號","楊上卜","8000000","1140225"
"1781","95453538","利聚股份有限公司","臺北市中正區北平東路16號6樓之3","蕭育仁","300000","1140220"
"1782","95453609","熒宇有限公司","新北市林口區公園路203號10樓之1至之2","吳國瑋","2000000","1140206"
"1783","95453615","樂富寶企業有限公司","新北市中和區中山路2段296號7樓之5","王怡卉","1000000","1140227"
"1784","95454038","揚佳國際股份有限公司","新竹縣竹北市鹿場里6鄰福興東路一段168號4樓","林鎮煙","100000","1140224"
"1785","95454136","萊迪貿易有限公司","新北市中和區中山路3段110號8樓","吳群穗","1000000","1140206"
"1786","95454380","信波有限公司","臺北市中山區南京東路3段208號9樓","江俞逸","3000000","1140213"
"1787","95454608","星睿娛樂有限公司","新北市汐止區新台五路1段95號16樓之1","楊穎紳","500000","1140219"
"1788","95454683","啟豐新能源科技股份有限公司","新竹縣竹北市建國街34號1樓","詹凱文","1000000","1140205"
"1789","95454902","翊善禮儀有限公司","彰化縣彰化市光南里中山路二段242號一樓","劉子毅","500000","1140213"
"1790","95455085","雞蛋花貳投資股份有限公司","新北市中和區中正路716號7樓之5","陳群志","51000","1140207"
"1791","95455304","晟屹有限公司","彰化縣花壇鄉中庄村中山路一段42號","何彥廷","600000","1140226"
"1792","95455389","逸華有限公司","新北市蘆洲區光復路77巷5號","許東逸","800000","1140211"
"1793","95455472","稼釀有限公司","彰化縣芳苑鄉草湖村二溪路草二段371號","陳姵儒","1000000","1140224"
"1794","95455515","興安投資顧問有限公司","苗栗縣南庄鄉東村大同路42號","葉曉蔓","500000","1140221"
"1795","95455634","奇竑工程有限公司","臺南市北區大興里公園路464號2樓","王克平","500000","1140221"
"1796","95456036","倍耳通股份有限公司","臺北市士林區天母東路1之4號1樓","林嵩岳","12000000","1140221"
"1797","95456084","渡海古美院股份有限公司","新北市新莊區思源路171號12樓","郭建宏","1000000","1140219"
"1798","95456325","共時間精神部落有限公司","臺北市大安區樂業街41巷16弄4號","金質靈","100000","1140224"
"1799","95456747","天助開發工程有限公司","臺中市西屯區大鵬里文心路三段241號10樓之1","賴駿燁","2000000","1140218"
"1800","95456752","財神爺投資企業有限公司","新北市板橋區中山路1段206巷56號","洪伶瑩","3580000","1140203"
"1801","95456795","寵幸福有限公司","高雄市三民區大豐二路197號18樓","陳美喻","100000","1140212"
"1802","95456850","開羅建設有限公司","臺北市大安區復興南路1段352號6樓之1","李磊哲","1200000","1140204"
"1803","95457133","美膠美有限公司","桃園市中壢區忠義里中華路二段201號3樓","王宗棋","200000","1140226"
"1804","95457210","熊燿國際有限公司","嘉義市東區興美三街130號一樓","蘇建銘","2000000","1140221"
"1805","95457302","昭福鑫股份有限公司","嘉義市東區興安里興美六路369號","郭福利","10000000","1140205"
"1806","95457345","馥吉股份有限公司","臺北市大安區忠孝東路4段95號1樓","潘麒鈞","2600000","1140224"
"1807","95457632","藍夢有限公司","桃園市桃園區莊敬路一段210巷118號8樓","邱柏恩","500000","1140227"
"1808","95457675","均贊股份有限公司","彰化縣和美鎮竹營里義安路102巷110-12號1樓","陳靖鈴","2100000","1140205"
"1809","95457773","你是我唯一想要的了解管理顧問有限公司","臺北市萬華區忠孝西路2段20號3樓","童立","50000","1140214"
"1810","95457886","彤欣室內裝修設計工程有限公司","桃園市八德區介壽路二段1352巷40之1號(1樓)","鄭智遠","1000000","1140210"
"1811","95458111","菁遇幸福文化有限公司","高雄市鼓山區明華路315號7樓之3","蘇靖雅","300000","1140207"
"1812","95458148","永淨佃能源有限公司","臺南市南區建南里明興路113號3樓","王進南","1000000","1140204"
"1813","95458317","永誠信資產管理有限公司","臺中市西屯區逢福里河南路二段262號6樓之3","何秉學","100000","1140219"
"1814","95458479","兆懿投資有限公司","臺中市南區福興里五權南路167號地下一樓之6","李兆庭","1100000","1140224"
"1815","95459168","六三實業有限公司","臺中市北屯區同榮里新興路136號1樓","謝佑典","200000","1140220"
"1816","95459575","李木白國際行銷有限公司","新北市新莊區思源路422號3樓","卓依儒","1000000","1140219"
"1817","95459667","三羽貿易有限公司","新北市汐止區同興路123號","曾繁治","1000000","1140203"
"1818","95459786","肆柒車隊有限公司","新北市蘆洲區重陽街16號8樓","徐岳証","200000","1140203"
"1819","95459857","鈞陽不動產有限公司","高雄市左營區明華一路132號","朱弘鈞","1350000","1140213"
"1820","95459998","金智寶綠能科技股份有限公司","臺中市南區忠明南路916號11樓之4","李俊成","100000","1140218"
"1821","95460427","珩石資本股份有限公司","臺北市中正區濟南路2段49之2號1樓","蔡書文","200000","1140204"
"1822","95460432","靜藍股份有限公司","臺中市北屯區大連路二段271號","劉華茂","5000000","1140124"
"1823","95460502","天滙建設股份有限公司","臺中市后里區眉山里甲后路二段485巷30號1樓","王淵澤","500000","1140214"
"1824","95460622","耘真誠永續投資股份有限公司","新竹市東區綠水里光復路二段295號11樓之7","陳永坤","100000","1140225"
"1825","95460691","勁能創意行銷有限公司","南投縣南投市平和里信義街250巷1弄5號1樓","許齡予","1000000","1140211"
"1826","95461045","京霖乙實業有限公司","臺中市沙鹿區中華路二段432巷3號1樓","張如意","800000","1140219"
"1827","95461087","蔚淶科技有限公司","臺中市龍井區東海里遊園北路448巷26號1樓","曹小麗","520000","1140208"
"1828","95461220","百翊化工有限公司","高雄市鹽埕區七賢三路210號1樓","何翊銘","1000000","1140204"
"1829","95461241","鹿慕行銷有限公司","嘉義市東區蘭潭里小雅路183號3樓之12","林宗霖","100000","1140122"
"1830","95461495","建伈傳媒有限公司","高雄市苓雅區中山二路489號8樓之2","李建霖","200000","1140224"
"1831","95461501","長興汽車有限公司","臺中市南屯區永定里永春東六路500號","陳瓊葉","600000","1140227"
"1832","95461734","神諭遊戲有限公司","新北市新店區民權路153號4樓","鄧福祥","200000","1140224"
"1833","95461782","大隱築里室內設計有限公司","臺中市北區賴厝里山西路一段71號8樓之1","朱家慶","200000","1140210"
"1834","95461994","映曦生活有限公司","新竹縣竹北市北崙里7鄰光明二街25號五樓","汪虹","1000000","1140213"
"1835","95462023","吉禾環保有限公司","新竹縣湖口鄉中正村溪北街68巷8號","黃福祈","5000000","1140217"
"1836","95462380","拾光莊園有限公司","新竹縣竹北市中興里復興一街137號7樓","黃美華","500000","1140205"
"1837","95462635","萬豪地產有限公司","桃園市八德區大宏里廣豐路115號5樓","鄭佩琪","100000","1140124"
"1838","95462889","婇明有限公司","臺北市大安區忠孝東路4段169號11樓之4","蔡鏡汶","500000","1140208"
"1839","95463058","隆豐有限公司","新北市新莊區四維路119巷24號","陳家億","500000","1140213"
"1840","95463732","旺進實業有限公司","臺北市萬華區莒光路156號7樓","陳介仁","100000","1140221"
"1841","95463753","睿斯科技股份有限公司","臺北市大安區忠孝東路4段220號13樓","林金璋","1000000","1140214"
"1842","95463846","辰將國際貿易有限公司","高雄市鳳山區中崙一路35號","紀彥成","100000","1140224"
"1843","95463923","雄鑫房屋仲介有限公司","高雄市左營區明華一路172號","黃稼和","1000000","1140211"
