"序號","統一編號","公司名稱","公司所在地","代表人","資本額","核准設立日期"
"2253","96760252","有福嘉投資有限公司","臺北市中山區南京東路3段201號9樓","尤嘉琳","1000000","1140203"
"2254","96760400","航極有限公司","新北市板橋區大仁街60巷3弄1號2樓","徐錦汝","200000","1140227"
"2255","96760422","弘宸實業有限公司","新竹縣竹東鎮中山里大林路48巷8號","余弘祥","500000","1140221"
"2256","96760936","采川銘有限公司","新北市鶯歌區中正三路156巷47號（1樓）","王文采","2000000","1140217"
"2257","96761040","金童有限公司","臺北市內湖區康樂街72巷5號5樓","林蕭富美","1000000","1140211"
"2258","96761175","萊德鈺有限公司","臺中市北屯區和平里建和路二段188號","黃鈺婷","1000000","1140220"
"2259","96761338","鑫翔翔投資有限公司","臺南市新市區新市里光華街175之1號1樓","陳翰樽","1000000","1140207"
"2260","96761581","安柏生技有限公司","臺北市信義區基隆路2段81之1號12樓","辜頌惟","1800000","1140212"
"2261","96761837","騰昌營建廢棄物共同清除處理股份有限公司","桃園市桃園區長德里愛九街1號6樓","史碩仁","1500000","1140220"
"2262","96761920","時間軸製作所股份有限公司","臺北市中山區南京東路3段188號11樓","謝國豪","2000000","1140218"
"2263","96762006","寶科營造有限公司","雲林縣虎尾鎮墾地里科園路160號1樓","陳偉翔","3600000","1140225"
"2264","96762081","阿拉伯聯合大公國商穆罕卡辛貿易有限公司","桃園市蘆竹區南崁路一段218號9樓之2","穆斯塔","0","1140220"
"2265","96762152","廣達租賃有限公司","臺北市內湖區洲子街58號3樓","曾雅君","1000000","1140211"
"2266","96762364","加加減減股份有限公司","臺北市北投區立功街153號3樓","張中星","6000000","1140208"
"2267","96762456","博宇資源開發有限公司","新竹市東區復興里自由路67號8樓之2","張博宇","1000000","1140225"
"2268","96762580","帆訊遮陽有限公司","高雄市燕巢區深水里湖內巷2之10號","黃耀民","500000","1140218"
"2269","96762717","微寮境投資有限公司","新竹市北區中清路一段350號","吳承恩","1000000","1140205"
"2270","96762771","茱麗葉照明有限公司","桃園市龜山區新路里中原街20巷25號3樓","魏稜蒼","500000","1140221"
"2271","96763048","馮羽樓有限公司","新北市土城區學府路1段126巷19號8樓","馮天昱","200000","1140210"
"2272","96763589","請記得我麻雀有限公司","臺中市西區臺灣大道二段239號13樓","李守宏","100000","1140217"
"2273","96763639","勁漾貿易有限公司","基隆市仁愛區愛一路35號5樓之1","吳沛葦","200000","1140208"
"2274","96763814","寬澤設計有限公司","臺中市南區長榮里學府路100號1樓","何妙慧","500000","1140212"
"2275","96763820","思卓蓓莉國際貿易股份有限公司","南投縣埔里鎮中正路210之9號","劉兆翔","200000","1140217"
"2276","96764026","嘉鵬防災消防有限公司","嘉義縣中埔鄉和睦村中華路840號一樓","賴鵬和","2000000","1140214"
"2277","96764320","喬納斯科技股份有限公司","臺中市龍井區新東里遊園南路319巷153之1號","陳世昌","25000000","1140218"
"2278","96764530","藍海創新電子有限公司","高雄市新興區民生一路56號3樓之4","李惠賢","6000000","1140124"
"2279","96764898","碩陽有限公司","臺中市烏日區學田路論子巷26之4號","陳旻億","100000","1140203"
"2280","96764948","光遠工程有限公司","新北市新莊區中正路新建巷15弄18號4樓","楊任傑","1000000","1140220"
"2281","96765046","穩達通信科技有限公司","高雄市新興區民生一路56號15樓之4","陳敬中","400000","1140218"
"2282","96765340","潤馳汽車有限公司","臺北市大安區忠孝東路3段305號4樓之4","王貞懿","500000","1140214"
"2283","96765361","子悦有限公司","高雄市林園區文賢南路123號6樓","彭芸蓁","1000000","1140204"
"2284","96765411","金長泰有限公司","雲林縣崙背鄉東明村正義路136號1樓","廖元廷","2000000","1140221"
"2285","96765427","興善建設有限公司","苗栗縣竹南鎮正南里28鄰大營路38號","林忠義","1000000","1140203"
"2286","96765587","翊亨工程有限公司","高雄市鼓山區明華路253號14樓","何信利","300000","1140226"
"2287","96765926","坤馳電機有限公司","臺中市大里區景庄街82號","莊育民","200000","1140218"
"2288","96766137","艾鄰居專業有限公司","臺南市安南區國安里宜居路596號3樓","蔣依玲","100000","1140218"
"2289","96766431","鑫柏鑫科技工程有限公司","高雄市前鎮區英德街804號1樓","陳冠樺","500000","1140219"
"2290","96766468","天賦珠寶有限公司","新北市淡水區新市一路1段88號(1樓)","YAN KYEN KHWAY楊鈞惠","6800000","1140221"
"2291","96766474","恩滿創業投資股份有限公司","臺北市松山區復興北路81巷20號1樓","郭哲佑","25900000","1140217"
"2292","96766896","上泰斯影像設計股份有限公司","新北市新莊區民安西路173巷4號3樓","李宜學","400000","1140204"
"2293","96767001","阿米哥寵物食品股份有限公司","高雄市鹽埕區七賢二路472號","陳惠真","100000","1140226"
"2294","96767092","透明資訊有限公司","臺北市松山區基隆路1段8號13樓","林映佑","100000","1140205"
"2295","96767136","帥玳貿易有限公司","新北市鶯歌區中山路249巷8弄8號","呂學昱","100000","1140205"
"2296","96767298","喜量有限公司","臺南市東區大同里大同路1段173號6樓之1","莊勝安","300000","1140203"
"2297","96767591","兆金國際貿易有限公司","臺中市清水區槺榔里臨港路五段136號1樓","左兆金","200000","1140220"
"2298","96767608","銀森有限公司","苗栗縣公館鄉五谷村五谷19之50號3樓","蔡安琪","1000000","1140219"
"2299","96767810","元鏘股份有限公司","臺北市中山區中山北路1段11號10樓之1","林謝玉嬌","200000","1140213"
"2300","96768091","樂道投資有限公司","臺中市神岡區豐洲里豐洲路465號2樓","林建甫","100000","1140218"
"2301","96768310","瑞捷國際興業股份有限公司","桃園市中壢區中央里中美路29號4樓","黃俞典","100000","1140220"
"2302","96768445","東一工程有限公司","臺北市信義區基隆路1段163號14樓之1","YANG SEUNG JIN","500000","1140221"
"2303","96768607","衍立光股份有限公司","新北市林口區文化二路一段390號6樓","楊書睿","15000000","1140213"
"2304","96768888","宥嘉貿易有限公司","桃園市中壢區復興里復華九街105號","吳瑞泉","6000000","1140220"
"2305","96769599","萬野投資有限公司","臺中市霧峰區本堂里育群路15號","張佳慧","10900000","1140204"
"2306","96769660","三市食品行有限公司","南投縣南投市內興里光明南路60巷86號3樓","蔡澤鏞","550000","1140219"
"2307","96769866","進好文教有限公司","臺中市太平區建興里建興路221巷5號1樓","徐志強","500000","1140214"
"2308","96770012","新加坡商富盛達電子有限公司","臺北市大同區民權西路136號15樓之10","任述中","1000000","1140203"
"2309","96770033","互欣智醫有限公司","臺中市北區館前路19號7樓之2","蔡秉岳","1000000","1140218"
"2310","96770596","玗芃有限公司","高雄市鼓山區明華路317號17樓之2","孫振國","500000","1140227"
"2311","96770673","豪強汽車材料有限公司","彰化縣芬園鄉嘉興村嘉中街300巷建250號1樓","賴月善","2000000","1140221"
"2312","96770884","利奇永成有限公司","雲林縣口湖鄉湖東村文明路28號1樓","蘇仰厚","1800000","1140214"
"2313","96770961","迅富投資顧問股份有限公司","臺中市西區精誠路298號1樓","鄭群譯","2000000","1140218"
"2314","96771096","佶祥易貿易有限公司","新北市中和區中山路2段332巷17號2樓","劉映辰","200000","1140214"
"2315","96771146","鑫民蔬果有限公司","臺北市萬華區西園路2段372巷12號","詹涵云","2000000","1140226"
"2316","96771510","日本沙棘美麗股份有限公司","臺北市中正區重慶南路1段10號8樓之15","佐藤 俊文","3000000","1140219"
"2317","96771552","鴻啟建設有限公司","新北市蘆洲區光榮路97巷9號","陳鴻億","1000000","1140210"
"2318","96771770","大貓有禮有限公司","臺北市中山區南京西路1號6樓之1","陳怡安","1000000","1140212"
"2319","96772004","捷克商歐洲旅遊有限公司","臺中市南屯區大正街6號2樓之1","賴思敏","0","1140211"
"2320","96772150","樂宸數位科技有限公司","高雄市前鎮區一心二路44號2樓","吳祖寧","300000","1140206"
"2321","96772216","美福實業有限公司","桃園市桃園區天祥五街52號5號","邱信瑋","1000000","1140205"
"2322","96772481","中路有限公司","臺中市北屯區平安里文心路四段696號25樓","戴勝堂","3000000","1140211"
"2323","96772855","岳鼎營造有限公司","南投縣埔里鎮泰安里民族二街88號1樓","黃俊偉","3600000","1140210"
"2324","96772996","慵懶福和餐飲有限公司","新北市永和區福和路288號","林郁勛","360000","1140224"
"2325","96773067","晶運鑫有限公司","臺北市松山區南京東路5段70號5樓之2","尤勝良","2000000","1140203"
"2326","96773171","黑川建設開發有限公司","新北市板橋區民生路3段12號21樓之1","徐灝","1000000","1140225"
"2327","96773427","橙億建設股份有限公司","臺北市大同區重慶北路3段131號1樓","賴奕均","10000000","1140219"
"2328","96773469","沃客創意有限公司","新北市樹林區中正路633號10樓之3","蔡蕎因","100000","1140211"
"2329","96773550","昕居有限公司","新北市中和區中正路1194巷11號5樓","陳依昕","500000","1140203"
"2330","96774100","虹量科技股份有限公司","新竹市東區復興里自由路111號7樓之2","陳建清","1100000","1140217"
"2331","96774208","正朝興業有限公司","屏東縣枋寮鄉人和村建興路241號1樓","陳正朝","1000000","1140220"
"2332","96774262","宏岳科技工程有限公司","臺中市北區梅川里漢口路四段287巷7號4樓之16","江怡紋","5000000","1140205"
"2333","96774663","韓瑞實業有限公司","臺北市中山區南京東路2段150號7樓","蔡力謙","100000","1140206"
"2334","96774740","与杰貿易有限公司","臺北市信義區基隆路2段125號7樓","李玉杰","100000","1140218"
"2335","96774761","新擇技研有限公司","高雄市左營區崇德路300號20樓","黃嚴平","200000","1140224"
"2336","96774798","微笑初點有限公司","桃園市平鎮區東豐路662巷117號","陳念初","200000","1140205"
"2337","96774951","易舉工程有限公司","高雄市三民區興安街64號1樓","楊凱翔","1000000","1140221"
"2338","96775184","登太投資有限公司","新竹市香山區頂福里香檳五街305號一樓","楊鎮銨","29000000","1140207"
"2339","96775591","春村教育有限公司","臺北市中山區南京東路3段189號8樓","許謹玟","100000","1140213"
"2340","96775874","麒佑科技有限公司","高雄市三民區大昌二路111號4樓","宋婉寧","20000","1140218"
"2341","96775924","摘星文化股份有限公司","新北市淡水區學府路136巷40弄20號","李夢婷","100000","1140212"
"2342","96775972","匠遊國際租賃有限公司","宜蘭縣礁溪鄉德陽路200號4樓之2","張煥周","5000000","1140122"
"2343","96776064","皇豐工程有限公司","高雄市旗山區光正街18之3號","張瑞慶","1000000","1140217"
"2344","96776199","信嘉物流有限公司","臺北市大同區承德路3段272號2樓","黃怡婕","500000","1140211"
"2345","96776206","台灣奇驥系統有限公司","新北市三重區自由街20號5樓","黃建榮","1000000","1140219"
"2346","96776276","東群環保有限公司","臺東縣臺東市岩灣里北安路19號1樓","楊惠棋","1300000","1140226"
"2347","96776509","御禮文創有限公司","高雄市左營區高鐵路682號1樓","蘇伯宇","100000","1140227"
"2348","96776536","宏燿整合行銷有限公司","臺北市信義區忠孝東路5段370號4樓","秦仁德","2000000","1140218"
"2349","96776634","曾馳資本有限公司","臺北市大安區敦化南路1段205號2樓之8","謝翔名","4000000","1140208"
"2350","96776986","沄希國際有限公司","臺中市北區頂厝里進化北路238號8樓之1","蔡宗諭","100000","1140221"
"2351","96777182","晴嵐有限公司","臺北市中山區復興北路156號6樓","黃瓊儀","200000","1140210"
"2352","96777789","淺山有限公司","臺東縣臺東市光榮街52號9樓","吳佳諭","1000000","1140124"
"2353","96777900","群賢醫研股份有限公司","臺北市中正區博愛路52號4樓","汪作良","20000000","1140207"
"2354","96777922","哲麼大有限公司","臺北市中山區長安東路2段173號3樓","郭哲成","100000","1140211"
"2355","96778133","沐春國際投資有限公司","南投縣竹山鎮祖師街87號","林惠娟","5000000","1140226"
"2356","96778350","逐夢星辰有限公司","臺中市西屯區大鵬里文心路三段241號21樓之2","馮溢華","1000000","1140219"
"2357","96778470","宜康健康管理顧問有限公司","高雄市小港區漢民路349號2樓","李威宏","5000","1140224"
"2358","96778485","滿滿荷包餐飲有限公司","臺北市信義區嘉興街8號","馮羿築","1000000","1140218"
"2359","96778540","聚華盈餐飲股份有限公司","臺中市北屯區松竹路三段312號","葉彥輝","500000","1140219"
"2360","96778611","躍動綜合有限公司","高雄市岡山區中山北路266號","趙首傑","500000","1140221"
"2361","96778794","鑫永強有限公司","高雄市鳳山區鳳頂路391號1樓","劉東杰","1000000","1140214"
"2362","96779013","冰星有限公司","新北市汐止區新台五路1段35之1號13樓","張菁","2000000","1140226"
"2363","96779127","數博國際有限公司","桃園市蘆竹區新興里文新街7號2樓","陳筱文","100000","1140213"
"2364","96779442","鑫源油漆工程有限公司","新竹市香山區鹽水里長興街155號1樓","林莉媛","200000","1140204"
"2365","96779479","環青汽機車國際貿易有限公司","桃園市龍潭區龍祥里聖亭路300巷176號","李適華","200000","1140225"
"2366","96779631","親一社有限公司","桃園市龜山區文化里復興二路99號","林鉦傑","300000","1140203"
"2367","96779891","蝴蝶蘭一號股份有限公司","嘉義市西區致遠里新榮路35巷8號10樓","施作君","5000000","1140204"
"2368","96780285","來台旺有限公司","金門縣金湖鎮瓊林里中山路8-8號","林鑫一","100000","1140213"
"2369","96780356","安訢裝潢工程股份有限公司","臺中市西屯區中清路二段1259號1樓","江朗安","5000000","1140206"
"2370","96780383","睿見行動有限公司","臺中市北屯區河北二街36號6樓之9","季成昊","600000","1140220"
"2371","96780623","未來豆有限公司","雲林縣斗六市林頭里25鄰成功路396號二樓","黃冠霖","3000000","1140220"
"2372","96780638","符碼視覺有限公司","桃園市大溪區仁和里仁和二街１４９號(2樓)","吳承澤","1000000","1140207"
"2373","96780659","乳鴿有限公司","臺中市西區向上路一段36號6樓之3","李寬祥","1000000","1140219"
"2374","96780671","凱瑋廣告行銷有限公司","臺南市中西區赤嵌里中山路193號","張育瑋","300000","1140221"
"2375","96780692","德鎧生物技術有限公司","桃園市中壢區西園路81號","陳俊男","4500000","1140205"
"2376","96780813","世貿投資有限公司","桃園市桃園區敬二街3號4樓","邱世湞","1000000","1140210"
"2377","96781073","永續綠生活有限公司","臺北市大安區新生南路3段88號6樓","黃正順","1800000","1140219"
"2378","96781094","德成建設有限公司","臺東縣臺東市仁和里中興路一段388號一樓","沈育成","100000","1140213"
"2379","96781186","茗湛有限公司","臺中市大里區東興里大明路285號1樓","蔡居佑","1000000","1140224"
"2380","96781355","惟晴股份有限公司","雲林縣土庫鎮忠正里中山路246號1樓","蔡珊珊","1200000","1140226"
"2381","96781377","艾斯顧問有限公司","臺北市中山區復興北路70號9樓之1","連偉策","1200000","1140225"
"2382","96781432","梵樹文創有限公司","新北市板橋區三民路2段37號23樓之1","蔡維琳","100000","1140212"
"2383","96781453","緯澤科技有限公司","新竹市北區中山路40巷25之1號3樓之15","姜州欽","1000000","1140218"
"2384","96781545","五方投資有限公司","桃園市中壢區中華路二段330號16樓之15","楊博崴","10000","1140224"
"2385","96781622","特好喝程程有限公司","新北市中和區中山路3段121號","程詩涵","500000","1140213"
"2386","96781947","皇家再生醫學科技股份有限公司","臺中市西屯區市政北七路186號3樓","黃炳文","1000000","1140226"
"2387","96782143","利成精密有限公司","高雄市鳳山區新生街67巷5號","林孜玲","300000","1140226"
"2388","96782185","紘祐股份有限公司","高雄市三民區同盟一路279號1樓","蔡祐麟","5010000","1140211"
"2389","96782397","願世界因我們而美好有限公司","屏東縣屏東市廣興里廣興51-3號1樓","王紹丞","1000000","1140205"
"2390","96782431","桃霖車業有限公司","桃園市中壢區後寮里中山東路三段110號(1樓)、112號(1樓)","路智翔","500000","1140212"
"2391","96782468","禾欣溫室資材有限公司","臺南市新營區三仙里中華路51號6樓","張明信","500000","1140225"
"2392","96782690","桂詮有限公司","高雄市小港區桂華街326號1樓","龔采緹","100000","1140221"
"2393","96782777","凱揚汽車股份有限公司","新北市新莊區中正路58號","林傳凱","10000000","1140221"
"2394","96782827","虎訊科技有限公司","新竹市東區光復路一段576巷17號","黃佳詩","450000","1140224"
"2395","96783115","鉑駩機電有限公司","臺中市太平區新光里振福路511號1樓","羅昌聘","1000000","1140208"
"2396","96783234","頤群投資管理顧問股份有限公司","臺北市大同區承德路1段70之1號12樓","鍾家豪","500000","1140219"
"2397","96783240","勝拓工程有限公司","臺中市北屯區太和路一段218之1號1樓","游建海","2000000","1140205"
"2398","96783516","炫金行銷顧問有限公司","新北市板橋區松江街72巷6號","巫順智","1000000","1140225"
"2399","96783608","璨星時代娛樂有限公司","彰化縣和美鎮新庄里彰美路二段398號","葉千毅","100000","1140124"
"2400","96783641","誠嘉泰投資有限公司","屏東縣潮州鎮三共里永坤路71號2樓","簡健祐","1350000","1140211"
"2401","96783728","艾樂屋國際企業有限公司","桃園市桃園區永興里新生路103號6樓","李季剛","3000000","1140211"
"2402","96783776","天銳機械科技有限公司","臺中市南區樹義里復興路一段271號5樓之5","彭志偉","1000000","1140207"
"2403","96783797","緒品室內裝修股份有限公司","新北市新莊區新北大道4段171號3樓","張辰韻","1500000","1140227"
"2404","96784070","潔傾舒生技有限公司","桃園市桃園區中成里正光二街8巷20號","孫塋茜","200000","1140206"
"2405","96784206","絲集有限公司","新北市新店區新和街100號","徐仲彥","100000","1140212"
"2406","96784579","顏己有限公司","臺中市龍井區龍泉里中社七街98巷9號2樓","王冠瑾","500000","1140227"
"2407","96784655","勝彪有限公司","新北市三重區分子尾街45號（1樓）","許馬魁","1000000","1140221"
"2408","96784894","璽樂環保股份有限公司","苗栗縣造橋鄉談文村育英街18號二樓之六","黃暐瀚","100000","1140205"
"2409","96785107","品鏡餐飲股份有限公司","高雄市新興區民生一路56號18樓之6","黃雋維","2000000","1140211"
"2410","96785113","光焰傳媒有限公司","臺中市北屯區平德里北平路三段157號1樓","陳泳銍","200000","1140219"
"2411","96785134","君尊股份有限公司","高雄市鼓山區明誠四路286號20樓","鄒承君","550000","1140225"
"2412","96785161","林柏投資有限公司","臺中市西屯區福星路217號1樓","林柏志","4500000","1140205"
"2413","96785248","宗昊有限公司","高雄市前鎮區一心二路128號6樓之2","蔡宗霖","500000","1140212"
"2414","96785325","大億發建設有限公司","屏東縣屏東市瑞光里林森路1巷61號1樓","甘瑩鈞","100000","1140122"
"2415","96785373","南星科研有限公司","臺南市東區德光里崇學路165號7樓","楊岡錦","500000","1140210"
"2416","96785578","光翔企劃股份有限公司","臺北市松山區基隆路1段8號16樓之1","蘇志翔","550000","1140227"
"2417","96785612","鋐宇工程有限公司","高雄市小港區鳳林路97巷3號2樓","張校銘","100000","1140224"
"2418","96785649","成大劍橋教育科技有限公司","高雄市鼓山區大順一路859號2樓","楊勝傑","1000000","1140218"
"2419","96785726","華紹科技有限公司","臺中市西區吉龍里五權一街11號3樓","呂紹華","100000","1140204"
"2420","96785866","尹大開發事業有限公司","新北市新莊區新北大道4段187號9樓","應尹甄","2000000","1140206"
"2421","96785937","亞細亞國際有限公司","高雄市苓雅區自強三路176巷18號4樓","徐文炫","1000000","1140203"
"2422","96786020","美商天凡生技有限公司","臺北市內湖區洲子街55號4樓","陳建嘉","100000","1140214"
"2423","96786247","馬谷科技有限公司","高雄市三民區大豐二路498巷18弄23號","黎彥君","200000","1140225"
"2424","96786252","寶陽全球事業有限公司","桃園市桃園區民權路6號12樓","蕭玉蓉","500000","1140211"
"2425","96786817","通禾營造有限公司","南投縣國姓鄉國姓村和平巷148號1樓","羅得通","3600000","1140211"
"2426","96787246","康頤投資股份有限公司","臺北市大安區東豐街7號4樓之2","鄭予菲","1000000","1140211"
"2427","96787365","大業租賃住宅服務有限公司","臺中市南屯區溝墘里文心路一段510號2樓","林吉茂","600000","1140124"
"2428","96787512","陳紹興業有限公司","臺中市北區文莊里中清路一段89號11樓之8","陳紹綸","50000","1140219"
"2429","96787718","矽致有限公司","新北市中和區華安街21巷7號4樓","鍾玉玲","100000","1140212"
"2430","96787766","雄政工程有限公司","高雄市小港區廈莊一街81號9樓","林政璋","3000000","1140210"
"2431","96787793","瑩峰有限公司","臺中市大里區立德里立中六街42號1樓","廖財炘","1200000","1140124"
"2432","96787800","精釜鋁業有限公司","新北市三重區河邊北街128巷10號","陳紹北","3000000","1140226"
"2433","96788202","鼎可股份有限公司","新北市汐止區大安街48號4樓","謝金益","100000","1140221"
"2434","96788462","佩堃築夢工程有限公司","高雄市鳳山區文龍東路757巷10號2樓","洪堃木","10000","1140212"
"2435","96788548","芸儷有限公司","臺中市西屯區河南路二段327號4樓之5","張育誠","300000","1140217"
"2436","96788688","閎淇工程股份有限公司","新北市樹林區三龍街101巷1號(1樓)","角芮嫻","1000000","1140218"
"2437","96788792","愛得福生技有限公司","臺南市佳里區忠仁里興中街60號1樓","陳振豐","500000","1140208"
"2438","96789080","康熹時尚運動有限公司","臺中市南屯區同心里南屯路二段290號12樓之2","陳柔予","100000","1140219"
"2439","96789096","雷特海有限公司","桃園市桃園區褔林里介壽路459巷5弄6號","林秀芃","20000","1140219"
"2440","96789188","昌運國際開發有限公司","臺北市中山區民權西路70號10樓","SEIN KYAW","7000000","1140220"
"2441","96789434","翔永冠工程有限公司","高雄市六龜區河邊巷60號","李明鴻","100000","1140217"
"2442","96789504","峻揚汽車環保有限公司","嘉義市東區荖藤里文化路866號","蔡慶祥","503000","1140224"
"2443","96789574","得勤文保有限公司","新竹市東區金山里金山八街106號4樓","師英傑","1000000","1140207"
"2444","96789618","智慧晶片股份有限公司","新北市汐止區新台五路1段93號21樓之6","簡鴻兆","3000000","1140225"
"2445","96789639","澄翔科技股份有限公司","臺北市文山區木新路2段176號1樓","廖日以","5000000","1140204"
"2446","96789666","心嘉國際有限公司","臺北市中正區青島東路4之8號","蔡孟泓","200000","1140213"
"2447","96789716","邑璽建設事業有限公司","臺中市太平區太平里太平路501號1樓","黃浤裕","2000000","1140207"
"2448","96790220","川石怪獸電力股份有限公司","臺北市中山區植福路308號5樓之2","林哲良","1000000","1140214"
"2449","96790306","三滴龍二室內裝修設計有限公司","高雄市鼓山區龍德路389號5樓","王茂州","100000","1140219"
"2450","96790447","藍星石投資有限公司","桃園市中壢區新街里11鄰環北路398號12樓之3","徐稚甯","2000000","1140214"
"2451","96790468","燿城國際有限公司","新北市永和區得和路231號4樓","劉韋利","4000000","1140214"
"2452","96790538","柏越大數據有限公司","臺中市烏日區湖日里新興路379號1樓","張凱柏","2000000","1140204"
"2453","96790657","双和陶瓷行銷有限公司","新北市鶯歌區中正三路389號(1樓)","黃晨瑋","500000","1140226"
"2454","96790761","程現有限公司","宜蘭縣五結鄉隆昌路10號1樓","應昕亨","1500000","1140213"
"2455","96790782","寶恆昌電子有限公司","桃園市中壢區過嶺里民族路六段130號9樓之5","陳商庸","1000000","1140208"
"2456","96790832","青菜園三代食品有限公司","臺北市信義區基隆路2段77號5樓之2","曹惠萍","500000","1140206"
"2457","96791558","國民蛋品有限公司","臺中市北區中清路一段372號2樓","李國政","100000","1140211"
